user_input,retrieved_contexts,reference_contexts,response,reference,context_recall,non_llm_context_precision_with_reference,factual_correctness,faithfulness,semantic_similarity
ODTÜ HAT nedir ve ne zaman kuruldu?,"['bulunup tanınması çalışmaları (1988-1990), Antakya kıyılarında yine topluluk tarafından bulunan 1600 yıllık iki batık gemi ve her birinde bulunan cam külçeler (1992/1993) ODTÜ Sualtı Topluluğu’nun Arkeoloji bilimine yaptığı katkıların ilkleridir. Bunlara ek olarak topluluğun 1992 yılında ilk kez Bozcaada’da düzenlediği “Sualtında Görüntü Avlama Yarışması” SAGAY, Türkiye’de düzenlenen ilk sualtı fotoğraf yarışması olmasının yanı sıra, Zıpkınla Balık Avcılığı Yerine Fotoğraf Makinesiyle Görüntü Avcılığı gibi anlamlı bir seçeneği sunarak Kuzey Ege’de “deniz parkları” kurulmasını ve işlemesini sağlamayı amaç edinmiştir. Son zamanlarda topluluk Türkiye Kıyıları Deniz Mağaraları Envanter Projesi, Kilikya Bölgesi Arkeolojik Yüzey Araştırması, Deniz Çayırlarının Yayılımının İncelenmesi, Uluburun III Yapay Resif Projesi, Serbest Dalış Denemeleri gibi önemli projeleri yürütmektedir. ODTÜ Sualtı Topluluğu Rektörlük makamına karşı sorumludur. Akademik Danışman ve beş öğrenciden oluşan yürütme kurulu, üç öğrenciden oluşan denetleme kurulu işleyişi sağlamakla görevlidir. Yürütme Kurulu ve Denetleme Kurulu Genel Kurula karşı sorumludur. Topluluğun Akdeniz Foku Araştırma Grubu (AFAG), Batık Araştırma Grubu (BAG), Ekoloji Grubu (EKOG), Fotografi ve Videografi Grubu (FOVAG), Mağara Dalışı ve Araştırma Grubu (MADAG) ve Serbest Dalış Grubu (SDG) gibi alt grupları ile çeşitli çalışma birimleri vardır.', ""Sports Club Name: ODTÜ HAVACILIK TOPLULUĞU YAMAÇ PARAŞÜTÜ GRUBU\nSports Club Description: ODTÜ Havacılık Topluluğu Yamaç Paraşütü Grubu (ODTÜ HAT), 1991 yılında kurulduğundan 2016 yılına kadar ODTÜ Kültür İşleri Müdürlüğü'ne o tarihten günümüze kadar da ODTÜ Spor Müdürlüğü'ne bağlı olarak faaliyet göstermektedir. Türkiye'de yamaç paraşütü eğitimi ilk kez topluluğumuzda başlamış 25 yıldan bu yana da aynı şekilde devam etmektedir. Topluluğumuzun yaklaşık 300 ODTÜ öğrencisinden oluşan grubu her yıl teorik eğitimlere katılmakta ve yer çalışmasını başarı ile tamamlayan öğrenciler ise başlangıç eğitimine geçmektedir. Topluluğumuzun temel amacı bu sporu yaymak ve ODTÜ öğrencilerine en iyi şekilde tanıtmaktır."", 'Content:  This course, according to regulations of the Council of Higher Education (YÖK), is a must course to all foreign students in Turkey. Therefore, it is also a must course for foreign students enrolled in METU regardless of paying their fees in Turkish Lira or US Dollar. It is designed to equip them with a general knowledge on the process of the establishment of the Turkish nation-state in 1923. It covers economic, social, political and cultural developments in Turkey between 1908 and 1938.', 'ODTÜ’nün değil Türkiye’nin değerli bir yarışması haline gelen bu organizasyona her sene 20 farklı ülkeden 400’ü aşkın sporcu ve 5000 dans severi ağırlamaktadır. Uluslararası platformlarda da övgüler almaya devam eden ve 16.sını 4-5 Kasım 2017 tarihlerinde gerçekleştireceğimiz METU OPEN son 3 senedir tüm Uluslararası Yarışmalar arasında ilk 10’da yer almaktadır.', 'FAQ Answer:   Eğer söz konusu liste ""tek yönlü duyuru listesi"" ise, liste yapılandırması gereği e-posta gönderme yetkisine sahip kişiler haricinde hiç bir kullanıcı mesaj gönderememektedir. Ancak üyelerin e-posta gönderebildiği bir liste söz konusu ise, gönderdiginiz mesajlarin listeye ulaşmamasının iki temel sebebi vardır: Listeye üyelik için kullanmadığıniz bir e-posta adresinden mesaj gönderiyor olabilirsiniz. Genelde birden fazla e-posta adresi kullanıyorsanız ve üye olan adresten farklı bir adrese yönlendirme tanımladıysanız, liste mesajlarini aldığınız e-posta adresi ile üyelik için kullandığınız e-posta adresi farklı olabilir. Mesajları aldığınız e-posta adresinin listeye üye olarak kayıtlı olup olmadığını kontrol etmesi için abc-l-ownermetu.edu.tr adresinden liste yöneticisiyle iletişime geçiniz. Listeye üyelik için kullandığınız e-posta adresinden mesaj gönderiyorsanız mesajiniz onay bekliyor olabilir. Mesajinızın onay için bekletiliyor olmasının olası sebepleri aşağıda listelenmiştir: Gönderdiğiniz mesaj liste mesaj kotasını aşan bir büyüklüğe sahip olabilir (örneğin; çok büyük bir dosya eklentisi gönderiyor olabilirsiniz). Mesajınızın alıcı adresi bölümünde liste adıyla beraber çok sayıda e-posta adresini yazmış olabilirsiniz. Mesajiniz liste ayarları gereği moderatör onayı için bekletiliyor olabilir. Tüm bu olası sebeplerle ilgili olarak abc-l-ownermetu.edu.tr adresinden liste yöneticisi ile iletişime geçebilir, detaylı bilgi alabilirsiniz.  (Yukarıda geçen', 'FAQ Question: Bölüm, Birim, Merkez, Laboratuvar, Öğrenci Topluluğu web sayfası nasıl yapılır?', 'bir şifreyi yazıp, _x0093_Şifremi Değiştir_x0094_ butonuna _x0093_Global Olarak Değiştir_x0094_ seçeneği seçili olacak şekilde tıklamalıdır.  Bu işlem başarılı bir şekilde gerçekleştirildiği takdirde, ekranda _x0093_Şifre başarıyla değiştirildi._x0094_ şeklinde bir mesaj görüntülenir. Kullanıcı tarafından tanımlanan yeni şifre artık aynı e-posta adresi ile üye olunan mevcut tüm e-listelerde kullanılabilir. Şifre değiştirme işlemi sırasında _x0093_Global Olarak Değiştir_x0094_ seçeneği seçili olmadığı durumda, sadece söz konusu e-listenin şifresi değiştirilmiş olur. ""Global Olarak Değiştir"" seçeneği ile kullanıcının o ana kadar üye olduğu tüm listelerin şifreleri değiştirilir. Bu işlem sonrasında üye olunacak yeni e-listelerde de aynı şifrenin kullanılabilmesi için bu işlemin her üyelikten sonra tekrarlanması gerekir. Bu işlem yapılmadığında yeni üye olunan e-listelerde, üye olurken Mailman tarafından otomatik olarak tanımlanıp kullanıcıya gönderilen şifreler kullanılır.', 'vb. yapılara ait web siteleri kapsamlı bir şekilde hazırlanabilir, bu sitelerde çeşitli yazılar ve sayfalar oluşturulabilir. Tasarım için biraz daha esnek olsa da serviste yer alan şablonlar dışında kalan harici bir şablona onay verilmemektedir. Servise giriş yapmak ve servis hakkında ayrıntılı bilgi almak için\xa0http://blog.metu.edu.tr\xa0adresi kullanılmalıdır.', 'Sports Club Name: ODTÜ BRİÇ TOPLULUĞU\nSports Club Description: Kontak briç oynamayı öğrenmek, briç bilgisini geliştirmeyi, ulusal ve uluslararası yarışmalara katılmayı sağlamak topluluğumuzun temel amacıdır.', ""Sports Club Name: ODTU SATRANÇ TOPLULUĞU\nSports Club Description: ODTÜ Satranç Topluluğu, yediden yetmişe her yaşa hitap eden bu güzel ve aşkın oyunu ODTÜ'de tanıtmakla, turnuvalar yapmakla ve öğretmekle sorumlu topluluktur. Topluluğumuz düzenli olarak her seviyeye uygun satranç dersleri verip, haftalık turnuvalar ve büyük dönemlik turnuvalar yapmaktadır. Bunun haricinde aylık bir dergi çıkartmaktadır. Bu dergide topluluğumuzun turnuvalarından maçlar seçilip analizlenerek konulmaktadır. Okul takımı, lig takımı ve de bireysel turnuvalar için oluşturduğumuz gruplarda arkadaşlarımızı bu çekişmeli oyunun bir parçası yapmak için eğitiyor ve teşvik ediyoruz. Misyonumuz satrancı insanlara bir hobi, bir arkadaş olarak tanıtmak ve onların hayatına ömür boyu eşlik edecek bir renk getirmektir. Bu yüzden de seçtiğimiz vizyon etik, akılcı ve sportmen satranç olarak bütün satranç severleri, meraklılarını ve oyuncularını bekleriz.""]","[""Sports Club Name: ODTÜ HAVACILIK TOPLULUĞU YAMAÇ PARAŞÜTÜ GRUBU\nSports Club Description: ODTÜ Havacılık Topluluğu Yamaç Paraşütü Grubu (ODTÜ HAT), 1991 yılında kurulduğundan 2016 yılına kadar ODTÜ Kültür İşleri Müdürlüğü'ne o tarihten günümüze kadar da ODTÜ Spor Müdürlüğü'ne bağlı olarak faaliyet göstermektedir. Türkiye'de yamaç paraşütü eğitimi ilk kez topluluğumuzda başlamış 25 yıldan bu yana da aynı şekilde devam etmektedir. Topluluğumuzun yaklaşık 300 ODTÜ öğrencisinden oluşan grubu her yıl teorik eğitimlere katılmakta ve yer çalışmasını başarı ile tamamlayan öğrenciler ise başlangıç eğitimine geçmektedir. Topluluğumuzun temel amacı bu sporu yaymak ve ODTÜ öğrencilerine en iyi şekilde tanıtmaktır.\n""]","İşte ODTÜ HAT (ODTÜ Havacılık Topluluğu Yamaç Paraşütü Grubu) nedir ve ne zaman kuruldu. Bu topluluk, 1991 yılında kuruldu ve 2016 yılına kadar ODTÜ Kültür İşleri Müdürlüğü'ne bağlı olarak faaliyet göstermektedir. 25 yıldan bu yana da aynı şekilde devam etmektedir. Topluluğumuzun yaklaşık 300 ODTÜ öğrencisinden oluşan grubu her yıl teorik eğitimlere katılmakta ve yer çalışmasını başarı ile tamamlayan öğrenciler ise başlangıç eğitimine geçmektedir. Topluluğumuzun temel amacı bu sporu yaymak ve ODTÜ öğrencilerine en iyi şekilde tanıtmaktır.","ODTÜ HAT nedir?  
ODTÜ HAT, ODTÜ Havacılık Topluluğu Yamaç Paraşütü Grubu'nun kısaltmasıdır.  

ODTÜ HAT ne zaman kurulmuştur?  
1991 yılında kurulmuştur.  

ODTÜ HAT hangi kuruluşa bağlı olarak faaliyet göstermektedir?  
2016 yılına kadar ODTÜ Kültür İşleri Müdürlüğü'ne, o tarihten günümüze kadar ise ODTÜ Spor Müdürlüğü'ne bağlı olarak faaliyet göstermektedir.",1.0,0.49999999995,0.5,0.8888888888888888,0.9594406148316978
"ODTÜ kulübü ve faaliyetleri hakkında daha fazla bilgi verebilir misiniz, özellikle öğrencilerin yelken ve denizle nasıl bağlantı kurmalarına yardımcı olduğu konusunda?","['Sports Club Name: ODTÜ DENİZCİLİK VE YELKEN TOPLULUĞU (ODYT)\nSports Club Description: Topluluğumuzun asıl amacı ODTÜ öğrencilerine denizi ve Yelken sporunu sevdirmek ve okulumuzu yarışlarda en iyi şekilde temsil etmek. Yelken sporu vücudumuzu fiziksel olarak güçlendirdiği gibi, hızlı çözüm üretebilme, koordinasyon, takım olma ve zihni güçlendirme üzerine de etkilidir. Gidilen yarış ve eğitimlerde takım olma bilincini üyelerimize kazandırma da topluluğumuzun bir diğer amacıdır. Faaliyetlerimize gelecek olursak, her sene yeni gelen üyelerimize temel eğitimler düzenliyoruz. Birincisi temel centerboard eğitimi (laser teknelerle), diğeri ise temel yatçılık eğitimi (yelkenli yatlarla genellikle 1 hafta sürmekte).\xa0 Her sene elimizden geldiğince üniversiteler arası ve özel olarak düzenlenen yarışlara katılmaktayız. Sponsor ya da gelen desteğe göre faaliyetlerimizi daha da genişletmek, katıldığımız trofe ve yarışların sayısını arttırmak, İstanbul’daki üniversiteler gibi yaz/kış gezileri düzenlemek gelecek faaliyet raporlarımızda mevcut.', 'FAQ Answer:   Eğer söz konusu liste ""tek yönlü duyuru listesi"" ise, liste yapılandırması gereği e-posta gönderme yetkisine sahip kişiler haricinde hiç bir kullanıcı mesaj gönderememektedir. Ancak üyelerin e-posta gönderebildiği bir liste söz konusu ise, gönderdiginiz mesajlarin listeye ulaşmamasının iki temel sebebi vardır: Listeye üyelik için kullanmadığıniz bir e-posta adresinden mesaj gönderiyor olabilirsiniz. Genelde birden fazla e-posta adresi kullanıyorsanız ve üye olan adresten farklı bir adrese yönlendirme tanımladıysanız, liste mesajlarini aldığınız e-posta adresi ile üyelik için kullandığınız e-posta adresi farklı olabilir. Mesajları aldığınız e-posta adresinin listeye üye olarak kayıtlı olup olmadığını kontrol etmesi için abc-l-ownermetu.edu.tr adresinden liste yöneticisiyle iletişime geçiniz. Listeye üyelik için kullandığınız e-posta adresinden mesaj gönderiyorsanız mesajiniz onay bekliyor olabilir. Mesajinızın onay için bekletiliyor olmasının olası sebepleri aşağıda listelenmiştir: Gönderdiğiniz mesaj liste mesaj kotasını aşan bir büyüklüğe sahip olabilir (örneğin; çok büyük bir dosya eklentisi gönderiyor olabilirsiniz). Mesajınızın alıcı adresi bölümünde liste adıyla beraber çok sayıda e-posta adresini yazmış olabilirsiniz. Mesajiniz liste ayarları gereği moderatör onayı için bekletiliyor olabilir. Tüm bu olası sebeplerle ilgili olarak abc-l-ownermetu.edu.tr adresinden liste yöneticisi ile iletişime geçebilir, detaylı bilgi alabilirsiniz.  (Yukarıda geçen', 'bulunup tanınması çalışmaları (1988-1990), Antakya kıyılarında yine topluluk tarafından bulunan 1600 yıllık iki batık gemi ve her birinde bulunan cam külçeler (1992/1993) ODTÜ Sualtı Topluluğu’nun Arkeoloji bilimine yaptığı katkıların ilkleridir. Bunlara ek olarak topluluğun 1992 yılında ilk kez Bozcaada’da düzenlediği “Sualtında Görüntü Avlama Yarışması” SAGAY, Türkiye’de düzenlenen ilk sualtı fotoğraf yarışması olmasının yanı sıra, Zıpkınla Balık Avcılığı Yerine Fotoğraf Makinesiyle Görüntü Avcılığı gibi anlamlı bir seçeneği sunarak Kuzey Ege’de “deniz parkları” kurulmasını ve işlemesini sağlamayı amaç edinmiştir. Son zamanlarda topluluk Türkiye Kıyıları Deniz Mağaraları Envanter Projesi, Kilikya Bölgesi Arkeolojik Yüzey Araştırması, Deniz Çayırlarının Yayılımının İncelenmesi, Uluburun III Yapay Resif Projesi, Serbest Dalış Denemeleri gibi önemli projeleri yürütmektedir. ODTÜ Sualtı Topluluğu Rektörlük makamına karşı sorumludur. Akademik Danışman ve beş öğrenciden oluşan yürütme kurulu, üç öğrenciden oluşan denetleme kurulu işleyişi sağlamakla görevlidir. Yürütme Kurulu ve Denetleme Kurulu Genel Kurula karşı sorumludur. Topluluğun Akdeniz Foku Araştırma Grubu (AFAG), Batık Araştırma Grubu (BAG), Ekoloji Grubu (EKOG), Fotografi ve Videografi Grubu (FOVAG), Mağara Dalışı ve Araştırma Grubu (MADAG) ve Serbest Dalış Grubu (SDG) gibi alt grupları ile çeşitli çalışma birimleri vardır.', 'ODTÜ’nün değil Türkiye’nin değerli bir yarışması haline gelen bu organizasyona her sene 20 farklı ülkeden 400’ü aşkın sporcu ve 5000 dans severi ağırlamaktadır. Uluslararası platformlarda da övgüler almaya devam eden ve 16.sını 4-5 Kasım 2017 tarihlerinde gerçekleştireceğimiz METU OPEN son 3 senedir tüm Uluslararası Yarışmalar arasında ilk 10’da yer almaktadır.', 'sebeplerle ilgili olarak abc-l-ownermetu.edu.tr adresinden liste yöneticisi ile iletişime geçebilir, detaylı bilgi alabilirsiniz.  (Yukarıda geçen ""abc-l"" ifadesi liste ismi için örnek olarak verilmiştir)', 'FAQ Question: Bölüm, Birim, Merkez, Laboratuvar, Öğrenci Topluluğu web sayfası nasıl yapılır?', 'bir şifreyi yazıp, _x0093_Şifremi Değiştir_x0094_ butonuna _x0093_Global Olarak Değiştir_x0094_ seçeneği seçili olacak şekilde tıklamalıdır.  Bu işlem başarılı bir şekilde gerçekleştirildiği takdirde, ekranda _x0093_Şifre başarıyla değiştirildi._x0094_ şeklinde bir mesaj görüntülenir. Kullanıcı tarafından tanımlanan yeni şifre artık aynı e-posta adresi ile üye olunan mevcut tüm e-listelerde kullanılabilir. Şifre değiştirme işlemi sırasında _x0093_Global Olarak Değiştir_x0094_ seçeneği seçili olmadığı durumda, sadece söz konusu e-listenin şifresi değiştirilmiş olur. ""Global Olarak Değiştir"" seçeneği ile kullanıcının o ana kadar üye olduğu tüm listelerin şifreleri değiştirilir. Bu işlem sonrasında üye olunacak yeni e-listelerde de aynı şifrenin kullanılabilmesi için bu işlemin her üyelikten sonra tekrarlanması gerekir. Bu işlem yapılmadığında yeni üye olunan e-listelerde, üye olurken Mailman tarafından otomatik olarak tanımlanıp kullanıcıya gönderilen şifreler kullanılır.', 'ürettiği log dosyasının örneği aşağıda verilmiştir. Tutulan log bilgisinde, bağlantı yapan bilgisayarın adresi, hedef dosya ve kullanıcı adı bilgileri bulunmalıdır. Tue Mar 25 16:39:48 2008 0 bogus.com 528 /ftp/pub/IMPORTANT-WARNING.txt b _ o r anonim ftp 1 * c  Yukarıdaki örnekte yer alan bilgi alanları, kanunda belirtilen başlıklarla aşağıdaki şekilde ilişkilendirilmiştir: Bağlantı tarih-saat bilgisi: ""Tue Mar 25 16:39:48 2008""  Kaynak Adres: ""bogus.com""  İstenen dosya: ""ftp/pub/IMPORTANT-WARNING.txt""  Kullanıcı adı: ""anonim""  Birimler, yer sağlayıcı faaliyetleri kapsamında verdikleri servislerin ürettiği logları inceleyip, sahip oldukları sistemlerde verdikleri servislerin yarattığı trafik loglarını yönetmelikte tarif edildiği şekilde (zaman damgası ile birlikte) kayıt altına almak, bu logları, gizliliğini sağlayarak arşivlemekle yükümlüdür.', 'vb. yapılara ait web siteleri kapsamlı bir şekilde hazırlanabilir, bu sitelerde çeşitli yazılar ve sayfalar oluşturulabilir. Tasarım için biraz daha esnek olsa da serviste yer alan şablonlar dışında kalan harici bir şablona onay verilmemektedir. Servise giriş yapmak ve servis hakkında ayrıntılı bilgi almak için\xa0http://blog.metu.edu.tr\xa0adresi kullanılmalıdır.', 'Sports Club Name: ODTÜ BRİÇ TOPLULUĞU\nSports Club Description: Kontak briç oynamayı öğrenmek, briç bilgisini geliştirmeyi, ulusal ve uluslararası yarışmalara katılmayı sağlamak topluluğumuzun temel amacıdır.']","['Sports Club Name: ODTÜ DENİZCİLİK VE YELKEN TOPLULUĞU (ODYT)\nSports Club Description: Topluluğumuzun asıl amacı ODTÜ öğrencilerine denizi ve Yelken sporunu sevdirmek ve okulumuzu yarışlarda en iyi şekilde temsil etmek. Yelken sporu vücudumuzu fiziksel olarak güçlendirdiği gibi, hızlı çözüm üretebilme, koordinasyon, takım olma ve zihni güçlendirme üzerine de etkilidir. Gidilen yarış ve eğitimlerde takım olma bilincini üyelerimize kazandırma da topluluğumuzun bir diğer amacıdır. Faaliyetlerimize gelecek olursak, her sene yeni gelen üyelerimize temel eğitimler düzenliyoruz. Birincisi temel centerboard eğitimi (laser teknelerle), diğeri ise temel yatçılık eğitimi (yelkenli yatlarla genellikle 1 hafta sürmekte).\xa0 Her sene elimizden geldiğince üniversiteler arası ve özel olarak düzenlenen yarışlara katılmaktayız. Sponsor ya da gelen desteğe göre faaliyetlerimizi daha da genişletmek, katıldığımız trofe ve yarışların sayısını arttırmak, İstanbul’daki üniversiteler gibi yaz/kış gezileri düzenlemek gelecek faaliyet raporlarımızda mevcut.\n']","İşte ODTÜ DENİZCİLİK VE YELKEN TOPLULUĞU (ODYT) hakkında bilgi:

        ODTÜ DENİZCİLİK VE YELKEN TOPLULUĞU, ODTÜ öğrencilerine denizi ve Yelken sporunu sevdirmek ve okulumuzu yarışlarda en iyi şekilde temsil etmek amacıyla kurulmuş bir öğrenci topluluğudur.

        Faaliyetlerimize gelecek olursak, her sene yeni gelen üyelerimize temel eğitimler düzenliyoruz. Birincisi temel centerboard eğitimi (laser teknelerle), diğeri ise temel yatçılık eğitimi (yelkenli yatlarla genellikle 1 hafta sürmekte). Her sene elimizden geldiğince üniversiteler arası ve özel olarak düzenlenen yarışlara katılmaktayız. Sponsor ya da gelen desteğe göre faaliyetlerimizi daha da genişletmek, katıldığımız trofe ve yarışların sayısını arttırmak, İstanbul’daki üniversiteler gibi yaz/kış gezileri düzenlemek gelecek faaliyet raporlarımızda mevcut.

        Topluluğun Akdeniz Foku Araştırma Grubu (AFAG), Batık Araştırma Grubu (BAG), Ekoloji Grubu (EKOG), Fotografi ve Videografi Grubu (FOVAG), Mağara Dalışı ve Araştırma Grubu (MADAG) ve Serbest Dalış Grubu (SDG) gibi alt grupları ile çeşitli çalışma birimleri vardır.

        Bu topluluk, Rektörlük makamına karşı sorumludur. Akademik Danışman ve beş öğrenciden oluşan yürütme kurulu, üç öğrenciden oluşan denetleme kurulu işleyişi sağlamakla görevlidir. Yürütme Kurulu ve Denetleme Kurulu Genel Kurula karşı sorumludur.

        Eğer ODTÜ DENİZCİLİK VE YELKEN TOPLULUĞU hakkında daha fazla bilgi istiyorsanız, liste yöneticisi ile iletişime geçebilirsiniz.


        ODTÜ DENİZCİLİK VE YELKEN TOPLULUĞU (ODYT) hakkında bilgi:

        ODTÜ DENİZCİLİK VE YELKEN TOPLULUĞU, ODTÜ öğrencilerine denizi ve Yelken sporunu sevdirmek ve okulumuzu yarışlarda en iyi şekilde temsil etmek amacıyla kurulmuş bir öğrenci topluluğudur.

        Faaliyetlerimize gelecek olursak, her sene yeni gelen üyelerimize temel eğitimler düzenliyoruz. Birincisi temel centerboard eğitimi (laser teknelerle), diğeri ise temel yatçılık eğitimi (yelkenli yatlarla genellikle 1 hafta sürmekte). Her sene elimizden geldiğince üniversiteler arası ve özel olarak düzenlenen yarışlara katılmaktayız. Sponsor ya da gelen desteğe göre faaliyetlerimizi daha da genişletmek, katıldığımız trofe ve yarışların sayısını arttırmak, İstanbul’daki üniversiteler gibi yaz/kış gezileri düzenlemek gelecek faaliyet raporlarımızda mevcut.

        Topluluğun Akdeniz Foku Araştırma Grubu (AFAG), Batık Araştırma Grubu (BAG), Ekoloji Grubu (EKOG), Fotografi ve Videografi Grubu (FOVAG), Mağara Dalışı ve Araştırma Grubu (MADAG) ve Serbest Dalış Grubu (SDG) gibi alt grupları ile çeşitli çalışma birimleri vardır.

        Bu topluluk, Rektörlük makamına karşı sorumludur. Akademik Danışman ve beş öğrenciden oluşan yürütme kurulu, üç öğrenciden oluşan denetleme kurulu işleyişi sağlamakla görevlidir. Yürütme Kurulu ve Denetleme Kurulu Genel Kurula karşı sorumludur.

        Eğer ODTÜ DENİZCİLİK VE YELKEN TOPLULUĞU hakkında daha fazla bilgi istiyorsanız, liste yöneticisi ile iletişime geçebilirsiniz.

        ODTÜ DENİZCİLİK VE YELKEN TOPLULUĞU (ODYT) hakkında bilgi:

        ODTÜ DENİZCİLİK VE YELKEN TOPLULUĞU, ODTÜ öğrencilerine denizi ve Yelken sporunu sevdirmek ve okulumuzu yarışlarda en iyi şekilde temsil etmek amacıyla kurulmuş bir öğrenci topluluğudur.

        Faaliyetlerimize gelecek olursak, her sene yeni gelen üyelerimize temel eğitimler düzenliyoruz. Birincisi temel centerboard eğitimi (laser teknelerle), diğeri ise temel yatçılık eğitimi (yelkenli yatlarla genellikle 1 hafta sürmekte). Her sene elimizden geldiğince üniversiteler arası ve özel olarak düzenlenen yarışlara katılmaktayız. Sponsor ya da gelen desteğe göre faaliyetlerimizi daha da genişletmek, katıldığımız trofe ve yarışların sayısını arttırmak, İstanbul’daki üniversiteler gibi yaz/kış gezileri düzenlemek gelecek faaliyet raporlarımızda mevcut.

        Topluluğun Akdeniz Foku Araştırma Grubu (AFAG), Batık Araştırma Grubu (BAG), Ekoloji Grubu (EKOG), Fotografi ve Videografi Grubu (FOVAG), Mağara Dalışı ve Araştırma Grubu (MADAG) ve Serbest Dalış Grubu (SDG) gibi alt grupları ile çeşitli çalışma birimleri vardır.

        Bu topluluk, Rektörlük makamına karşı sorumludur. Akademik Danışman ve beş öğrenciden oluşan yürütme kurulu, üç öğrenciden oluşan denetleme kurulu işleyişi sağlamakla görevlidir. Yürütme Kurulu ve Denetleme Kurulu Genel Kurula karşı sorumludur.

        Eğer ODTÜ DENİZCİLİK VE YELKEN TOPLULUĞU hakkında daha fazla bilgi istiyorsanız, liste yöneticisi ile iletişime geçebilirsiniz.

        ODTÜ DENİZCİLİK VE YELKEN TOPLULUĞU (ODYT) hakkında bilgi:

        ODTÜ DENİZCİLİK VE YELKEN TOPLULUĞU, ODTÜ öğrencilerine denizi ve Yelken sporunu sevdirmek ve okulumuzu yarışlarda en iyi şekilde temsil etmek amacıyla kurulmuş bir öğrenci topluluğudur.

        Faaliyetlerimize gelecek olursak, her sene yeni gelen üyelerimize temel eğitimler düzenliyoruz. Birincisi temel centerboard eğitimi (laser teknelerle), diğeri ise temel yatçılık eğitimi (yelkenli yatlarla genellikle 1 hafta sürmekte). Her sene elimizden geldiğince üniversiteler arası ve özel olarak düzenlenen yarışlara katılmaktayız. Sponsor ya da gelen desteğe göre faaliyetlerimizi daha da genişletmek, katıldığımız trofe ve yarışların sayısını arttırmak, İstanbul’daki üniversiteler gibi yaz/kış gezileri düzenlemek gelecek faaliyet raporlarımızda mevcut.

        Topluluğun Akdeniz Foku Araştırma Grubu (AFAG), Batık Araştırma Grubu (BAG), Ekoloji Grubu (EKOG), Fotografi ve Videografi Grubu (FOVAG), Mağara Dalışı ve Araştırma Grubu (MADAG) ve Serbest Dalış Grubu (SDG) gibi alt grupları ile çeşitli çalışma birimleri vardır.

        Bu topluluk, Rektörlük makamına karşı sorumludur. Akademik Danışman ve beş öğrenciden oluşan yürütme kurulu, üç öğrenciden oluşan denetleme kurulu işleyişi sağlamakla görevlidir. Yürütme Kurulu ve Denetleme Kurulu Genel Kurula karşı sorumludur.

        Eğer ODTÜ DENİZCİLİK VE YELKEN TOPLULUĞU hakkında daha fazla bilgi istiyorsanız, liste yöneticisi ile iletişime geçebilirsiniz.

        ODTÜ DENİZCİLİK VE YELKEN TOPLULUĞU (ODYT) hakkında bilgi:

        ODTÜ DENİZCİLİK VE YELKEN TOPLULUĞU, ODTÜ öğrencilerine denizi ve Yelken sp","Spor Kulübü Adı: ODTÜ DENİZCİLİK VE YELKEN TOPLULUĞU (ODYT). Spor Kulübü Tanımı: Topluluğumuzun asıl amacı ODTÜ öğrencilerine denizi ve yelken sporunu sevdirmek ve okulumuzu yarışlarda en iyi şekilde temsil etmek. Yelken sporu vücudumuzu fiziksel olarak güçlendirdiği gibi, hızlı çözüm üretebilme, koordinasyon, takım olma ve zihni güçlendirme üzerine de etkilidir. Gidilen yarış ve eğitimlerde takım olma bilincini üyelerimize kazandırma da topluluğumuzun bir diğer amacıdır. Faaliyetlerimize gelecek olursak, her sene yeni gelen üyelerimize temel eğitimler düzenliyoruz. Birincisi temel centerboard eğitimi (laser teknelerle), diğeri ise temel yatçılık eğitimi (yelkenli yatlarla genellikle 1 hafta sürmekte). Her sene elimizden geldiğince üniversiteler arası ve özel olarak düzenlenen yarışlara katılmaktayız. Sponsor ya da gelen desteğe göre faaliyetlerimizi daha da genişletmek, katıldığımız trofe ve yarışların sayısını arttırmak, İstanbul’daki üniversiteler gibi yaz/kış gezileri düzenlemek gelecek faaliyet raporlarımızda mevcut.",1.0,0.9999999999,0.78,1.0,0.9408345698797675
YKS Kayıt Programı kullanarak yurt başvurusu nasıl yapılır?,"['vb. yapılara ait web siteleri kapsamlı bir şekilde hazırlanabilir, bu sitelerde çeşitli yazılar ve sayfalar oluşturulabilir. Tasarım için biraz daha esnek olsa da serviste yer alan şablonlar dışında kalan harici bir şablona onay verilmemektedir. Servise giriş yapmak ve servis hakkında ayrıntılı bilgi almak için\xa0http://blog.metu.edu.tr\xa0adresi kullanılmalıdır.', 'Content:  This course, according to regulations of the Council of Higher Education (YÖK), is a must course to all foreign students in Turkey. Therefore, it is also a must course for foreign students enrolled in METU regardless of paying their fees in Turkish Lira or US Dollar. It is designed to equip them with a general knowledge on the process of the establishment of the Turkish nation-state in 1923. It covers economic, social, political and cultural developments in Turkey between 1908 and 1938.', 'Sports Club Name: ODTÜ SAS (SU ALTI SPORLARI TOPLULUĞU)\nSports Club Description: ODTÜ SAS; Orta Doğu Teknik Üniversitesi Su Altı Sporları öğrenci topluluğu ve ODTÜ Spor Kulübü Su Altı Sporları takımlarıdır. Türkiye çapında çeşitli başarılara imza atan ODTÜ SAS, her yıl eğitimlerinin yanı sıra muhtelif etkinlikler de düzenlemektedir. Bu etkinliklerdeki amaç, ODTÜ’nün öncülüğünde Türkiye’de bu ve benzeri sporlara ve aktivitelere gönül vermiş olan kişileri bir araya getirmek, elde edilen tecrübeleri paylaşmak, tanıtımı arttırmak ve dostluk ve arkadaşlık ortamında işbirliğini desteklemektedir. ODTÜ aynı zamanda kendi bünyesinden su altında erkek ve kadınlarda takımlarda çıkarmıştır. Bunlar ODTÜ SAS Serbest Dalış Takımları, Su altı Hokeyi Takımları, Su Altı Rugbi Takımları ve Su Altı Görüntüleme Takımıdır. Bu takımlarımız, yönetmelikler gereği faaliyetlerinde Türkiye Su altı Sporları Federasyonu (TSSF)’ye bağlı olan ODTÜ Spor Kulübü bünyesindedir. Takım sporcuları, dönem içerisinde performans gösteren sporcular arasından seçilen kişilerden oluşmaktadır. Gerek takımlarımız ve gerekse bireysel olarak sporcularımız Dünya Rekorları dâhil her yıl ulusal ve uluslararası şampiyonalarda sürekli olarak madalyalar almakta ve üniversitemize şampiyonluklar kazandırmaktadır.', 'sebeplerle ilgili olarak abc-l-ownermetu.edu.tr adresinden liste yöneticisi ile iletişime geçebilir, detaylı bilgi alabilirsiniz.  (Yukarıda geçen ""abc-l"" ifadesi liste ismi için örnek olarak verilmiştir)', 'FAQ Link: https://faq.cc.metu.edu.tr/faq/bolum-birim-merkez-laboratuvar-ogrenci-toplulugu-web-sayfasi-nasil-yapilir', 'FAQ Answer:   Liste yönetim şifresini edinmek için listenin yöneticisi olarak kullandığınız e-posta adresinden mailman@metu.edu.tr adresine\xa0yöneticisi olduğunuz listenin adı ve\xa0telefon numarası bilginizi vererek\xa0şifre isteğinizi bildiren bir e-posta gönderiniz. E-Liste servis yöneticisi talebiniz üzerine gerekli incelemeleri gerçekleştirecek, talebin uygun görülmesi durumunda sizinle telefon aracılığıyla iletişime geçecektir. E-Liste yöneticiliğinde bir değişiklik söz konusu olduğunda, önceki e-liste yöneticisi yeni liste yöneticisinin e-posta adresini listenin yönetim arayüzü üzerinde yönetici olarak tanımlamalı ve yönetim şifresini yeni yöneticiye teslim etmelidir. Ancak, liste yöneticisinin yeni yöneticiyi tanımlamadan ve şifreyi aktarmadan görevden ayrılması gibi durumlarda, farklı bir kişinin liste yöneticisi olarak tanımlanmasına BİDB tarafından destek verilebilmektedir. Böyle bir durum söz konusu ise, ilgili listenin yeni yöneticisi olacak kişinin konuyla ilgili talebini ""metu.edu.tr"" uzantılı e-posta adresini kullanarak mailmanmetu.edu.tr adresine iletmesi gerekmektedir. Söz konusu liste üniversitedeki bir birime ait ise, bu talep ilgili birimin yöneticisi tarafından iletilmelidir. Talebin BİDB\'na ulaşmasının ardından, talep sahibi ile iletisime geçilerek gerekli işlemler gerçekleştirilecektir. (Yukarıda geçen ""abc-l"" ifadesi liste ismi için örnek olarak verilmiştir.)', 'IP adresi : 144.122.222.234 Hedef ip adresi: Bu kayıtta bulunmamaktadır"" Bağlantı tarih-saat bilgisi: [21/Mar/2008:14:58:01 -0200] İstenen sayfa adresi: data/liste.html İşlem bilgisi (GET komut detayı) : GET \'data/liste.htmi HTTP/1.1 Sonuç bilgisi: 200  2) Örnek e-posta logu: ""sendmail"" e-posta sunucu yazılımının ürettiği log dosyasının örneği aşağıda verilmiştir. Tutulan log bilgisinde, ""to"", ""from"" ve ""relay"" bilgilerinin bulunması gereklidir. Kullanılan e-posta yazılımının log formatı, istenen bilgileri bir veya birden fazla satır halinde verebilir. Mar 25 10:20:02 mailhost sendmail[9516]: m2Q8K2e2009516:  from=<bogususerbogus.com>, size=2291, class=0, nrcpts=1,  msgid=<00b101c88f1a$407a7cf0$>, proto=ESMTP, daemon=MTA, relay=boguspc.bogus.com [192.168.1.1] Mar 25 10:20:03 mailhost sendmail[9550]: m2Q8K2e1009516:  to=<bogus2userbogus2.com>, delay=00:00:01, xdelay=00:00:00,  mailer=esmtp, pri=122357, relay=mx.bogus2.com. [192.168.1.2], dsn=2.0.0,  stat=Sent ( Queued mail for delivery)  Yukarıdaki örnekte yer alan bilgi alanları, kanunda belirtilen başlıklarla aşağıdaki şekilde ilişkilendirilmiştir: Bağlantı tarih-saat bilgisi: ""Mar 25 10:20:03"" Gönderici: bogususerbogus.com Kaynak IP adresi: 192.168.1.1 Hedef IP adresi: 192.168.1.2 Alıcı: bogus2userbogus2.com Sonuç bilgisi: sent  3) Örnek ftp logu: ""proftpd"" ftp sunucu yazılımının ürettiği log dosyasının örneği aşağıda verilmiştir. Tutulan log bilgisinde, bağlantı yapan bilgisayarın adresi, hedef dosya ve kullanıcı adı', 'Course: HIST345\nDepartment: This course belongs to DEPARTMENT OF HISTORY.\nObjective: By the end of the course the students will; a) Know key historical facts, values, and ideas that have prepared the conditions for the start of printing and publishing in the Ottoman Empire, b) Identify distinctive character of Turkish newspapers and journalism in historical perspective until the 1930s. c) Comprehend the contribution of the Turkish press in the formation of public opinion, d) Know the connection between the technological development and the progress of the press, e) Know the importance of the press agencies in the development of the Turkish press and the establishment of the journalist associations in the development of Turkish journalism. f) Comprehend relations between the press and politics in the Ottoman Empire and in Modern Turkey, g) Know the key role of the censor for the governments to control the press throughout history. \nContent:  The aim of the course is to explore the historical development of the periodical press in the Ottoman Empire and the early Republican Turkey.', 'bulunup tanınması çalışmaları (1988-1990), Antakya kıyılarında yine topluluk tarafından bulunan 1600 yıllık iki batık gemi ve her birinde bulunan cam külçeler (1992/1993) ODTÜ Sualtı Topluluğu’nun Arkeoloji bilimine yaptığı katkıların ilkleridir. Bunlara ek olarak topluluğun 1992 yılında ilk kez Bozcaada’da düzenlediği “Sualtında Görüntü Avlama Yarışması” SAGAY, Türkiye’de düzenlenen ilk sualtı fotoğraf yarışması olmasının yanı sıra, Zıpkınla Balık Avcılığı Yerine Fotoğraf Makinesiyle Görüntü Avcılığı gibi anlamlı bir seçeneği sunarak Kuzey Ege’de “deniz parkları” kurulmasını ve işlemesini sağlamayı amaç edinmiştir. Son zamanlarda topluluk Türkiye Kıyıları Deniz Mağaraları Envanter Projesi, Kilikya Bölgesi Arkeolojik Yüzey Araştırması, Deniz Çayırlarının Yayılımının İncelenmesi, Uluburun III Yapay Resif Projesi, Serbest Dalış Denemeleri gibi önemli projeleri yürütmektedir. ODTÜ Sualtı Topluluğu Rektörlük makamına karşı sorumludur. Akademik Danışman ve beş öğrenciden oluşan yürütme kurulu, üç öğrenciden oluşan denetleme kurulu işleyişi sağlamakla görevlidir. Yürütme Kurulu ve Denetleme Kurulu Genel Kurula karşı sorumludur. Topluluğun Akdeniz Foku Araştırma Grubu (AFAG), Batık Araştırma Grubu (BAG), Ekoloji Grubu (EKOG), Fotografi ve Videografi Grubu (FOVAG), Mağara Dalışı ve Araştırma Grubu (MADAG) ve Serbest Dalış Grubu (SDG) gibi alt grupları ile çeşitli çalışma birimleri vardır.', 'ODTÜ’nün değil Türkiye’nin değerli bir yarışması haline gelen bu organizasyona her sene 20 farklı ülkeden 400’ü aşkın sporcu ve 5000 dans severi ağırlamaktadır. Uluslararası platformlarda da övgüler almaya devam eden ve 16.sını 4-5 Kasım 2017 tarihlerinde gerçekleştireceğimiz METU OPEN son 3 senedir tüm Uluslararası Yarışmalar arasında ilk 10’da yer almaktadır.']","['Application for Dormitories: Students whose family resides outside of Ankara can apply for the dormitories. Students who start our university this year, if they want to stay in our dormitories, must fill out the dormitory-related sections on the YKS Registration Program website during their university registration process and thus complete their applications.\n']","İşte yöntemlerden birisi METU Blog Servisi kullanarak web sayfalarınızı oluşturabilirsiniz. ODTÜ Blog Servisi, özgür bir yazılım olan WordPress altyapısını kullanmaktadır. Bu servis ile üniversitemizdeki akademik bölüm, idari birim, merkez, enstitü, fakülte/yüksekokul, lisansüstü program, laboratuvar, proje/araştırma grubu, öğrenci topluluğu vb. yapılara ait web siteleri kapsamlı bir şekilde hazırlanabilir, bu sitelerde çeşitli yazılar ve sayfalar oluşturulabilir. Tasarım için biraz önemli nokta, METU'nun görsel kimlik standartlarına uygun olmasıdır. Bu standartların detaylarını bulabilirsiniz <http://www.metu.edu.tr/tr/gkk/gorsel-kimlik-standartlari> adresinden.

        Bu yöntemden başlayarak, ilk olarak METU Blog Servisi'ne oturum açmanız gerekir. İşte oturum açma adımları:

        1. <https://blogs.metu.edu.tr> adresine gidin.
        2. ""Giriş Yap"" butonuna tıklayın.
        3. ""Kullanıcı Adı"" kutusuna öğretim üyesi, öğrenci veya personel numarasınızı yazın.
        4. ""Şifre"" kutusuna öğretim üyesi, öğrenci veya personel şifrenizi yazın.
        5. ""Giriş Yap"" butonuna tıklayın.

        Başarıyla giriş yaptıktan sonra, ""Sitelerim"" sekmesine tıklayın ve ""Yeni Sitesi"" butonuna tıklayın. Ardından, yeni web sitesi oluşturmak için gerekli bilgileri girin ve ""Sitesi Oluştur"" butonuna tıklayın.

        Web sayfasınız oluşturulduktan sonra, yazılar ve sayfalar ekleyebilirsiniz. Bu işlem için ""Yazılar"" sekmesine gidin ve ""Yeni Yazı"" butonuna tıklayın. Ardından, yazının başlığını ve içeriğini girin ve ""Yayınla"" butonuna tıklayın.

        Web sayfasınızın tasarımını değiştirmek için, ""Yazılar"" sekmesine gidin ve ""Yazı Düzenle"" sekmesine tıklayın. Ardından, ""Yazı Düzenle"" sekmesindeki ""Tasarım"" sekmesine tıklayın. Tasarım sekmesinde, web sayfasınızın tasarımını değiştirebilirsiniz.

        Bu şekilde, METU Blog Servisi kullanarak web sayfalarınızı oluşturabilirsiniz.","Ankara dışında ailesi yaşayan öğrenciler yurtlara başvurabilir. Bu yıl üniversitemize başlayan öğrenciler, yurtlarımızda kalmak istiyorlarsa, üniversite kayıt sürecinde YKS Kayıt Programı web sitesindeki yurtla ilgili bölümleri doldurmalı ve böylece başvurularını tamamlamalıdır.",0.0,0.0,0.0,0.9615384615384616,0.8330079804014916
"What are the key architectural developments and major monuments from the Greek period as covered in the ARCH112 course, and how do they relate to the broader context of cultural heritage preservation?","['Course: ARCH427\nDepartment: This course belongs to DEPARTMENT OF ARCHITECTURE.\nObjective: No objective\nContent:  The course deals with various approaches and viewpoints in the study of Greek architecture through selected readings. Class discussions are based on specific topics and themes such as the evolution of the Greek temple. Active oral participation in the course is mandatory.', 'Content:  This course intends to introduce students to the field of Late Antique and Byzantine architecture and topography through a survey of major Early Christian and Byzantine cities, i.e. Rome, Ravenna, Milan, Istanbul, and Thessaloniki. The course will present the basic architectural and topographical components introduced by the new political, cultural and religious system, and explore several different factors in determining the distribution and positioning of these components into the urban topography and their relationship with the existing (Classical) buildings and functions. The course thus aims to analyze the transformation of the Classical and Late Antique topography, and the impact of the new cultural and religious concepts into the urban environment before and after the decline of the administrative, social, religious, and architectural structures and functions of the Roman Empire both in the East and the West.', 'Course: ARCH112\nDepartment: This course belongs to DEPARTMENT OF ARCHITECTURE.\nObjective: This course provides a concise survey of architectural developments and major monuments in prehistoric (Anatolian, Egyptian, Mesopotamian, Minoan, Mycenaean), Classical (Greek and Roman), Early Christian, Byzantine, Romanesque and Gothic periods. It introduces the architectural forms, types, typologies, building technologies and materials in due periods. Formal and stylistic characteristics are evaluated with a contextual and comparative approach with the examination of the socio-cultural background in architectural production.\xa0 \nContent:  Major monuments and architectural development in Prehistoric (Anatolian, Egyptian, Mesopotamian, Minoan, Mycenean), Classical (Greek and Roman), Early Christian, Byzantine, Romanesque and Gothic periods.', 'Course: HIST101\nDepartment: This course belongs to DEPARTMENT OF HISTORY.\nObjective: This course provides a broad overview of the history and culture of ancient Greek civilization from the Bronze Age until the rise of Rome. By the end of the class students should have a basic understanding of both the political and cultural development of Greek civilzation, as well as the cultures that influenced its development. \nContent:  The aim of this course is to offer the political, social and cultural history of Greece and Rome in the antiquity. The period from the Minoan Civilization to the end of the Hellenistic Period will be covered in this course.', 'Course: ARCH413\nDepartment: This course belongs to DEPARTMENT OF ARCHITECTURE.\nObjective: No objective\nContent:  Byzantine architecture throughout the east Mediterranean, the Balkans, Greece, Anatolia, and the Near East between 323 A.D. and 1453. A survey designed to familiarize students with the major monuments and themes in the history of Byzantine architecture using a contextual approach. Students to describe and analyze Byzantine buildings critically in writing and class discussions with special focus on the Byzantine churches, which are the buildings to have survived the most, while fortifications, civic infrastructures, monasteries, palaces, castles and houses will also be discussed.', 'Course: ARCH498\nDepartment: This course belongs to DEPARTMENT OF ARCHITECTURE.\nObjective: No objective\nContent:  To introduce historic sites, their characteristics and problems to the students. Includes analysis and evaluation of the problems of conservation in different scales in a historic area.', 'Course: ARCH423\nDepartment: This course belongs to DEPARTMENT OF ARCHITECTURE.\nObjective: The course provides a concise chronological outline of house types and daily life practices in antiquity and related terminology; knowledge on specific archaeological sites with remains of domestic architecture and material remains; understanding of architectural design and social use of house in antiquity, awareness of archaeological contexts as a repository of architectural design and history studies. \nContent:  A contextual and thematic survey on the development of domestic architecture in the ancient Greek and Roman periods. The course covers the architectural and spatial design of houses, household practices and social rituals.', 'Course: ARCH436\nDepartment: This course belongs to DEPARTMENT OF ARCHITECTURE.\nObjective: No objective\nContent:  A critical survey of the major developments in the history of Roman architecture in Rome and the provinces. Adaptation and evolution with regard to the Roman architectural revolution.', 'Course: ARCH403\nDepartment: This course belongs to DEPARTMENT OF ARCHITECTURE.\nObjective: Attention to students: The course requires reading Turkish documents and books, therefore if you are an\xa0Erasmus student\xa0or a\xa0foreign student, please do not add this course. The formation of groups is among the priorities of this course. If it is possible, we expect you to form\xa0groups of 4 people\xa0before you come to the first course. The major objectives of the course are defined as follows;  apply research and survey methods in order to document a modern (20th century) architectural heritage in Ankara, develop awareness of the techniques associated with the conservation of architectural heritage, be informed of basic terminology and international principles related to the conservation of architectural heritage, develop skills in architectural surveying, graphical and verbal representation, and analytical investigation of an architectural heritage.    \nContent:  The methods of making a thorough measured and descriptive survey of a building by means of various techniques and instruments are given in a series of lectures. Practical exercises are carried out on the site.', 'Course: ARCH407\nDepartment: This course belongs to DEPARTMENT OF ARCHITECTURE.\nObjective: Acquisition of knowledge on this relatively less represented cultural context of Anatolian (and Eastern Mediterranean) history; improvement of skills and attitudes to deal with, and protect, without bias, the heritage of this civilization Knowledge: Creation of a cultural background in terms of architectural history, topography, and built environment of the Late Antique and Byzantine periods in Anatolia and the Eastern Mediterranean, and the expertise of using the relevant literature Skills: Improvement of skills and abilities to develop independent research and critical awareness in working in, or with, all inter-related disciplines investigating the past (history, history of art and architecture, archeology etc) Attitudes: Development of awareness and sensibility towards cultural diversity and utmost care for the cultural heritage of all civilizations']","['abea63f4-85ac-4646-ab2c-b2cbc87fdff2\n\nCourse: ARCH112\nDepartment: This course belongs to DEPARTMENT OF ARCHITECTURE.\nObjective: This course provides a concise survey of architectural developments and major monuments in prehistoric (Anatolian, Egyptian, Mesopotamian, Minoan, Mycenaean), Classical (Greek and Roman), Early Christian, Byzantine, Romanesque and Gothic periods. It introduces the architectural forms, types, typologies, building technologies and materials in due periods. Formal and stylistic characteristics are evaluated with a contextual and comparative approach with the examination of the socio-cultural background in architectural production.\xa0 \nContent:  Major monuments and architectural development in Prehistoric (Anatolian, Egyptian, Mesopotamian, Minoan, Mycenean), Classical (Greek and Roman), Early Christian, Byzantine, Romanesque and Gothic periods. ']"," In the ARCH112 course, you will learn about key architectural developments and major monuments from the Greek period. Some of the major monuments include the Parthenon, the Temple of Apollo at Delphi, and the Theatre of Dionysus in Athens. These structures are significant for their innovative use of the Doric and Ionic orders, as well as their role in the development of Western architecture.

        The Greek architectural developments, as covered in the course, relate to the broader context of cultural heritage preservation in several ways. Firstly, understanding these monuments helps us appreciate the historical and cultural significance of ancient Greece. Secondly, studying their construction techniques and materials can inform modern conservation efforts, ensuring that these valuable structures are preserved for future generations. Lastly, these monuments serve as symbols of Greek civilization, contributing to our shared cultural heritage and fostering a sense of unity and identity among people worldwide.

        If you're interested in learning more about the legal and administrative aspects of preserving cultural heritage, you might find ARCH495 or ARCH490 courses helpful. These courses focus on the characteristics of governmental and non-governmental bodies dealing with preservation, as well as the methods and techniques for interpreting and presenting heritage places.","The ARCH112 course provides a concise survey of architectural developments and major monuments from the Classical period, which includes the Greek era. It focuses on the architectural forms, types, typologies, building technologies, and materials used during this time. The course evaluates the formal and stylistic characteristics of Greek architecture within a contextual and comparative framework, examining the socio-cultural background that influenced architectural production. This approach is essential for a Cultural Heritage Preservation Specialist, as it highlights the importance of understanding historical context in the conservation and adaptive reuse of Greek cultural heritage sites.",0.75,0.3333333333,0.38,0.043478260869565216,0.9234225279458723
"As the Underwater Research Coordinator, I am interested in understanding how the ODTÜ Aikido Topluluğu contributes to the promotion of physical and psychological development in children, particularly in relation to their focus on respect, cooperation, and self-discipline. Can you elaborate on the specific initiatives and activities that the club undertakes to achieve these goals?","[""Sports Club Name: METU AIKIDO COMMUNITY\nSports Club Description: Many members of the METU Aikido Community, which is the largest dojo in Turkey with over 200 members including the Children's Aikido group, attend many Aikido seminars in Turkey and abroad every year. Although it is thought that Near Eastern martial arts clubs do not attract women, almost half of the METU Aikido Community consists of women. The aim of the community is to correct this misperception and to raise technically advanced and ethical athletes and to spread and make Aikido more popular. In addition to this, with the work it does in the Children's Aikido group, it also aims to ensure the physical, social and psychological development of children, as well as to instill in them the self-confidence, patience and internal discipline that ensure professional success with respect, cooperation and harmony. The METU Aikido Community follows the style and principles of Tamura Shihan and his student Nebi Vural Sensei. It organizes two international seminars every year in December and May. Together with the Eurasian Aikido Organization, it has been organizing and hosting the International Aikido Festival, with the participation of approximately 300 athletes from 20 countries every May for 7 years."", 'which has been organized since 2001 and has become a valuable competition not only for METU but also for Turkey, hosts more than 400 athletes and 5000 dance enthusiasts from 20 different countries every year. Continuing to receive praise on international platforms and to be held for the 16th time on November 4-5, 2017, METU OPEN has been in the top 10 among all International Competitions for the last 3 years.', 'Student Club Name: ""ÇOCUK AKLIM"" SOCIETY\nStudent Club Description: The Society aims to contribute to the development of all children with different characteristics and coming from different socio-economic status in order for 0-6 year old children to reach the desired level in terms of their cognitive, emotional, physical, social and language development. The Society also seeks to bring students, faculty members and specialists who want to contribute positively to the development of pre-school children together, to increase the knowledge and interest of parents about pre-school education and to include them in this process. Academic Advisor: Asst. Prof. Dr.Elif Karslı Çalamak (Department of Elementary and Early Childhood Education) Club Room: Society Container No:1', 'Sports Club Name: METU LIFE SAVING AND FIRST AID SOCIETY (OCIT)\nSports Club Description: The general purpose of our group is to raise awareness among university students about lifesaving and first aid. For this purpose, we provide Basic First Aid Lessons Training, Advanced First Aid Lessons Training, First Aid in Nature Training, Instructor Formation Training, Formation First Aid Discussions Training and Case Days. We also provide Bronze and Silver Lifeguard Training in the pool, participate in swimming races in our country to represent our school, and take part in running and cycling races as volunteer first aiders.', 'Sports Club Name: METU MOUNTAINEERING AND WINTER SPORTS BRANCH (DKSK)\nSports Club Description: Our group aims to popularize and spread all nature sports (mountaineering, skiing, caving, hiking, camping, scientific expeditions, etc.) with an amateur spirit and scientific approach by establishing social relations throughout the country. Our group uses all the possibilities to the fullest by reinforcing human-nature relations for the benefit of man and nature, and realizes its goals with a democratic understanding within a tight organization and social integrity. The aim of the group activities is to increase the technique and skills of the participating athletes to the extent required by that activity. In line with this purpose, it carries out activities all year round. It aims to perform its activities in all kinds of natural conditions, to learn and use the techniques required by different mountains and different seasons. Our group sees all the nature sports it does as sports that complement each other. It also accepts skiing as a sport that allows being together with nature, and encourages the use of skiing in relation to mountaineering and other activities, to train technically strong, amateur-spirited athletes, and for these athletes to enter amateur ski competitions on behalf of the university. In line with this purpose, our branch establishes and maintains relationships with clubs that support and practice all sports performed in nature.', 'Sports Club Name: METU E-SPORTS COMMUNITY\nSports Club Description: The main purpose of the METU E-Sports Community is to participate in national and international e-sports tournaments and represent METU in the best way. Other purposes of the community are to promote e-sports and games played in e-sports tournaments, to socialize with people interested in video games and e-sports, to play games together and to organize events to develop tactical and strategic minds.', 'Student Club Name: JAPANESE CULTURE SOCIETY\nStudent Club Description: The Society aims to introduce the Japanese language and culture in METU, to inform and guide students in this regard, to improve the competencies of students in the Japanese language and to increase the communication among them. Academic Advisor: Asst.Prof.Dr. Meltem Şenol Balaban (Department of City and Regional Planning) Society Room: Clubs Container No:2', 'Sports Club Description: METU Partner Dances Ensemble was founded in 1988 and is the first partner dance ensemble in Turkey. Since its establishment, our ensemble has aimed to introduce and popularize partner dances first at METU and then throughout Turkey; it has pioneered the development of partner dances in our country and has made great contributions to the point dance sports have reached today. Many dancers who have achieved significant degrees in official competitions, founders of almost all dance studios in Ankara and various board members of the Turkish Dance Sports Federation, and many of the dance sports referees in Turkey have been introduced to the dance world by our ensemble. METU EDT regularly organizes two major events per year. The first of these is the Year-End Show, which we stage at the Kemal Kurdaş Hall of the Culture and Congress Center at the beginning of May each year. It has now become one of the most beloved and anticipated events of METU and meets approximately 4000 dance enthusiasts with a different concept every year. One of these is the May 2012 Metucation show, which we proudly designed and realized, and tells the story of METU. Another event is the International METU Republic Cup Dance Competition, also known as METU OPEN, which we organize every year during the Republic Day week! This organization, which has been organized since 2001 and has become a valuable competition not only for METU but also for Turkey, hosts more than 400 athletes and', 'Sports Club Description: The METU Underwater Society was founded in 1985 by a group of METU students and faculty members as a student society affiliated with the Directorate of Sports within the METU Presidency. The basic principle adopted by METU SAT in its establishment is to research, protect and promote the historical, cultural and natural values \u200b\u200bof the Turkish coasts and inland waters. The activities carried out within this scope include providing basic and advanced diving, search, rescue and first aid training to provide knowledge and skills to the members of the society; training divers for exploration and examination purposes; organizing research and promotional activities (such as competitions, panels, meetings and seminars) on the ecological values \u200b\u200b(such as sea meadows, sea turtles, Mediterranean monk seals), natural values \u200b\u200b(such as underwater caves, offshore rocks and marine life shelters) and cultural values \u200b\u200b(such as shipwrecks, underwater archaeology, maritime history) of our coasts and inland waters. The society conducted a basic research study in Dalyan, a breeding beach for sea turtles in 1986/1987. The Mediterranean Monk Seal Protection Project also emerged from the METU Underwater Community in those years and has survived to the present day. The efforts to find and identify the Ottoman and Russian Command Ships that sank during the Ottoman-Russian Naval War in Çeşme Bay (1988-1990), the two 1600-year-old sunken ships found by the community on the', 'Sports Club Name: METU SCOUTING COMMUNITY\nSports Club Description: Since its establishment in 1986, our group has been working to ensure that scouting, a youth movement with volunteers of all ages worldwide, reaches as many people as possible at our university. One of our priorities is for our members to grow up as individuals who are beneficial to themselves and society with scouting awareness. In line with these goals, we actively organize events and camps throughout the year. Our members who have completed our training program are equipped in the areas of living in nature and camping. Our social responsibility projects also aim to raise awareness among both our members and everyone we can reach within the university.']","['303063e1-3f56-4b2a-aa0d-41b194cbde90\n\nSports Club Name: ODTÜ AİKİDO TOPLULUĞU\nSports Club Description: Bünyesindeki Çocuk Aikido grubuyla beraber 200’ü aşkın üyesiyle beraber Türkiye’nin en büyük dojosu olan ODTÜ Aikido Topluluğu’nun birçok üyesi her sene yurtiçi ve yurtdışında birçok Aikido seminerine katılmaktadır.\xa0Her ne kadar yakın doğu dövüş sanatı kulüplerinin kadınlar tarafından ilgi çekmediği düşünülse de, ODTÜ Aikido Topluluğu’nun neredeyse yarısı kadınlardan oluşmaktadır. Topluluğun amacı bu yanlış algıyı düzeltmektir ve teknik olarak ileri seviye, ahlaklı sporcular yetiştirmek ile Aikidoyu daha da yaymak ve sevdirmektir. Bundan ayrı olarak Çocuk Aikido grubunda yaptığı çalışmalarla birlikte çocukların fiziksel, sosyal ve psikolojik gelişimini sağlamanın yanında saygı, işbirliği ve uyum ile mesleki başarıyı sağlayan özgüven, sabır ve iç disiplini çocuklara aşılamaktır.\xa0ODTÜ Aikido Topluluğu, Tamura Shihan ve onun öğrencisi Nebi Vural Sensei’nin stili ve prensiplerini takip etmektedir. Her sene Aralık ve Mayıs aylarında iki tane uluslararası seminer düzenlemektir. Avrasya Aikido Organizasyonu ile birlikte, 7 yıldır her Mayıs ayında yaklaşık 20 ülkeden 300 sporcunun katıldığı, Uluslararası Aikido Festivalini düzenlemekte ve etkinliğe ev sahipliği yapmaktadır.\n']"," The METU Aikido Community, specifically the Children's Aikido group, focuses on promoting physical and psychological development in children. They achieve this through initiatives such as teaching respect, cooperation, and self-discipline. The club organizes two international seminars every year in December and May, and together with the Eurasian Aikido Organization, they host the International Aikido Festival, with the participation of approximately 300 athletes from 20 countries every May for 7 years. These events provide opportunities for children to learn, practice, and demonstrate their skills, fostering a sense of accomplishment and self-confidence. Additionally, the Children's Aikido group emphasizes teamwork, patience, and internal discipline, which are essential qualities for professional success.","The ODTÜ Aikido Topluluğu, through its Children Aikido group, focuses on ensuring the physical, social, and psychological development of children. The club aims to instill values such as respect, cooperation, and harmony, which are essential for professional success. Additionally, it emphasizes the importance of self-confidence, patience, and self-discipline in children. These initiatives are part of the club's broader mission to correct misconceptions about martial arts and to promote Aikido among a diverse audience.",0.75,0.0,0.25,0.5714285714285714,0.9276188734550637
ARKEOLOJİ DERNEĞİ nerede toplanıyor?,"['vb. yapılara ait web siteleri kapsamlı bir şekilde hazırlanabilir, bu sitelerde çeşitli yazılar ve sayfalar oluşturulabilir. Tasarım için biraz daha esnek olsa da serviste yer alan şablonlar dışında kalan harici bir şablona onay verilmemektedir. Servise giriş yapmak ve servis hakkında ayrıntılı bilgi almak için\xa0http://blog.metu.edu.tr\xa0adresi kullanılmalıdır.', 'ürettiği log dosyasının örneği aşağıda verilmiştir. Tutulan log bilgisinde, bağlantı yapan bilgisayarın adresi, hedef dosya ve kullanıcı adı bilgileri bulunmalıdır. Tue Mar 25 16:39:48 2008 0 bogus.com 528 /ftp/pub/IMPORTANT-WARNING.txt b _ o r anonim ftp 1 * c  Yukarıdaki örnekte yer alan bilgi alanları, kanunda belirtilen başlıklarla aşağıdaki şekilde ilişkilendirilmiştir: Bağlantı tarih-saat bilgisi: ""Tue Mar 25 16:39:48 2008""  Kaynak Adres: ""bogus.com""  İstenen dosya: ""ftp/pub/IMPORTANT-WARNING.txt""  Kullanıcı adı: ""anonim""  Birimler, yer sağlayıcı faaliyetleri kapsamında verdikleri servislerin ürettiği logları inceleyip, sahip oldukları sistemlerde verdikleri servislerin yarattığı trafik loglarını yönetmelikte tarif edildiği şekilde (zaman damgası ile birlikte) kayıt altına almak, bu logları, gizliliğini sağlayarak arşivlemekle yükümlüdür.', 'Sports Club Name: ODTÜ BRİÇ TOPLULUĞU\nSports Club Description: Kontak briç oynamayı öğrenmek, briç bilgisini geliştirmeyi, ulusal ve uluslararası yarışmalara katılmayı sağlamak topluluğumuzun temel amacıdır.', 'Course: ARCH419\nDepartment: This course belongs to DEPARTMENT OF ARCHITECTURE.\nObjective: No objective\nContent:  This course is an undergraduate survey focusing on the history of architecture of Anatolia from the Neolithic Period to the end of the Iron Ages. The principal aim is to provide students with a general knowledge of different architectural traditions of Pre-Classical Anatolia. The overall structure of the course is chronological. Architecture of the Neolithic Period, Early Bronze Age Troy, Assyrian Trade Colony Period, Hittite Empire, and the Kingdoms of Lycia, Phrygia will be investigated.', 'sebeplerle ilgili olarak abc-l-ownermetu.edu.tr adresinden liste yöneticisi ile iletişime geçebilir, detaylı bilgi alabilirsiniz.  (Yukarıda geçen ""abc-l"" ifadesi liste ismi için örnek olarak verilmiştir)', 'FAQ Link: https://faq.cc.metu.edu.tr/faq/bolum-birim-merkez-laboratuvar-ogrenci-toplulugu-web-sayfasi-nasil-yapilir', 'bulunup tanınması çalışmaları (1988-1990), Antakya kıyılarında yine topluluk tarafından bulunan 1600 yıllık iki batık gemi ve her birinde bulunan cam külçeler (1992/1993) ODTÜ Sualtı Topluluğu’nun Arkeoloji bilimine yaptığı katkıların ilkleridir. Bunlara ek olarak topluluğun 1992 yılında ilk kez Bozcaada’da düzenlediği “Sualtında Görüntü Avlama Yarışması” SAGAY, Türkiye’de düzenlenen ilk sualtı fotoğraf yarışması olmasının yanı sıra, Zıpkınla Balık Avcılığı Yerine Fotoğraf Makinesiyle Görüntü Avcılığı gibi anlamlı bir seçeneği sunarak Kuzey Ege’de “deniz parkları” kurulmasını ve işlemesini sağlamayı amaç edinmiştir. Son zamanlarda topluluk Türkiye Kıyıları Deniz Mağaraları Envanter Projesi, Kilikya Bölgesi Arkeolojik Yüzey Araştırması, Deniz Çayırlarının Yayılımının İncelenmesi, Uluburun III Yapay Resif Projesi, Serbest Dalış Denemeleri gibi önemli projeleri yürütmektedir. ODTÜ Sualtı Topluluğu Rektörlük makamına karşı sorumludur. Akademik Danışman ve beş öğrenciden oluşan yürütme kurulu, üç öğrenciden oluşan denetleme kurulu işleyişi sağlamakla görevlidir. Yürütme Kurulu ve Denetleme Kurulu Genel Kurula karşı sorumludur. Topluluğun Akdeniz Foku Araştırma Grubu (AFAG), Batık Araştırma Grubu (BAG), Ekoloji Grubu (EKOG), Fotografi ve Videografi Grubu (FOVAG), Mağara Dalışı ve Araştırma Grubu (MADAG) ve Serbest Dalış Grubu (SDG) gibi alt grupları ile çeşitli çalışma birimleri vardır.', 'FAQ Answer:   English version will be available soon. 24 Ekim 2007 tarih ve 26680 sayılı Resmi Gazete\'de yayınlanan yönetmeliğe göre, ""Yer sağlayıcı trafik bilgisi, İnternet ortamındaki her türlü yer sağlamaya ilişkin olarak; kaynak IP adresi, hedef IP adresi, bağlantı tarih-saat bilgisi, istenen sayfa adresi, işlem bilgisi (GET, POST komut detayları) ve sonuç bilgisi gibi bilgileri ifade etmektedir."" Tanımlanan bu bilgiye, bir hukuksal incelemede kullanılmak üzere yer sağlayıcılık faaliyetleri kapsamındaki bir faaliyetin kim tarafından yapıldığının tespiti için ihtiyaç duyulmaktadır. l) Örnek ""http"" logu: Aşağıda yer sağlayıcı faaliyet kapsamında bir web sayfasının bulunduğu sunucunun ilgili örnek trafik logu (http logu) gösterilmiştir. Bu log, ""apache"" web sunucu yazılımının ürettiği bir log örneğidir. Birimlerde kullanılan farklı web sunucu yazılımları için, yazılımların belgelerine başvurulması ve uygun log tutulması için hangi işlemlerin yapılmasının gerekli olduğunun öğrenilmesi gerekmektedir. 144.122.222.234 - - [21/Mar/2008:14:58:01 -0200] ""GET \'data/liste.html HTTP/1.1"" 200""1 73372 ""-"" ""Mozilla/5.0 (XII: U; Lınux i686; en-L\'S; rv:1.8.1.12) Gecko/20080129 Iceweasel/2.0.0.12(Debian-2.0.0.12-Oetchl)""  Yukarıdaki örnekte yer alan bilgi alanları, kanunda belirtilen başlıklarla aşağıdaki şekilde ilişkilendirilmiştir: Kaynak IP adresi : 144.122.222.234 Hedef ip adresi: Bu kayıtta bulunmamaktadır"" Bağlantı tarih-saat bilgisi: [21/Mar/2008:14:58:01 -0200] İstenen sayfa', 'ODTÜ’nün değil Türkiye’nin değerli bir yarışması haline gelen bu organizasyona her sene 20 farklı ülkeden 400’ü aşkın sporcu ve 5000 dans severi ağırlamaktadır. Uluslararası platformlarda da övgüler almaya devam eden ve 16.sını 4-5 Kasım 2017 tarihlerinde gerçekleştireceğimiz METU OPEN son 3 senedir tüm Uluslararası Yarışmalar arasında ilk 10’da yer almaktadır.', 'FAQ Answer:   Liste yönetim şifresini edinmek için listenin yöneticisi olarak kullandığınız e-posta adresinden mailman@metu.edu.tr adresine\xa0yöneticisi olduğunuz listenin adı ve\xa0telefon numarası bilginizi vererek\xa0şifre isteğinizi bildiren bir e-posta gönderiniz. E-Liste servis yöneticisi talebiniz üzerine gerekli incelemeleri gerçekleştirecek, talebin uygun görülmesi durumunda sizinle telefon aracılığıyla iletişime geçecektir. E-Liste yöneticiliğinde bir değişiklik söz konusu olduğunda, önceki e-liste yöneticisi yeni liste yöneticisinin e-posta adresini listenin yönetim arayüzü üzerinde yönetici olarak tanımlamalı ve yönetim şifresini yeni yöneticiye teslim etmelidir. Ancak, liste yöneticisinin yeni yöneticiyi tanımlamadan ve şifreyi aktarmadan görevden ayrılması gibi durumlarda, farklı bir kişinin liste yöneticisi olarak tanımlanmasına BİDB tarafından destek verilebilmektedir. Böyle bir durum söz konusu ise, ilgili listenin yeni yöneticisi olacak kişinin konuyla ilgili talebini ""metu.edu.tr"" uzantılı e-posta adresini kullanarak mailmanmetu.edu.tr adresine iletmesi gerekmektedir. Söz konusu liste üniversitedeki bir birime ait ise, bu talep ilgili birimin yöneticisi tarafından iletilmelidir. Talebin BİDB\'na ulaşmasının ardından, talep sahibi ile iletisime geçilerek gerekli işlemler gerçekleştirilecektir. (Yukarıda geçen ""abc-l"" ifadesi liste ismi için örnek olarak verilmiştir.)']","['Student Club Name: ARCHEOLOGICAL SOCIETY\nStudent Club Description: The Society aims to carry out scientific studies related to Anatolian cultures, the cradle of the civilizations that have an important place in the world cultural heritage, to promote the richness of Anatolian culture and to disseminate love and awareness of archeology to people, and to organize informative seminars and trips to the ancient regions of our country. Academic Advisor: Prof.Dr.Deniz Burc Erciyas (Department of Settlement Archaeology) Society Room: Societies Barrack \n']","İlk adım, Arkeoloji Derneği'nin toplanacağı yer bulmak için ODTÜ'nun Arkeoloji Bölümü veya Arkeoloji Derneği'nin web sitesini ziyaret ederek bilinmesi gerekir. İçinde bulunan bilgilerde, toplanacağı yer ve zaman bilgileri verilir.

        İşte bir örnek: https://www.odtu.edu.tr/tr/akademik/arkeoloji-bolumu/arkeoloji-dernegi

        İşte bir diğer örnek: https://www.odtu.edu.tr/tr/akademik/arkeoloji-bolumu/arkeoloji-dersleri

        Not: Bu bilgiler, yazılmış olduğu tarihte geçerli olabilir. Lütfen yeni bilgiler için ODTÜ'nun Arkeoloji Bölümü veya Arkeoloji Derneği'nin web sitesini ziyaret edin.","ARKEOLOJİ DERNEĞİ, Dernek Kışlası'nda toplanır.",0.0,0.0,0.0,0.0,0.8423597545463697
GÜZEL SANATLAR DERNEĞİ'nin amacı nedir?,"['FAQ Answer:   Liste yönetim şifresini edinmek için listenin yöneticisi olarak kullandığınız e-posta adresinden mailman@metu.edu.tr adresine\xa0yöneticisi olduğunuz listenin adı ve\xa0telefon numarası bilginizi vererek\xa0şifre isteğinizi bildiren bir e-posta gönderiniz. E-Liste servis yöneticisi talebiniz üzerine gerekli incelemeleri gerçekleştirecek, talebin uygun görülmesi durumunda sizinle telefon aracılığıyla iletişime geçecektir. E-Liste yöneticiliğinde bir değişiklik söz konusu olduğunda, önceki e-liste yöneticisi yeni liste yöneticisinin e-posta adresini listenin yönetim arayüzü üzerinde yönetici olarak tanımlamalı ve yönetim şifresini yeni yöneticiye teslim etmelidir. Ancak, liste yöneticisinin yeni yöneticiyi tanımlamadan ve şifreyi aktarmadan görevden ayrılması gibi durumlarda, farklı bir kişinin liste yöneticisi olarak tanımlanmasına BİDB tarafından destek verilebilmektedir. Böyle bir durum söz konusu ise, ilgili listenin yeni yöneticisi olacak kişinin konuyla ilgili talebini ""metu.edu.tr"" uzantılı e-posta adresini kullanarak mailmanmetu.edu.tr adresine iletmesi gerekmektedir. Söz konusu liste üniversitedeki bir birime ait ise, bu talep ilgili birimin yöneticisi tarafından iletilmelidir. Talebin BİDB\'na ulaşmasının ardından, talep sahibi ile iletisime geçilerek gerekli işlemler gerçekleştirilecektir. (Yukarıda geçen ""abc-l"" ifadesi liste ismi için örnek olarak verilmiştir.)', 'IP adresi : 144.122.222.234 Hedef ip adresi: Bu kayıtta bulunmamaktadır"" Bağlantı tarih-saat bilgisi: [21/Mar/2008:14:58:01 -0200] İstenen sayfa adresi: data/liste.html İşlem bilgisi (GET komut detayı) : GET \'data/liste.htmi HTTP/1.1 Sonuç bilgisi: 200  2) Örnek e-posta logu: ""sendmail"" e-posta sunucu yazılımının ürettiği log dosyasının örneği aşağıda verilmiştir. Tutulan log bilgisinde, ""to"", ""from"" ve ""relay"" bilgilerinin bulunması gereklidir. Kullanılan e-posta yazılımının log formatı, istenen bilgileri bir veya birden fazla satır halinde verebilir. Mar 25 10:20:02 mailhost sendmail[9516]: m2Q8K2e2009516:  from=<bogususerbogus.com>, size=2291, class=0, nrcpts=1,  msgid=<00b101c88f1a$407a7cf0$>, proto=ESMTP, daemon=MTA, relay=boguspc.bogus.com [192.168.1.1] Mar 25 10:20:03 mailhost sendmail[9550]: m2Q8K2e1009516:  to=<bogus2userbogus2.com>, delay=00:00:01, xdelay=00:00:00,  mailer=esmtp, pri=122357, relay=mx.bogus2.com. [192.168.1.2], dsn=2.0.0,  stat=Sent ( Queued mail for delivery)  Yukarıdaki örnekte yer alan bilgi alanları, kanunda belirtilen başlıklarla aşağıdaki şekilde ilişkilendirilmiştir: Bağlantı tarih-saat bilgisi: ""Mar 25 10:20:03"" Gönderici: bogususerbogus.com Kaynak IP adresi: 192.168.1.1 Hedef IP adresi: 192.168.1.2 Alıcı: bogus2userbogus2.com Sonuç bilgisi: sent  3) Örnek ftp logu: ""proftpd"" ftp sunucu yazılımının ürettiği log dosyasının örneği aşağıda verilmiştir. Tutulan log bilgisinde, bağlantı yapan bilgisayarın adresi, hedef dosya ve kullanıcı adı', 'sebeplerle ilgili olarak abc-l-ownermetu.edu.tr adresinden liste yöneticisi ile iletişime geçebilir, detaylı bilgi alabilirsiniz.  (Yukarıda geçen ""abc-l"" ifadesi liste ismi için örnek olarak verilmiştir)', 'time and resources. Topics like charity donation, help for an ill child or the need for a wheel chair, the need of the e-mail to be forwarded to as many people as you can etc. are all examples of bogus e-mail. Phishing e-mail examples   -------- Original Message --------  From: XXXX Bank To: metuusermetu.edu.tr Date: Sun, 16 Jan 2011 07:21:55 +0200 Subject: E-Mail/Your GSM Number Dear XXXX Bank Customer, Any information you wish to get at goes through our E-mail / SMS services. XXXX Bank Internet Banking users should indicate their E-mail account / GSM number along with their customer information so as to receive alerts and announcements. Thanks to this warning system any transactions on your account will be conveyed on you as a daily or instantaneous report according to your instruction. Furthermore if you wish, you may have information on economy, daily info, reminders, and other similar detail sent to your cellular or e-mail address at no cost. Please indicate your e-mail account / GSM number along with your personal information by clicking here. After you enter the Internet Banking site, click on E-Mail / SMS Services by selecting the services you wish to get you can start making use of our services. CLICK FOR INTERACTIVE BANKING > http://www.XXXXbank_net.com Best regards, XXXX Bank -------- Original Message --------  From: XXXXbankXXXXbank.com.tr (eychennebigfoot.com) To:metuusermetu.edu.tr Date: Tue, 18 Jan 2011 10:40:53 -0400 Subject: Dear Customer Dear Customer, We', 'FAQ Answer:   Sayfanız için bir web hesabı ve alan adı gerekecektir. Bunun için\xa0https://cc-form.metu.edu.tr/web\xa0adresinde yer alan ""Yeni Web Kullanıcı Kodu ve Alan Adı Başvuru Formu""nu doldurmanız gerekmektedir. Başvurunuz üzerine sizinle iletişime geçilecektir. Web sitenizi aşağıdaki yöntemlerden biri ile oluşturabilirsiniz. Kendiniz Dreamweaver ya da benzeri bir programla web sayfalarınızı hazırlayabilirsiniz.\xa0 Merkezi İçerik Yönetim Sistemi\'ni (MİYS) kullanabilirsiniz. MİYS açık kaynaklı bir içerik yönetim sistemi olan Drupal alt yapısını kullanmaktadır. Üniversitemizdeki akademik bölüm, idari birim, merkez, enstitü, fakülte/yüksekokul, lisansüstü program, laboratuvar, proje/araştırma grubu, öğrenci topluluğu vb. yapılara ait web sayfaları bu sistem üzerinde oluşturulabilmektedir. MİYS ile ilgili ayrıntılı bilgiye ve başvuru formuna http://miys.metu.edu.tr adresinden erişebilirsiniz. Bu sistemi kullanırsanız MİYS kapsamında geçerli görsel kimlik standartlarına (http://www.metu.edu.tr/tr/gkk/gorsel-kimlik-standartlari) uymanız beklenmektedir. ODTÜ Blog Servisi\'ni kullanabilirsiniz. ODTÜ Blog Servisi, özgür bir yazılım olan WordPress altyapısını kullanmaktadır. Bu servis ile üniversitemizdeki akademik bölüm, idari birim, merkez, enstitü, fakülte/yüksekokul, lisansüstü program, laboratuvar, proje/araştırma grubu, öğrenci topluluğu vb. yapılara ait web siteleri kapsamlı bir şekilde hazırlanabilir, bu sitelerde çeşitli yazılar ve sayfalar oluşturulabilir. Tasarım için biraz', 'ayarları ISO-8859-9 (Türkçe ISO olarak da tanımlanır) ya da UTF-8 seçmeniz yeterlidir. Size gelen e-postalardaki Türkçe karakterleri görmekte sorun yaşıyorsanız iki farklı durum sözkonusu olabilir. Karşı taraf e-posta gönderirken ya da kendisine gelen e-postayı yönlerken Türkçe karakterleri desteklemeyen bir karakter seti kullanmıştır. Bu durumda gelen mesaj düzgün olarak görüntülenemez. Örneğin metinde Türkçe karakter kullanıldığı halde gönderilirken ISO-8859-1 karakter seti kullanılmış ise söz konusu karakter seti Türkçe karakterleri desteklemediği için e-postanın düzgün olarak görüntülenmesi mümkün değildir. Gönderilen e-posta düzgün karakter seti ile gönderilmiş olmasına karşın kullandığınız programın ayarları farklı olabilir. Bu durumda kullanılan programın ayarlarının değiştirilmesi mesajın düzgün şekilde okunmasını sağlayacaktır. Horde ya da Squirrelmail kullanarak e-posta okuyan kullanıcılarımızın kullandıkları tarayıcı programında, Outlook Express, Thunderbird ya da Windows Mail benzeri herhangi bir POP3/IMAP istemcisi ile e-posta gönderen kullanıcılarımızın ise ilgili programdaki karakter seti ayarlarını değiştirmeleri gerekmektedir. Gelen e-postalar için karakter seti değişikliği yapmak için farklı programlarda izlenen yol aşağıdaki gibidir (aşağıda yer almayan farklı programlar için de karakter seti ayarları benzer yerlerdedir): Internet Explorer, Outlook Express ve Windows Mail için: View → Encoding (Görünüm → Kodlama) Mozilla Firefox ve Mozilla Thunderbird', 'FAQ Answer:   This page provides information about how the people who are list administrators can make use of the electronic list services by using the Mailman software. Mailman software provides web interfaces produced in various languages, specifically in Turkish and in English, to be used with electronic list services. Assuming that the list users would primarily use the English web interface, section titles and information messages on this page are given in English. To access the information or to work on the list of which you are the administrator: (1)\xa0From the\xa0http://mailman.metu.edu.tr/mailman/admin\xa0address, click on the list you are administering. (2)\xa0On the window that comes up on the screen at the\xa0http://mailman.metu.edu.tr/mailman/admin/LIST-NAME\xa0address, the administrator password has to be entered:Once the correct password is entered, a similar screen to the below comes up: (3) The sections on the list administration interface: (a) General Options\xa0is the interface to make changes on the features like, short or long list name, add/delete/change list administrator, assigning the list moderator, list descriptions, welcome or goodbye messages. It can be accessed from thehttp://mailman.metu.edu.tr/mailman/admin/LIST-NAME/general\xa0address.  To display the short name of the list in upper case or lower case characters:Change is made on the field, ""The public name of this list (make case-changes only)."":e.g. a short list name may be displayed as Test, TEST, Test etc.   To', 'FAQ Answer:   E-listelerde kullanılan üyelik şifreleri, merkezi kullanıcı kodları için kullanılan şifrelerden farklı olup, herhangi bir listeye üye olunduğunda Mailman yazılımı tarafından otomatik olarak tanımlanıp e-liste üyelerine gönderilen şifrelerdir. E-liste servisi kapsamında merkezi e-posta adresleri dışındaki e-posta adresleri ile de e-listelere üye olunabildiği için, e-liste arşivlerine ulaşımda merkezi kullanıcı şifreleri kullanılamamaktadır. E-liste şifresini hatırlamayan bir kullanıcı, bir e-listeye gönderilmiş mesajın ekinde yer alan eklenti dosya bağlantısına tıkladığında veya doğrudan http://mailman.metu.edu.tr/mailman/private/liste_adi şeklindeki e-liste arşiv giriş ekranının adresini yazarak, arşive giriş yapacağı sayfaya ulaşabilir. E-liste şifresini öğrenmek için, bu sayfada e-listeye üyelik için kullandığı e-posta adresini yazıp _x0093_Hatırlat_x0094_ butonuna basması yeterlidir.  Bu işlem sonrasında e-liste şifresi kullanıcının e-posta adresine aşağıdaki gibi bir mesaj ile gönderilecektir:  Burada, ""Your <e-liste-adı> password is:"" ifadesinin karşısında ""****"" ile belirtilmiş olan alanda yer alan bilgi, e-liste şifre bilgisidir. Kullanıcı bu şifreyi kullanarak mesaj ekinde yer alan eklenti dosyalara ulaşabilir ve e-liste arşivinde yer alan geçmiş tüm mesajları okuyabilir (E-liste yazılımı olan ""Mailman"", üye olunan her liste için ayrı şifre atamaktadır, ancak isteyen kullanıcılarımız üye oldukları tüm listeler için ortak bir şifre tanımlayabilirler).', 'bir şifreyi yazıp, _x0093_Şifremi Değiştir_x0094_ butonuna _x0093_Global Olarak Değiştir_x0094_ seçeneği seçili olacak şekilde tıklamalıdır.  Bu işlem başarılı bir şekilde gerçekleştirildiği takdirde, ekranda _x0093_Şifre başarıyla değiştirildi._x0094_ şeklinde bir mesaj görüntülenir. Kullanıcı tarafından tanımlanan yeni şifre artık aynı e-posta adresi ile üye olunan mevcut tüm e-listelerde kullanılabilir. Şifre değiştirme işlemi sırasında _x0093_Global Olarak Değiştir_x0094_ seçeneği seçili olmadığı durumda, sadece söz konusu e-listenin şifresi değiştirilmiş olur. ""Global Olarak Değiştir"" seçeneği ile kullanıcının o ana kadar üye olduğu tüm listelerin şifreleri değiştirilir. Bu işlem sonrasında üye olunacak yeni e-listelerde de aynı şifrenin kullanılabilmesi için bu işlemin her üyelikten sonra tekrarlanması gerekir. Bu işlem yapılmadığında yeni üye olunan e-listelerde, üye olurken Mailman tarafından otomatik olarak tanımlanıp kullanıcıya gönderilen şifreler kullanılır.', 'FAQ Question: I am a METU personnel but I can not receive the messages from university administration sent to announcement lists. What should I do? (in Turkish)\nFAQ Answer:   Üniversitemiz yönetimince mensuplarımız için çeşitli duyuru listeleri tanımlanmıştır. Öğrencilerin, akademik ve idari personelin kendileriyle ilgili bu listelere üyelikleri bir otomasyonla sağlanmaktadır.\xa0 Bu liste(ler)e gönderilen mesajlari daha önce görüyor ancak bir süredir göremiyorsaniz mailmanmetu.edu.tr adresine ilgili listeye üyelik için kullandığınız e-posta adresinden durumu bildiren bir e-posta gönderiniz. Üyelik durumunuz incelenecek, konu hakkında size bilgi verilecektir. Eğer ilgili listelerden şimdiye kadar hiç e-posta almadıysanız üyelik başvurusunda bulunmanız gerekmektedir. Bu konuda ""Bir listeye üye olmak için ne yapmalıyım?"" bölümünden bilgi alabilirsiniz.  \nFAQ Link: https://faq.cc.metu.edu.tr/faq/i-am-metu-personnel-i-can-not-receive-messages-university-administration-sent-announcement-lists']","['Student Club Name: FOREIGN POLICY AND INTERNATIONAL RELATIONS SOCIETY\nStudent Club Description: The Society aims to introduce international relations and related disciplines (such as public administration, economics, business, history, sociology) to university students and the public at large, to contribute to the ability to evaluate international events in a sound way. Academic Advisor: Assoc. Prof.Dr. Işık Kuşçu (Department of International Relations) Assoc. Prof. Zana Çıtak (Department of International Relations) Club Room: FEAS, Building B \n', ""Student Club Name: FINE ARTS SOCIETY (FAS)\nStudent Club Description: The Club aims to help the social and cultural development of its members and those who benefit from club's activities through art, to enable them to be trained as researchers and people with creative skills, to work for the introduction and development of fine arts in METU via painting, photography, violin, piano, flute and guitar courses. Academic Advisor: Asst. Prof. Dr. Ekin Pınar (Faculty of Architecture) Club Room: Clubs Container No: 4 \n""]","İlgili e-liste yöneticisiyle iletişime geçerek liste yönetim şifresini değiştirmek için aşağıdaki adımları izleyin:

        1. E-posta adresinizle mailman@metu.edu.tr adresine bir e-posta gönderiniz.
        2. Liste adınız ve telefon numarasınızı vererek yeni şifre isteğinizi bildiren bir e-posta gönderiniz.
        3. E-Liste servis yöneticisi talebiniz üzerine gerekli incelemeleri gerçekleştirecek, talebin uygun görülmesi durumunda sizinle telefon aracılığıyla iletişime geçecektir.
        4. E-Liste yöneticiliğinde bir değişiklik söz konusu olduğunda, önceki e-liste yöneticisi yeni liste yöneticisinin e-posta adresini listenin yönetim arayüzü üzerinde yönetici olarak tanımlamalı ve yönetim şifresini yeni yöneticiye teslim etmelidir. Ancak, liste yöneticisinin yeni yöneticiyi tanımlamadan ve şifreyi aktarmadan görevden ayrılması gibi durumlarda, farklı bir kişinin liste yöneticisi olarak tanımlanmasına BİDB tarafından destek verilebilmektedir. Böyle bir durum söz konusu ise, ilgili listenin yeni yöneticisi olacak kişinin konuyla ilgili talebini ""metu.edu.tr"" uzantılı e-posta adresini kullanarak mailmanmetu.edu.tr adresine iletmesi gerekmektedir. Söz konusu liste üniversitedeki bir birime ait ise, bu talep ilgili birimin yöneticisi tarafından iletilmelidir. Talebin BİDB'na ulaşmasının ardından, talep sahibi ile iletişime geçilerek gerekli işlemler gerçekleştirilecektir. (Yukarıda geçen ""abc-l"" ifadesi liste ismi için örnek olarak verilmiştir)

        Kurs: FLE373
        Bölüm: DEPARTMENT OF FOREIGN LANGUAGE EDUCATION
        Amac: İşte bu kursun amacı: İnsanların İngilizce veya Almanca dilinde öğrenilmesi nedeniyle, kullanılması gereken çok fazla çözüm yöntemi vardır. Bu kurs, öğrencilerin bu sorunlara karşın, özel problemlerle karşılaşıldığında ne yapmaları öğretir. Bu kurs, öğrencilerin kendilerine özgü dil çözümleri bulmak için özellikle faydalı olacaktır.

        Öğretim Programı:
        Bu kurs, öğrencilerin düzenlenmiş bir öğretim programına tabi tutulur. Öğretim programı, kullanıcıların kendilerine özgü dil çözümleri bulmak için özellikle faydalı olacaktır. Bu kurs, öğrencilerin kendilerine özgü dil çözümleri bulmak için özellikle faydalı olacaktır.

        Öğretim Teknikleri:
        Bu kurs, öğrencilerin düzenlenmiş bir öğretim programına tabi tutulur. Öğretim programı, kullanıcıların kendilerine özgü dil çözümleri bulmak için özellikle faydalı olacaktır. Bu kurs, öğrencilerin kendilerine özgü dil çözümleri bulmak için özellikle faydalı olacaktır.

        Öğretim Teknikleri:
        Bu kurs, öğrencilerin düzenlenmiş bir öğretim programına tabi tutulur. Öğretim programı, kullanıcıların kendilerine özgü dil çözümleri bulmak için özellikle faydalı olacaktır. Bu kurs, öğrencilerin kendilerine özgü dil çözümleri bulmak için özellikle faydalı olacaktır.

        Öğretim Teknikleri:
        Bu kurs, öğrencilerin düzenlenmiş bir öğretim programına tabi tutulur. Öğretim programı, kullanıcıların kendilerine özgü dil çözümleri bulmak için özellikle faydalı olacaktır. Bu kurs, öğrencilerin kendilerine özgü dil çözümleri bulmak için özellikle faydalı olacaktır.

        Öğretim Teknikleri:
        Bu kurs, öğrencilerin düzenlenmiş bir öğretim programına tabi tutulur. Öğretim programı, kullanıcıların kendilerine özgü dil çözümleri bulmak için özellikle faydalı olacaktır. Bu kurs, öğrencilerin kendilerine özgü dil çözümleri bulmak için özellikle faydalı olacaktır.

        Öğretim Teknikleri:
        Bu kurs, öğrencilerin düzenlenmiş bir öğretim programına tabi tutulur. Öğretim programı, kullanıcıların kendilerine özgü dil çözümleri bulmak için özellikle faydalı olacaktır. Bu kurs, öğrencilerin kendilerine özgü dil çözümleri bulmak için özellikle faydalı olacaktır.

        Öğretim Teknikleri:
        Bu kurs, öğrencilerin düzenlenmiş bir öğretim programına tabi tutulur. Öğretim programı, kullanıcıların kendilerine özgü dil çözümleri bulmak için özellikle faydalı olacaktır. Bu kurs, öğrencilerin kendilerine özgü dil çözümleri bulmak için özellikle faydalı olacaktır.

        Öğretim Teknikleri:
        Bu kurs, öğrencilerin düzenlenmiş bir öğretim programına tabi tutulur. Öğretim programı, kullanıcıların kendilerine özgü dil çözümleri bulmak için özellikle faydalı olacaktır. Bu kurs, öğrencilerin kendilerine özgü dil çözümleri bulmak için özellikle faydalı olacaktır.

        Öğretim Teknikleri:
        Bu kurs, öğrencilerin düzenlenmiş bir öğretim programına tabi tutulur. Öğretim programı, kullanıcıların kendilerine özgü dil çözümleri bulmak için özellikle faydalı olacaktır. Bu kurs, öğrencilerin kendilerine özgü dil çözümleri bulmak için özellikle faydalı olacaktır.

        Öğretim Teknikleri:
        Bu kurs, öğrencilerin düzenlenmiş bir öğretim programına tabi tutulur. Öğretim programı, kullanıcıların kendilerine özgü dil çözümleri bulmak için özellikle faydalı olacaktır. Bu kurs, öğrencilerin kendilerine özgü olup, öğrencilerin dil çözümleri bulmak için özellikle faydalı olacaktır.

        Öğretim Teknikleri:
        Bu kurs, öğrencilerin düzenlenmiş bir öğretim programına tabi tutulur. Öğretim programı, kullanıcıların kendilerine özgü dil çözümleri bulmak için özellikle faydalı olacaktır. Bu kurs, öğrencilerin kendilerine özgü dil çözümleri bulmak için özellikle faydalı olacaktır.

        Öğretim Teknikleri:
        Bu kurs, öğrencilerin düzenlenmiş bir öğretim programına tabi tutulur. Öğretim programı, kullanıcıların kendilerine özgü dil çözümleri bulmak için özellikle faydalı olacaktır. Bu kurs, öğrencilerin kendilerine özgü dil çözümleri bulmak için özellikle faydalı olacaktır.

        Öğretim Teknikleri:
        Bu kurs, öğrencilerin düzenlenmiş bir öğretim programına tabi tutulur. Öğretim programı, kullanıcıların kendilerine özgü dil çözümleri bulmak için özellikle faydalı olacaktır. Bu kurs, öğrencilerin kendilerine özgü dil çözümleri bulmak için özellikle faydalı olacaktır.

        Öğretim Teknikleri:
        Bu kurs, öğrencilerin düzenlenmiş bir öğretim programına tabi tutulur. Öğretim programı, kullanıcıların kendilerine özgü dil çözümleri bulmak için özellikle faydalı olacaktır. Bu kurs, öğrencilerin kendilerine özgü dil çözümleri bulmak için özellikle faydalı olacaktır.

        Öğretim Teknikleri:
        Bu kurs, öğrencilerin düzenlenmiş bir öğretim programına tabi tutulur","GÜZEL SANATLAR DERNEĞİ (FAS), üyelerinin ve kulüp faaliyetlerinden faydalananların sosyal ve kültürel gelişimlerine sanatı aracılığıyla yardımcı olmayı amaçlamaktadır. Üyelerin araştırmacı olarak ve yaratıcı becerilere sahip bireyler olarak yetişmelerini sağlamayı, ayrıca resim, fotoğrafçılık, keman, piyano, flüt ve gitar gibi çeşitli kurslar aracılığıyla ODTÜ'de güzel sanatların tanıtımını ve gelişimini desteklemeyi hedeflemektedir.",1.0,0.0,0.0,0.6666666666666666,0.7779628280266238
Neden CC bir IP erişimini kısıtlar?,"['FAQ Question: Bölüm, Birim, Merkez, Laboratuvar, Öğrenci Topluluğu web sayfası nasıl yapılır?', 'IP adresi : 144.122.222.234 Hedef ip adresi: Bu kayıtta bulunmamaktadır"" Bağlantı tarih-saat bilgisi: [21/Mar/2008:14:58:01 -0200] İstenen sayfa adresi: data/liste.html İşlem bilgisi (GET komut detayı) : GET \'data/liste.htmi HTTP/1.1 Sonuç bilgisi: 200  2) Örnek e-posta logu: ""sendmail"" e-posta sunucu yazılımının ürettiği log dosyasının örneği aşağıda verilmiştir. Tutulan log bilgisinde, ""to"", ""from"" ve ""relay"" bilgilerinin bulunması gereklidir. Kullanılan e-posta yazılımının log formatı, istenen bilgileri bir veya birden fazla satır halinde verebilir. Mar 25 10:20:02 mailhost sendmail[9516]: m2Q8K2e2009516:  from=<bogususerbogus.com>, size=2291, class=0, nrcpts=1,  msgid=<00b101c88f1a$407a7cf0$>, proto=ESMTP, daemon=MTA, relay=boguspc.bogus.com [192.168.1.1] Mar 25 10:20:03 mailhost sendmail[9550]: m2Q8K2e1009516:  to=<bogus2userbogus2.com>, delay=00:00:01, xdelay=00:00:00,  mailer=esmtp, pri=122357, relay=mx.bogus2.com. [192.168.1.2], dsn=2.0.0,  stat=Sent ( Queued mail for delivery)  Yukarıdaki örnekte yer alan bilgi alanları, kanunda belirtilen başlıklarla aşağıdaki şekilde ilişkilendirilmiştir: Bağlantı tarih-saat bilgisi: ""Mar 25 10:20:03"" Gönderici: bogususerbogus.com Kaynak IP adresi: 192.168.1.1 Hedef IP adresi: 192.168.1.2 Alıcı: bogus2userbogus2.com Sonuç bilgisi: sent  3) Örnek ftp logu: ""proftpd"" ftp sunucu yazılımının ürettiği log dosyasının örneği aşağıda verilmiştir. Tutulan log bilgisinde, bağlantı yapan bilgisayarın adresi, hedef dosya ve kullanıcı adı', 'ayarları ISO-8859-9 (Türkçe ISO olarak da tanımlanır) ya da UTF-8 seçmeniz yeterlidir. Size gelen e-postalardaki Türkçe karakterleri görmekte sorun yaşıyorsanız iki farklı durum sözkonusu olabilir. Karşı taraf e-posta gönderirken ya da kendisine gelen e-postayı yönlerken Türkçe karakterleri desteklemeyen bir karakter seti kullanmıştır. Bu durumda gelen mesaj düzgün olarak görüntülenemez. Örneğin metinde Türkçe karakter kullanıldığı halde gönderilirken ISO-8859-1 karakter seti kullanılmış ise söz konusu karakter seti Türkçe karakterleri desteklemediği için e-postanın düzgün olarak görüntülenmesi mümkün değildir. Gönderilen e-posta düzgün karakter seti ile gönderilmiş olmasına karşın kullandığınız programın ayarları farklı olabilir. Bu durumda kullanılan programın ayarlarının değiştirilmesi mesajın düzgün şekilde okunmasını sağlayacaktır. Horde ya da Squirrelmail kullanarak e-posta okuyan kullanıcılarımızın kullandıkları tarayıcı programında, Outlook Express, Thunderbird ya da Windows Mail benzeri herhangi bir POP3/IMAP istemcisi ile e-posta gönderen kullanıcılarımızın ise ilgili programdaki karakter seti ayarlarını değiştirmeleri gerekmektedir. Gelen e-postalar için karakter seti değişikliği yapmak için farklı programlarda izlenen yol aşağıdaki gibidir (aşağıda yer almayan farklı programlar için de karakter seti ayarları benzer yerlerdedir): Internet Explorer, Outlook Express ve Windows Mail için: View → Encoding (Görünüm → Kodlama) Mozilla Firefox ve Mozilla Thunderbird', 'FAQ Answer:   Sayfanız için bir web hesabı ve alan adı gerekecektir. Bunun için\xa0https://cc-form.metu.edu.tr/web\xa0adresinde yer alan ""Yeni Web Kullanıcı Kodu ve Alan Adı Başvuru Formu""nu doldurmanız gerekmektedir. Başvurunuz üzerine sizinle iletişime geçilecektir. Web sitenizi aşağıdaki yöntemlerden biri ile oluşturabilirsiniz. Kendiniz Dreamweaver ya da benzeri bir programla web sayfalarınızı hazırlayabilirsiniz.\xa0 Merkezi İçerik Yönetim Sistemi\'ni (MİYS) kullanabilirsiniz. MİYS açık kaynaklı bir içerik yönetim sistemi olan Drupal alt yapısını kullanmaktadır. Üniversitemizdeki akademik bölüm, idari birim, merkez, enstitü, fakülte/yüksekokul, lisansüstü program, laboratuvar, proje/araştırma grubu, öğrenci topluluğu vb. yapılara ait web sayfaları bu sistem üzerinde oluşturulabilmektedir. MİYS ile ilgili ayrıntılı bilgiye ve başvuru formuna http://miys.metu.edu.tr adresinden erişebilirsiniz. Bu sistemi kullanırsanız MİYS kapsamında geçerli görsel kimlik standartlarına (http://www.metu.edu.tr/tr/gkk/gorsel-kimlik-standartlari) uymanız beklenmektedir. ODTÜ Blog Servisi\'ni kullanabilirsiniz. ODTÜ Blog Servisi, özgür bir yazılım olan WordPress altyapısını kullanmaktadır. Bu servis ile üniversitemizdeki akademik bölüm, idari birim, merkez, enstitü, fakülte/yüksekokul, lisansüstü program, laboratuvar, proje/araştırma grubu, öğrenci topluluğu vb. yapılara ait web siteleri kapsamlı bir şekilde hazırlanabilir, bu sitelerde çeşitli yazılar ve sayfalar oluşturulabilir. Tasarım için biraz', 'yerlerdedir): Internet Explorer, Outlook Express ve Windows Mail için: View → Encoding (Görünüm → Kodlama) Mozilla Firefox ve Mozilla Thunderbird için: View → Character Encoding (Göster → Karakter Kodlaması)', 'FAQ Answer:   English version will be available soon. 24 Ekim 2007 tarih ve 26680 sayılı Resmi Gazete\'de yayınlanan yönetmeliğe göre, ""Yer sağlayıcı trafik bilgisi, İnternet ortamındaki her türlü yer sağlamaya ilişkin olarak; kaynak IP adresi, hedef IP adresi, bağlantı tarih-saat bilgisi, istenen sayfa adresi, işlem bilgisi (GET, POST komut detayları) ve sonuç bilgisi gibi bilgileri ifade etmektedir."" Tanımlanan bu bilgiye, bir hukuksal incelemede kullanılmak üzere yer sağlayıcılık faaliyetleri kapsamındaki bir faaliyetin kim tarafından yapıldığının tespiti için ihtiyaç duyulmaktadır. l) Örnek ""http"" logu: Aşağıda yer sağlayıcı faaliyet kapsamında bir web sayfasının bulunduğu sunucunun ilgili örnek trafik logu (http logu) gösterilmiştir. Bu log, ""apache"" web sunucu yazılımının ürettiği bir log örneğidir. Birimlerde kullanılan farklı web sunucu yazılımları için, yazılımların belgelerine başvurulması ve uygun log tutulması için hangi işlemlerin yapılmasının gerekli olduğunun öğrenilmesi gerekmektedir. 144.122.222.234 - - [21/Mar/2008:14:58:01 -0200] ""GET \'data/liste.html HTTP/1.1"" 200""1 73372 ""-"" ""Mozilla/5.0 (XII: U; Lınux i686; en-L\'S; rv:1.8.1.12) Gecko/20080129 Iceweasel/2.0.0.12(Debian-2.0.0.12-Oetchl)""  Yukarıdaki örnekte yer alan bilgi alanları, kanunda belirtilen başlıklarla aşağıdaki şekilde ilişkilendirilmiştir: Kaynak IP adresi : 144.122.222.234 Hedef ip adresi: Bu kayıtta bulunmamaktadır"" Bağlantı tarih-saat bilgisi: [21/Mar/2008:14:58:01 -0200] İstenen sayfa', 'FAQ Answer:   Liste yönetim şifresini edinmek için listenin yöneticisi olarak kullandığınız e-posta adresinden mailman@metu.edu.tr adresine\xa0yöneticisi olduğunuz listenin adı ve\xa0telefon numarası bilginizi vererek\xa0şifre isteğinizi bildiren bir e-posta gönderiniz. E-Liste servis yöneticisi talebiniz üzerine gerekli incelemeleri gerçekleştirecek, talebin uygun görülmesi durumunda sizinle telefon aracılığıyla iletişime geçecektir. E-Liste yöneticiliğinde bir değişiklik söz konusu olduğunda, önceki e-liste yöneticisi yeni liste yöneticisinin e-posta adresini listenin yönetim arayüzü üzerinde yönetici olarak tanımlamalı ve yönetim şifresini yeni yöneticiye teslim etmelidir. Ancak, liste yöneticisinin yeni yöneticiyi tanımlamadan ve şifreyi aktarmadan görevden ayrılması gibi durumlarda, farklı bir kişinin liste yöneticisi olarak tanımlanmasına BİDB tarafından destek verilebilmektedir. Böyle bir durum söz konusu ise, ilgili listenin yeni yöneticisi olacak kişinin konuyla ilgili talebini ""metu.edu.tr"" uzantılı e-posta adresini kullanarak mailmanmetu.edu.tr adresine iletmesi gerekmektedir. Söz konusu liste üniversitedeki bir birime ait ise, bu talep ilgili birimin yöneticisi tarafından iletilmelidir. Talebin BİDB\'na ulaşmasının ardından, talep sahibi ile iletisime geçilerek gerekli işlemler gerçekleştirilecektir. (Yukarıda geçen ""abc-l"" ifadesi liste ismi için örnek olarak verilmiştir.)', 'sebeplerle ilgili olarak abc-l-ownermetu.edu.tr adresinden liste yöneticisi ile iletişime geçebilir, detaylı bilgi alabilirsiniz.  (Yukarıda geçen ""abc-l"" ifadesi liste ismi için örnek olarak verilmiştir)', 'bir şifreyi yazıp, _x0093_Şifremi Değiştir_x0094_ butonuna _x0093_Global Olarak Değiştir_x0094_ seçeneği seçili olacak şekilde tıklamalıdır.  Bu işlem başarılı bir şekilde gerçekleştirildiği takdirde, ekranda _x0093_Şifre başarıyla değiştirildi._x0094_ şeklinde bir mesaj görüntülenir. Kullanıcı tarafından tanımlanan yeni şifre artık aynı e-posta adresi ile üye olunan mevcut tüm e-listelerde kullanılabilir. Şifre değiştirme işlemi sırasında _x0093_Global Olarak Değiştir_x0094_ seçeneği seçili olmadığı durumda, sadece söz konusu e-listenin şifresi değiştirilmiş olur. ""Global Olarak Değiştir"" seçeneği ile kullanıcının o ana kadar üye olduğu tüm listelerin şifreleri değiştirilir. Bu işlem sonrasında üye olunacak yeni e-listelerde de aynı şifrenin kullanılabilmesi için bu işlemin her üyelikten sonra tekrarlanması gerekir. Bu işlem yapılmadığında yeni üye olunan e-listelerde, üye olurken Mailman tarafından otomatik olarak tanımlanıp kullanıcıya gönderilen şifreler kullanılır.', 'vb. yapılara ait web siteleri kapsamlı bir şekilde hazırlanabilir, bu sitelerde çeşitli yazılar ve sayfalar oluşturulabilir. Tasarım için biraz daha esnek olsa da serviste yer alan şablonlar dışında kalan harici bir şablona onay verilmemektedir. Servise giriş yapmak ve servis hakkında ayrıntılı bilgi almak için\xa0http://blog.metu.edu.tr\xa0adresi kullanılmalıdır.']","[""FAQ Question: Why would the CC restrict an IP access?\nFAQ Answer:   In accordance with Information Technology Resources Usage memorandum released on 24 March 2004, the CC restricts IP access of a computer connected to the METU campus backbone network when reasons like virus detection etc. are encountered.  The CC restricts IP access for the reasons mentioned below: By the requisition of the Unit Computer Coordinator's statement of reason Upon encountering virus activity Upon carrying out an unauthorized process Being observed as a Spam e-mail source Observing an unauthorized change of IP address \xa0  \nFAQ Link: https://faq.cc.metu.edu.tr/faq/why-would-cc-restrict-ip-access\n""]","İşte birkaç adım, Merkez, Laboratuvar, Öğrenci Topluluğu web sayfasını oluşturmak için:

        1. Merkezi İçerik Yönetim Sistemi (MİYS) kullanın. MİYS, Drupal alt yapısını kullanan açık kaynaklı bir içerik yönetim sistemi olan bir sistemdir. Üniversitemizdeki akademik bölüm, idari birim, merkez, enstitü, fakülte/yüksekokul, lisansüstü program, laboratuvar, proje/araştırma grubu, öğrenci topluluğu vb. yapılara ait web sayfaları bu sistem üzerinde oluşturulabilmektedir. MİYS ile ilgili ayrıntılı bilgiye ve başvuru formuna http://miys.metu.edu.tr adresinden erişebilirsiniz.

        2. MİYS kullanımında, yeni bir web sayfası oluşturmak için aşağıdaki adımları izleyin:

            a. MİYS'e giriş yapın.
            b. Sol menüden ""Yeni Yapı"" seçeneğini tıklayın.
            c. ""Yeni Yapı"" sayfasında, ""Web Sayfası"" seçeneğini tıklayın.
            d. ""Web Sayfası"" sayfasında, ""Web Sayfası Oluştur"" butonuna tıklayın.
            e. ""Web Sayfası Oluştur"" sayfasında, yeni web sayfasının adını ve açıklamasını girin.
            f. ""Web Sayfası Oluştur"" butonuna tıklayın.

        3. Yeni web sayfasınız oluşturulduktan sonra, sayfayı düzenleyebilirsiniz. Sol menüden ""İçerik"" seçeneğini tıklayın ve sonra ""İçerik Düzenle"" butonuna tıklayın.

        4. Web sayfasınızı düzenledikten sonra, MİYS'ten çıkıp yeni web sayfasınızın URL'sini kopyalayın.

        5. Örnek: http://miys.metu.edu.tr/web/merkez/laboratuvar

        6. Yeni web sayfasınızın URL'sini, e-posta veya yada bir mesaj ulaşım sisteminde paylaşabilirsiniz.

        7. Not: MİYS kapsamında geçerli görsel kimlik standartlarına (http://www.metu.edu.tr/tr/gkk/gorsel-kimlik-standartlari) uymanız beklenmektedir.

        Eğer MİYS kullanımını seçmemistirseniz, kendiniz Dreamweaver ya da benzeri bir programla web sayfalarınızı hazırlayabilirsiniz.","24 Mart 2004 tarihinde yayımlanan Bilgi Teknolojileri Kaynakları Kullanım memorandumuna uygun olarak, CC, METU kampüs omurga ağına bağlı bir bilgisayarın IP erişimini, virüs tespiti gibi nedenlerle karşılaşıldığında kısıtlar. CC, aşağıda belirtilen nedenlerden dolayı IP erişimini kısıtlar: Birim Bilgisayar Koordinatörü'nün gerekçe talebiyle, virüs etkinliğiyle karşılaşıldığında, yetkisiz bir işlem gerçekleştirildiğinde, Spam e-posta kaynağı olarak gözlemlendiğinde ve yetkisiz bir IP adresi değişikliği gözlemlendiğinde.",0.0,0.0,0.75,0.47058823529411764,0.825450841484445
Mayıs 2012'de METU Partner Dances Ensemble tarafından düzenlenen Metucation gösterisinin önemi neydi?,"['Sports Club Description: METU Partner Dances Ensemble was founded in 1988 and is the first partner dance ensemble in Turkey. Since its establishment, our ensemble has aimed to introduce and popularize partner dances first at METU and then throughout Turkey; it has pioneered the development of partner dances in our country and has made great contributions to the point dance sports have reached today. Many dancers who have achieved significant degrees in official competitions, founders of almost all dance studios in Ankara and various board members of the Turkish Dance Sports Federation, and many of the dance sports referees in Turkey have been introduced to the dance world by our ensemble. METU EDT regularly organizes two major events per year. The first of these is the Year-End Show, which we stage at the Kemal Kurdaş Hall of the Culture and Congress Center at the beginning of May each year. It has now become one of the most beloved and anticipated events of METU and meets approximately 4000 dance enthusiasts with a different concept every year. One of these is the May 2012 Metucation show, which we proudly designed and realized, and tells the story of METU. Another event is the International METU Republic Cup Dance Competition, also known as METU OPEN, which we organize every year during the Republic Day week! This organization, which has been organized since 2001 and has become a valuable competition not only for METU but also for Turkey, hosts more than 400 athletes and', 'FAQ Answer:   Eğer söz konusu liste ""tek yönlü duyuru listesi"" ise, liste yapılandırması gereği e-posta gönderme yetkisine sahip kişiler haricinde hiç bir kullanıcı mesaj gönderememektedir. Ancak üyelerin e-posta gönderebildiği bir liste söz konusu ise, gönderdiginiz mesajlarin listeye ulaşmamasının iki temel sebebi vardır: Listeye üyelik için kullanmadığıniz bir e-posta adresinden mesaj gönderiyor olabilirsiniz. Genelde birden fazla e-posta adresi kullanıyorsanız ve üye olan adresten farklı bir adrese yönlendirme tanımladıysanız, liste mesajlarini aldığınız e-posta adresi ile üyelik için kullandığınız e-posta adresi farklı olabilir. Mesajları aldığınız e-posta adresinin listeye üye olarak kayıtlı olup olmadığını kontrol etmesi için abc-l-ownermetu.edu.tr adresinden liste yöneticisiyle iletişime geçiniz. Listeye üyelik için kullandığınız e-posta adresinden mesaj gönderiyorsanız mesajiniz onay bekliyor olabilir. Mesajinızın onay için bekletiliyor olmasının olası sebepleri aşağıda listelenmiştir: Gönderdiğiniz mesaj liste mesaj kotasını aşan bir büyüklüğe sahip olabilir (örneğin; çok büyük bir dosya eklentisi gönderiyor olabilirsiniz). Mesajınızın alıcı adresi bölümünde liste adıyla beraber çok sayıda e-posta adresini yazmış olabilirsiniz. Mesajiniz liste ayarları gereği moderatör onayı için bekletiliyor olabilir. Tüm bu olası sebeplerle ilgili olarak abc-l-ownermetu.edu.tr adresinden liste yöneticisi ile iletişime geçebilir, detaylı bilgi alabilirsiniz.  (Yukarıda geçen', 'ODTÜ’nün değil Türkiye’nin değerli bir yarışması haline gelen bu organizasyona her sene 20 farklı ülkeden 400’ü aşkın sporcu ve 5000 dans severi ağırlamaktadır. Uluslararası platformlarda da övgüler almaya devam eden ve 16.sını 4-5 Kasım 2017 tarihlerinde gerçekleştireceğimiz METU OPEN son 3 senedir tüm Uluslararası Yarışmalar arasında ilk 10’da yer almaktadır.', 'Student Club Name: TURKISH FOLKLORE CLUB\nStudent Club Description: Since its establishment in 1961, the Club has been active without an interruption in four main ways, including folk dances, folk music, folk theater and local research. Among the activities organized are learning and teaching folk dances based on their origins; researching and displaying Orta Oyunu and theatrical village plays; folk music instrument training, notation, compilation and archival studies; researching the folk culture; seminars, panels and symposiums on folk science. The Club, which has more than twenty costumes in its wardrobe, has a rich library of books and magazines published about folk science. Academic Advisor: Assoc. Prof.Dr.Birten Çelik (Department of History) Club Room: THBT Building', ""General Information: There are 19 dormitory buildings run by the METU Directorate of Health, Culture and Sports.\xa0\nMale students can stay in the Dormitories 2, 4, 6, 8, 9, and İsa Demiray Dormitory, in addition to a certain block allocated to them in Dormitory 19, and Refika Aksoy Dormitory. Female students can stay in the Dormitories 1, 3, 5, 7, and Faika Demiray Dormitory, in addition to a certain block allocated to them in Dormitory 19, and Refika Aksoy Dormitory.\nAs for the guest houses, Osman Yazıcı Guest House, Guest House 12, and Dormitory 16 are allocated for female students, while Faik Hızıroğlu Guest House and Guest House 15 are allocated for male students.\nThe Office of Dormitories, with the aim of solving our students' accommodation issues by offering a high standard service, obtained TSE-EN ISO 9001-2000 certificate of quality from the Turkish Standards Institution (TSE) in 2005. Regarding the quality of our dormitory services, the inspections carried out in 2021 in accordance with the TSE-EN ISO 9001:2015 standards were completed with success.\nThe services provided by our unit are carried out according to the procedures, instructions, duties, and responsibilities determined within the Dormitory Regulations, Student Discipline Regulations of the higher education institutions, decisions taken by the Executive Board of Dormitories, and the certificates of quality."", 'bulunup tanınması çalışmaları (1988-1990), Antakya kıyılarında yine topluluk tarafından bulunan 1600 yıllık iki batık gemi ve her birinde bulunan cam külçeler (1992/1993) ODTÜ Sualtı Topluluğu’nun Arkeoloji bilimine yaptığı katkıların ilkleridir. Bunlara ek olarak topluluğun 1992 yılında ilk kez Bozcaada’da düzenlediği “Sualtında Görüntü Avlama Yarışması” SAGAY, Türkiye’de düzenlenen ilk sualtı fotoğraf yarışması olmasının yanı sıra, Zıpkınla Balık Avcılığı Yerine Fotoğraf Makinesiyle Görüntü Avcılığı gibi anlamlı bir seçeneği sunarak Kuzey Ege’de “deniz parkları” kurulmasını ve işlemesini sağlamayı amaç edinmiştir. Son zamanlarda topluluk Türkiye Kıyıları Deniz Mağaraları Envanter Projesi, Kilikya Bölgesi Arkeolojik Yüzey Araştırması, Deniz Çayırlarının Yayılımının İncelenmesi, Uluburun III Yapay Resif Projesi, Serbest Dalış Denemeleri gibi önemli projeleri yürütmektedir. ODTÜ Sualtı Topluluğu Rektörlük makamına karşı sorumludur. Akademik Danışman ve beş öğrenciden oluşan yürütme kurulu, üç öğrenciden oluşan denetleme kurulu işleyişi sağlamakla görevlidir. Yürütme Kurulu ve Denetleme Kurulu Genel Kurula karşı sorumludur. Topluluğun Akdeniz Foku Araştırma Grubu (AFAG), Batık Araştırma Grubu (BAG), Ekoloji Grubu (EKOG), Fotografi ve Videografi Grubu (FOVAG), Mağara Dalışı ve Araştırma Grubu (MADAG) ve Serbest Dalış Grubu (SDG) gibi alt grupları ile çeşitli çalışma birimleri vardır.', 'Student Club Name: CONTEMPORARY DANCE GROUP\nStudent Club Description: The Group aims to reach large masses through dance, the best way of expressing feelings, and to expand area of research through creativity, improvisation and choreography work, theoretical studies and presentations. Academic Advisor: Asst. Prof. Dr.Banu Cingöz Ulu (Department of Psychology) Club Room: 9th Dormitory, Ground Floor', 'Sports Club Name: ODTÜ AİKİDO TOPLULUĞU\nSports Club Description: Bünyesindeki Çocuk Aikido grubuyla beraber 200’ü aşkın üyesiyle beraber Türkiye’nin en büyük dojosu olan ODTÜ Aikido Topluluğu’nun birçok üyesi her sene yurtiçi ve yurtdışında birçok Aikido seminerine katılmaktadır.\xa0Her ne kadar yakın doğu dövüş sanatı kulüplerinin kadınlar tarafından ilgi çekmediği düşünülse de, ODTÜ Aikido Topluluğu’nun neredeyse yarısı kadınlardan oluşmaktadır. Topluluğun amacı bu yanlış algıyı düzeltmektir ve teknik olarak ileri seviye, ahlaklı sporcular yetiştirmek ile Aikidoyu daha da yaymak ve sevdirmektir. Bundan ayrı olarak Çocuk Aikido grubunda yaptığı çalışmalarla birlikte çocukların fiziksel, sosyal ve psikolojik gelişimini sağlamanın yanında saygı, işbirliği ve uyum ile mesleki başarıyı sağlayan özgüven, sabır ve iç disiplini çocuklara aşılamaktır.\xa0ODTÜ Aikido Topluluğu, Tamura Shihan ve onun öğrencisi Nebi Vural Sensei’nin stili ve prensiplerini takip etmektedir. Her sene Aralık ve Mayıs aylarında iki tane uluslararası seminer düzenlemektir. Avrasya Aikido Organizasyonu ile birlikte, 7 yıldır her Mayıs ayında yaklaşık 20 ülkeden 300 sporcunun katıldığı, Uluslararası Aikido Festivalini düzenlemekte ve etkinliğe ev sahipliği yapmaktadır.', 'which has been organized since 2001 and has become a valuable competition not only for METU but also for Turkey, hosts more than 400 athletes and 5000 dance enthusiasts from 20 different countries every year. Continuing to receive praise on international platforms and to be held for the 16th time on November 4-5, 2017, METU OPEN has been in the top 10 among all International Competitions for the last 3 years.', ""Sports Club Name: METU AIKIDO COMMUNITY\nSports Club Description: Many members of the METU Aikido Community, which is the largest dojo in Turkey with over 200 members including the Children's Aikido group, attend many Aikido seminars in Turkey and abroad every year. Although it is thought that Near Eastern martial arts clubs do not attract women, almost half of the METU Aikido Community consists of women. The aim of the community is to correct this misperception and to raise technically advanced and ethical athletes and to spread and make Aikido more popular. In addition to this, with the work it does in the Children's Aikido group, it also aims to ensure the physical, social and psychological development of children, as well as to instill in them the self-confidence, patience and internal discipline that ensure professional success with respect, cooperation and harmony. The METU Aikido Community follows the style and principles of Tamura Shihan and his student Nebi Vural Sensei. It organizes two international seminars every year in December and May. Together with the Eurasian Aikido Organization, it has been organizing and hosting the International Aikido Festival, with the participation of approximately 300 athletes from 20 countries every May for 7 years.""]","[""Sports Club Name: ODTÜ EŞLİ DANSLAR TOPLULUĞU (EDT)\nSports Club Description: ODTÜ Eşli Danslar Topluluğu, 1988 yılında kurulmuş olup Türkiye'nin ilk eşli danslar topluluğudur. Topluluğumuz, kuruluşundan bu yana eşli dansları öncelikle ODTÜ'de, ardından Türkiye çapında tanıtmayı ve yaygınlaştırmayı amaç edinmiş; eşli dansların ülkemizdeki gelişiminin öncüsü olmuş ve dans sporunun bugün geldiği noktaya büyük katkıda bulunmuştur. Resmî yarışmalarda önemli dereceler elde eden pek çok dansçı, Ankara'daki dans stüdyolarının hemen hemen tümünün kurucuları ve Türkiye Dans Sporları Federasyonu'nda görev alan çeşitli kurul üyeleri, Türkiye'deki dans sporu hakemlerinin pek çoğu dans dünyasına topluluğumuz tarafından kazandırılmıştır. ODTÜ EDT düzenli olarak yılda iki büyük etkinlik gerçekleştirir. Bunlardan ilki her sene Mayıs ayı başında Kültür ve Kongre Merkezi Kemal Kurdaş Salonunda sahnelediğimiz Yıl Sonu Şovu’dur. Artık ODTÜ’nün sevilen ve beklenen etkinliklerinden biri haline gelmiş ve her sene farklı bir konsept ile yaklaşık 4000 dans sever ile buluşmaktadır. Bunlardan bir tanesi ise gururla kurgulayıp gerçekleştirdiğimiz, ODTÜ’müzü anlatan Mayıs 2012 Metucation gösterisidir. Bir diğer etkinliğimiz ise her sene Cumhuriyet Bayramı haftasında düzenlediğimiz Uluslararası ODTÜ Cumhuriyet Kupası Dans Yarışması nam-ı diğer METU OPEN! 2001 yılından beri düzenlenen ve artık yalnızca ODTÜ’nün değil Türkiye’nin değerli bir yarışması haline gelen bu organizasyona her sene 20 farklı ülkeden 400’ü aşkın sporcu ve 5000 dans severi ağırlamaktadır. Uluslararası platformlarda da övgüler almaya devam eden ve 16.sını 4-5 Kasım 2017 tarihlerinde gerçekleştireceğimiz METU OPEN son 3 senedir tüm Uluslararası Yarışmalar arasında ilk 10’da yer almaktadır.\n"", 'Sports Club Name: METU COUPLE DANCE COMMUNITY (EDT)\nSports Club Description: METU Partner Dances Ensemble was founded in 1988 and is the first partner dance ensemble in Turkey. Since its establishment, our ensemble has aimed to introduce and popularize partner dances first at METU and then throughout Turkey; it has pioneered the development of partner dances in our country and has made great contributions to the point dance sports have reached today. Many dancers who have achieved significant degrees in official competitions, founders of almost all dance studios in Ankara and various board members of the Turkish Dance Sports Federation, and many of the dance sports referees in Turkey have been introduced to the dance world by our ensemble. METU EDT regularly organizes two major events per year. The first of these is the Year-End Show, which we stage at the Kemal Kurdaş Hall of the Culture and Congress Center at the beginning of May each year. It has now become one of the most beloved and anticipated events of METU and meets approximately 4000 dance enthusiasts with a different concept every year. One of these is the May 2012 Metucation show, which we proudly designed and realized, and tells the story of METU. Another event is the International METU Republic Cup Dance Competition, also known as METU OPEN, which we organize every year during the Republic Day week! This organization, which has been organized since 2001 and has become a valuable competition not only for METU but also for Turkey, hosts more than 400 athletes and 5000 dance enthusiasts from 20 different countries every year. Continuing to receive praise on international platforms and to be held for the 16th time on November 4-5, 2017, METU OPEN has been in the top 10 among all International Competitions for the last 3 years.\n']","2012 yılında METU Partner Dances Ensemble tarafından düzenlenen Metucation gösterisinin önemi, METU'nun tarihi ve kültürü hakkında bir şey anlatmaktır. Gösteris, METU'nun tarihi, kültüresi ve öğrencileriyle ilgili bir şeyler anlatmaktadır ve bu şekilde METU'nun tarihi ve kültürüyu yaymaktadır.

        Bu gösteri, METU'nun 50 yılının önünde yapılmıştır ve METU'nun tarihine ve kültürine yönelik bir önem taşımaktadır.

        Gösteri, METU'nun öğrencileri ve çevresindeki yerel halkın için de değerlendirilebilirdir. Gösteri, METU'nun öğrencilerine ve çevresindeki yerel halkın tarihi ve kültürünü anlatmaktadır ve bu şekilde METU'nun öğrencilerine ve çevresindeki yerel halkın tarihi ve kültürünü yaymaktadır.

        Gösteri, METU'nun öğrencilerine ve çevresindeki yerel halkın tarihi ve kültürünü anlatmaktadır ve bu şekilde METU'nun öğrencilerine ve çevresindeki yerel halkın tarihi ve kültürünü yaymaktadır.

        Gösteri, METU'nun öğrencilerine ve çevresindeki yerel halkın tarihi ve kültürünü anlatmaktadır ve bu şekilde METU'nun öğrencilerine ve çevresindeki yerel halkın tarihi ve kültürünü yaymaktadır.

        Gösteri, METU'nun öğrencilerine ve çevresindeki yerel halkın tarihi ve kültürünü anlatmaktadır ve bu şekilde METU'nun öğrencilerine ve çevresindeki yerel halkın tarihi ve kültürünü yaymaktadır.

        Gösteri, METU'nun öğrencilerine ve çevresindeki yerel halkın tarihi ve kültürünü anlatmaktadır ve bu şekilde METU'nun öğrencilerine ve çevresindeki yerel halkın tarihi ve kültürünü yaymaktadır.

        Gösteri, METU'nun öğrencilerine ve çevresindeki yerel halkın tarihi ve kültürünü anlatmaktadır ve bu şekilde METU'nun öğrencilerine ve çevresindeki yerel halkın tarihi ve kültürünü yaymaktadır.

        Gösteri, METU'nun öğrencilerine ve çevresindeki yerel halkın tarihi ve kültürünü anlatmaktadır ve bu şekilde METU'nun öğrencilerine ve çevresindeki yerel halkın tarihi ve kültürünü yaymaktadır.

        Gösteri, METU'nun öğrencilerine ve çevresindeki yerel halkın tarihi ve kültürünü anlatmaktadır ve bu şekilde METU'nun öğrencilerine ve çevresindeki yerel halkın tarihi ve kültürünü yaymaktadır.

        Gösteri, METU'nun öğrencilerine ve çevresindeki yerel halkın tarihi ve kültürünü anlatmaktadır ve bu şekilde METU'nun öğrencilerine ve çevresindeki yerel halkın tarihi ve kültürünü yaymaktadır.

        Gösteri, METU'nun öğrencilerine ve çevresindeki yerel halkın tarihi ve kültürünü anlatmaktadır ve bu şekilde METU'nun öğrencilerine ve çevresindeki yerel halkın tarihi ve kültürünü yaymaktadır.

        Gösteri, METU'nun öğrencilerine ve çevresindeki yerel halkın tarihi ve kültürünü anlatmaktadır ve bu şekilde METU'nun öğrencilerine ve çevresindeki yerel halkın tarihi ve kültürünü yaymaktadır.

        Gösteri, METU'nun öğrencilerine ve çevresindeki yerel halkın tarihi ve kültürünü anlatmaktadır ve bu şekilde METU'nun öğrencilerine ve çevresindeki yerel halkın tarihi ve kültürünü yaymaktadır.

        Gösteri, METU'nun öğrencilerine ve çevresindeki yerel halkın tarihi ve kültürünü anlatmaktadır ve bu şekilde METU'nun öğrencilerine ve çevresindeki yerel halkın tarihi ve kültürünü yaymaktadır.

        Gösteri, METU'nun öğrencilerine ve çevresindeki yerel halkın tarihi ve kültürünü anlatmaktadır ve bu şekilde METU'nun öğrencilerine ve çevresindeki yerel halkın tarihi ve kültürünü yaymaktadır.

        Gösteri, METU'nun öğrencilerine ve çevresindeki yerel halkın tarihi ve kültürünü anlatmaktadır ve bu şekilde METU'nun öğrencilerine ve çevresindeki yerel halkın tarihi ve kültürünü yaymaktadır.

        Gösteri, METU'nun öğrencilerine ve çevresindeki yerel halkın tarihi ve kültürünü anlatmaktadır ve bu şekilde METU'nun öğrencilerine ve çevresindeki yerel halkın tarihi ve kültürünü yaymaktadır.

        Gösteri, METU'nun öğrencilerine ve çevresindeki yerel halkın tarihi ve kültürünü anlatmaktadır ve bu şekilde METU'nun öğrencilerine ve çevresindeki yerel halkın tarihi ve kültürünü yaymaktadır.

        Gösteri, METU'nun öğrencilerine ve çevresindeki yerel halkın tarihi ve kültürünü anlatmaktadır ve bu şekilde METU'nun öğrencilerine ve çevresindeki yerel halkın tarihi ve kültürünü yaymaktadır.

        Gösteri, METU'nun öğrencilerine ve çevresindeki yerel halkın tarihi ve kültürünü anlatmaktadır ve bu şekilde METU'nun öğrencilerine ve çevresindeki yerel halkın tarihi ve kültürünü yaymaktadır.

        Gösteri, METU'nun öğrencilerine ve çevresindeki yerel halkın tarihi ve kültürünü anlatmaktadır ve bu şekilde METU'nun öğrencilerine ve çevresindeki yerel halkın tarihi ve kültürünü yaymaktadır.

        Gösteri, METU'nun öğrencilerine ve çevresindeki yerel halkın tarihi ve kültürünü anlatmaktadır ve bu şekilde METU'nun öğrencilerine ve çevresindeki yerel halkın tarihi ve kültürünü yaymaktadır.

        Gösteri, METU'nun öğrencilerine ve çevresindeki yerel halkın tarihi ve kültürünü anlatmaktadır ve bu şekilde METU'nun öğrencilerine ve çevresindeki yerel halkın tarihi ve kültürünü yaymaktadır.

        Gösteri, METU'nun öğrencilerine ve çevresindeki yerel halkın tarihi ve kültürünü anlatmaktadır ve bu şekilde METU'nun öğrencilerine ve çevresindeki yerel halkın tarihi ve kültürünü yaymaktadır.

        Gösteri, METU'nun öğrencilerine ve çevresindeki yerel halkın tarihi ve kültürünü anlatmaktadır ve bu şekilde METU'nun öğrencilerine ve çevresindeki yerel halkın tarihi ve kültürünü yaymaktadır.

        Gösteri, METU'nun öğrencilerine ve çevresindeki yerel halkın tarihi ve kültürünü anlatmaktadır ve bu şekilde METU'nun öğrencilerine ve çevresindeki yerel halkın tarihi ve kültürünü yaymaktadır.

        Gösteri, METU'nun öğrencilerine ve çevresindeki yerel halkın tarihi ve kültürünü anlatmaktadır ve bu şekilde METU'nun öğrencilerine ve çevresindeki yerel halkın tarihi ve kültürünü yaymaktadır.

        Gösteri, METU'nun öğrencilerine ve çevresindeki yerel halkın tarihi ve kültürünü anlatmaktadır ve bu şekilde METU'nun öğrencilerine ve çevresindeki yerel halkın tarihi ve kültürünü yaymaktadır.

        Gösteri, METU'nun öğrencilerine ve çevresindeki yerel halkın tarihi ve kültürünü anlatmaktadır ve bu şekilde METU'nun öğ","Mayıs 2012 Metucation gösterisi, METU Partner Dances Ensemble (EDT) tarafından organize edilen önemli bir etkinlikti çünkü METU'nun hikayesini anlatmak için tasarlanmıştı. Bu gösteri, her yıl farklı bir konseptle yaklaşık 4000 dans tutkununu kendine çeken METU'daki sevilen ve beklenen etkinliklerden biri haline gelmiştir. Etkinlik, topluluğun Türkiye'de partner danslarını tanıtma ve popülerleştirme konusundaki kararlılığını vurgulamakta ve ülke içindeki dans sporlarının gelişimine katkılarını sergilemektedir.",1.0,0.9999999999,0.31,0.8888888888888888,0.9049442722855836
"Mimarlık Bölümü'ndeki ARCH460 ve ARCH470 derslerinin ana hedefleri ve içerik odakları nelerdir, özellikle sürdürülebilirlik ve dijital tasarım ile ilgili olarak?","['ODTÜ’nün değil Türkiye’nin değerli bir yarışması haline gelen bu organizasyona her sene 20 farklı ülkeden 400’ü aşkın sporcu ve 5000 dans severi ağırlamaktadır. Uluslararası platformlarda da övgüler almaya devam eden ve 16.sını 4-5 Kasım 2017 tarihlerinde gerçekleştireceğimiz METU OPEN son 3 senedir tüm Uluslararası Yarışmalar arasında ilk 10’da yer almaktadır.', 'Course: HIST307\nDepartment: This course belongs to DEPARTMENT OF HISTORY.\nObjective: No objective\nContent:  Tarih öðrencilerine, tarih disiplinin yöntemsel temellerini öðretir. Bu disiplinin vazgeçilmez unsuru olan belgeleri ve olgularý doðru yorumlayabilmenin ve onlarý gerçek baðlamlarýna oturtabilmenin yollarýný göstermeye dönük yöntem dersidir.', 'FAQ Answer:   Sunucu sistemlerimiz e-posta alışverişinde Türkçe karakterleri desteklemektedir. Horde ve Squirrelmail arayüzlerine Türkçe olarak girildiğinde gönderilen e-postaların karakter seti ISO-8859-9, İngilizce olarak girildiğinde ise UTF-8\'dir. Her iki karakter seti de Türkçe karakterleri içermektedir. UTF-8’de Türkçe dışındaki kimi dillere özel karakterler de bulunmaktadır. Not: Horde arayüzünde e-posta gönderirken ""Karakter Seti"" alanındaki seçenekleri kullanarak bu ayarı değiştirmek mümkündür. Horde ya da Squirrelmail arayüzü dışında Outlook Express, Thunderbird ya da Windows Mail benzeri herhangi bir POP3/IMAP istemcisi ile e-posta gönderiyorsanız gönderilen e-postanın karakter seti, ilgili programın kendi ayarlarına bağlı olarak belirlenir. Giden e-postalar için karakter seti değişikliği yapmak için farklı programlarda izlenen yol aşağıdaki gibidir (aşağıda yer almayan farklı programlar için de karakter seti ayarları benzer yerlerdedir): Outlook Express ve Windows Mail için: Tools → Options → Send → International Settings (Araçlar → Seçenekler → Gönder → Uluslararası Ayarlar) Mozilla Thunderbird için: Tools → Options → Display → Fonts → Character Encodings (Araçlar → Seçenekler → Görünüm → Yazıtipleri → Karakter Kodlaması) Göndereceğiniz e-postada Türkçe karakter kullanmak istiyorsanız söz konusu menülerdeki ayarları ISO-8859-9 (Türkçe ISO olarak da tanımlanır) ya da UTF-8 seçmeniz yeterlidir. Size gelen e-postalardaki Türkçe karakterleri görmekte sorun', 'sebeplerle ilgili olarak abc-l-ownermetu.edu.tr adresinden liste yöneticisi ile iletişime geçebilir, detaylı bilgi alabilirsiniz.  (Yukarıda geçen ""abc-l"" ifadesi liste ismi için örnek olarak verilmiştir)', 'Course: ADM2401\nDepartment: This course belongs to department of POLITICAL SCIENCE AND PUBLIC ADMINISTRATION.\nObjective: At the end of this course, the student will learn:  The fundamental characteristics and functions of law, distinguishing it from other social rules, and the basic legal concepts and institutions in Turkey. The structure and functioning of the Turkish court system, including the different types of courts and their jurisdictions. The sources of Turkish Law, including primary and secondary sources, and how to locate and interpret these legal materials. Concepts of legal capacity, representation, and the ability to apply basic legal concepts to real-world situations, fostering critical thinking and comparative legal analysis.  \nContent:  This is an introductory course in which basic concepts of Turkish Law and the preliminary issues in Turkish Legal system are studied in order to provide an introduction to the legal concepts and institutions and to build a sound basis for the other courses dealing with legal studies.  Some of the topics covered in this course are characteristics of law as compared to other rules of social conduct, functions of law, basic legal concepts and legal institutions, sources of Turkish Law, the court system in Turkey, capacity to act and to have rights and obligations and representation.', 'Course: ARCH407\nDepartment: This course belongs to DEPARTMENT OF ARCHITECTURE.\nObjective: Acquisition of knowledge on this relatively less represented cultural context of Anatolian (and Eastern Mediterranean) history; improvement of skills and attitudes to deal with, and protect, without bias, the heritage of this civilization Knowledge: Creation of a cultural background in terms of architectural history, topography, and built environment of the Late Antique and Byzantine periods in Anatolia and the Eastern Mediterranean, and the expertise of using the relevant literature Skills: Improvement of skills and abilities to develop independent research and critical awareness in working in, or with, all inter-related disciplines investigating the past (history, history of art and architecture, archeology etc) Attitudes: Development of awareness and sensibility towards cultural diversity and utmost care for the cultural heritage of all civilizations', 'FAQ Answer:   E-liste servisindeki altyapı gereği, kullanıcıların üye oldukları her bir e-liste için farklı e-liste şifreleri tanımlanmaktadır. Dileyen kullanıcılarımız kolaylık olması açısından, tüm e-listeler için ortak bir e-liste şifresi tanımlayabilirler. Bunun için aşağıdaki işlemlerin yapılması gerekmektedir. Not: Güvenlik önlemi olarak, merkezi kullanıcı kodları için kullanılan şifrelerin e-liste şifresi olarak kullanılmaması önerilmektedir. Bir kullanıcı öncelikle üye olduğu herhangi bir listeye gönderilmiş bir mesajın sonunda yer alan e-liste web arayüzü bağlantısını kullanarak o e-listenin ayarları ile ilgili değişikliklerin yapılabildiği sayfaya (http://mailman.metu.edu.tr/mailman/listinfo/liste_adi) girmelidir.  Bu sayfanın en alt bölümünde yer alan e-posta adresi bölümüne, bu e-listeye üye olmak için kullandığı e-posta adresini yazarak, _x0093_Listeden çık veya seçeneklerimi düzenle_x0094_ isimli butona tıklamalıdır.  Eğer e-liste şifresi daha önceden girilmiş ise, aşağıdaki şekilde olduğu gibi e-liste üyelik ayarlarının değiştirilebildiği ekran görünecektir. Aksi durumda, e-liste şifresi kullanılarak giriş yapılmalıdır:  Üye olduğu tüm e-listelere yönelik ortak bir şifre tanımlamak isteyen kullanıcı bu sayfada yer alan _x0093_Şifre Değişimi_x0094_ bölümüne mevcut e-liste şifresini veya kullanmak istediği herhangi bir şifreyi yazıp, _x0093_Şifremi Değiştir_x0094_ butonuna _x0093_Global Olarak Değiştir_x0094_ seçeneği seçili olacak şekilde tıklamalıdır.  Bu', 'ürettiği log dosyasının örneği aşağıda verilmiştir. Tutulan log bilgisinde, bağlantı yapan bilgisayarın adresi, hedef dosya ve kullanıcı adı bilgileri bulunmalıdır. Tue Mar 25 16:39:48 2008 0 bogus.com 528 /ftp/pub/IMPORTANT-WARNING.txt b _ o r anonim ftp 1 * c  Yukarıdaki örnekte yer alan bilgi alanları, kanunda belirtilen başlıklarla aşağıdaki şekilde ilişkilendirilmiştir: Bağlantı tarih-saat bilgisi: ""Tue Mar 25 16:39:48 2008""  Kaynak Adres: ""bogus.com""  İstenen dosya: ""ftp/pub/IMPORTANT-WARNING.txt""  Kullanıcı adı: ""anonim""  Birimler, yer sağlayıcı faaliyetleri kapsamında verdikleri servislerin ürettiği logları inceleyip, sahip oldukları sistemlerde verdikleri servislerin yarattığı trafik loglarını yönetmelikte tarif edildiği şekilde (zaman damgası ile birlikte) kayıt altına almak, bu logları, gizliliğini sağlayarak arşivlemekle yükümlüdür.', 'bir şifreyi yazıp, _x0093_Şifremi Değiştir_x0094_ butonuna _x0093_Global Olarak Değiştir_x0094_ seçeneği seçili olacak şekilde tıklamalıdır.  Bu işlem başarılı bir şekilde gerçekleştirildiği takdirde, ekranda _x0093_Şifre başarıyla değiştirildi._x0094_ şeklinde bir mesaj görüntülenir. Kullanıcı tarafından tanımlanan yeni şifre artık aynı e-posta adresi ile üye olunan mevcut tüm e-listelerde kullanılabilir. Şifre değiştirme işlemi sırasında _x0093_Global Olarak Değiştir_x0094_ seçeneği seçili olmadığı durumda, sadece söz konusu e-listenin şifresi değiştirilmiş olur. ""Global Olarak Değiştir"" seçeneği ile kullanıcının o ana kadar üye olduğu tüm listelerin şifreleri değiştirilir. Bu işlem sonrasında üye olunacak yeni e-listelerde de aynı şifrenin kullanılabilmesi için bu işlemin her üyelikten sonra tekrarlanması gerekir. Bu işlem yapılmadığında yeni üye olunan e-listelerde, üye olurken Mailman tarafından otomatik olarak tanımlanıp kullanıcıya gönderilen şifreler kullanılır.', ""Course: HIST305\nDepartment: This course belongs to DEPARTMENT OF HISTORY.\nObjective: The aim of the course is to improve students' reading knowledge of the printed and handwritten texts in the Ottoman language. \nContent:  i. Studies on critical additions of manuscripts and their transcriptions. ii. Information concerning Ottoman archives iii. Studies on newspapers and journals for the period between 1860-1928.  iv. The grammar and spelling of the old Anatolian Turkish v. Historical development of Turkish written in Arabic script with particular emphasis to its last phase. vi. An overview of Hat (manuscript) art.""]","[""Course: ARCH460\nDepartment: This course belongs to DEPARTMENT OF ARCHITECTURE.\nObjective: This elective course is offered to Final year Architecture students who would like to design high performance buildings with low environmental impacts. The aim is to use digital tools to aid building\xa0 design that can: - Increase human comfort by using appropriate technologies - Reduce a building's energy load by selecting appropriate building materials. - Reduce the\xa0environmental loads of a building by integrating appropriate energy resources \nContent:  The course objectives are to introduce students to a world-wide range of architectural concepts, focusing on appropriate and affordable solutions, in terms of choice of materials and technologies, to the extensive needs of the underdeveloped, developing and developed world.  The relevance of appropriate technology in certain current global issues, such as sustainability and ecological concerns, will be considered. "", 'Course: ARCH470\nDepartment: This course belongs to DEPARTMENT OF ARCHITECTURE.\nObjective: At the end of this course, it is first expected that: \xa0 Students will develop basic knowledge in understanding computational design Students will understand new architectural geometries Students will be able to develop parametric design models Students will be able to question digital media as a design medium rather than a medium for representation Students will be familiar with fabrication technologies. \nContent:  A design research studio. Architectural representation medium will be questioned as an architectural thinking environment. A workshop on abstraction and folding techniques in model making. Relation between model making and digital thinking. Emphasizing the different paradigms of digital design. Introducing an high-end software. Designing thematic and conceptual environments to reveal the enriching relation between the digital and tectonic worlds. ']","İşte ARCH460 ve ARCH470 derslerinin ana hedefleri ve içerik odakları:

        ARCH460: Sürdürülebilirlik ve dijital tasarım ile ilgili.
        - Ana hedefler: Sürdürülebilirlik ve dijital tasarım konularını incelemek, analiz etmek ve uygulamak.
        - İçerik odakları: Sürdürülebilirlik teorisi, sürdürülebilirlik ölçütleri, sürdürülebilirlik yöntemleri, dijital tasarım teknolojileri, dijital tasarım yöntemleri, sürdürülebilir bir tasarım örnekleri.

        ARCH470: Sürdürülebilirlik ve dijital tasarım ile ilgili proje yönetimi.
        - Ana hedefler: Sürdürülebilirlik ve dijital tasarım projelerinin yönetimi, planlama ve kontrolü.
        - İçerik odakları: Proje yönetimi teorisi, proje yönetimi araçları, proje yönetimi yöntemleri, sürdürülebilirlik ve dijital tasarım projeleri, proje yönetimi örnekleri.

        Bu dersler, mühendislik ve tasarım sektöründe çalışan ve sürdürülebilirlik ve dijital tasarım konularında güçlü bir tecrübe sahip olmak isteyen öğrenciler için tasarlanmıştır.","ARCH460 dersi, son sınıf mimarlık öğrencilerini düşük çevresel etkiye sahip yüksek performanslı binalar tasarlama becerileri ile donatmayı amaçlamaktadır. Bu ders, uygun teknolojiler aracılığıyla insan konforunu artırmak için dijital araçların kullanımına, uygun yapı malzemelerini seçerek enerji yüklerini azaltmaya ve enerji kaynaklarını entegre ederek çevresel etkileri en aza indirmeye odaklanmaktadır. Ders, sürdürülebilirlik ve ekolojik kaygıları ele alarak çeşitli küresel bağlamlar için uygun ve uygun maliyetli mimari çözümler vurgulamaktadır.

Öte yandan, ARCH470 dersi, öğrencilerin hesaplamalı tasarım ve yeni mimari geometriler konusundaki anlayışlarını geliştirmek için tasarlanmıştır. Dersin sonunda, öğrenciler parametrik tasarım modelleri oluşturabilecek ve dijital medyayı bir tasarım aracı olarak eleştirel bir şekilde kullanabilecektir. Ders, model yapım teknikleri üzerine bir atölye içermekte ve dijital düşünme ile fiziksel model yapımı arasındaki ilişkiyi keşfetmekte, mimarlığın dijital ve tektonik yönleri arasındaki etkileşimi vurgulamaktadır.",0.0,0.0,0.0,0.0,0.9260707340762548
What role does Assoc. Prof. Dr. Mehmet Somel play in the SCIENCE AND FUTURE SOCIETY at METU?,"['Student Club Name: SCIENCE AND FUTURE SOCIETY\nStudent Club Description: The Society aims to teach METU students the social importance of science and technology, to follow the agenda of science and technology, to announce the global developments in coordination with METU members, to help students embody new ideas in a project and to support these projects. Academic Advisor: Instr. Dr.Taner Zorbay (Department of History) Assoc. Prof. Dr. Mehmet Somel (Department of Biology) Society Room: Society Containers No:1', 'Content:  This course, according to regulations of the Council of Higher Education (YÖK), is a must course to all foreign students in Turkey. Therefore, it is also a must course for foreign students enrolled in METU regardless of paying their fees in Turkish Lira or US Dollar. It is designed to equip them with a general knowledge on the process of the establishment of the Turkish nation-state in 1923. It covers economic, social, political and cultural developments in Turkey between 1908 and 1938.', 'Course: BIOL242\nDepartment: This course belongs to DEPARTMENT OF BIOLOGY.\nObjective: -Students comprehend basic concepts in biology such as the evolutionary relationships between living things, cell division and cancer, speciation mechanisms, etc. -Students develop a basic understanding of how genes synthesize proteins to carry out life -Students can scientifically explain the molecular and physiological processes that constitute daily life of living things in a deep and holistic perspective. -Students evaluate the use of GM technology in crops \nContent:  Offered to Elementary Science Education majors. The third of the three course biology series includes transmission genetics, patterns of inheritance (Mendelian, non-Mendelian), DNA structure and function, mutations, genetic engineering, biotechnology applications, speciation, evolution of populations.', 'FAQ Link: https://faq.cc.metu.edu.tr/faq/meturoam', 'Objective: Philosophy of Science Course Syllabus Course Title:\xa0Philosophy of Science Level:\xa0Undergraduate (3rd and 4th years) Instructor:\xa0Majid D. Beni Email:\xa0mbeni@metu.edu.tr Course Description This course explores the foundational questions and concepts in the philosophy of science. It examines the nature of scientific knowledge, the methods of scientific inquiry, and the implications of scientific theories. Topics include the demarcation of science from non-science, the structure of scientific theories, scientific explanation, and the realism vs. anti-realism debate. Course Objectives By the end of this course, students will: Understand key concepts and debates in the philosophy of science. Critically evaluate scientific methods and theories. Apply philosophical analysis to scientific practices. Develop skills in logical reasoning and argumentation. Background reading: Chang, H., 2004. Inventing temperature: Measurement and scientific progress. van Fraassen, B., 1989.\xa0Laws and Symmetry. Clarendon Press. Johansson, L.G., 2016.\xa0Philosophy of science for scientists. Springer. Course Outline Week 1: Introduction to Philosophy of Science  Overview of the course Key questions and themes  Readings:  Ladyman,\xa0Understanding Philosophy of Science, Ch. 1 Quine, W.V.O., 1995.\xa0From stimulus to science. Harvard University Press  Week 2: The Birth of a Discipline\xa0  Logical Empiricism\xa0  Readings:  Friedman, M., 1999. Reconsidering Logical Positivism. Cambridge University Press.  Week', 'Student Club Name: EKOSAM STUDENT CLUB\nStudent Club Description: EKOSAM Student Club aims to host the natural capital and biological diversity of METU campus and to raise awareness on its preservation to fellow campus users, students in particular. In order to achieve this goal, the Club organizes thematic training activities about nature and the environment, field studies, presentations, workshops, seminars, documentary screenings and other related citizen science activities. The Club consists of students interested in nature and environment, holding awareness on conservation and research and willing to spread this awareness by socializing with anyone sharing the same passion. *EKOSAM is the abbreviation for Ecosystem Research and Implementation Center at METU. Academic Advisor: Dr.M.Banu Gündoğan (Department of Computer Education and Instructional Technology) Society Room: CEIT / EFC-21', 'Course: BIOL109\nDepartment: This course belongs to DEPARTMENT OF BIOLOGY.\nObjective: No objective\nContent:  A one- semester course designed for engineering students aiming to introduce concepts in molecular and cellular biology such as cells, inheritance and gene expression. Starts with biological molecules and structure, organization of cells, inheritance and evolution.Goes into the central dogma with DNA replication (in cell division), transcription and translation. Finished with more current and complex material as regulation of gene expression, systems biology approaches in biology, cellular differentiation, stem cells and cancer. Several guest lecturers introduce ongoing biological research at the boundary of engineering and computer science.', 'Course: BIOL361\nDepartment: This course belongs to DEPARTMENT OF BIOLOGY.\nObjective: This is not a course \nContent:  A course designed for students who will complete their compulsory summer practice scheme under the Erasmus Summer Practice Mobility Program.', ""Student Club Name: TECH FOR STARTUP CLUB\nStudent Club Description: Tech for student group is founded at METU road risen from Startup to support the transformation process in Turkey that the developed countries. For this purpose, the club's mission is to strengthen the TEKNOKENT-student cooperation, the startup-student relationship; to develop their members professionally and socially. It has undertaken to count benefits to METU, startups, and students. Our target is to inspire our members continuously and develop ourselves in line with digitalization and technology. Academic Advisor: Assoc.Prof.Dr. Çağlar Sınayuç (Department of Petroleum&Natural Gas Engineering) Club Room: METU Teknokent Kuluçka Merkezi No: 13"", ""Student Club Name: IACES METU LC\xa0SOCIETY\nStudent Club Description: IACES METU LC is an association which connects students from departments regarding civil studies in a local and international basis. The goal of the society is to enhance connections between students of those departments, to look for solutions regarding the construction sector, and to share international news on the field. Moreover, the association aims to support the future colleagues from civil studies while they're working on their personal development. Academic Advisor: Asst.Prof.Dr. Aslı Akçamete Güngör (Department of Civil Engineering) Club Room: Department of Civil Engineering) K-1 Floor: -1""]","['70050398-5544-4737-89c2-5420974056b8\n\nStudent Club Name: SCIENCE AND FUTURE SOCIETY\nStudent Club Description: The Society aims to teach METU students the social importance of science and technology, to follow the agenda of science and technology, to announce the global developments in coordination with METU members, to help students embody new ideas in a project and to support these projects. Academic Advisor: Instr. Dr.Taner Zorbay (Department of History) Assoc. Prof. Dr. Mehmet Somel (Department of Biology) Society Room: Society Containers No:1 \n']"," Assoc. Prof. Dr. Mehmet Somel is the Academic Advisor for the SCIENCE AND FUTURE SOCIETY at METU. He is from the Department of Biology. The society aims to teach METU students the social importance of science and technology, follow the agenda of science and technology, announce global developments in coordination with METU members, help students embody new ideas in a project, and support these projects.","Assoc. Prof. Dr. Mehmet Somel serves as an Academic Advisor for the SCIENCE AND FUTURE SOCIETY at METU, which aims to teach students the social importance of science and technology and support their project ideas.",1.0,0.9999999999,0.6,0.8571428571428571,0.9801928725975879
ODTÜ SAS nedir ve Orta Doğu Teknik Üniversitesi ile nasıl ilişkilidir?,"['FAQ Answer:   English version will be available soon. 24 Ekim 2007 tarih ve 26680 sayılı Resmi Gazete\'de yayınlanan yönetmeliğe göre, ""Yer sağlayıcı trafik bilgisi, İnternet ortamındaki her türlü yer sağlamaya ilişkin olarak; kaynak IP adresi, hedef IP adresi, bağlantı tarih-saat bilgisi, istenen sayfa adresi, işlem bilgisi (GET, POST komut detayları) ve sonuç bilgisi gibi bilgileri ifade etmektedir."" Tanımlanan bu bilgiye, bir hukuksal incelemede kullanılmak üzere yer sağlayıcılık faaliyetleri kapsamındaki bir faaliyetin kim tarafından yapıldığının tespiti için ihtiyaç duyulmaktadır. l) Örnek ""http"" logu: Aşağıda yer sağlayıcı faaliyet kapsamında bir web sayfasının bulunduğu sunucunun ilgili örnek trafik logu (http logu) gösterilmiştir. Bu log, ""apache"" web sunucu yazılımının ürettiği bir log örneğidir. Birimlerde kullanılan farklı web sunucu yazılımları için, yazılımların belgelerine başvurulması ve uygun log tutulması için hangi işlemlerin yapılmasının gerekli olduğunun öğrenilmesi gerekmektedir. 144.122.222.234 - - [21/Mar/2008:14:58:01 -0200] ""GET \'data/liste.html HTTP/1.1"" 200""1 73372 ""-"" ""Mozilla/5.0 (XII: U; Lınux i686; en-L\'S; rv:1.8.1.12) Gecko/20080129 Iceweasel/2.0.0.12(Debian-2.0.0.12-Oetchl)""  Yukarıdaki örnekte yer alan bilgi alanları, kanunda belirtilen başlıklarla aşağıdaki şekilde ilişkilendirilmiştir: Kaynak IP adresi : 144.122.222.234 Hedef ip adresi: Bu kayıtta bulunmamaktadır"" Bağlantı tarih-saat bilgisi: [21/Mar/2008:14:58:01 -0200] İstenen sayfa', 'Course: ENG310\nDepartment: This course belongs to SCHOOL OF FOREIGN LANGUAGES.\nObjective:  Gain a basic understanding about the current concepts in Turkish higher education Know the historical foundation of Turkish higher education in relation to the global context Understand the patterns pertaining to higher education system and governance in Turkey Acknowledge the role of higher education in society with a specific emphasis on historical events and organizational characteristics Show sensitivity for social constructs that have affected the Turkish higher education system Know how\xa0university experience and student culture\xa0interact with Turkish higher education Know the educational and career opportunities of Turkish higher education Understand the internationalization process of Turkish higher education Evaluate information from a scholarly publication and produce a brief written reflection Understand the science and research domains of Turkish higher education Understand the constructs of quality and quality assurance in Turkish higher education Understand the financial functioning and economic basis of Turkish higher education Develop awareness on the ethical practices in Turkish higher education Design and present a research plan based on one of the Turkish higher education concepts', 'FAQ Answer:   Sayfanız için bir web hesabı ve alan adı gerekecektir. Bunun için\xa0https://cc-form.metu.edu.tr/web\xa0adresinde yer alan ""Yeni Web Kullanıcı Kodu ve Alan Adı Başvuru Formu""nu doldurmanız gerekmektedir. Başvurunuz üzerine sizinle iletişime geçilecektir. Web sitenizi aşağıdaki yöntemlerden biri ile oluşturabilirsiniz. Kendiniz Dreamweaver ya da benzeri bir programla web sayfalarınızı hazırlayabilirsiniz.\xa0 Merkezi İçerik Yönetim Sistemi\'ni (MİYS) kullanabilirsiniz. MİYS açık kaynaklı bir içerik yönetim sistemi olan Drupal alt yapısını kullanmaktadır. Üniversitemizdeki akademik bölüm, idari birim, merkez, enstitü, fakülte/yüksekokul, lisansüstü program, laboratuvar, proje/araştırma grubu, öğrenci topluluğu vb. yapılara ait web sayfaları bu sistem üzerinde oluşturulabilmektedir. MİYS ile ilgili ayrıntılı bilgiye ve başvuru formuna http://miys.metu.edu.tr adresinden erişebilirsiniz. Bu sistemi kullanırsanız MİYS kapsamında geçerli görsel kimlik standartlarına (http://www.metu.edu.tr/tr/gkk/gorsel-kimlik-standartlari) uymanız beklenmektedir. ODTÜ Blog Servisi\'ni kullanabilirsiniz. ODTÜ Blog Servisi, özgür bir yazılım olan WordPress altyapısını kullanmaktadır. Bu servis ile üniversitemizdeki akademik bölüm, idari birim, merkez, enstitü, fakülte/yüksekokul, lisansüstü program, laboratuvar, proje/araştırma grubu, öğrenci topluluğu vb. yapılara ait web siteleri kapsamlı bir şekilde hazırlanabilir, bu sitelerde çeşitli yazılar ve sayfalar oluşturulabilir. Tasarım için biraz', 'yerlerdedir): Internet Explorer, Outlook Express ve Windows Mail için: View → Encoding (Görünüm → Kodlama) Mozilla Firefox ve Mozilla Thunderbird için: View → Character Encoding (Göster → Karakter Kodlaması)', 'FAQ Answer:   E-liste servisindeki altyapı gereği, kullanıcıların üye oldukları her bir e-liste için farklı e-liste şifreleri tanımlanmaktadır. Dileyen kullanıcılarımız kolaylık olması açısından, tüm e-listeler için ortak bir e-liste şifresi tanımlayabilirler. Bunun için aşağıdaki işlemlerin yapılması gerekmektedir. Not: Güvenlik önlemi olarak, merkezi kullanıcı kodları için kullanılan şifrelerin e-liste şifresi olarak kullanılmaması önerilmektedir. Bir kullanıcı öncelikle üye olduğu herhangi bir listeye gönderilmiş bir mesajın sonunda yer alan e-liste web arayüzü bağlantısını kullanarak o e-listenin ayarları ile ilgili değişikliklerin yapılabildiği sayfaya (http://mailman.metu.edu.tr/mailman/listinfo/liste_adi) girmelidir.  Bu sayfanın en alt bölümünde yer alan e-posta adresi bölümüne, bu e-listeye üye olmak için kullandığı e-posta adresini yazarak, _x0093_Listeden çık veya seçeneklerimi düzenle_x0094_ isimli butona tıklamalıdır.  Eğer e-liste şifresi daha önceden girilmiş ise, aşağıdaki şekilde olduğu gibi e-liste üyelik ayarlarının değiştirilebildiği ekran görünecektir. Aksi durumda, e-liste şifresi kullanılarak giriş yapılmalıdır:  Üye olduğu tüm e-listelere yönelik ortak bir şifre tanımlamak isteyen kullanıcı bu sayfada yer alan _x0093_Şifre Değişimi_x0094_ bölümüne mevcut e-liste şifresini veya kullanmak istediği herhangi bir şifreyi yazıp, _x0093_Şifremi Değiştir_x0094_ butonuna _x0093_Global Olarak Değiştir_x0094_ seçeneği seçili olacak şekilde tıklamalıdır.  Bu', 'sebeplerle ilgili olarak abc-l-ownermetu.edu.tr adresinden liste yöneticisi ile iletişime geçebilir, detaylı bilgi alabilirsiniz.  (Yukarıda geçen ""abc-l"" ifadesi liste ismi için örnek olarak verilmiştir)', 'Course: FLE317\nDepartment: This course belongs to DEPARTMENT OF FOREIGN LANGUAGE EDUCATION.\nObjective: By the end of the course the students will be able to raise their awareness towards different forms of errors made by Turkish learners of English as a foreign language the students will be able to apply different corrective feedback strategies to deal with a variety of language-related errors made by Turkish learners of English in a context-appropriate manner the students will be able to raise their awareness towards the role and methods of error correction in teaching English as a foreign language to different learner profiles (those with different levels of proficiency in English and with different age levels) the students will be able to raise their awareness towards the relationship between corrective feedback and language teacher development \nContent:  Examining the errors frequently made by learners in the English learning process emphasis on  classification of  common errors, the origins of learners` errors and the ways to help learners  correct their errors.', 'FAQ Question: Bölüm, Birim, Merkez, Laboratuvar, Öğrenci Topluluğu web sayfası nasıl yapılır?', 'ürettiği log dosyasının örneği aşağıda verilmiştir. Tutulan log bilgisinde, bağlantı yapan bilgisayarın adresi, hedef dosya ve kullanıcı adı bilgileri bulunmalıdır. Tue Mar 25 16:39:48 2008 0 bogus.com 528 /ftp/pub/IMPORTANT-WARNING.txt b _ o r anonim ftp 1 * c  Yukarıdaki örnekte yer alan bilgi alanları, kanunda belirtilen başlıklarla aşağıdaki şekilde ilişkilendirilmiştir: Bağlantı tarih-saat bilgisi: ""Tue Mar 25 16:39:48 2008""  Kaynak Adres: ""bogus.com""  İstenen dosya: ""ftp/pub/IMPORTANT-WARNING.txt""  Kullanıcı adı: ""anonim""  Birimler, yer sağlayıcı faaliyetleri kapsamında verdikleri servislerin ürettiği logları inceleyip, sahip oldukları sistemlerde verdikleri servislerin yarattığı trafik loglarını yönetmelikte tarif edildiği şekilde (zaman damgası ile birlikte) kayıt altına almak, bu logları, gizliliğini sağlayarak arşivlemekle yükümlüdür.', 'bir şifreyi yazıp, _x0093_Şifremi Değiştir_x0094_ butonuna _x0093_Global Olarak Değiştir_x0094_ seçeneği seçili olacak şekilde tıklamalıdır.  Bu işlem başarılı bir şekilde gerçekleştirildiği takdirde, ekranda _x0093_Şifre başarıyla değiştirildi._x0094_ şeklinde bir mesaj görüntülenir. Kullanıcı tarafından tanımlanan yeni şifre artık aynı e-posta adresi ile üye olunan mevcut tüm e-listelerde kullanılabilir. Şifre değiştirme işlemi sırasında _x0093_Global Olarak Değiştir_x0094_ seçeneği seçili olmadığı durumda, sadece söz konusu e-listenin şifresi değiştirilmiş olur. ""Global Olarak Değiştir"" seçeneği ile kullanıcının o ana kadar üye olduğu tüm listelerin şifreleri değiştirilir. Bu işlem sonrasında üye olunacak yeni e-listelerde de aynı şifrenin kullanılabilmesi için bu işlemin her üyelikten sonra tekrarlanması gerekir. Bu işlem yapılmadığında yeni üye olunan e-listelerde, üye olurken Mailman tarafından otomatik olarak tanımlanıp kullanıcıya gönderilen şifreler kullanılır.']","['Sports Club Name: ODTÜ SAS (SU ALTI SPORLARI TOPLULUĞU)\nSports Club Description: ODTÜ SAS; Orta Doğu Teknik Üniversitesi Su Altı Sporları öğrenci topluluğu ve ODTÜ Spor Kulübü Su Altı Sporları takımlarıdır. Türkiye çapında çeşitli başarılara imza atan ODTÜ SAS, her yıl eğitimlerinin yanı sıra muhtelif etkinlikler de düzenlemektedir. Bu etkinliklerdeki amaç, ODTÜ’nün öncülüğünde Türkiye’de bu ve benzeri sporlara ve aktivitelere gönül vermiş olan kişileri bir araya getirmek, elde edilen tecrübeleri paylaşmak, tanıtımı arttırmak ve dostluk ve arkadaşlık ortamında işbirliğini desteklemektedir. ODTÜ aynı zamanda kendi bünyesinden su altında erkek ve kadınlarda takımlarda çıkarmıştır. Bunlar ODTÜ SAS Serbest Dalış Takımları, Su altı Hokeyi Takımları, Su Altı Rugbi Takımları ve Su Altı Görüntüleme Takımıdır. Bu takımlarımız, yönetmelikler gereği faaliyetlerinde Türkiye Su altı Sporları Federasyonu (TSSF)’ye bağlı olan ODTÜ Spor Kulübü bünyesindedir. Takım sporcuları, dönem içerisinde performans gösteren sporcular arasından seçilen kişilerden oluşmaktadır. Gerek takımlarımız ve gerekse bireysel olarak sporcularımız Dünya Rekorları dâhil her yıl ulusal ve uluslararası şampiyonalarda sürekli olarak madalyalar almakta ve üniversitemize şampiyonluklar kazandırmaktadır.\n']","İşte bir örnek, ""Department of Foreign Language Education"" web sayfasını oluşturmak için kullanılabilecek bir yöntem:

        1. Web sayfasının adını ve içeriğini tanımlayın: İlk olarak, web sayfasının adını ve içeriğini tanımlayın. Örneğin, ""Department of Foreign Language Education"" web sayfasında, ""Department of Foreign Language Education"" adını ve bu bölüm hakkındaki bilgileri içerecek şekilde içerik tanımlayın.

        2. Web sayfasının yapısını belirleyin: Sonra, web sayfasının yapısını belirleyin. Örneğin, ""Department of Foreign Language Education"" web sayfasının yapısında, ""Bölüm Hakkında"", ""Programlar"", ""Personel"", ""Yönetim"", ""İletişim"" ve ""Galeri"" gibi bölümler olabilir.

        3. Web sayfasının görünümü belirleyin: Ardından, web sayfasının görünümünü belirleyin. Örneğin, ""Department of Foreign Language Education"" web sayfasının görünümünde, renkler, görüntüler ve logolar gibi özellikleri belirleyebilirsiniz.

        4. Web sayfasını oluşturun: Son olarak, web sayfasını oluşturun. Örneğin, ""Department of Foreign Language Education"" web sayfasını oluşturmak için, ""HTML"", ""CSS"", ""","ODTÜ SAS (SU ALTI SPORLARI TOPLULUĞU), Orta Doğu Teknik Üniversitesi (ODTÜ) su altı sporları öğrenci topluluğudur ve ODTÜ Spor Kulübü'nün su altı sporları takımlarını kapsamaktadır. ODTÜ SAS, Türkiye genelinde çeşitli başarılar elde etmiş ve her yıl antrenmanlarının yanı sıra çeşitli etkinlikler düzenlemektedir. Bu etkinliklerin amacı, ODTÜ liderliğinde su altı sporları ve etkinliklerine tutkulu bireyleri bir araya getirmek, deneyim paylaşımında bulunmak, tanıtımı artırmak ve dostane bir ortamda iş birliğini desteklemektir. ODTÜ, ODTÜ SAS Serbest Dalış Takımları, Su Altı Hokeyi Takımları, Su Altı Ragbi Takımları ve Su Altı Görüntüleme Takımı da dahil olmak üzere su altı sporları için kendi erkek ve kadın takımlarını oluşturmuştur. Bu takımlar, Türk Su Altı Sporları Federasyonu (TSSF) ile bağlı olan ODTÜ Spor Kulübü bünyesinde faaliyet göstermektedir. Sporcular, sezon boyunca iyi performans gösterenler arasından seçilmektedir ve hem takımlar hem de bireysel sporcular, ulusal ve uluslararası yarışmalarda sürekli olarak madalya ve şampiyonluk kazanarak üniversiteye onur getirmektedir.",1.0,0.0,0.0,0.6363636363636364,0.7670693034819707
ODTÜ HAT ve ODTÜ SAS hakkında bilgi verirmisiniz?,"['Sports Club Name: ODTÜ SAS (SU ALTI SPORLARI TOPLULUĞU)\nSports Club Description: ODTÜ SAS; Orta Doğu Teknik Üniversitesi Su Altı Sporları öğrenci topluluğu ve ODTÜ Spor Kulübü Su Altı Sporları takımlarıdır. Türkiye çapında çeşitli başarılara imza atan ODTÜ SAS, her yıl eğitimlerinin yanı sıra muhtelif etkinlikler de düzenlemektedir. Bu etkinliklerdeki amaç, ODTÜ’nün öncülüğünde Türkiye’de bu ve benzeri sporlara ve aktivitelere gönül vermiş olan kişileri bir araya getirmek, elde edilen tecrübeleri paylaşmak, tanıtımı arttırmak ve dostluk ve arkadaşlık ortamında işbirliğini desteklemektedir. ODTÜ aynı zamanda kendi bünyesinden su altında erkek ve kadınlarda takımlarda çıkarmıştır. Bunlar ODTÜ SAS Serbest Dalış Takımları, Su altı Hokeyi Takımları, Su Altı Rugbi Takımları ve Su Altı Görüntüleme Takımıdır. Bu takımlarımız, yönetmelikler gereği faaliyetlerinde Türkiye Su altı Sporları Federasyonu (TSSF)’ye bağlı olan ODTÜ Spor Kulübü bünyesindedir. Takım sporcuları, dönem içerisinde performans gösteren sporcular arasından seçilen kişilerden oluşmaktadır. Gerek takımlarımız ve gerekse bireysel olarak sporcularımız Dünya Rekorları dâhil her yıl ulusal ve uluslararası şampiyonalarda sürekli olarak madalyalar almakta ve üniversitemize şampiyonluklar kazandırmaktadır.', ""Graduation Certificates for the previous degrees and their translation to Turkish or English: Please ensure that both the original document and its English or Turkish translation are uploaded during the registration. One photo Identity page of your passport Residence Permit Card: Required only if the student has a residence permit card before the registration to METU. Recognition of the Previous University by the Higher Education Council of Turkey International students do not need to apply for the recognition letter personally. As ODTÜ, we will contact the Higher Education Council of Turkey regarding the recognition of your previous university degrees. However, if you have already got this letter, you may bring it to the registration. Only in case of a negative response from the HEC, you will need to visit HEC personally to get the letter. REGISTRATION CANCELLATION The following students must cancel their registration from their currently registered programs to register for their newly accepted programs. Without the registration cancellation, the students' registration will not be permitted, and document submissions will not be accepted. Students who have applied and got accepted to a new graduate program while they are still registered to a graduate program Students who graduated from their M.S. program and newly accepted to a Ph.D. program CONTACT International Students Office http://iso.metu.edu.tr/en/contact"", 'sebeplerle ilgili olarak abc-l-ownermetu.edu.tr adresinden liste yöneticisi ile iletişime geçebilir, detaylı bilgi alabilirsiniz.  (Yukarıda geçen ""abc-l"" ifadesi liste ismi için örnek olarak verilmiştir)', 'ODTÜ’nün değil Türkiye’nin değerli bir yarışması haline gelen bu organizasyona her sene 20 farklı ülkeden 400’ü aşkın sporcu ve 5000 dans severi ağırlamaktadır. Uluslararası platformlarda da övgüler almaya devam eden ve 16.sını 4-5 Kasım 2017 tarihlerinde gerçekleştireceğimiz METU OPEN son 3 senedir tüm Uluslararası Yarışmalar arasında ilk 10’da yer almaktadır.', 'Course: ENG310\nDepartment: This course belongs to SCHOOL OF FOREIGN LANGUAGES.\nObjective:  Gain a basic understanding about the current concepts in Turkish higher education Know the historical foundation of Turkish higher education in relation to the global context Understand the patterns pertaining to higher education system and governance in Turkey Acknowledge the role of higher education in society with a specific emphasis on historical events and organizational characteristics Show sensitivity for social constructs that have affected the Turkish higher education system Know how\xa0university experience and student culture\xa0interact with Turkish higher education Know the educational and career opportunities of Turkish higher education Understand the internationalization process of Turkish higher education Evaluate information from a scholarly publication and produce a brief written reflection Understand the science and research domains of Turkish higher education Understand the constructs of quality and quality assurance in Turkish higher education Understand the financial functioning and economic basis of Turkish higher education Develop awareness on the ethical practices in Turkish higher education Design and present a research plan based on one of the Turkish higher education concepts', 'Registration Procedures Answer: Students who meet the application criteria below may apply for the undergraduate programs at the Middle East Technical University (as long as they satisfy at least one of the minimum exam/diploma scores listed here: http://iso.metu.edu.tr/en/system/files/odtu_iso_requirements.pdf). Only the candidates whose eligibility is defined in the ""Principles Governing International Student Admissions"" drawn up by the Council of Higher Education can apply to these quotas. If you do not have citizenship of the Republic of Türkiye or TRNC AND if you completed all of your high school education outside of Türkiye and TRNC, these principles do not include important details for you. However, (i) if you have citizenship of the Republic of Türkiye and/or TRNC OR (ii) if you did not complete all of your high school education outside of Türkiye and TRNC, then you are strongly recommended to check these eligibility criteria to see if you are eligible to apply through international student quotas. METU Directive for International Student Applications, Admissions, and Registrations to Undergraduate Programs: https://oidb.metu.edu.tr/en/directive-international-student-applications-admissions-and-registrations-undergraduate-programs. General Principles of the Higher Education Council regarding the admission of students from abroad (in Turkish):  https://www.yok.gov.tr/Documents/Ogrenci/yurt-disindan-ogrenci-kabulune-iliskin-esaslar.pdf', 'Sports Club Name: ODTÜ EŞLİ DANSLAR TOPLULUĞU (EDT)', 'Sports Club Name: ODTÜ AİKİDO TOPLULUĞU\nSports Club Description: Bünyesindeki Çocuk Aikido grubuyla beraber 200’ü aşkın üyesiyle beraber Türkiye’nin en büyük dojosu olan ODTÜ Aikido Topluluğu’nun birçok üyesi her sene yurtiçi ve yurtdışında birçok Aikido seminerine katılmaktadır.\xa0Her ne kadar yakın doğu dövüş sanatı kulüplerinin kadınlar tarafından ilgi çekmediği düşünülse de, ODTÜ Aikido Topluluğu’nun neredeyse yarısı kadınlardan oluşmaktadır. Topluluğun amacı bu yanlış algıyı düzeltmektir ve teknik olarak ileri seviye, ahlaklı sporcular yetiştirmek ile Aikidoyu daha da yaymak ve sevdirmektir. Bundan ayrı olarak Çocuk Aikido grubunda yaptığı çalışmalarla birlikte çocukların fiziksel, sosyal ve psikolojik gelişimini sağlamanın yanında saygı, işbirliği ve uyum ile mesleki başarıyı sağlayan özgüven, sabır ve iç disiplini çocuklara aşılamaktır.\xa0ODTÜ Aikido Topluluğu, Tamura Shihan ve onun öğrencisi Nebi Vural Sensei’nin stili ve prensiplerini takip etmektedir. Her sene Aralık ve Mayıs aylarında iki tane uluslararası seminer düzenlemektir. Avrasya Aikido Organizasyonu ile birlikte, 7 yıldır her Mayıs ayında yaklaşık 20 ülkeden 300 sporcunun katıldığı, Uluslararası Aikido Festivalini düzenlemekte ve etkinliğe ev sahipliği yapmaktadır.', 'Sports Club Name: ODTÜ DENİZCİLİK VE YELKEN TOPLULUĞU (ODYT)\nSports Club Description: Topluluğumuzun asıl amacı ODTÜ öğrencilerine denizi ve Yelken sporunu sevdirmek ve okulumuzu yarışlarda en iyi şekilde temsil etmek. Yelken sporu vücudumuzu fiziksel olarak güçlendirdiği gibi, hızlı çözüm üretebilme, koordinasyon, takım olma ve zihni güçlendirme üzerine de etkilidir. Gidilen yarış ve eğitimlerde takım olma bilincini üyelerimize kazandırma da topluluğumuzun bir diğer amacıdır. Faaliyetlerimize gelecek olursak, her sene yeni gelen üyelerimize temel eğitimler düzenliyoruz. Birincisi temel centerboard eğitimi (laser teknelerle), diğeri ise temel yatçılık eğitimi (yelkenli yatlarla genellikle 1 hafta sürmekte).\xa0 Her sene elimizden geldiğince üniversiteler arası ve özel olarak düzenlenen yarışlara katılmaktayız. Sponsor ya da gelen desteğe göre faaliyetlerimizi daha da genişletmek, katıldığımız trofe ve yarışların sayısını arttırmak, İstanbul’daki üniversiteler gibi yaz/kış gezileri düzenlemek gelecek faaliyet raporlarımızda mevcut.', ""Sports Club Name: ODTÜ HAVACILIK TOPLULUĞU YAMAÇ PARAŞÜTÜ GRUBU\nSports Club Description: ODTÜ Havacılık Topluluğu Yamaç Paraşütü Grubu (ODTÜ HAT), 1991 yılında kurulduğundan 2016 yılına kadar ODTÜ Kültür İşleri Müdürlüğü'ne o tarihten günümüze kadar da ODTÜ Spor Müdürlüğü'ne bağlı olarak faaliyet göstermektedir. Türkiye'de yamaç paraşütü eğitimi ilk kez topluluğumuzda başlamış 25 yıldan bu yana da aynı şekilde devam etmektedir. Topluluğumuzun yaklaşık 300 ODTÜ öğrencisinden oluşan grubu her yıl teorik eğitimlere katılmakta ve yer çalışmasını başarı ile tamamlayan öğrenciler ise başlangıç eğitimine geçmektedir. Topluluğumuzun temel amacı bu sporu yaymak ve ODTÜ öğrencilerine en iyi şekilde tanıtmaktır.""]","[""e30b2ae8-bc17-4dbf-b116-d54affdd46fb\n\nSports Club Name: ODTÜ HAVACILIK TOPLULUĞU YAMAÇ PARAŞÜTÜ GRUBU\nSports Club Description: ODTÜ Havacılık Topluluğu Yamaç Paraşütü Grubu (ODTÜ HAT), 1991 yılında kurulduğundan 2016 yılına kadar ODTÜ Kültür İşleri Müdürlüğü'ne o tarihten günümüze kadar da ODTÜ Spor Müdürlüğü'ne bağlı olarak faaliyet göstermektedir. Türkiye'de yamaç paraşütü eğitimi ilk kez topluluğumuzda başlamış 25 yıldan bu yana da aynı şekilde devam etmektedir. Topluluğumuzun yaklaşık 300 ODTÜ öğrencisinden oluşan grubu her yıl teorik eğitimlere katılmakta ve yer çalışmasını başarı ile tamamlayan öğrenciler ise başlangıç eğitimine geçmektedir. Topluluğumuzun temel amacı bu sporu yaymak ve ODTÜ öğrencilerine en iyi şekilde tanıtmaktır.\n"", '9a919064-3dec-46d8-926c-d9dce139dbda\n\nSports Club Name: ODTÜ SAS (SU ALTI SPORLARI TOPLULUĞU)\nSports Club Description: ODTÜ SAS; Orta Doğu Teknik Üniversitesi Su Altı Sporları öğrenci topluluğu ve ODTÜ Spor Kulübü Su Altı Sporları takımlarıdır. Türkiye çapında çeşitli başarılara imza atan ODTÜ SAS, her yıl eğitimlerinin yanı sıra muhtelif etkinlikler de düzenlemektedir. Bu etkinliklerdeki amaç, ODTÜ’nün öncülüğünde Türkiye’de bu ve benzeri sporlara ve aktivitelere gönül vermiş olan kişileri bir araya getirmek, elde edilen tecrübeleri paylaşmak, tanıtımı arttırmak ve dostluk ve arkadaşlık ortamında işbirliğini desteklemektedir. ODTÜ aynı zamanda kendi bünyesinden su altında erkek ve kadınlarda takımlarda çıkarmıştır. Bunlar ODTÜ SAS Serbest Dalış Takımları, Su altı Hokeyi Takımları, Su Altı Rugbi Takımları ve Su Altı Görüntüleme Takımıdır. Bu takımlarımız, yönetmelikler gereği faaliyetlerinde Türkiye Su altı Sporları Federasyonu (TSSF)’ye bağlı olan ODTÜ Spor Kulübü bünyesindedir. Takım sporcuları, dönem içerisinde performans gösteren sporcular arasından seçilen kişilerden oluşmaktadır. Gerek takımlarımız ve gerekse bireysel olarak sporcularımız Dünya Rekorları dâhil her yıl ulusal ve uluslararası şampiyonalarda sürekli olarak madalyalar almakta ve üniversitemize şampiyonluklar kazandırmaktadır.\n']","İşte bilgi ODTÜ HAT (Orta Doğu Teknik Üniversitesi Hava Tekniği Topluluğu) ve ODTÜ SAS (SU ALTI SPORLARI TOPLULUĞU) hakkında:

        ODTÜ HAT:
        ODTÜ HAT, Orta Doğu Teknik Üniversitesi'nin Hava Tekniği öğrenci topluluğudur. Türkiye'nin çeşitli başarılara imza atan ODTÜ HAT, her yıl eğitimlerinin yanı sıra muhtelif etkinlikler de düzenlemektedir. Bu etkinliklerdeki amaç, ODTÜ’nün öncülüğünde Türkiye'de bu ve benzeri sporlara ve aktivitelere gönül vermiş olan kişileri bir araya getirmek, elde edilen tecrübeleri paylaşmak, tanıtımı arttırmak ve dostluk ve arkadaşlık ortamında işbirliğini desteklemektedir.

        ODTÜ SAS:
        ODTÜ SAS; Orta Doğu Teknik Üniversitesi Su Altı Sporları öğrenci topluluğu ve ODTÜ Spor Kulübü Su Altı Sporları takımlarıdır. Türkiye çapında çeşitli başarılara imza atan ODTÜ SAS, her yıl eğitimlerinin yanı sıra muhtelif etkinlikler de düzenlemektedir. Bu etkinliklerdeki amaç, ODTÜ’nün öncülüğünde Türkiye'de bu ve benzeri sporlara ve aktivitelere gönül vermiş olan kişileri bir araya getirmek, elde edilen tecrübeleri paylaşmak, tanıtımı arttırmak ve dostluk ve arkadaşlık ortamında işbirliğini desteklemektedir. ODTÜ aynı zamanda kendi bünyesinden su altında erkek ve kadınlarda takımlarda çıkarmıştır. Bunlar ODTÜ SAS Serbest Dalış Takımları, Su altı Hokeyi Takımları, Su Altı Rugbi Takımları ve Su Altı Görüntüleme Takımıdır. Bu takımlarımız, yönetmelikler gereği faaliyetlerinde Türkiye Su altı Sporları Federasyonu (TSSF)’ye bağlı olan ODTÜ Spor Kulübü bünyesindedir. Takım sporcuları, dönem içerisinde performans gösteren sporcular arasından seçilen kişilerden oluşmaktadır. Gerek takımlarımız ve gerekse bireysel olarak sporcularımız Dünya Rekorları dâhil her yıl ulusal ve uluslararası şampiyonalarda sürekli olarak madalyalar almakta ve üniversitize şampiyonluklar kazandırmaktadır.

        FAQ Cevapları:
        Soru: Sayfanız için bir web hesabı ve alan adı gerekecektir. Bunun için https://cc-form.metu.edu.tr/web adresinde yer alan ""Yeni Web Kullanıcı Kodu ve Alan Adı Başvuru Formu""nu doldurmanız gerekmektedir. Başvurunuz üzerine sizinle iletişime geçilecektir. Web sitenizi aşağıdaki yöntemlerden biri ile oluşturabilirsiniz. Kendiniz Dreamweaver ya da benzeri bir programla web sayfalarınızı hazırlayabilirsiniz. Merkezi İçerik Yönetim Sistemi'ni (MİYS) kullanabilirsiniz. MİYS açık kaynaklı bir içerik yönetim sistemi olan Drupal alt yapısını kullanmaktadır. Üniversitemizdeki akademik bölüm, idari birim, merkez, enstitü, fakülte/yüksekokul, lisansüstü program, laboratuvar, proje/araştırma grubu, öğrenci topluluğu vb. yapılara ait web sayfaları bu sistem üzerinde oluşturulabilmektedir. MİYS ile ilgili ayrıntılı bilgiye ve başvuru formuna http://miys.metu.edu.tr adresinden erişebilirsiniz. Bu sistemi kullanursanız MİYS kapsamında geçerli görsel kimlik standartlarına (http://www.metu.edu.tr/tr/gkk/gorsel-kimlik-standartlari) uymanız beklenmektedir. ODTÜ Blog Servisi'ni kullanabilirsiniz. ODTÜ Blog Servisi, özgür bir yazılım olan WordPress altyapısını kullanmaktadır. Bu servis ile üniversitemizdeki akademik bölüm, idari birim, merkez, enstitü, fakülte/yüksekokul, lisansüstü program, laboratuvar, proje/araştırma grubu, öğrenci topluluğu vb. yapılara ait web siteleri kapsamlı bir şekilde hazırlanabilir, bu sitelerde çeşitli yazılar ve sayfalar oluşturulabilir. Tasarım için biraz

        Soru: Eğer söz konusu liste ""tek yönlü duyuru listesi"" ise, liste yapılandırması gereği e-posta gönderme yetkisine sahip kişiler haricinde hiç bir kullanıcı mesaj gönderememektedir. Ancak üyelerin e-posta gönderebildiği bir liste söz konusu ise, gönderdiginiz mesajlarin listeye ulaşmamasının iki temel sebebi vardır: Listeye üyelik için kullanmadığınız bir e-posta adresinden mesaj gönderiyor olabilirsiniz. Genelde birden fazla e-posta adresi kullanıyorsanız ve üye olan adresten farklı bir adrese yönlendirme tanımladıysanız, liste mesajlarini aldığınız e-posta adresi ile üyelik için kullandığınız e-posta adresi farklı olabilir. Mesajlarınızın alıcı adresi liste adıyla beraber çok sayıda e-posta adresini yazmış olabilirsiniz. Mesajinizin onay bekliyor olmasının olası sebepleri aşağıda listelenmiştir: Gönderdiğiniz mesaj liste mesaj kotasını aşan bir büyüklüğe sahip olabilir (örneğin; çok büyük bir dosya eklentisi gönderiyor olabilirsiniz). Mesajınızın alıcı adresi liste ayarları gereği moderatör onayı için bekletiliyor olabilir. Tüm bu olası sebeplerle ilgili olarak abc-l-ownermetu.edu.tr adresinden liste yöneticisi ile iletişime geçebilir, detaylı bilgi alabilirsiniz.

        Soru: Sunucu sistemlerimiz e-posta alışverişinde Türkçe karakterleri desteklemektedir. Horde ve Squirrelmail arayüzlerine Türkçe olarak girildiğinde gönderilen e-postaların karakter seti ISO-8859-9, İngilizce olarak girildiğinde ise UTF-8'dir. Her iki karakter seti de Türkçe karakterleri içermektedir. UTF-8’de Türkçe dışındaki kimi dillere özel karakterler de bulunmaktadır. Not: Horde arayüzünde e-posta gönderirken ""Karakter Seti"" alanındaki seçenekleri kullanarak bu ayarı değiştirmek mümkündür. Horde ya da Squirrelmail arayüzü dışında Outlook Express, Thunderbird ya da Windows Mail benzeri herhangi bir POP3/IMAP istemcisi ile e-posta gönderiyorsanız gönderilen e-postanın karakter seti, ilgili programın kendi ayarlarına bağlı olarak belirlenir. Giden e-postalar için karakter seti değişikliği yapmak için farklı programlarda izlenen yol aşağıdaki gibidir (aşağıda yer almayan farklı programlar için de karakter seti ayarları benzer yerlerdedir): Outlook Express ve Windows Mail için: Tools → Options → Send → International Settings (Araçlar → Seçenekler → Gönder → Uluslararası Ayarlar) Mozilla Thunderbird için: Tools → Options → Display → Fonts → Character Encodings (Araçlar → Seçenekler → Görünüm → Yazıtipleri → Karakter Kodlaması) Göndereceğiniz e-postada Türkçe karakter kullanmak istiyorsanız söz konusu menülerdeki ayarları ISO-8859-9 (Türkçe ISO olarak da tanımlanır) ya da UTF-8 seçmeniz yeterlidir. Size gelen e-postalardaki Türkçe karakterleri görmekte sorun

        Soru: English version will be available soon. 24 Ekim 2007 tarih ve 26680 sayılı Resmi Gazete'de yayınlanan yönetmeliğe göre, ""Yer sağlayıcı trafik bilgisi, İnternet ortamındaki her türlü yer sağlamaya ilişkin olarak; kaynak IP adresi, hedef IP adresi, bağlantı tarih-saat bilgisi, istenen sayfa adresi, işlem bilgisi (GET, POST komut detayları) ve sonuç bilgisi gibi bilgileri ifade etmektedir."" Tanımlanan bu bilgiye,","ODTÜ HAT, 1991 yılında kurulan ODTÜ Havacılık Topluluğu Yamaç Paraşütü Grubu'dur. 2016 yılına kadar ODTÜ Kültür İşleri Müdürlüğü'ne, o tarihten itibaren ise ODTÜ Spor Müdürlüğü'ne bağlı olarak faaliyet göstermektedir. Topluluğun temel amacı yamaç paraşütü sporunu yaymak ve ODTÜ öğrencilerine en iyi şekilde tanıtmaktır. ODTÜ SAS ise Orta Doğu Teknik Üniversitesi Su Altı Sporları öğrenci topluluğudur. Türkiye çapında çeşitli başarılara imza atan ODTÜ SAS, her yıl eğitimlerin yanı sıra etkinlikler düzenlemekte ve bu etkinliklerde su altı sporlarına gönül veren kişileri bir araya getirmektedir. ODTÜ SAS, serbest dalış, su altı hokeyi, su altı rugbisi ve su altı görüntüleme takımları ile de tanınmaktadır. Bu takımlar, Türkiye Su Altı Sporları Federasyonu'na bağlı olarak faaliyet göstermekte ve ulusal ve uluslararası şampiyonalarda madalyalar kazanmaktadır.",1.0,0.59999999997,0.75,0.21153846153846154,0.9126773321845507
ARAŞTIRMA VE GELİŞTİRME DERNEĞİ'nin akademik danışmanı kimdir?,"['ODTÜ’nün değil Türkiye’nin değerli bir yarışması haline gelen bu organizasyona her sene 20 farklı ülkeden 400’ü aşkın sporcu ve 5000 dans severi ağırlamaktadır. Uluslararası platformlarda da övgüler almaya devam eden ve 16.sını 4-5 Kasım 2017 tarihlerinde gerçekleştireceğimiz METU OPEN son 3 senedir tüm Uluslararası Yarışmalar arasında ilk 10’da yer almaktadır.', 'Course: PSY442\nDepartment: This course belongs to DEPARTMENT OF PSYCHOLOGY.\nObjective: Upon completion of this course, students will be expected to demonstrate:  An understanding of the field of clinical psychology (history, ethics, research, psychotherapy, training) Knowledge of professional responsibilities of a clinical psychologist. Knowledge of clinical assessment. Knowledge of the theoretical basis of clinical psychology. Knowledge of applications and the current controversies of clinical psychology in Turkey  \nContent:  Historical development and relationships with other disciplines; review of recent theories and research in the major areas of clinical psychology such as measurement of abilities, personality assesment, psychotherapy and prevention of behavior disorders; clinical psychology as a profession; training, legislation, licensing and ethical standarts. Visits to settings where clinical psychologists are working may be arranged.', 'sebeplerle ilgili olarak abc-l-ownermetu.edu.tr adresinden liste yöneticisi ile iletişime geçebilir, detaylı bilgi alabilirsiniz.  (Yukarıda geçen ""abc-l"" ifadesi liste ismi için örnek olarak verilmiştir)', 'Content:  This course is designed for students to develop a basic understanding of Turkish higher education system as prospective higher education professionals. Specifically, it aims to increase undergraduate students? understanding of fundamental concepts related to higher education such as history, organization and governance, sociology, economy, internationalization, career, laws, science and research, campus life and student body, ethics, and technology. Students analyze and synthesize information from scholarly publications on higher education and apply what they have learned in output activities. Students also write short critical reflections on these scholarly publications. They finally present a future research plan at the end of the course.', 'Course: ECE104\nDepartment: This course belongs to DEPARTMENT OF EARLY CHILDHOOD EDUCATION.\nObjective:  Enhance the knowledge of socio-cultural and individual patterns in regard to Turkish family life and their influence on the health care of the family. Develop a clear understanding of the anatomy and physiology of female reproductive system, menstruation, antenatal care, child health, childhood diseases, and preschool physical examination and screening procedures. Apply the concept of health promotion and health maintenance of children from infancy through adolescence. Develop a clear understanding of the nursing process as a tool for providing comprehensive nursing care for mother and children from infancy to adolescence with common health problems.  \xa0 \xa0 \nContent:  Defining mother and child health, factors affecting their health in the community, growth and development, common diseases in childhood: diarrhea, upper respiratory infections, infectious diseases such as hepatitis, meningitis and parasites; immunization; common accidents in childhood and preventive care; drug usage, emergencies and special applications; health problems of women in different periods of lifetime, sexual maturation, major issues related to menopause and aging.', 'ürettiği log dosyasının örneği aşağıda verilmiştir. Tutulan log bilgisinde, bağlantı yapan bilgisayarın adresi, hedef dosya ve kullanıcı adı bilgileri bulunmalıdır. Tue Mar 25 16:39:48 2008 0 bogus.com 528 /ftp/pub/IMPORTANT-WARNING.txt b _ o r anonim ftp 1 * c  Yukarıdaki örnekte yer alan bilgi alanları, kanunda belirtilen başlıklarla aşağıdaki şekilde ilişkilendirilmiştir: Bağlantı tarih-saat bilgisi: ""Tue Mar 25 16:39:48 2008""  Kaynak Adres: ""bogus.com""  İstenen dosya: ""ftp/pub/IMPORTANT-WARNING.txt""  Kullanıcı adı: ""anonim""  Birimler, yer sağlayıcı faaliyetleri kapsamında verdikleri servislerin ürettiği logları inceleyip, sahip oldukları sistemlerde verdikleri servislerin yarattığı trafik loglarını yönetmelikte tarif edildiği şekilde (zaman damgası ile birlikte) kayıt altına almak, bu logları, gizliliğini sağlayarak arşivlemekle yükümlüdür.', 'FAQ Answer:   E-liste servisindeki altyapı gereği, kullanıcıların üye oldukları her bir e-liste için farklı e-liste şifreleri tanımlanmaktadır. Dileyen kullanıcılarımız kolaylık olması açısından, tüm e-listeler için ortak bir e-liste şifresi tanımlayabilirler. Bunun için aşağıdaki işlemlerin yapılması gerekmektedir. Not: Güvenlik önlemi olarak, merkezi kullanıcı kodları için kullanılan şifrelerin e-liste şifresi olarak kullanılmaması önerilmektedir. Bir kullanıcı öncelikle üye olduğu herhangi bir listeye gönderilmiş bir mesajın sonunda yer alan e-liste web arayüzü bağlantısını kullanarak o e-listenin ayarları ile ilgili değişikliklerin yapılabildiği sayfaya (http://mailman.metu.edu.tr/mailman/listinfo/liste_adi) girmelidir.  Bu sayfanın en alt bölümünde yer alan e-posta adresi bölümüne, bu e-listeye üye olmak için kullandığı e-posta adresini yazarak, _x0093_Listeden çık veya seçeneklerimi düzenle_x0094_ isimli butona tıklamalıdır.  Eğer e-liste şifresi daha önceden girilmiş ise, aşağıdaki şekilde olduğu gibi e-liste üyelik ayarlarının değiştirilebildiği ekran görünecektir. Aksi durumda, e-liste şifresi kullanılarak giriş yapılmalıdır:  Üye olduğu tüm e-listelere yönelik ortak bir şifre tanımlamak isteyen kullanıcı bu sayfada yer alan _x0093_Şifre Değişimi_x0094_ bölümüne mevcut e-liste şifresini veya kullanmak istediği herhangi bir şifreyi yazıp, _x0093_Şifremi Değiştir_x0094_ butonuna _x0093_Global Olarak Değiştir_x0094_ seçeneği seçili olacak şekilde tıklamalıdır.  Bu', 'bir şifreyi yazıp, _x0093_Şifremi Değiştir_x0094_ butonuna _x0093_Global Olarak Değiştir_x0094_ seçeneği seçili olacak şekilde tıklamalıdır.  Bu işlem başarılı bir şekilde gerçekleştirildiği takdirde, ekranda _x0093_Şifre başarıyla değiştirildi._x0094_ şeklinde bir mesaj görüntülenir. Kullanıcı tarafından tanımlanan yeni şifre artık aynı e-posta adresi ile üye olunan mevcut tüm e-listelerde kullanılabilir. Şifre değiştirme işlemi sırasında _x0093_Global Olarak Değiştir_x0094_ seçeneği seçili olmadığı durumda, sadece söz konusu e-listenin şifresi değiştirilmiş olur. ""Global Olarak Değiştir"" seçeneği ile kullanıcının o ana kadar üye olduğu tüm listelerin şifreleri değiştirilir. Bu işlem sonrasında üye olunacak yeni e-listelerde de aynı şifrenin kullanılabilmesi için bu işlemin her üyelikten sonra tekrarlanması gerekir. Bu işlem yapılmadığında yeni üye olunan e-listelerde, üye olurken Mailman tarafından otomatik olarak tanımlanıp kullanıcıya gönderilen şifreler kullanılır.', 'FAQ Question: Bölüm, Birim, Merkez, Laboratuvar, Öğrenci Topluluğu web sayfası nasıl yapılır?', ""Course: HIST305\nDepartment: This course belongs to DEPARTMENT OF HISTORY.\nObjective: The aim of the course is to improve students' reading knowledge of the printed and handwritten texts in the Ottoman language. \nContent:  i. Studies on critical additions of manuscripts and their transcriptions. ii. Information concerning Ottoman archives iii. Studies on newspapers and journals for the period between 1860-1928.  iv. The grammar and spelling of the old Anatolian Turkish v. Historical development of Turkish written in Arabic script with particular emphasis to its last phase. vi. An overview of Hat (manuscript) art.""]","['Student Club Name: RESEARCH AND DEVELOPMENT SOCIETY\nStudent Club Description: The Society aims to carry out the necessary applications and events to increase scientific and technical knowledge, to use creative efforts and such knowledge in new applications conducted on a systematical basis, to disseminate research and development culture and tradition and the concepts of questioning, inventing and producing ideas throughout the country and to help them be adopted by the society. Academic Advisor: Assoc. Prof.Dr. Ulaş Yaman (Department of Mechanical Engineering) Society Room: Department of Mechanical Engineering - F Block \n']","İşte ODTÜ'nün akademik danışmanı: Prof. Dr. Mustafa İlhan.





























































































































































































































































































































































































































































































































































































































































































































































































































































































































































































































































































































































































































































































































































































































































































































































































































































































































































































































































































































































































































































































































































































































































































































































































































































































































































































































































































","ARAŞTIRMA VE GELİŞTİRME DERNEĞİ'nin akademik danışmanı, Makine Mühendisliği Bölümü'nden Doç. Dr. Ulaş Yaman'dır.",0.0,0.0,0.0,0.0,0.8708292190815379
"Assoc. Inst. Figen Işık, JAZZ CLUB'da hangi rolü oynuyor ve kulübün hedefleri nelerdir?","['Student Club Name: JAZZ CLUB\nStudent Club Description: The Club aims to provide jazz music education and a library for students who want to learn how to perform jazz music, to provide a comprehensive archive to jazz music listeners, to contribute to the recognition and listening of jazz music by more people, and to organize courses for students. Academic Advisor: Assoc. Inst. Figen Işık (Department of Industrial Design) Club Room: Club Containers No:8', 'Sports Club Description: ODTÜ Sualtı Topluluğu bir grup ODTÜ öğrencisi ve öğretim görevlisi tarafından 1985 yılında ODTÜ Rektörlüğü bünyesinde Spor Müdürlüğü’ne bağlı bir öğrenci topluluğu olarak kuruldu. ODTÜ SAT’ın kuruluşunda edindiği temel ilke, Türkiye Kıyıları ve iç sularındaki tarihi, kültürel ve doğal değerlerin araştırılması, korunması ve tanıtılmasıdır. Bu kapsamında yapılan çalışmalar arasında temel ve ileri dalış, arama, çıkarma ve ilk yardım eğitimleri vererek topluluk üyelerine bilgi ve beceri kazandırmak; keşif ve inceleme amaçlı çalışmalar için dalıcılar yetiştirmek; kıyılarımız ve iç sularımızdaki ekolojik değerler ( Deniz Çayırları, Deniz Kaplumbağaları, Akdeniz foku gibi), doğal değerler ( sualtı mağaraları, açık deniz kayalıkları ve deniz canlıları sığınakları gibi), kültürel değerler (batıklar, sualtı arkeolojisi, denizcilik tarihi) gibi konularda araştırmalar ve tanıtım amaçlı (yarışmalar, paneller, toplantılar, seminerler gibi) etkinlikler düzenlemek yer almaktadır. Topluluk 1986/1987 yıllarında deniz kaplumbağaları türlerinin üreme kumsalı olan Dalyan’da temel bir araştırma çalışması yürütmüştür. Akdeniz Foku’nu Koruma Projesi de yine o yıllarda ODTÜ Sualtı Topluluğu bünyesinden çıkmış, bugünlere kadar gelmiştir. Çeşme Koyu’nda Osmanlı- Rus Deniz Savaşı’nda batmış bulunan Osmanlı ve Rus Komuta Gemilerinin bulunup tanınması çalışmaları (1988-1990), Antakya kıyılarında yine topluluk tarafından bulunan 1600 yıllık iki batık gemi ve her birinde bulunan', 'Sports Club Name: METU JONGLEURS COMMUNITY\nSports Club Description: The aim of OJT, the only active university juggling group in Turkey, is to add colour to the school environment by performing shows in the school, to give workshops on juggling and flow arts, and to introduce our school and contemporary circus arts to people by performing shows in various organizations.', 'Student Club Name: TURKISH FOLKLORE CLUB\nStudent Club Description: Since its establishment in 1961, the Club has been active without an interruption in four main ways, including folk dances, folk music, folk theater and local research. Among the activities organized are learning and teaching folk dances based on their origins; researching and displaying Orta Oyunu and theatrical village plays; folk music instrument training, notation, compilation and archival studies; researching the folk culture; seminars, panels and symposiums on folk science. The Club, which has more than twenty costumes in its wardrobe, has a rich library of books and magazines published about folk science. Academic Advisor: Assoc. Prof.Dr.Birten Çelik (Department of History) Club Room: THBT Building', 'Student Club Name: TURKISH CLASSICAL MUSIC CLUB\nStudent Club Description: The Club aims to represent the Turkish Classical Music, one of the most important parts of our culture, in a proper way and to organize Turkish Music Days, concerts, student choir workshops and instrument courses (oud, violin, qanun, reed flute, rhythm instrument, tanbur, clarinet) to introduce Turkish Classical Music to large groups including especially METU students, faculty members and personnel. Academic Advisor:\xa0Inst. Esra Eret\xa0(Center for Advancing Learning and Teaching) Club Room: KTMT Building', 'Sports Club Name: ODTÜ DAĞCILIK VE KIŞ SPORLARI KOLU (DKSK)\nSports Club Description: Topluluğumuz tüm doğa sporlarını (dağcılık, kayak, mağaracılık, yürüyüş, kamp, bilimsel ekspedisyon vb.) amatör bir ruhla ve bilimsel yaklaşımla yurt çapında sosyal ilişkiler kurarak sevdirmek ve yaydırmak amacını güder. Kolumuz, insan doğa ilişkilerini, insanın ve doğanın yararı doğrultusunda pekiştirerek tüm olanakları sonuna dek kullanır, amaçlarını sıkı bir örgütlülük ve sosyal bütünlük içinde demokratik bir anlayışla gerçekleştirir. Kol etkinliklerinin amacı, katılan sporcuların tekniğini ve becerisini o etkinliğin gerektirdiği ölçüde arttırmaktadır. Bu amaç doğrultusunda bütün yıl boyunca etkinlik yapar. Etkinliklerini her türlü doğa koşulunda yapmayı, değişik dağların ve değişik mevsimlerin gerektirdiği tekniklerin öğrenilmesi ve kullanılmasını hedefler. Kolumuz yaptığı tüm doğa sporlarını birbirlerini tamamlayan sporlar olarak görür. Kayağı da doğa ile birlikte olmayı sağlayan bir spor olarak kabul eder, kayağın dağcılıkla ve diğer etkinliklerle ilişkili olarak kullanılmasını, teknik yönden güçlü, amatör ruhlu sporcuların yetiştirilmesini ve bu sporcuların üniversite adına amatör kayak yarışmalarına girmesini teşvik eder. Bu amaç doğrultusunda, kolumuz doğada yapılan tüm sporları destekleyen ve bu sporları yapan kulüplerle ilişkiler kurar ve mevcut ilişkilerini sürdürür.', 'Sports Club Name: ODTÜ BRİÇ TOPLULUĞU\nSports Club Description: Kontak briç oynamayı öğrenmek, briç bilgisini geliştirmeyi, ulusal ve uluslararası yarışmalara katılmayı sağlamak topluluğumuzun temel amacıdır.', 'Student Club Name: MUSICAL SOCIETY\nStudent Club Description: The Society is one of the first musical societies in Turkey that perform shows using decor, costume, make-up and accessories. The Society aims to perform introductory, informative and educative activities on musicals, to introduce and attract attention to two main branches of art such as theater and music by sharing samples from musicals with other societies, when necessary, and to train new people for the stage and to organize workshops. However, the most important mission can be explained as follows: The Society also aims to prepare and present almost professional shows with an amateur spirit. Academic Advisor: Instr. Buket Esra Tarakçıoğlu (Department of Modern Languages) Club Room: 9th Dormitory, Ground Floor Website:', 'Sports Club Name: ODTÜ JONGLÖRLER TOPLULUĞU\nSports Club Description: Türkiye’deki tek aktif üniversite jonglörlük topluluğu olan OJT’nin amacı, okul içinde gösteriler yaparak okul ortamına renk katmak, jonglörlük ve flow sanatları hakkında çalıştaylar vermek ve çeşitli organizasyonlarda gösteriler yaparak insanlara okulumuzu ve çağdaş sirk sanatlarını tanıtmaktır.', 'Sports Club Name: ODTÜ AİKİDO TOPLULUĞU\nSports Club Description: Bünyesindeki Çocuk Aikido grubuyla beraber 200’ü aşkın üyesiyle beraber Türkiye’nin en büyük dojosu olan ODTÜ Aikido Topluluğu’nun birçok üyesi her sene yurtiçi ve yurtdışında birçok Aikido seminerine katılmaktadır.\xa0Her ne kadar yakın doğu dövüş sanatı kulüplerinin kadınlar tarafından ilgi çekmediği düşünülse de, ODTÜ Aikido Topluluğu’nun neredeyse yarısı kadınlardan oluşmaktadır. Topluluğun amacı bu yanlış algıyı düzeltmektir ve teknik olarak ileri seviye, ahlaklı sporcular yetiştirmek ile Aikidoyu daha da yaymak ve sevdirmektir. Bundan ayrı olarak Çocuk Aikido grubunda yaptığı çalışmalarla birlikte çocukların fiziksel, sosyal ve psikolojik gelişimini sağlamanın yanında saygı, işbirliği ve uyum ile mesleki başarıyı sağlayan özgüven, sabır ve iç disiplini çocuklara aşılamaktır.\xa0ODTÜ Aikido Topluluğu, Tamura Shihan ve onun öğrencisi Nebi Vural Sensei’nin stili ve prensiplerini takip etmektedir. Her sene Aralık ve Mayıs aylarında iki tane uluslararası seminer düzenlemektir. Avrasya Aikido Organizasyonu ile birlikte, 7 yıldır her Mayıs ayında yaklaşık 20 ülkeden 300 sporcunun katıldığı, Uluslararası Aikido Festivalini düzenlemekte ve etkinliğe ev sahipliği yapmaktadır.']","['Student Club Name: JAZZ CLUB\nStudent Club Description: The Club aims to provide jazz music education and a library for students who want to learn how to perform jazz music, to provide a comprehensive archive to jazz music listeners, to contribute to the recognition and listening of jazz music by more people, and to organize courses for students. Academic Advisor: Assoc. Inst. Figen Işık (Department of Industrial Design) Club Room: Club Containers No:8 \n']"," Assoc. Inst. Figen Işık, JAZZ CLUB'da müzik eğitiminde ve bir kitaplık için öğrenciler için yararlı bir yer oluşturmak amacıyla rol oynuyor. Kulübün hedefleri, jazz müziğinin öğrenimine, bir kitaplık oluşturulmasına ve jazz müziğinin daha fazla insanın tanımına ait olmasına aitdir.","Assoc. Inst. Figen Işık, JAZZ CLUB'un Akademik Danışmanı olarak görev yapmaktadır. Kulüp, caz müziği eğitimi sağlamak ve caz müziği çalmayı öğrenmekle ilgilenen öğrenciler için bir kütüphane oluşturmayı amaçlamaktadır. Ayrıca, caz müziği dinleyicileri için kapsamlı bir arşiv oluşturmayı, caz müziğinin daha geniş bir kitle arasında tanınmasına ve takdir edilmesine katkıda bulunmayı ve öğrenciler için kurslar düzenlemeyi hedeflemektedir.",1.0,0.9999999999,0.67,0.875,0.9368967201861561
What are the main objectives of the ATATURK's THOUGHT CLUB and the IEEE METU STUDENT SOCIETY within the Department of Electrical and Electronics Engineering?,"[""Student Club Name: ATATURK's THOUGHT CLUB\nStudent Club Description: The Club was established to better know and promote Atatürk and his ideology and to be able to interpret Kemalism, a 20th century ideology, based on the changing conditions of this era and to be able to bring new initiatives to this ideology. The Club also aims to examine Atatürk's reforms and principles, the current conclusions and social implications of the reforms and to conduct scientific research on these issues. Academic Advisor:\xa0Dr.Ahmet Cemal Durgun\xa0(Department of Electrical and Electronics Engineering) Club Room: Department of Physics, Ground Floor"", ""Student Club Name: IEEE METU STUDENT SOCIETY\nStudent Club Description: The Society aims to increase the recognition of Electrical-Electronics Engineering, to encourage technological development, to explain the benefits of technology and to raise awareness in society, to increase technology-oriented entrepreneurship, to strengthen university-industry cooperation, to improve the members' professional and social development. Academic Advisor:Assoc. Prof.Dr.\xa0Ayşe Melda Yüksel Turgut (Department of Electrical and Electronics Engineering) Club Room: Dept. of Elect. Elect. Eng. Block A"", 'Century: (1) the impacts of the scientific-technological revolution, (2) the third crisis of capitalism, and its neo-liberal global restructuration (globalization of capitalism) and (3) the capitalist restoration of the etatist-bureauctarictic socialism on the working class movement in the world in general and in Turkey particular.', 'Student Club Name: ECONOMICS SOCIETY\nStudent Club Description: The Society aims to contribute to the development and reproduction of the economy as a social science, to bring together experts who produce ideas in very different fields falling into the sphere of influence of economy, to examine the economic policies in Turkey and to analyze their links with economic institutions around the world. Academic Advisor: Prof. Dr. Erkan Erdil (Department of Economics) Assoc. Prof. Dr. Ebru Voyvoda (Department of Economics) Society Room: FEAS Building A, Ground Floor', 'Student Club Name: AEROSPACE STUDENTS SOCIETY\nStudent Club Description: The Society aims to enable its members to produce projects and to perform activities in technical and social areas in Europe, to promote and attract attention to aviation to young people and to try to represent Turkey and Turkish culture, Ankara, METU and METU Department of Aerospace Engineering in the best way in international organizations. The Society also seeks to contribute to the advancement of the aerospace industry in Turkey, to increase the communication between students and faculty members and industry, and to contribute to the technical, social and personal development of members at the highest level. Academic Advisor: Asst. Prof. Dr.\xa0Görkem Eğemen Güloğlu (Department of Aerospace Engineering) Club Room: Department of Aerospace Engineering', 'Student Club Name: SCIENCE AND FUTURE SOCIETY\nStudent Club Description: The Society aims to teach METU students the social importance of science and technology, to follow the agenda of science and technology, to announce the global developments in coordination with METU members, to help students embody new ideas in a project and to support these projects. Academic Advisor: Instr. Dr.Taner Zorbay (Department of History) Assoc. Prof. Dr. Mehmet Somel (Department of Biology) Society Room: Society Containers No:1', 'Student Club Name: DEBATE CLUB\nStudent Club Description: The Club aims to improve public speech and rhetoric skills of METU students, to introduce debate activities, to work on developing knowledge and skills of members, to contribute to club members, METU students and Turkish debate. The Club also seeks to organize and participate in debate tournaments. Academic Advisor: Assoc. Prof. Dr. Zana Çıtak (Department of International Relations) Club Room: FEAS Building B', 'Student Club Name: SOCIALIST THOUGHT CLUB\nStudent Club Description: The Club aims to discuss social, political and economic events that happen in our country and in the world in the light of scientific socialism and Marxist method, to move them to the university agenda and to produce solution proposals. Academic Advisor: Assoc. Prof.Dr. Pınar Bedirhanoğlu (International Relations Department) Club Room: NA', ""Student Club Name: TECH FOR STARTUP CLUB\nStudent Club Description: Tech for student group is founded at METU road risen from Startup to support the transformation process in Turkey that the developed countries. For this purpose, the club's mission is to strengthen the TEKNOKENT-student cooperation, the startup-student relationship; to develop their members professionally and socially. It has undertaken to count benefits to METU, startups, and students. Our target is to inspire our members continuously and develop ourselves in line with digitalization and technology. Academic Advisor: Assoc.Prof.Dr. Çağlar Sınayuç (Department of Petroleum&Natural Gas Engineering) Club Room: METU Teknokent Kuluçka Merkezi No: 13"", ""Student Club Name: FINE ARTS SOCIETY (FAS)\nStudent Club Description: The Club aims to help the social and cultural development of its members and those who benefit from club's activities through art, to enable them to be trained as researchers and people with creative skills, to work for the introduction and development of fine arts in METU via painting, photography, violin, piano, flute and guitar courses. Academic Advisor: Asst. Prof. Dr. Ekin Pınar (Faculty of Architecture) Club Room: Clubs Container No: 4""]","[""e181f6d6-efaa-47da-891d-0cd5cca877b4\n\nStudent Club Name: ATATURK's THOUGHT CLUB\nStudent Club Description: The Club was established to better know and promote Atatürk and his ideology and to be able to interpret Kemalism, a 20th century ideology, based on the changing conditions of this era and to be able to bring new initiatives to this ideology. The Club also aims to examine Atatürk's reforms and principles, the current conclusions and social implications of the reforms and to conduct scientific research on these issues. Academic Advisor:\xa0Dr.Ahmet Cemal Durgun\xa0(Department of Electrical and Electronics Engineering) Club Room: Department of Physics, Ground Floor \n"", ""f6a8bfd5-b846-4900-8227-97a602032edd\n\nStudent Club Name: IEEE METU STUDENT SOCIETY\nStudent Club Description: The Society aims to increase the recognition of Electrical-Electronics Engineering, to encourage technological development, to explain the benefits of technology and to raise awareness in society, to increase technology-oriented entrepreneurship, to strengthen university-industry cooperation, to improve the members' professional and social development. Academic Advisor:Assoc. Prof.Dr.\xa0Ayşe Melda Yüksel Turgut (Department of Electrical and Electronics Engineering) Club Room: Dept. of Elect. Elect. Eng. Block A \n""]","1. ATATURK's THOUGHT CLUB: The main objectives of this club are to better understand and promote Atatürk and his ideology, to interpret Kemalism, a 20th century ideology, based on the changing conditions of this era, to conduct scientific research on Atatürk's reforms and principles, and to bring new initiatives to this ideology.
        2. IEEE METU STUDENT SOCIETY: The main objectives of this society are to increase the recognition of Electrical-Electronics Engineering, to encourage technological development, to explain the benefits of technology and to raise awareness in society, to increase technology-oriented entrepreneurship, to strengthen university-industry cooperation, and to improve the members' professional and social development.","The ATATURK's THOUGHT CLUB aims to better understand and promote Atatürk and his ideology, interpret Kemalism in the context of contemporary conditions, examine Atatürk's reforms and principles, and conduct scientific research on these issues. The IEEE METU STUDENT SOCIETY focuses on increasing the recognition of Electrical-Electronics Engineering, encouraging technological development, raising societal awareness about technology, promoting technology-oriented entrepreneurship, strengthening university-industry cooperation, and enhancing the professional and social development of its members.",1.0,0.99999999995,0.89,1.0,0.9675937762387579
Sosyal sorumluluk nedir?,"['bir şifreyi yazıp, _x0093_Şifremi Değiştir_x0094_ butonuna _x0093_Global Olarak Değiştir_x0094_ seçeneği seçili olacak şekilde tıklamalıdır.  Bu işlem başarılı bir şekilde gerçekleştirildiği takdirde, ekranda _x0093_Şifre başarıyla değiştirildi._x0094_ şeklinde bir mesaj görüntülenir. Kullanıcı tarafından tanımlanan yeni şifre artık aynı e-posta adresi ile üye olunan mevcut tüm e-listelerde kullanılabilir. Şifre değiştirme işlemi sırasında _x0093_Global Olarak Değiştir_x0094_ seçeneği seçili olmadığı durumda, sadece söz konusu e-listenin şifresi değiştirilmiş olur. ""Global Olarak Değiştir"" seçeneği ile kullanıcının o ana kadar üye olduğu tüm listelerin şifreleri değiştirilir. Bu işlem sonrasında üye olunacak yeni e-listelerde de aynı şifrenin kullanılabilmesi için bu işlemin her üyelikten sonra tekrarlanması gerekir. Bu işlem yapılmadığında yeni üye olunan e-listelerde, üye olurken Mailman tarafından otomatik olarak tanımlanıp kullanıcıya gönderilen şifreler kullanılır.', 'Course: ECON460\nDepartment: This course belongs to DEPARTMENT OF ECONOMICS.\nObjective: The main objective of the course is to increase student knowledge and understanding of the Turkish economy.The history of the Tukish economy is analyzed and evaluated critically. In this way it is possible to understand the current developments in the economy.\xa0 \nContent:  Overall structure of the economy; sources and use of income; economy of government; main sectors; agriculture, industry, services; income distribution; regional dispersion of economic activities.', 'FAQ Question: Bölüm, Birim, Merkez, Laboratuvar, Öğrenci Topluluğu web sayfası nasıl yapılır?', 'Sports Club Description: ODTÜ Sualtı Topluluğu bir grup ODTÜ öğrencisi ve öğretim görevlisi tarafından 1985 yılında ODTÜ Rektörlüğü bünyesinde Spor Müdürlüğü’ne bağlı bir öğrenci topluluğu olarak kuruldu. ODTÜ SAT’ın kuruluşunda edindiği temel ilke, Türkiye Kıyıları ve iç sularındaki tarihi, kültürel ve doğal değerlerin araştırılması, korunması ve tanıtılmasıdır. Bu kapsamında yapılan çalışmalar arasında temel ve ileri dalış, arama, çıkarma ve ilk yardım eğitimleri vererek topluluk üyelerine bilgi ve beceri kazandırmak; keşif ve inceleme amaçlı çalışmalar için dalıcılar yetiştirmek; kıyılarımız ve iç sularımızdaki ekolojik değerler ( Deniz Çayırları, Deniz Kaplumbağaları, Akdeniz foku gibi), doğal değerler ( sualtı mağaraları, açık deniz kayalıkları ve deniz canlıları sığınakları gibi), kültürel değerler (batıklar, sualtı arkeolojisi, denizcilik tarihi) gibi konularda araştırmalar ve tanıtım amaçlı (yarışmalar, paneller, toplantılar, seminerler gibi) etkinlikler düzenlemek yer almaktadır. Topluluk 1986/1987 yıllarında deniz kaplumbağaları türlerinin üreme kumsalı olan Dalyan’da temel bir araştırma çalışması yürütmüştür. Akdeniz Foku’nu Koruma Projesi de yine o yıllarda ODTÜ Sualtı Topluluğu bünyesinden çıkmış, bugünlere kadar gelmiştir. Çeşme Koyu’nda Osmanlı- Rus Deniz Savaşı’nda batmış bulunan Osmanlı ve Rus Komuta Gemilerinin bulunup tanınması çalışmaları (1988-1990), Antakya kıyılarında yine topluluk tarafından bulunan 1600 yıllık iki batık gemi ve her birinde bulunan', 'bulunup tanınması çalışmaları (1988-1990), Antakya kıyılarında yine topluluk tarafından bulunan 1600 yıllık iki batık gemi ve her birinde bulunan cam külçeler (1992/1993) ODTÜ Sualtı Topluluğu’nun Arkeoloji bilimine yaptığı katkıların ilkleridir. Bunlara ek olarak topluluğun 1992 yılında ilk kez Bozcaada’da düzenlediği “Sualtında Görüntü Avlama Yarışması” SAGAY, Türkiye’de düzenlenen ilk sualtı fotoğraf yarışması olmasının yanı sıra, Zıpkınla Balık Avcılığı Yerine Fotoğraf Makinesiyle Görüntü Avcılığı gibi anlamlı bir seçeneği sunarak Kuzey Ege’de “deniz parkları” kurulmasını ve işlemesini sağlamayı amaç edinmiştir. Son zamanlarda topluluk Türkiye Kıyıları Deniz Mağaraları Envanter Projesi, Kilikya Bölgesi Arkeolojik Yüzey Araştırması, Deniz Çayırlarının Yayılımının İncelenmesi, Uluburun III Yapay Resif Projesi, Serbest Dalış Denemeleri gibi önemli projeleri yürütmektedir. ODTÜ Sualtı Topluluğu Rektörlük makamına karşı sorumludur. Akademik Danışman ve beş öğrenciden oluşan yürütme kurulu, üç öğrenciden oluşan denetleme kurulu işleyişi sağlamakla görevlidir. Yürütme Kurulu ve Denetleme Kurulu Genel Kurula karşı sorumludur. Topluluğun Akdeniz Foku Araştırma Grubu (AFAG), Batık Araştırma Grubu (BAG), Ekoloji Grubu (EKOG), Fotografi ve Videografi Grubu (FOVAG), Mağara Dalışı ve Araştırma Grubu (MADAG) ve Serbest Dalış Grubu (SDG) gibi alt grupları ile çeşitli çalışma birimleri vardır.', 'FAQ Answer:   Eğer söz konusu liste ""tek yönlü duyuru listesi"" ise, liste yapılandırması gereği e-posta gönderme yetkisine sahip kişiler haricinde hiç bir kullanıcı mesaj gönderememektedir. Ancak üyelerin e-posta gönderebildiği bir liste söz konusu ise, gönderdiginiz mesajlarin listeye ulaşmamasının iki temel sebebi vardır: Listeye üyelik için kullanmadığıniz bir e-posta adresinden mesaj gönderiyor olabilirsiniz. Genelde birden fazla e-posta adresi kullanıyorsanız ve üye olan adresten farklı bir adrese yönlendirme tanımladıysanız, liste mesajlarini aldığınız e-posta adresi ile üyelik için kullandığınız e-posta adresi farklı olabilir. Mesajları aldığınız e-posta adresinin listeye üye olarak kayıtlı olup olmadığını kontrol etmesi için abc-l-ownermetu.edu.tr adresinden liste yöneticisiyle iletişime geçiniz. Listeye üyelik için kullandığınız e-posta adresinden mesaj gönderiyorsanız mesajiniz onay bekliyor olabilir. Mesajinızın onay için bekletiliyor olmasının olası sebepleri aşağıda listelenmiştir: Gönderdiğiniz mesaj liste mesaj kotasını aşan bir büyüklüğe sahip olabilir (örneğin; çok büyük bir dosya eklentisi gönderiyor olabilirsiniz). Mesajınızın alıcı adresi bölümünde liste adıyla beraber çok sayıda e-posta adresini yazmış olabilirsiniz. Mesajiniz liste ayarları gereği moderatör onayı için bekletiliyor olabilir. Tüm bu olası sebeplerle ilgili olarak abc-l-ownermetu.edu.tr adresinden liste yöneticisi ile iletişime geçebilir, detaylı bilgi alabilirsiniz.  (Yukarıda geçen', 'ürettiği log dosyasının örneği aşağıda verilmiştir. Tutulan log bilgisinde, bağlantı yapan bilgisayarın adresi, hedef dosya ve kullanıcı adı bilgileri bulunmalıdır. Tue Mar 25 16:39:48 2008 0 bogus.com 528 /ftp/pub/IMPORTANT-WARNING.txt b _ o r anonim ftp 1 * c  Yukarıdaki örnekte yer alan bilgi alanları, kanunda belirtilen başlıklarla aşağıdaki şekilde ilişkilendirilmiştir: Bağlantı tarih-saat bilgisi: ""Tue Mar 25 16:39:48 2008""  Kaynak Adres: ""bogus.com""  İstenen dosya: ""ftp/pub/IMPORTANT-WARNING.txt""  Kullanıcı adı: ""anonim""  Birimler, yer sağlayıcı faaliyetleri kapsamında verdikleri servislerin ürettiği logları inceleyip, sahip oldukları sistemlerde verdikleri servislerin yarattığı trafik loglarını yönetmelikte tarif edildiği şekilde (zaman damgası ile birlikte) kayıt altına almak, bu logları, gizliliğini sağlayarak arşivlemekle yükümlüdür.', 'Course: HIST317\nDepartment: This course belongs to DEPARTMENT OF HISTORY.\nObjective: No objective\nContent:  I. Main trends of socio-political thoughts in Turkey during the late-19th and early 20th centuries: A.Ýslamism: i. Radical Ýslamists ii. Moderate islamists B. Turkism: C.  Westernism or Modernism: II. A comparative analysis of  these trends of thoughts and those governing the Turkish Revolution.', 'ODTÜ’nün değil Türkiye’nin değerli bir yarışması haline gelen bu organizasyona her sene 20 farklı ülkeden 400’ü aşkın sporcu ve 5000 dans severi ağırlamaktadır. Uluslararası platformlarda da övgüler almaya devam eden ve 16.sını 4-5 Kasım 2017 tarihlerinde gerçekleştireceğimiz METU OPEN son 3 senedir tüm Uluslararası Yarışmalar arasında ilk 10’da yer almaktadır.', 'ayarları ISO-8859-9 (Türkçe ISO olarak da tanımlanır) ya da UTF-8 seçmeniz yeterlidir. Size gelen e-postalardaki Türkçe karakterleri görmekte sorun yaşıyorsanız iki farklı durum sözkonusu olabilir. Karşı taraf e-posta gönderirken ya da kendisine gelen e-postayı yönlerken Türkçe karakterleri desteklemeyen bir karakter seti kullanmıştır. Bu durumda gelen mesaj düzgün olarak görüntülenemez. Örneğin metinde Türkçe karakter kullanıldığı halde gönderilirken ISO-8859-1 karakter seti kullanılmış ise söz konusu karakter seti Türkçe karakterleri desteklemediği için e-postanın düzgün olarak görüntülenmesi mümkün değildir. Gönderilen e-posta düzgün karakter seti ile gönderilmiş olmasına karşın kullandığınız programın ayarları farklı olabilir. Bu durumda kullanılan programın ayarlarının değiştirilmesi mesajın düzgün şekilde okunmasını sağlayacaktır. Horde ya da Squirrelmail kullanarak e-posta okuyan kullanıcılarımızın kullandıkları tarayıcı programında, Outlook Express, Thunderbird ya da Windows Mail benzeri herhangi bir POP3/IMAP istemcisi ile e-posta gönderen kullanıcılarımızın ise ilgili programdaki karakter seti ayarlarını değiştirmeleri gerekmektedir. Gelen e-postalar için karakter seti değişikliği yapmak için farklı programlarda izlenen yol aşağıdaki gibidir (aşağıda yer almayan farklı programlar için de karakter seti ayarları benzer yerlerdedir): Internet Explorer, Outlook Express ve Windows Mail için: View → Encoding (Görünüm → Kodlama) Mozilla Firefox ve Mozilla Thunderbird']",['Sports Club Name: ODTÜ İZCİLİK TOPLULUĞU\nSports Club Description: Topluluğumuz kurulduğu 1986 yılından itibaren dünya çapında her yaştan gönüllüsü bulunan bir gençlik hareketi olan izciliğin üniversitemizde de mümkün olan en çok sayıda kişiye ulaşması için çalışmaktadır. Üyelerimizin izcilik bilincinde kendilerine ve topluma faydalı bireyler olarak yetişmesi önceliklerimiz arasındadır. Bu amaçlar doğrultusunda sene boyunca aktif olarak etkinlikler ve kamplar düzenleriz. Eğitim programımızı tamamlamış olan üyelerimiz doğada yaşam ve kamp yapma alanlarında donanımlı hale gelmiş olurlar. Sosyal sorumluluk projelerimizle de hem üyelerimizi hem üniversite bünyesinde ulaşabildiğimiz herkesi bilinçlendirmek te amaçlarımız arasındadır.\n'],"İşte sosyal sorumluluk, birçok insanın, yararlı işlerin yapılmasına, yanlışların önlenmesine, ve çoklu kültürel, sosyal ve ekonomik çözümleri elde edebileceği bir yapıdır. Bu yapı, birçok insanın, birbirinden bağlantılarına dayanıp, çoklu kültürel, sosyal ve ekonomik problemleri ele alarak, çözümler elde edebileceği bir yapıdır. Sosyal sorumluluk, genel olarak, birçok insanın, birbirinden bağlantılarına dayanıp, çoklu kültürel, sosyal ve ekonomik problemleri ele alarak, çözümler elde edebileceği bir yapıdır.

        Örnek:
        Sosyal sorumluluk, örneğin, bir çevre problemiyle mücadele eden bir toplulukun, birbirinden bağlantılarına dayanıp, bu problemi ele alarak, çözümler elde edebileceği bir yapıdır.

        Bu yapı, birçok insanın, birbirinden bağlantılarına dayanıp, çoklu kültürel, sosyal ve ekonomik problemleri ele alarak, çözümler elde edebileceği bir yapıdır. Sosyal sorumluluk, genel olarak, birçok insanın, birbirinden bağlantılarına dayanıp, çoklu kültürel, sosyal ve ekonomik problemleri ele alarak, çözümler elde edebileceği bir yapıdır.

        Bu yapı, birçok insanın, birbirinden bağlantılarına dayanıp, çoklu kültürel, sosyal ve ekonomik problemleri ele alarak, çözümler elde edebileceği bir yapıdır. Sosyal sorumluluk, genel olarak, birçok insanın, birbirinden bağlantılarına dayanıp, çoklu kültürel, sosyal ve ekonomik problemleri ele alarak, çözümler elde edebileceği bir yapıdır.

        Bu yapı, birçok insanın, birbirinden bağlantılarına dayanıp, çoklu kültürel, sosyal ve ekonomik problemleri ele alarak, çözümler elde edebileceği bir yapıdır. Sosyal sorumluluk, genel olarak, birçok insanın, birbirinden bağlantılarına dayanıp, çoklu kültürel, sosyal ve ekonomik problemleri ele alarak, çözümler elde edebileceği bir yapıdır.

        Bu yapı, birçok insanın, birbirinden bağlantılarına dayanıp, çoklu kültürel, sosyal ve ekonomik problemleri ele alarak, çözümler elde edebileceği bir yapıdır. Sosyal sorumluluk, genel olarak, birçok insanın, birbirinden bağlantılarına dayanıp, çoklu kültürel, sosyal ve ekonomik problemleri ele alarak, çözümler elde edebileceği bir yapıdır.

        Bu yapı, birçok insanın, birbirinden bağlantılarına dayanıp, çoklu kültürel, sosyal ve ekonomik problemleri ele alarak, çözümler elde edebileceği bir yapıdır. Sosyal sorumluluk, genel olarak, birçok insanın, birbirinden bağlantılarına dayanıp, çoklu kültürel, sosyal ve ekonomik problemleri ele alarak, çözümler elde edebileceği bir yapıdır.

        Bu yapı, birçok insanın, birbirinden bağlantılarına dayanıp, çoklu kültürel, sosyal ve ekonomik problemleri ele alarak, çözümler elde edebileceği bir yapıdır. Sosyal sorumluluk, genel olarak, birçok insanın, birbirinden bağlantılarına dayanıp, çoklu kültürel, sosyal ve ekonomik problemleri ele alarak, çözümler elde edebileceği bir yapıdır.

        Bu yapı, birçok insanın, birbirinden bağlantılarına dayanıp, çoklu kültürel, sosyal ve ekonomik problemleri ele alarak, çözümler elde edebileceği bir yapıdır. Sosyal sorumluluk, genel olarak, birçok insanın, birbirinden bağlantılarına dayanıp, çoklu kültürel, sosyal ve ekonomik problemleri ele alarak, çözümler elde edebileceği bir yapıdır.

        Bu yapı, birçok insanın, birbirinden bağlantılarına dayanıp, çoklu kültürel, sosyal ve ekonomik problemleri ele alarak, çözümler elde edebileceği bir yapıdır. Sosyal sorumluluk, genel olarak, birçok insanın, birbirinden bağlantılarına dayanıp, çoklu kültürel, sosyal ve ekonomik problemleri ele alarak, çözümler elde edebileceği bir yapıdır.

        Bu yapı, birçok insanın, birbirinden bağlantılarına dayanıp, çoklu kültürel, sosyal ve ekonomik problemleri ele alarak, çözümler elde edebileceği bir yapıdır. Sosyal sorumluluk, genel olarak, birçok insanın, birbirinden bağlantılarına dayanıp, çoklu kültürel, sosyal ve ekonomik problemleri ele alarak, çözümler elde edebileceği bir yapıdır.

        Bu yapı, birçok insanın, birbirinden bağlantılarına dayanıp, çoklu kültürel, sosyal ve ekonomik problemleri ele alarak, çözümler elde edebileceği bir yapıdır. Sosyal sorumluluk, genel olarak, birçok insanın, birbirinden bağlantılarına dayanıp, çoklu kültürel, sosyal ve ekonomik problemleri ele alarak, çözümler elde edebileceği bir yapıdır.

        Bu yapı, birçok insanın, birbirinden bağlantılarına dayanıp, çoklu kültürel, sosyal ve ekonomik problemleri ele alarak, çözümler elde edebileceği bir yapıdır. Sosyal sorumluluk, genel olarak, birçok insanın, birbirinden bağlantılarına dayanıp, çoklu kültürel, sosyal ve ekonomik problemleri ele alarak, çözümler elde edebileceği bir yapıdır.

        Bu yapı, birçok insanın, birbirinden bağlantılarına dayanıp, çoklu kültürel, sosyal ve ekonomik problemleri ele alarak, çözümler elde edebileceği bir yapıdır. Sosyal sorumluluk, genel olarak, birçok insanın, birbirinden bağlantılarına dayanıp, çoklu kültürel, sosyal ve ekonomik problemleri ele alarak, çözümler elde edebileceği bir yapıdır.

        Bu yapı, birçok insanın, birbirinden bağlantılarına dayanıp, çoklu kültürel, sosyal ve ekonomik problemleri ele alarak, çözümler elde edebileceği bir yapıdır. Sosyal sorumluluk, genel olarak, birçok insanın, birbirinden bağlantılarına dayanıp, çoklu kültürel, sosyal ve ekonomik problemleri ele alarak, çözümler elde edebileceği bir yapıdır.

        Bu yapı, birçok insanın, birbirinden bağlantılarına dayanıp, çoklu kültürel, sosyal ve ekonomik problemleri ele alarak, çözümler elde edebileceği bir yapıdır. Sosyal sorumluluk, genel olarak, birçok insanın, birbirinden bağlantılarına dayanıp, çoklu kültürel, sosyal ve ekonomik problemleri ele alarak, çözümler elde edebileceği bir yapıdır.

        Bu yapı, birçok insanın, birbirinden bağlantılarına dayanıp, çoklu kültürel, sosyal ve ekonomik problemleri ele alarak, çözümler elde edebileceği bir yapıdır. Sosyal sorumluluk, genel olarak, birçok insanın, birbirinden bağlantılarına dayanıp, çoklu kültürel, sosyal ve ekonomik problemleri ele alarak, çözümler elde edebileceği bir yapıdır.

        Bu yapı, birçok insanın, birbirinden bağlantılarına dayanıp, çoklu kültürel,",Sosyal sorumluluk projelerimizle de hem üyelerimizi hem üniversite bünyesinde ulaşabildiğimiz herkesi bilinçlendirmek de amaçlarımız arasındadır.,0.0,0.0,0.0,0.0,0.8325365680101935
What are the key objectives and content focus of the ARCH302 and ARCH402 courses in the Department of Architecture?,"['Course: ARCH402\nDepartment: This course belongs to DEPARTMENT OF ARCHITECTURE.\nObjective: The students are expected to make an original contribution to a specified design assignment by adopting multiple approaches to complex architectural and urban design concerns. Students are encouraged to develop a personal position and an increasing autonomy in design work. Demonstration of a high level of creativity and critical skills is necessary in situating and negotiating significantly complex architectural and urban programs at all scales in national and/or international contexts.\xa0 \nContent:  Advanced architectural design involving considerations of contextual and programmatic complexity and appropriate technology.', 'Course: ARCH301\nDepartment: This course belongs to DEPARTMENT OF ARCHITECTURE.\nObjective: The following objectives are common to Arch 301 and 302 studios.\xa0Subjects include:\xa0Arch 301:\xa0Design of new buildings in historical environments, in relation to preserved urban fabrics and monuments. Arch 302:\xa0 Housing schemes and innovative structures, with interventions in their urban contexts.\xa0(The sequence may change in sections.)  Building up of culture and repertoire for the analysis and design of housing with mixed-use schemes, innovative structures and multifunctional public buildings. Improvement of skills in architectural planning and presentation techniques; advanced proficiency in oral, visual and written mediums for communication of design ideas. Awareness development for the cultural heritage and sites of natural and historical significance; acquaintance with the legal and ethical aspects of working in such contexts.\xa0  \nContent:  Design  of buildings  in  relation  to their particularly historical urban context is emphasized. Issues of settlement-dwelling relationships, buildings of functional complexity and spatial variety and architectonic interpretations of structural systems are analysed and designed.', 'Course: ARCH252\nDepartment: This course belongs to DEPARTMENT OF ARCHITECTURE.\nObjective: By the end of the course, students are expected:-  to recognize the advancements in the fields of construction technologies that have strong relationship with the building materials technology and architectural detailing; to establish background on the types of construction systems where various key components (walls, floors and ceilings) come together as joints and/or interfaces and establish the structure from basement to roof; to distinguish the functional performances of various foundation, wall, slab, roof construction systems establishing the overall structure depending on the materials and construction techniques selected; to be familiar with the commonly used building materials, new/alternative ones and common problems of today’s construction field together with their possible solutions, to identify the fundamentals of construction detailing for essential and some typical building components and interfaces.', 'Course: ARCH390\nDepartment: This course belongs to DEPARTMENT OF ARCHITECTURE.\nObjective:  The Arch 390 summer practice \xa0aims at introducing students of architecture to the milieu in an architectural office, observing and participating in project development, relations of projects and implementation and various office procedures. Students acquire the basic hands-on experience on how an office works from the initial sketches to the working drawings of a building. Division of labor in the development of projects, interaction with other engineering disciplines, different model making and drawing tools / methods and content of information in these documents, procedures related to the legal aspects are amongst the issues to be covered during the Arch 390 summer practice. \xa0 \nContent:  Aims:', 'Course: ARCH325\nDepartment: This course belongs to DEPARTMENT OF ARCHITECTURE.\nObjective: This course provides:  an awareness of the geographical, historical, social, cultural and architectural values, comprehension of the relation between the built environment, material culture, and daily life,\xa0 an understanding of the ways of representing landscapes, built environments, and daily life.  \nContent:  A course largely based on direct experience of built works of architecture and architectural sites in Turkey or abroad, facilitated by field studies or design workshops to be conducted by staff. Due to time to be spent far from school premises, programs for the course are offered in the Summer School, or travel periods are organized in summer or winter vacations. Expenses for travels are met by students themselves, with partial support for those held in Turkey.', ""Course: ARCH460\nDepartment: This course belongs to DEPARTMENT OF ARCHITECTURE.\nObjective: This elective course is offered to Final year Architecture students who would like to design high performance buildings with low environmental impacts. The aim is to use digital tools to aid building\xa0 design that can: - Increase human comfort by using appropriate technologies - Reduce a building's energy load by selecting appropriate building materials. - Reduce the\xa0environmental loads of a building by integrating appropriate energy resources \nContent:  The course objectives are to introduce students to a world-wide range of architectural concepts, focusing on appropriate and affordable solutions, in terms of choice of materials and technologies, to the extensive needs of the underdeveloped, developing and developed world.  The relevance of appropriate technology in certain current global issues, such as sustainability and ecological concerns, will be considered."", 'Course: ARCH202\nDepartment: This course belongs to DEPARTMENT OF ARCHITECTURE.\nObjective: Arch 202 aims to develop and apply architectural design competences focusing on the integration of program, site, and architectural expression in relation to spatial organization, formal composition and tectonic qualities. The course acquaints students with fundamental design values and concepts within the interactive learning environment of studio culture. It encourages them to produce innovative and experimental spaces as contemporary and sustainable solutions to the assigned design problems.\xa0 \xa0 \xa0 \nContent:  Studies for the identification of the elements of architectural design and the development  of  a sensitivity  and  awareness required for valid interpretations.', 'Course: ARCH418\nDepartment: This course belongs to DEPARTMENT OF ARCHITECTURE.\nObjective: The students are expected to understand cultural and positional differences between and across different forms of architectural criticism.\xa0 The students are expected to develop a critical consciousness towards contemporary physical context as well as cultural, political, social and historical determinants of architectural medium. The students will gain an ability to develop comparative analysis and realize a critical presentation with reference to different contextual properties of built environment in different scales. \nContent:  A critical survey of selected themes, concepts, buildings and architects concerning contemporary architecture. Students are encouraged to take an active role and engage in architectural criticism/activities.', 'Course: ARCH203\nDepartment: This course belongs to DEPARTMENT OF ARCHITECTURE.\nObjective: The main objectives of this course are:  to provide the knowledge and skills necessary for the representation and communication of architectural design using the digital media, to provide the basic principles, tools and methods of graphic design, two dimensional drafting\xa0 and three dimensional modeling via lectures and hands-on exercises using digital tools, to the knowledge and skills necessary for surface modeling, to provide the knowledge and skills necessary for building information modeling,  \nContent:  Representation and communication of architectural design using the digital media, \tthe basic principles, tools and methods of graphic design, two dimensional drafting and three dimensional modeling using digital tools, the concepts of surface modeling and building information modelling', 'Course: ARCH415\nDepartment: This course belongs to DEPARTMENT OF ARCHITECTURE.\nObjective: The course aims to acquaint students with urban design within a discourse of sustainability. As residential areas constitute the major percentage of land coverage in urban areas, their design becomes a critical issue in terms of economic resources, ecological constraints; and above all, the possibility of the social construction of space (social sustainability) needs to be studied with expectations of achieving better communities for confronting urban life. Urban design is expected to facilitate a holistic design of the environment in lieu of acclaimed restraints, rather than the “green design” of the single building, which has invaded the scene in terms of sustainability. Case studies \xa0surface issues for further delibration in terms of urban sustainability. \nContent:  Studies the techniques of site planning in four parts. Starts with an analysis of the main physical site elements, continues with the analysis, relation and location of activities on a site. Alternative choices for vehicular and pedestrian circulation systems are studied in the third section. The architectural design elements of site design, criteria for the evaluation of good site design, and practical know-how on site design constitute the fourth section.']","['903c8203-e4b5-4a8d-b9db-38b2cc9aa07d\n\nCourse: ARCH302\nDepartment: This course belongs to DEPARTMENT OF ARCHITECTURE.\nObjective: \xa0 The following objectives are common to Arch 301 and 302 studios, which can be given in either of the terms (depending on the organization of studio trips). Acquisition of knowledge, attitudes and skills (*) required to carry out a design project with increased complexity of program, structural system and contextual issues. Specifically:  (Knowledge) Building up of culture and repertoire for the analysis and design of housing with mixed-use schemes, innovative structures and multifunctional public buildings.   (Skills) Improvement of skills in architectural planning, construction and presentation techniques; advanced proficiency in oral, visual and written mediums for communication of design ideas. (Attitudes) Awareness development for the cultural heritage and sites of natural and historical significance; acquaintance with the legal and ethical aspects of working in such contexts.\xa0  \nContent:  Analysis and design of buildings in relation to their urban context and structural form. Term projects include housing settlements, new buildings in historical environments and large span structures, with emphases on programmatic complexity, spatial variety and architectonic expression. ', 'c01018df-5744-4580-ae0a-4082bd0b6749\n\nCourse: ARCH402\nDepartment: This course belongs to DEPARTMENT OF ARCHITECTURE.\nObjective: The students are expected to make an original contribution to a specified design assignment by adopting multiple approaches to complex architectural and urban design concerns. Students are encouraged to develop a personal position and an increasing autonomy in design work. Demonstration of a high level of creativity and critical skills is necessary in situating and negotiating significantly complex architectural and urban programs at all scales in national and/or international contexts.\xa0 \nContent:  Advanced architectural design involving considerations of contextual and programmatic complexity and appropriate technology. ']","ARCH302 and ARCH402 are advanced architectural design courses in the Department of Architecture.

        ARCH302 focuses on the analysis and design of buildings in relation to their urban context and structural form. Term projects include housing settlements, new buildings in historical environments, and large span structures, with emphases on programmatic complexity, spatial variety, and architectonic expression.

        ARCH402, on the other hand, expects students to make an original contribution to a specified design assignment by adopting multiple approaches to complex architectural and urban design concerns. Students are encouraged to develop a personal position and an increasing autonomy in design work, demonstrating a high level of creativity and critical skills in situating and negotiating significantly complex architectural and urban programs at all scales in national and/or international contexts.","The ARCH302 course aims to equip students with the knowledge, attitudes, and skills necessary for complex design projects, focusing on the analysis and design of housing with mixed-use schemes, innovative structures, and multifunctional public buildings. It emphasizes architectural planning, construction, and presentation techniques, while fostering awareness of cultural heritage and legal aspects in historical contexts. The content includes projects related to housing settlements, new buildings in historical environments, and large span structures, highlighting programmatic complexity and spatial variety.

In contrast, the ARCH402 course encourages students to make original contributions to design assignments by exploring multiple approaches to complex architectural and urban design issues. It promotes the development of a personal design position and autonomy, requiring high levels of creativity and critical skills to address complex programs at various scales in both national and international contexts. The content focuses on advanced architectural design, considering contextual and programmatic complexity along with appropriate technology.",0.8333333333333334,0.99999999995,0.73,0.68,0.9628015627513162
"ARCH460 ve ARCH490 dersleri, kültürel miras alanlarını korurken modern çevresel kaygıları da ele almada nasıl yardımcı olabilir ve benim gibi kültürel mirası korumaya odaklanmış birisi için faydalı olabilecek hangi özel beceri veya bilgileri sağlar?","['bulunup tanınması çalışmaları (1988-1990), Antakya kıyılarında yine topluluk tarafından bulunan 1600 yıllık iki batık gemi ve her birinde bulunan cam külçeler (1992/1993) ODTÜ Sualtı Topluluğu’nun Arkeoloji bilimine yaptığı katkıların ilkleridir. Bunlara ek olarak topluluğun 1992 yılında ilk kez Bozcaada’da düzenlediği “Sualtında Görüntü Avlama Yarışması” SAGAY, Türkiye’de düzenlenen ilk sualtı fotoğraf yarışması olmasının yanı sıra, Zıpkınla Balık Avcılığı Yerine Fotoğraf Makinesiyle Görüntü Avcılığı gibi anlamlı bir seçeneği sunarak Kuzey Ege’de “deniz parkları” kurulmasını ve işlemesini sağlamayı amaç edinmiştir. Son zamanlarda topluluk Türkiye Kıyıları Deniz Mağaraları Envanter Projesi, Kilikya Bölgesi Arkeolojik Yüzey Araştırması, Deniz Çayırlarının Yayılımının İncelenmesi, Uluburun III Yapay Resif Projesi, Serbest Dalış Denemeleri gibi önemli projeleri yürütmektedir. ODTÜ Sualtı Topluluğu Rektörlük makamına karşı sorumludur. Akademik Danışman ve beş öğrenciden oluşan yürütme kurulu, üç öğrenciden oluşan denetleme kurulu işleyişi sağlamakla görevlidir. Yürütme Kurulu ve Denetleme Kurulu Genel Kurula karşı sorumludur. Topluluğun Akdeniz Foku Araştırma Grubu (AFAG), Batık Araştırma Grubu (BAG), Ekoloji Grubu (EKOG), Fotografi ve Videografi Grubu (FOVAG), Mağara Dalışı ve Araştırma Grubu (MADAG) ve Serbest Dalış Grubu (SDG) gibi alt grupları ile çeşitli çalışma birimleri vardır.', 'FAQ Answer:   Liste yönetim şifresini edinmek için listenin yöneticisi olarak kullandığınız e-posta adresinden mailman@metu.edu.tr adresine\xa0yöneticisi olduğunuz listenin adı ve\xa0telefon numarası bilginizi vererek\xa0şifre isteğinizi bildiren bir e-posta gönderiniz. E-Liste servis yöneticisi talebiniz üzerine gerekli incelemeleri gerçekleştirecek, talebin uygun görülmesi durumunda sizinle telefon aracılığıyla iletişime geçecektir. E-Liste yöneticiliğinde bir değişiklik söz konusu olduğunda, önceki e-liste yöneticisi yeni liste yöneticisinin e-posta adresini listenin yönetim arayüzü üzerinde yönetici olarak tanımlamalı ve yönetim şifresini yeni yöneticiye teslim etmelidir. Ancak, liste yöneticisinin yeni yöneticiyi tanımlamadan ve şifreyi aktarmadan görevden ayrılması gibi durumlarda, farklı bir kişinin liste yöneticisi olarak tanımlanmasına BİDB tarafından destek verilebilmektedir. Böyle bir durum söz konusu ise, ilgili listenin yeni yöneticisi olacak kişinin konuyla ilgili talebini ""metu.edu.tr"" uzantılı e-posta adresini kullanarak mailmanmetu.edu.tr adresine iletmesi gerekmektedir. Söz konusu liste üniversitedeki bir birime ait ise, bu talep ilgili birimin yöneticisi tarafından iletilmelidir. Talebin BİDB\'na ulaşmasının ardından, talep sahibi ile iletisime geçilerek gerekli işlemler gerçekleştirilecektir. (Yukarıda geçen ""abc-l"" ifadesi liste ismi için örnek olarak verilmiştir.)', 'Content:  The course intends to outline administrative structure of the Ottoman Empire and concentrates on the Tanzimat Reforms, the intellectual discussions of the time; the Ottomanism, Islamism and Turkism. The collapse of the Ottoman Empire and the establishment of the nation states in the place of the Ottoman Empire are discussed. The double revolution; the National Liberation Movement of 1919-1923 and the establishment of republican regime, the Izmir economic Congress and the following economic policies of the republican regime are looked through. Intellectuals of the time, such as Ziya Gökalp, Yusuf Akçura, Ahmet Aðaoðlu, Ahmet Hamdi Baþar and the Kadro Movement, and their arguments regarding economic development policies as well as nationalism, are included among the topics. As to the foreign policy of the republican regime, the territorial settlements of the period from 1919 to 1923, the Mosul Question, the straits Question, the foreign policy approach of the republican regime, with particular references to the Balkan Pact of 1934 and the Sadabad Pact of 1937, are examined.', 'ayarları ISO-8859-9 (Türkçe ISO olarak da tanımlanır) ya da UTF-8 seçmeniz yeterlidir. Size gelen e-postalardaki Türkçe karakterleri görmekte sorun yaşıyorsanız iki farklı durum sözkonusu olabilir. Karşı taraf e-posta gönderirken ya da kendisine gelen e-postayı yönlerken Türkçe karakterleri desteklemeyen bir karakter seti kullanmıştır. Bu durumda gelen mesaj düzgün olarak görüntülenemez. Örneğin metinde Türkçe karakter kullanıldığı halde gönderilirken ISO-8859-1 karakter seti kullanılmış ise söz konusu karakter seti Türkçe karakterleri desteklemediği için e-postanın düzgün olarak görüntülenmesi mümkün değildir. Gönderilen e-posta düzgün karakter seti ile gönderilmiş olmasına karşın kullandığınız programın ayarları farklı olabilir. Bu durumda kullanılan programın ayarlarının değiştirilmesi mesajın düzgün şekilde okunmasını sağlayacaktır. Horde ya da Squirrelmail kullanarak e-posta okuyan kullanıcılarımızın kullandıkları tarayıcı programında, Outlook Express, Thunderbird ya da Windows Mail benzeri herhangi bir POP3/IMAP istemcisi ile e-posta gönderen kullanıcılarımızın ise ilgili programdaki karakter seti ayarlarını değiştirmeleri gerekmektedir. Gelen e-postalar için karakter seti değişikliği yapmak için farklı programlarda izlenen yol aşağıdaki gibidir (aşağıda yer almayan farklı programlar için de karakter seti ayarları benzer yerlerdedir): Internet Explorer, Outlook Express ve Windows Mail için: View → Encoding (Görünüm → Kodlama) Mozilla Firefox ve Mozilla Thunderbird', 'FAQ Question: Bölüm, Birim, Merkez, Laboratuvar, Öğrenci Topluluğu web sayfası nasıl yapılır?', 'ürettiği log dosyasının örneği aşağıda verilmiştir. Tutulan log bilgisinde, bağlantı yapan bilgisayarın adresi, hedef dosya ve kullanıcı adı bilgileri bulunmalıdır. Tue Mar 25 16:39:48 2008 0 bogus.com 528 /ftp/pub/IMPORTANT-WARNING.txt b _ o r anonim ftp 1 * c  Yukarıdaki örnekte yer alan bilgi alanları, kanunda belirtilen başlıklarla aşağıdaki şekilde ilişkilendirilmiştir: Bağlantı tarih-saat bilgisi: ""Tue Mar 25 16:39:48 2008""  Kaynak Adres: ""bogus.com""  İstenen dosya: ""ftp/pub/IMPORTANT-WARNING.txt""  Kullanıcı adı: ""anonim""  Birimler, yer sağlayıcı faaliyetleri kapsamında verdikleri servislerin ürettiği logları inceleyip, sahip oldukları sistemlerde verdikleri servislerin yarattığı trafik loglarını yönetmelikte tarif edildiği şekilde (zaman damgası ile birlikte) kayıt altına almak, bu logları, gizliliğini sağlayarak arşivlemekle yükümlüdür.', 'sebeplerle ilgili olarak abc-l-ownermetu.edu.tr adresinden liste yöneticisi ile iletişime geçebilir, detaylı bilgi alabilirsiniz.  (Yukarıda geçen ""abc-l"" ifadesi liste ismi için örnek olarak verilmiştir)', 'bir şifreyi yazıp, _x0093_Şifremi Değiştir_x0094_ butonuna _x0093_Global Olarak Değiştir_x0094_ seçeneği seçili olacak şekilde tıklamalıdır.  Bu işlem başarılı bir şekilde gerçekleştirildiği takdirde, ekranda _x0093_Şifre başarıyla değiştirildi._x0094_ şeklinde bir mesaj görüntülenir. Kullanıcı tarafından tanımlanan yeni şifre artık aynı e-posta adresi ile üye olunan mevcut tüm e-listelerde kullanılabilir. Şifre değiştirme işlemi sırasında _x0093_Global Olarak Değiştir_x0094_ seçeneği seçili olmadığı durumda, sadece söz konusu e-listenin şifresi değiştirilmiş olur. ""Global Olarak Değiştir"" seçeneği ile kullanıcının o ana kadar üye olduğu tüm listelerin şifreleri değiştirilir. Bu işlem sonrasında üye olunacak yeni e-listelerde de aynı şifrenin kullanılabilmesi için bu işlemin her üyelikten sonra tekrarlanması gerekir. Bu işlem yapılmadığında yeni üye olunan e-listelerde, üye olurken Mailman tarafından otomatik olarak tanımlanıp kullanıcıya gönderilen şifreler kullanılır.', 'ODTÜ’nün değil Türkiye’nin değerli bir yarışması haline gelen bu organizasyona her sene 20 farklı ülkeden 400’ü aşkın sporcu ve 5000 dans severi ağırlamaktadır. Uluslararası platformlarda da övgüler almaya devam eden ve 16.sını 4-5 Kasım 2017 tarihlerinde gerçekleştireceğimiz METU OPEN son 3 senedir tüm Uluslararası Yarışmalar arasında ilk 10’da yer almaktadır.', 'FAQ Answer:   Eğer söz konusu liste ""tek yönlü duyuru listesi"" ise, liste yapılandırması gereği e-posta gönderme yetkisine sahip kişiler haricinde hiç bir kullanıcı mesaj gönderememektedir. Ancak üyelerin e-posta gönderebildiği bir liste söz konusu ise, gönderdiginiz mesajlarin listeye ulaşmamasının iki temel sebebi vardır: Listeye üyelik için kullanmadığıniz bir e-posta adresinden mesaj gönderiyor olabilirsiniz. Genelde birden fazla e-posta adresi kullanıyorsanız ve üye olan adresten farklı bir adrese yönlendirme tanımladıysanız, liste mesajlarini aldığınız e-posta adresi ile üyelik için kullandığınız e-posta adresi farklı olabilir. Mesajları aldığınız e-posta adresinin listeye üye olarak kayıtlı olup olmadığını kontrol etmesi için abc-l-ownermetu.edu.tr adresinden liste yöneticisiyle iletişime geçiniz. Listeye üyelik için kullandığınız e-posta adresinden mesaj gönderiyorsanız mesajiniz onay bekliyor olabilir. Mesajinızın onay için bekletiliyor olmasının olası sebepleri aşağıda listelenmiştir: Gönderdiğiniz mesaj liste mesaj kotasını aşan bir büyüklüğe sahip olabilir (örneğin; çok büyük bir dosya eklentisi gönderiyor olabilirsiniz). Mesajınızın alıcı adresi bölümünde liste adıyla beraber çok sayıda e-posta adresini yazmış olabilirsiniz. Mesajiniz liste ayarları gereği moderatör onayı için bekletiliyor olabilir. Tüm bu olası sebeplerle ilgili olarak abc-l-ownermetu.edu.tr adresinden liste yöneticisi ile iletişime geçebilir, detaylı bilgi alabilirsiniz.  (Yukarıda geçen']","[""Course: ARCH460\nDepartment: This course belongs to DEPARTMENT OF ARCHITECTURE.\nObjective: This elective course is offered to Final year Architecture students who would like to design high performance buildings with low environmental impacts. The aim is to use digital tools to aid building\xa0 design that can: - Increase human comfort by using appropriate technologies - Reduce a building's energy load by selecting appropriate building materials. - Reduce the\xa0environmental loads of a building by integrating appropriate energy resources \nContent:  The course objectives are to introduce students to a world-wide range of architectural concepts, focusing on appropriate and affordable solutions, in terms of choice of materials and technologies, to the extensive needs of the underdeveloped, developing and developed world.  The relevance of appropriate technology in certain current global issues, such as sustainability and ecological concerns, will be considered. "", 'Course: ARCH490\nDepartment: This course belongs to DEPARTMENT OF ARCHITECTURE.\nObjective: This course covers the methods, basic principles, and practical issues of heritage place interpretation and presentation. The major objectives of the course are to provide knowledge and skills on:  general aspects of heritage place interpretation and presentation methods, basic principles, and practical issues of heritage place interpretation and presentation different methods, techniques, media and technologies for interpreting and presenting heritage places how to create stories and narratives about heritage places by, for, and with a broader public new and innovative ways of interpreting and presenting heritage places  \nContent:  This course is intended as an introduction to the methods, basic principles, and practical issues of heritage place interpretation and presentation, which is connecting people to heritage places. It is primarily a communication process that helps people make sense of, and understand more about the significance of heritage places to ensure their conservation. The primary objective of this course is to familiarise students with the full range of activities through which the significance of heritage places is communicated to a broader public. ']","İşte ARCH460 ve ARCH490 dersleri, kültürel mirası korumaya odaklanmış birisi için faydalı olabilecek özel beceriler ve bilgileri:

        1. Müze ve Arkeoloji Yönetmeliği (MZK) ve Tarih ve Mimarlık Yönetmeliği (TMK) gibi türkiye'de miras koruma sürecinde kullanılan yönetmelikler ve kuralların anlamı.
        2. Türkiye'deki kültürel mirası korumaya yönelik tüm yöntemler ve teknikler hakkında bilgi. Bu, mirasını korumak için yapılan araştırmalar, yönetim, yapısal değişiklikler, tamir ve saklama gibi konuları içerir.
        3. Kültürel mirası korumaya yönelik tüm yöntemler ve tekniklerin yanı sıra, mirasını korumak için yapılan araştırmaların yönetimi ve yönetiminde kullanılan yazılım ve araçlar hakkında bilgi.
        4. Kültürel mirası korumaya yönelik tüm yöntemler ve tekniklerin yanı sıra, mirasını korumak için yapılan araştırmaların yönetimi ve yönetiminde kullanılan yazılım ve araçlar hakkında bilgi.
        5. Kültürel mirası korumaya yönelik tüm yöntemler ve tekniklerin yanı sıra, mirasını korumak için yapılan araştırmaların yönetimi ve yönetiminde kullanılan yazılım ve araçlar hakkında bilgi.
        6. Kültürel mirası korumaya yönelik tüm yöntemler ve tekniklerin yanı sıra, mirasını korumak için yapılan araştırmaların yönetimi ve yönetiminde kullanılan yazılım ve araçlar hakkında bilgi.
        7. Kültürel mirası korumaya yönelik tüm yöntemler ve tekniklerin yanı sıra, mirasını korumak için yapılan araştırmaların yönetimi ve yönetiminde kullanılan yazılım ve araçlar hakkında bilgi.

        Bu özel beceriler ve bilgiler, ARCH460 ve ARCH490 derslerinde öğrenilebilir ve kültürel mirası korumaya odaklanmış birisi için faydalı olabilir.","ARCH460 ve ARCH490 dersleri, kültürel miras koruma üzerine odaklanan biri için gerekli olan değerli içgörüler ve beceriler sunmaktadır. ARCH460, düşük çevresel etkilere sahip yüksek performanslı binalar tasarlamaya vurgu yapar; bu, miras alanlarının sürdürülebilir bir şekilde korunmasını sağlamak için kritik öneme sahiptir. Öğrencilere, uygun malzeme ve teknolojiler aracılığıyla insan konforunu artırmayı ve enerji yüklerini azaltmayı hedefleyen bina tasarımını geliştirmek için dijital araçlar kullanmayı öğretir. Bu, miras alanlarını bütünlüklerini tehlikeye atmadan modern standartlara uyarlama ihtiyacıyla örtüşmektedir.

Diğer yandan, ARCH490, kültürel mirasa bağlanmak için hayati öneme sahip olan miras alanlarının yorumlanması ve sunumuna odaklanmaktadır. Miras alanlarının önemini etkili bir şekilde iletmek için yöntemler ve ilkeler kapsamaktadır; bu, değerlerinin kamu tarafından anlaşılmasını ve takdir edilmesini sağlamaktadır. Bu ders, öğrencilere miras alanlarını yorumlamak için hikayeler oluşturma ve çeşitli medya ve teknolojileri kullanma becerileri kazandırır; bu da daha geniş bir kitleyi çekmek ve bir sahiplenme duygusu geliştirmek için gereklidir.

Birlikte, bu dersler kültürel mirasın korunması ve bugünün acil çevresel sorunlarıyla başa çıkmak için kapsamlı bir temel sunmaktadır.",0.7142857142857143,0.0,0.33,0.0625,0.9353532368479859
METU'da yurt yerleştirmeleri için öğrenci başvurularının değerlendirilmesinde hangi kriterler ve süreçler yer almaktadır ve Rektörlük bu kararları nasıl etkilemektedir?,"['vb. yapılara ait web siteleri kapsamlı bir şekilde hazırlanabilir, bu sitelerde çeşitli yazılar ve sayfalar oluşturulabilir. Tasarım için biraz daha esnek olsa da serviste yer alan şablonlar dışında kalan harici bir şablona onay verilmemektedir. Servise giriş yapmak ve servis hakkında ayrıntılı bilgi almak için\xa0http://blog.metu.edu.tr\xa0adresi kullanılmalıdır.', 'bir şifreyi yazıp, _x0093_Şifremi Değiştir_x0094_ butonuna _x0093_Global Olarak Değiştir_x0094_ seçeneği seçili olacak şekilde tıklamalıdır.  Bu işlem başarılı bir şekilde gerçekleştirildiği takdirde, ekranda _x0093_Şifre başarıyla değiştirildi._x0094_ şeklinde bir mesaj görüntülenir. Kullanıcı tarafından tanımlanan yeni şifre artık aynı e-posta adresi ile üye olunan mevcut tüm e-listelerde kullanılabilir. Şifre değiştirme işlemi sırasında _x0093_Global Olarak Değiştir_x0094_ seçeneği seçili olmadığı durumda, sadece söz konusu e-listenin şifresi değiştirilmiş olur. ""Global Olarak Değiştir"" seçeneği ile kullanıcının o ana kadar üye olduğu tüm listelerin şifreleri değiştirilir. Bu işlem sonrasında üye olunacak yeni e-listelerde de aynı şifrenin kullanılabilmesi için bu işlemin her üyelikten sonra tekrarlanması gerekir. Bu işlem yapılmadığında yeni üye olunan e-listelerde, üye olurken Mailman tarafından otomatik olarak tanımlanıp kullanıcıya gönderilen şifreler kullanılır.', 'FAQ Answer:   Sayfanız için bir web hesabı ve alan adı gerekecektir. Bunun için\xa0https://cc-form.metu.edu.tr/web\xa0adresinde yer alan ""Yeni Web Kullanıcı Kodu ve Alan Adı Başvuru Formu""nu doldurmanız gerekmektedir. Başvurunuz üzerine sizinle iletişime geçilecektir. Web sitenizi aşağıdaki yöntemlerden biri ile oluşturabilirsiniz. Kendiniz Dreamweaver ya da benzeri bir programla web sayfalarınızı hazırlayabilirsiniz.\xa0 Merkezi İçerik Yönetim Sistemi\'ni (MİYS) kullanabilirsiniz. MİYS açık kaynaklı bir içerik yönetim sistemi olan Drupal alt yapısını kullanmaktadır. Üniversitemizdeki akademik bölüm, idari birim, merkez, enstitü, fakülte/yüksekokul, lisansüstü program, laboratuvar, proje/araştırma grubu, öğrenci topluluğu vb. yapılara ait web sayfaları bu sistem üzerinde oluşturulabilmektedir. MİYS ile ilgili ayrıntılı bilgiye ve başvuru formuna http://miys.metu.edu.tr adresinden erişebilirsiniz. Bu sistemi kullanırsanız MİYS kapsamında geçerli görsel kimlik standartlarına (http://www.metu.edu.tr/tr/gkk/gorsel-kimlik-standartlari) uymanız beklenmektedir. ODTÜ Blog Servisi\'ni kullanabilirsiniz. ODTÜ Blog Servisi, özgür bir yazılım olan WordPress altyapısını kullanmaktadır. Bu servis ile üniversitemizdeki akademik bölüm, idari birim, merkez, enstitü, fakülte/yüksekokul, lisansüstü program, laboratuvar, proje/araştırma grubu, öğrenci topluluğu vb. yapılara ait web siteleri kapsamlı bir şekilde hazırlanabilir, bu sitelerde çeşitli yazılar ve sayfalar oluşturulabilir. Tasarım için biraz', 'yerlerdedir): Internet Explorer, Outlook Express ve Windows Mail için: View → Encoding (Görünüm → Kodlama) Mozilla Firefox ve Mozilla Thunderbird için: View → Character Encoding (Göster → Karakter Kodlaması)', 'IP adresi : 144.122.222.234 Hedef ip adresi: Bu kayıtta bulunmamaktadır"" Bağlantı tarih-saat bilgisi: [21/Mar/2008:14:58:01 -0200] İstenen sayfa adresi: data/liste.html İşlem bilgisi (GET komut detayı) : GET \'data/liste.htmi HTTP/1.1 Sonuç bilgisi: 200  2) Örnek e-posta logu: ""sendmail"" e-posta sunucu yazılımının ürettiği log dosyasının örneği aşağıda verilmiştir. Tutulan log bilgisinde, ""to"", ""from"" ve ""relay"" bilgilerinin bulunması gereklidir. Kullanılan e-posta yazılımının log formatı, istenen bilgileri bir veya birden fazla satır halinde verebilir. Mar 25 10:20:02 mailhost sendmail[9516]: m2Q8K2e2009516:  from=<bogususerbogus.com>, size=2291, class=0, nrcpts=1,  msgid=<00b101c88f1a$407a7cf0$>, proto=ESMTP, daemon=MTA, relay=boguspc.bogus.com [192.168.1.1] Mar 25 10:20:03 mailhost sendmail[9550]: m2Q8K2e1009516:  to=<bogus2userbogus2.com>, delay=00:00:01, xdelay=00:00:00,  mailer=esmtp, pri=122357, relay=mx.bogus2.com. [192.168.1.2], dsn=2.0.0,  stat=Sent ( Queued mail for delivery)  Yukarıdaki örnekte yer alan bilgi alanları, kanunda belirtilen başlıklarla aşağıdaki şekilde ilişkilendirilmiştir: Bağlantı tarih-saat bilgisi: ""Mar 25 10:20:03"" Gönderici: bogususerbogus.com Kaynak IP adresi: 192.168.1.1 Hedef IP adresi: 192.168.1.2 Alıcı: bogus2userbogus2.com Sonuç bilgisi: sent  3) Örnek ftp logu: ""proftpd"" ftp sunucu yazılımının ürettiği log dosyasının örneği aşağıda verilmiştir. Tutulan log bilgisinde, bağlantı yapan bilgisayarın adresi, hedef dosya ve kullanıcı adı', 'sebeplerle ilgili olarak abc-l-ownermetu.edu.tr adresinden liste yöneticisi ile iletişime geçebilir, detaylı bilgi alabilirsiniz.  (Yukarıda geçen ""abc-l"" ifadesi liste ismi için örnek olarak verilmiştir)', 'FAQ Answer:   Eğer söz konusu liste ""tek yönlü duyuru listesi"" ise, liste yapılandırması gereği e-posta gönderme yetkisine sahip kişiler haricinde hiç bir kullanıcı mesaj gönderememektedir. Ancak üyelerin e-posta gönderebildiği bir liste söz konusu ise, gönderdiginiz mesajlarin listeye ulaşmamasının iki temel sebebi vardır: Listeye üyelik için kullanmadığıniz bir e-posta adresinden mesaj gönderiyor olabilirsiniz. Genelde birden fazla e-posta adresi kullanıyorsanız ve üye olan adresten farklı bir adrese yönlendirme tanımladıysanız, liste mesajlarini aldığınız e-posta adresi ile üyelik için kullandığınız e-posta adresi farklı olabilir. Mesajları aldığınız e-posta adresinin listeye üye olarak kayıtlı olup olmadığını kontrol etmesi için abc-l-ownermetu.edu.tr adresinden liste yöneticisiyle iletişime geçiniz. Listeye üyelik için kullandığınız e-posta adresinden mesaj gönderiyorsanız mesajiniz onay bekliyor olabilir. Mesajinızın onay için bekletiliyor olmasının olası sebepleri aşağıda listelenmiştir: Gönderdiğiniz mesaj liste mesaj kotasını aşan bir büyüklüğe sahip olabilir (örneğin; çok büyük bir dosya eklentisi gönderiyor olabilirsiniz). Mesajınızın alıcı adresi bölümünde liste adıyla beraber çok sayıda e-posta adresini yazmış olabilirsiniz. Mesajiniz liste ayarları gereği moderatör onayı için bekletiliyor olabilir. Tüm bu olası sebeplerle ilgili olarak abc-l-ownermetu.edu.tr adresinden liste yöneticisi ile iletişime geçebilir, detaylı bilgi alabilirsiniz.  (Yukarıda geçen', 'Course: CEIT133\nDepartment: This course belongs to DEPARTMENT OF COMPUTER EDUCATION AND INSTRUCTIONAL TECHNOLOGY.\nObjective: The main objective of the course is to enable participants to acquire an integrated understanding of the programming in Internet environment as applied to education. This course will include technical aspects of website development through a comprehensive introduction to the principles, tools, techniques, and best practices used in developing websites. \nContent:  Fundamentals and functions of the Internet. Common Internet applications used in education: WWW, e-mail, gopher, ftp. Principles of using Internet applications in education.', 'ürettiği log dosyasının örneği aşağıda verilmiştir. Tutulan log bilgisinde, bağlantı yapan bilgisayarın adresi, hedef dosya ve kullanıcı adı bilgileri bulunmalıdır. Tue Mar 25 16:39:48 2008 0 bogus.com 528 /ftp/pub/IMPORTANT-WARNING.txt b _ o r anonim ftp 1 * c  Yukarıdaki örnekte yer alan bilgi alanları, kanunda belirtilen başlıklarla aşağıdaki şekilde ilişkilendirilmiştir: Bağlantı tarih-saat bilgisi: ""Tue Mar 25 16:39:48 2008""  Kaynak Adres: ""bogus.com""  İstenen dosya: ""ftp/pub/IMPORTANT-WARNING.txt""  Kullanıcı adı: ""anonim""  Birimler, yer sağlayıcı faaliyetleri kapsamında verdikleri servislerin ürettiği logları inceleyip, sahip oldukları sistemlerde verdikleri servislerin yarattığı trafik loglarını yönetmelikte tarif edildiği şekilde (zaman damgası ile birlikte) kayıt altına almak, bu logları, gizliliğini sağlayarak arşivlemekle yükümlüdür.', 'ODTÜ’nün değil Türkiye’nin değerli bir yarışması haline gelen bu organizasyona her sene 20 farklı ülkeden 400’ü aşkın sporcu ve 5000 dans severi ağırlamaktadır. Uluslararası platformlarda da övgüler almaya devam eden ve 16.sını 4-5 Kasım 2017 tarihlerinde gerçekleştireceğimiz METU OPEN son 3 senedir tüm Uluslararası Yarışmalar arasında ilk 10’da yer almaktadır.']","[""General Information: There are 19 dormitory buildings run by the METU Directorate of Health, Culture and Sports.\xa0\nMale students can stay in the Dormitories 2, 4, 6, 8, 9, and İsa Demiray Dormitory, in addition to a certain block allocated to them in Dormitory 19, and Refika Aksoy Dormitory. Female students can stay in the Dormitories 1, 3, 5, 7, and Faika Demiray Dormitory, in addition to a certain block allocated to them in Dormitory 19, and Refika Aksoy Dormitory.\nAs for the guest houses, Osman Yazıcı Guest House, Guest House 12, and Dormitory 16 are allocated for female students, while Faik Hızıroğlu Guest House and Guest House 15 are allocated for male students.\nThe Office of Dormitories, with the aim of solving our students' accommodation issues by offering a high standard service, obtained TSE-EN ISO 9001-2000 certificate of quality from the Turkish Standards Institution (TSE) in 2005. Regarding the quality of our dormitory services, the inspections carried out in 2021 in accordance with the TSE-EN ISO 9001:2015 standards were completed with success.\nThe services provided by our unit are carried out according to the procedures, instructions, duties, and responsibilities determined within the Dormitory Regulations, Student Discipline Regulations of the higher education institutions, decisions taken by the Executive Board of Dormitories, and the certificates of quality.\nTherefore, every year, the Executive Board of Dormitories evaluates the dormitory applications of students based on the current capacity of dormitories, the number of applications, and the conditions for staying in the dormitories established in accordance with the aforementioned regulations and approved by the Rectorate. Then, the registration procedures of the students whose applications are accepted are conducted.\nWe endeavor to provide 24/7 uninterrupted service that includes an environment of respect, love, equality and trust in our dormitories with an understanding that prioritizes a service that is high-quality, transparent, modern but at the same time adherent to the traditions of METU, which can only be achieved with a team spirit.\n"", ""Evaluation of the Applications: The economic and social situation of each student's family who applies for dormitories is investigated through local administration units. This information obtained from the local authorities and the students' scores/rankings according to YKS are taken into consideration to create an overall score for each student in accordance with the criteria determined by the Executive Board of Dormitories and approved by the Rectorate. The results of applications are announced on the Office of Dormitories website. After learning their scores, students can learn when they can register for the dormitories and the dates for the next student placement through the announcement tables regarding registrations.\nThe students who have the following ranking success in YKS Exam are placed in the METU dormitories without further consideration of other criteria: ranking in the top 4,000 in Quantitative Field, ranking in the top 500 in Equal Weight Field, ranking in the top 300 in Verbal Field, and ranking in the top 100 in Foreign Language Field.""]","İşte METU'nun yurt yerleştirmeleri için öğrenci başvurularının değerlendirilmesinde kullanılan kriterler ve süreçler:

        1. Web hesabı ve alan adı başvuru formunun doldurulması.
        2. Başvurunuz üzerine sizinle iletişime geçilecektir.
        3. Web sitenizi aşağıdaki yöntemlerden biri ile oluşturabilirsiniz:
           - Dreamweaver ya da benzeri bir programla web sayfalarınızı hazırlayabilirsiniz.
           - Merkezi İçerik Yönetim Sistemi (MİYS) kullanabilirsiniz. MİYS açık kaynaklı bir içerik yönetim sistemi olan Drupal alt yapısını kullanmaktadır.
           - ODTÜ Blog Servisi'ni kullanabilirsiniz. ODTÜ Blog Servisi, özgür bir yazılım olan WordPress altyapısını kullanmaktadır.
        4. Kendiniz Dreamweaver ya da benzeri bir programla web sayfalarınızı hazırlayabilirsiniz.
        5. Merkezi İçerik Yönetim Sistemi (MİYS) kullanabilirsiniz. MİYS açık kaynaklı bir içerik yönetim sistemi olan Drupal alt yapısını kullanmaktadır.
        6. ODTÜ Blog Servisi'ni kullanabilirsiniz. ODTÜ Blog Servisi, özgür bir yazılım olan WordPress altyapısını kullanmaktadır.
        7. MİYS ile ilgili ayrıntılı bilgiye ve başvuru formuna http://miys.metu.edu.tr adresinden erişebilirsiniz.
        8. Bu sistemi kullanırsanız MİYS kapsamında geçerli görsel kimlik standartlarına (http://www.metu.edu.tr/tr/gkk/gorsel-kimlik-standartlari) uymanız beklenmektedir.
        9. ODTÜ Blog Servisi'ni kullanabilirsiniz. ODTÜ Blog Servisi, özgür bir yazılım olan WordPress altyapısını kullanmaktadır.
        10. Tasarım için biraz önemlilik gerektirir.

        Rektörlük bu kararları nasıl etkilemektedir:
        İşte Rektörlük bu kararları nasıl etkilemektedir:
        1. Web hesabı ve alan adı başvuru formunun doldurulmasından sonra sizinle iletişime geçilecektir.
        2. Web sitenizi oluşturduktan sonra, Rektörlük tarafından onaylanmaktadır.
        3. Rektörlük, web sitenizin tasarımı ve içeriği hakkında karar verebilir ve yapılacak değişiklikleri söyleyecektir.
        4. Rektörlük, web sitenizin yayınlanmasını izlemektedir.
        5. Rektörlük, web sitenizin işletiminde sorunlar yaşanırsa, onayı vererek yönetim haklarını sizin verebilir.
        6. Rektörlük, web sitenizin işletiminde sorunlar yaşanırsa, onayı vererek yönetim haklarını sizin verebilir.
        7. Rektörlük, web sitenizin işletiminde sorunlar yaşanırsa, onayı vererek yönetim haklarını sizin verebilir.
        8. Rektörlük, web sitenizin işletiminde sorunlar yaşanırsa, onayı vererek yönetim haklarını sizin verebilir.
        9. Rektörlük, web sitenizin işletiminde sorunlar yaşanırsa, onayı vererek yönetim haklarını sizin verebilir.
        10. Rektörlük, web sitenizin işletiminde sorunlar yaşanırsa, onayı vererek yönetim haklarını sizin verebilir.

        Bu sınıf, İngilizce çevirisi sözlüğünün yaratılmasına, yaratılan sözlükü kullanarak İngilizce metinlerin çevirilmesine, bu çevirilerin değerlendirilmesine ve bu çevirilerin yanı sıra yanlışlığınızı anlayan bir öğrenciyi üretmektedir.

        Bu sınıf, Çocuk Eğitimi Bölümünden ayrılır. Bu sınıf, Çocuk Eğitimi Bölümünden ayrılır. Bu sınıf, Çocuk Eğitimi Bölümünden ayrılır. Bu sınıf, Çocuk Eğitimi Bölümünden ayrılır. Bu sınıf, Çocuk Eğitimi Bölümünden ayrılır. Bu sınıf, Çocuk Eğitimi Bölümünden ayrılır. Bu sınıf, Çocuk Eğitimi Bölümünden ayrılır. Bu sınıf, Çocuk Eğitimi Bölümünden ayrılır. Bu sınıf, Çocuk Eğitimi Bölümünden ayrılır. Bu sınıf, Çocuk Eğitimi Bölümünden ayrılır. Bu sınıf, Çocuk Eğitimi Bölümünden ayrılır. Bu sınıf, Çocuk Eğitimi Bölümünden ayrılır. Bu sınıf, Çocuk Eğitimi Bölümünden ayrılır. Bu sınıf, Çocuk Eğitimi Bölümünden ayrılır. Bu sınıf, Çocuk Eğitimi Bölümünden ayrılır. Bu sınıf, Çocuk Eğitimi Bölümünden ayrılır. Bu sınıf, Çocuk Eğitimi Bölümünden ayrılır. Bu sınıf, Çocuk Eğitimi Bölümünden ayrılır. Bu sınıf, Çocuk Eğitimi Bölümünden ayrılır. Bu sınıf, Çocuk Eğitimi Bölümünden ayrılır. Bu sınıf, Çocuk Eğitimi Bölümünden ayrılır. Bu sınıf, Çocuk Eğitimi Bölümünden ayrılır. Bu sınıf, Çocuk Eğitimi Bölümünden ayrılır. Bu sınıf, Çocuk Eğitimi Bölümünden ayrılır. Bu sınıf, Çocuk Eğitimi Bölümünden ayrılır. Bu sınıf, Çocuk Eğitimi Bölümünden ayrılır. Bu sınıf, Çocuk Eğitimi Bölümünden ayrılır. Bu sınıf, Çocuk Eğitimi Bölümünden ayrılır. Bu sınıf, Çocuk Eğitimi Bölümünden ayrılır. Bu sınıf, Çocuk Eğitimi Bölümünden ayrılır. Bu sınıf, Çocuk Eğitimi Bölümünden ayrılır. Bu sınıf, Çocuk Eğitimi Bölümünden ayrılır. Bu sınıf, Çocuk Eğitimi Bölümünden ayrılır. Bu sınıf, Çocuk Eğitimi Bölümünden ayrılır. Bu sınıf, Çocuk Eğitimi Bölümünden ayrılır. Bu sınıf, Çocuk Eğitimi Bölümünden ayrılır. Bu sınıf, Çocuk Eğitimi Bölümünden ayrılır. Bu sınıf, Çocuk Eğitimi Bölümünden ayrılır. Bu sınıf, Çocuk Eğitimi Bölümünden ayrılır. Bu sınıf, Çocuk Eğitimi Bölümünden ayrılır. Bu sınıf, Çocuk Eğitimi Bölümünden ayrılır. Bu sınıf, Çocuk Eğitimi Bölümünden ayrılır. Bu sınıf, Çocuk Eğitimi Bölümünden ayrılır. Bu sınıf, Çocuk Eğitimi Bölümünden ayrılır. Bu sınıf, Çocuk Eğitimi Bölümünden ayrılır. Bu sınıf, Çocuk Eğitimi Bölümünden ayrılır. Bu sınıf, Çocuk Eğitimi Bölümünden ayrılır. Bu sınıf, Çocuk Eğitimi Bölümünden ayrılır. Bu sınıf, Çocuk Eğitimi Bölümünden ayrılır. Bu sınıf, Çocuk Eğitimi Bölümünden ayrılır. Bu sınıf, Çocuk Eğitimi Bölümünden ayrılır. Bu sınıf, Çocuk Eğitimi Bölümünden ayrılır. Bu sınıf, Çocuk Eğitimi Bölümünden ayrılır. Bu sınıf, Çocuk Eğitimi Bölümünden ayrılır. Bu sınıf, Çocuk Eğitimi Bölümünden ayrılır. Bu sınıf, Çocuk Eğitimi Bölümünden ayrılır. Bu sınıf, Çocuk Eğitimi Bölümünden ayr","METU'da yurt yerleştirmeleri için öğrenci başvurularının değerlendirilmesi birkaç kriter ve süreç içermektedir. Her öğrencinin ailesinin ekonomik ve sosyal durumu yerel yönetim birimleri aracılığıyla araştırılmaktadır. Bu bilgiler, öğrencilerin YKS sınavındaki puanları ve sıralamaları ile birlikte, Yurtlar İdare Kurulu tarafından belirlenen ve Rektörlük tarafından onaylanan kriterlere dayalı olarak her öğrenci için genel bir puan oluşturmak amacıyla kullanılmaktadır. Bu başvuruların sonuçları daha sonra Yurtlar Ofisi web sitesinde duyurulmaktadır. Ayrıca, Sayısal Alan'da ilk 4,000'de, Eşit Ağırlık Alanı'nda ilk 500'de, Sözel Alan'da ilk 300'de ve Yabancı Dil Alanı'nda ilk 100'de yer alan öğrenciler, diğer kriterlerin daha fazla dikkate alınmadan METU yurtlarına yerleştirilmektedir. Rektörlük, Yurtlar İdare Kurulu tarafından yapılan kriterlerin ve kararların onaylanmasında önemli bir rol oynamakta, süreçlerin kurumsal standartlar ve düzenlemelerle uyumlu olmasını sağlamaktadır.",0.0,0.0,,0.2982456140350877,0.9068888600342799
AEGEE-Ankara'nın öğrenci katılımını teşvik etmedeki rolü nedir ve gençler arasında Avrupa'nın anlaşılmasına nasıl katkıda bulunur?,"['ODTÜ’nün değil Türkiye’nin değerli bir yarışması haline gelen bu organizasyona her sene 20 farklı ülkeden 400’ü aşkın sporcu ve 5000 dans severi ağırlamaktadır. Uluslararası platformlarda da övgüler almaya devam eden ve 16.sını 4-5 Kasım 2017 tarihlerinde gerçekleştireceğimiz METU OPEN son 3 senedir tüm Uluslararası Yarışmalar arasında ilk 10’da yer almaktadır.', 'Course: SOC410\nDepartment: This course belongs to DEPARTMENT OF SOCIOLOGY.\nObjective: No objective\nContent:  Present socio-cultural structure of Turkey as well as its process of transformation. Constitution of basic identities and their reproduction in their reciprocal (usually confrontational) relationships. An hi-story  of the Ottoman Empire beginning from 16th century onwards, dissolution of it, foundation of the Republic and the developments afterwards.', 'FAQ Question: Bölüm, Birim, Merkez, Laboratuvar, Öğrenci Topluluğu web sayfası nasıl yapılır?', 'bulunup tanınması çalışmaları (1988-1990), Antakya kıyılarında yine topluluk tarafından bulunan 1600 yıllık iki batık gemi ve her birinde bulunan cam külçeler (1992/1993) ODTÜ Sualtı Topluluğu’nun Arkeoloji bilimine yaptığı katkıların ilkleridir. Bunlara ek olarak topluluğun 1992 yılında ilk kez Bozcaada’da düzenlediği “Sualtında Görüntü Avlama Yarışması” SAGAY, Türkiye’de düzenlenen ilk sualtı fotoğraf yarışması olmasının yanı sıra, Zıpkınla Balık Avcılığı Yerine Fotoğraf Makinesiyle Görüntü Avcılığı gibi anlamlı bir seçeneği sunarak Kuzey Ege’de “deniz parkları” kurulmasını ve işlemesini sağlamayı amaç edinmiştir. Son zamanlarda topluluk Türkiye Kıyıları Deniz Mağaraları Envanter Projesi, Kilikya Bölgesi Arkeolojik Yüzey Araştırması, Deniz Çayırlarının Yayılımının İncelenmesi, Uluburun III Yapay Resif Projesi, Serbest Dalış Denemeleri gibi önemli projeleri yürütmektedir. ODTÜ Sualtı Topluluğu Rektörlük makamına karşı sorumludur. Akademik Danışman ve beş öğrenciden oluşan yürütme kurulu, üç öğrenciden oluşan denetleme kurulu işleyişi sağlamakla görevlidir. Yürütme Kurulu ve Denetleme Kurulu Genel Kurula karşı sorumludur. Topluluğun Akdeniz Foku Araştırma Grubu (AFAG), Batık Araştırma Grubu (BAG), Ekoloji Grubu (EKOG), Fotografi ve Videografi Grubu (FOVAG), Mağara Dalışı ve Araştırma Grubu (MADAG) ve Serbest Dalış Grubu (SDG) gibi alt grupları ile çeşitli çalışma birimleri vardır.', 'bir şifreyi yazıp, _x0093_Şifremi Değiştir_x0094_ butonuna _x0093_Global Olarak Değiştir_x0094_ seçeneği seçili olacak şekilde tıklamalıdır.  Bu işlem başarılı bir şekilde gerçekleştirildiği takdirde, ekranda _x0093_Şifre başarıyla değiştirildi._x0094_ şeklinde bir mesaj görüntülenir. Kullanıcı tarafından tanımlanan yeni şifre artık aynı e-posta adresi ile üye olunan mevcut tüm e-listelerde kullanılabilir. Şifre değiştirme işlemi sırasında _x0093_Global Olarak Değiştir_x0094_ seçeneği seçili olmadığı durumda, sadece söz konusu e-listenin şifresi değiştirilmiş olur. ""Global Olarak Değiştir"" seçeneği ile kullanıcının o ana kadar üye olduğu tüm listelerin şifreleri değiştirilir. Bu işlem sonrasında üye olunacak yeni e-listelerde de aynı şifrenin kullanılabilmesi için bu işlemin her üyelikten sonra tekrarlanması gerekir. Bu işlem yapılmadığında yeni üye olunan e-listelerde, üye olurken Mailman tarafından otomatik olarak tanımlanıp kullanıcıya gönderilen şifreler kullanılır.', 'vb. yapılara ait web siteleri kapsamlı bir şekilde hazırlanabilir, bu sitelerde çeşitli yazılar ve sayfalar oluşturulabilir. Tasarım için biraz daha esnek olsa da serviste yer alan şablonlar dışında kalan harici bir şablona onay verilmemektedir. Servise giriş yapmak ve servis hakkında ayrıntılı bilgi almak için\xa0http://blog.metu.edu.tr\xa0adresi kullanılmalıdır.', 'Content:  The course intends to outline administrative structure of the Ottoman Empire and concentrates on the Tanzimat Reforms, the intellectual discussions of the time; the Ottomanism, Islamism and Turkism. The collapse of the Ottoman Empire and the establishment of the nation states in the place of the Ottoman Empire are discussed. The double revolution; the National Liberation Movement of 1919-1923 and the establishment of republican regime, the Izmir economic Congress and the following economic policies of the republican regime are looked through. Intellectuals of the time, such as Ziya Gökalp, Yusuf Akçura, Ahmet Aðaoðlu, Ahmet Hamdi Baþar and the Kadro Movement, and their arguments regarding economic development policies as well as nationalism, are included among the topics. As to the foreign policy of the republican regime, the territorial settlements of the period from 1919 to 1923, the Mosul Question, the straits Question, the foreign policy approach of the republican regime, with particular references to the Balkan Pact of 1934 and the Sadabad Pact of 1937, are examined.', 'Course: ENG310\nDepartment: This course belongs to SCHOOL OF FOREIGN LANGUAGES.\nObjective:  Gain a basic understanding about the current concepts in Turkish higher education Know the historical foundation of Turkish higher education in relation to the global context Understand the patterns pertaining to higher education system and governance in Turkey Acknowledge the role of higher education in society with a specific emphasis on historical events and organizational characteristics Show sensitivity for social constructs that have affected the Turkish higher education system Know how\xa0university experience and student culture\xa0interact with Turkish higher education Know the educational and career opportunities of Turkish higher education Understand the internationalization process of Turkish higher education Evaluate information from a scholarly publication and produce a brief written reflection Understand the science and research domains of Turkish higher education Understand the constructs of quality and quality assurance in Turkish higher education Understand the financial functioning and economic basis of Turkish higher education Develop awareness on the ethical practices in Turkish higher education Design and present a research plan based on one of the Turkish higher education concepts', 'Course: HIST233\nDepartment: This course belongs to DEPARTMENT OF HISTORY.\nObjective: No objective\nContent:  Focusing on the nomads, farmers and dervishes, the course will explore the Anatolian society before the rise of the Ottomans as an empire. Demographic, cultural as well as political and economic trends in Anatolia in the 12th to 15th centuries will be studied with readings in history, literature and arts.', ""Course: IR437\nDepartment: This course belongs to DEPARTMENT OF INTERNATIONAL RELATIONS.\nObjective: At the end of this course students will learn; The domestic political framework of Turkish foreign policy. Evolution of Turkey's political system. The impact of political actors, institutions, and ideologies in the domestic and foreign policy of Turkey. \nContent:  This course aims at elaborating domestic sources of foreign policy making in the context of Turkish politics. It is based on the hypothesis that an interactional approach better serves to the understanding of both Turkish domestic politics and Turkish foreign policy.""]","[""Student Club Name: EUROPEAN STUDENTS FORUM CLUB (AEGEE-Ankara)\nStudent Club Description: AEGEE supports students and young people to take active roles in society in Europe. In addition to creating a space for dialog and training opportunities, it acts as their representative against decision makers. In addition, AEGEE brings Europe closer to young people while strengthening mutual understanding. AEGEE-Ankara, which joined the AEGEE network in April 1995, became one of the network's most active locations throughout Europe. The inclusion of AEGEE-Ankara in the AEGEE network broke the dogmas on the borders of modern Europe and provided a new understanding of the concept of Europe of values within the AEGEE. Academic Advisor: Prof. Dr. Cem Bozşahin (Graduate School of Informatics) Club Room: Central Engineering Building 1st Floor \n""]","İlgili organizasyon, AEGEE-Ankara, Türkiye'nin en büyük gençlik topluluğudur. Bu topluluğun amacı, gençlerin Uluslararası iletişimini, topluluklarla ilgili projeleri ve etkinlikleri yapmak ve gençlik yarışmalarında Türkiye'yi temsil etmektir. Bu topluluğun, Avrupa'nın gençleri arasında anlaşılmasını, topluluklarla ilgili projelerin yürütülmesini ve gençlik yarışmalarında Türkiye'yi temsil etmek için çeşitli etkinlikler ve projeler yürütülmektedir.","AEGEE-Ankara, Nisan 1995'ten beri AEGEE ağına dahil olup, Avrupa genelinde öğrencilerin ve gençlerin topluma aktif roller üstlenmelerini destekleyerek öğrenci katılımını teşvik etmede önemli bir rol oynamaktadır. Kulüp, karar vericilere karşı öğrencilerin temsilcisi olarak hareket ederek diyalog ve eğitim fırsatları için bir alan yaratmaktadır. AEGEE-Ankara ayrıca, Avrupa'yı gençlere daha yakın hale getirmeye çalışırken karşılıklı anlayışı güçlendirerek, paylaşılan değerlere dayalı yeni bir Avrupa anlayışına katkıda bulunmaktadır.",0.6666666666666666,0.0,0.18,0.0,0.9397303135114126
What are the steps to connect to the meturoam network using a device that supports WPA2 Enterprise with PEAP/MSCHAPv2?,"['as PEAP and MSCHAPv2.  Use your METU usercode and password for the meturoam service. (Please make sure you use your usercode like e123456metu.edu.tr, not your email aliases in the form of name.surnamemetu.edu.tr) In Windows 10, protocol settings are done automatically. You do not need to set the protocols. For Linux operating systems or Windows 7 and below, you may also need to select WPA2-Enterprise and AES. In mobile devices, if you use the autocomplete function in your keyboard, a blank space may be added to your usercode. Pay attention to last character in your usercode. It should not be a blank space. If you are asked for a certificate, you may select ""Do not validate"" and skip it. (For some Android devices, certificate field might be compulsory. You can select ""Use System Certificate"" and type border.metu.edu.tr netlogin.metu.edu.tr) If you are asked for anonymous identity, you may type anonymous@metu.edu.tr.  For Raspberry pi devices, add the following conf to wpa_supplicant.conf file.network={ssid=""meturoam""key_mgmt=WPA-EAPpairwise=CCMPeap=PEAPidentity=""< username >""anonymous_identity=""anonymous@metu.edu.tr""password=""< password >""} Then restart wpa_supplicant. Actual filenames and paths may vary.killall wpa_supplicantwpa_supplicant -B -Dwext -i wlan0 -c /etc/wpa_supplicant/wpa_supplicant.conf -f /var/log/wpa_supplicant.log      If you forgot your password, you can set a new one in order to use the wireless network. Those users who do not prefer to create a meturoam', 'FAQ Answer:   A device must support WPA2 Enterprise with PEAP/MSCHAPv2 in order to be able to connect to METU wireless network, meturoam. Please click here: https://faq.cc.metu.edu.tr/faq/which-devices-are-known-not-support-meturoam for a list of some popular devices that are known to NOT work on the meturoam wireless network. Connecting to meturoam After a guest account created for you, please connect to meturoam SSID from your wireless device. You can use this password with every device you own, you do not have to set passwords for each device. Be sure to set the protocols as PEAP and MSCHAPv2.  Use your username and password sent via e-mail by the guest account creator for the meturoam service. In Windows 10, protocol settings are done automatically. You do not need to set the protocols. For Linux operating systems or Windows 7 and below, you may also need to select WPA2-Enterprise and AES. In mobile devices, if you use the autocomplete function in your keyboard, a blank space may be added to your username. Pay attention to last character in your username. It should not be a blank space. If you are asked for a certificate, you may skip it. (For some Android devices, certificate field might be compulsory. You can select ""Use System Certificate"" and type border.metu.edu.tr netlogin.metu.edu.tr) If you are asked for anonymous identity, you may type anonymous@metu.edu.tr. !!! Wireless network connection problems are observed in some of Android devices using Android 6 and', 'FAQ Question: How can I connect to eduroam wireless network via my iPhone?\nFAQ Answer:   You can connect to eduroam by downloading and executing the configuration file to your iOS device. Download configuration file for iOS devices via Safari webbrowser. Then please install downloaded config file (metu_eduroam.mobileconfig) from setting screen of Iphone device (settings-general-profile).\xa0 After installation has been completed, select the eduroam wireless network to connect. On User Account\xa0option screen,\xa0user_namemetu.edu.tr\xa0and password should be entered. \xa0  \nFAQ Link: https://faq.cc.metu.edu.tr/faq/how-can-i-connect-eduroam-wireless-network-my-iphone', 'FAQ Link: https://faq.cc.metu.edu.tr/faq/there-wireless-network-metu-how-can-i-connect', 'FAQ Question: I get a certificate warning when connecting to the wireless meturoam network with my device. What should I do?\nFAQ Answer:   When connecting to the meturoam wireless network, you may receive a certificate warning due to the operating system on your device and the antivirus software you use, if any. You can check the information on the alert screen and click Connect if the information is the same as the ""Fingerprint"" below: Radius Server: border.metu.edu.tr SHA-256 Fingerprint 52 FD 75 C8 9D 32 57 61 30 77 88 BA 9B 01 E0 6F F5 4C 1F 19 08 10 E5 F5 D4 F7 87 2E E4 6D A4 7A SHA-1 Fingerprint 5A 12 B5 A2 5E 20 D1 BC 73 74 2E 0E 35 60 B5 76 3D DB 14 A7  \nFAQ Link: https://faq.cc.metu.edu.tr/faq/i-get-certificate-warning-when-connecting-wireless-meturoam-network-my-device-what-should-i-do', 'eduroam ssid (service set identifier) and choose Properties, on the windoweduroam Wireless Network Properties window that\'s opened, changes on the Security heading should be done: Security type: WPA2 Enterprise Encryption Type: AES Choose a network authentication method : SecureW2 TTLS should ve choosen. Beside Secure W2 TTLSoption, on SecureW2 menu when clicked on Settings: Profile: click Configure under DEFAULT\xa0 on Connection option,\xa0 Use alternate outer identity and Use anonymous outer identity should be choosen. on Certificates option Verify Server Certificates option should ve removed. on Authentication option PAP should ve choosen. on User Account option, user_namemetu.edu.tr and password should be entered.  Microsoft Windows 10 Configuration In the wireless connections list, please connect to\xa0eduroam and provide your METU usercode (with @metu.edu.tr) and METU password. After you authenticate the certificate, you are connected to eduroam network. IMPORTANT:\xa0If you upgraded from previous versions of Windows 10, you need to uninstall any connection utilities like SecureW2, click ""forget eduroam"" and reconnect it with the above instructions. \xa0 Linux Operating Systems: Description with pictures for Ubuntu distribution In Linux operating systems, the the help of the wpa_supplicant, it\'s possible to connect to 802.1x wireless networks running on WPA or above. So to connect to eduroam, the wpa_supplicant application should be installed beforehand. This operation can be held', 'FAQ Question: metuconnect\nFAQ Answer:   If you do not have a password for meturoam and do not have access to METU wireless network, then you can connect to metuconnect SSID in order to connect to meturoam. After connecting to metuconnect, please login to\xa0https://netregister.metu.edu.tr and follow the instructions to create a new\xa0meturoam\xa0password. Users who already have meturoam passwords do not need to connect to metuconnect. There are access restrictions in the metuconnect network.  \nFAQ Link: https://faq.cc.metu.edu.tr/faq/metuconnect', 'FAQ Answer:    With METU VPN Service, by installing a packaged program (VPN Client) on personal computers and/or mobile devices, our members and students could access to our campus network resources when they are outside the campus.  Warning: For users using VPN, the connection speed per user is defined as 8 Mbps. For this reason, in the cases that VPN connection is not necessary it is recommended that you disconnect from your VPN connection. To use VPN Service on your Windows OS installed device follow these steps: Login to netregister.metu.edu.tr Click VPN service and download the installation file for your Operating System. Then start the setup process.   On the first screen click on Next option to start the setup process. Then continue by clicking Next buttons.     After you check the License Agreement, click on Next button.            After you choose where to setup VPN software, click on Next button.  Continue to setup by clicking on Install button.   Click on Finish button to finish installation process.  After the VPN software launched,\xa0Click on ""Click to download VPN profile"" button.  Then fill in the blanks accordingly. You should write\xa0border.metu.edu.tr\xa0in the field Enter VPN Server URL. When you finish, click on Download button.  Select default profile.   Then write your METU username -which is like e000000 (or your usercode if you are a METU personnel)- in the Username field and write your password in the Password field. When you finish, click on Proceed', 'install illegal software. Do not use Warez. If you use software from Warez, you enable unwanted, malicious codes on your computer. To increase your security, install software only from App Store or identified developers. (Apple >\xa0System Preferences >\xa0Security & Privacy >\xa0General tab, choose Allow apps downloaded in a secure way). 20. Backup Your Data You should always backup your valuable data against theft, loss, physical damage on disc etc. (Apple > System Preferences >\xa0Time Machine).  21. use eduroam SSID for wireless in METU There are 2 SSIDs for wireless network in METU Campus, eduroam and ng2k. ng2k is an open wireless network that works with MAC address authentication. On the other hand eduroam is secure wireless network working on RADIUS based 8021.x security standard. Furthermore if you setup eduroam on your device, you can wireless network in any institution that is a member of the eduroam infrastructure. You can visit http://eduroam.metu.edu.tr to get information about setting up eduroam SSID on your computer. References:  1.\xa0\xa0\xa0\xa0 http://www.macworld.co.uk/feature/mac/22-ultimate-tricks-improve-mac-security-best-tips-3643100/ 2.\xa0\xa0\xa0\xa0 https://www.intego.com/mac-security-blog/15-mac-hardening-security-tips-to-protect-your-privacy/', 'FAQ Answer: A device must support WPA2 Enterprise with PEAP/MSCHAPv2 in order to be able to connect to METU wireless network, meturoam. Please click here: https://faq.cc.metu.edu.tr/faq/which-devices-are-known-not-support-meturoam for a list of some popular devices that are known to NOT work on the meturoam wireless network. To connect to the meturoam wireless network, you need a METU usercode and a password for meturoam. If you have a password, please continue to HOW-TO  section. If you didn\'t create a password for meturoam or you want to renew your password, please visit https://netregister.metu.edu.tr and click Wireless icon, then click ""meturoam"" icon.  In the meturoam menu, please provide a new password to be used only for this service with your user code. (In some Android and IOS devices, some special characters like #, \', $ in the password may cause problems to connect to meturoam. If you can connect to meturoam via a computer but having problems with Android or IOS devices, please check your password for special characters and create a new password with other characters.)    Connecting to meturoam After you set your new password, please connect to meturoam SSID from your wireless device. You can use this password with every device you own, you do not have to set passwords for each device. Be sure to set the protocols as PEAP and MSCHAPv2.  Use your METU usercode and password for the meturoam service. (Please make sure you use your usercode like e123456metu.edu.tr,']","['e1b3eea5-6779-4216-a5ef-748f1fc3a4f5\n\nFAQ Question: How can I connect to meturoam network?\nFAQ Answer: A device must support WPA2 Enterprise with PEAP/MSCHAPv2 in order to be able to connect to METU wireless network, meturoam. Please click here: https://faq.cc.metu.edu.tr/faq/which-devices-are-known-not-support-meturoam for a list of some popular devices that are known to NOT work on the meturoam wireless network. To connect to the meturoam wireless network, you need a METU usercode and a password for meturoam. If you have a password, please continue to HOW-TO  section. If you didn\'t create a password for meturoam or you want to renew your password, please visit https://netregister.metu.edu.tr and click Wireless icon, then click ""meturoam"" icon.  In the meturoam menu, please provide a new password to be used only for this service with your user code. (In some Android and IOS devices, some special characters like #, \', $ in the password may cause problems to connect to meturoam. If you can connect to meturoam via a computer but having problems with Android or IOS devices, please check your password for special characters and create a new password with other characters.)    Connecting to meturoam After you set your new password, please connect to meturoam SSID from your wireless device. You can use this password with every device you own, you do not have to set passwords for each device. Be sure to set the protocols as PEAP and MSCHAPv2.  Use your METU usercode and password for the meturoam service. (Please make sure you use your usercode like e123456metu.edu.tr, not your email aliases in the form of name.surnamemetu.edu.tr) In Windows 10, protocol settings are done automatically. You do not need to set the protocols. For Linux operating systems or Windows 7 and below, you may also need to select WPA2-Enterprise and AES. In mobile devices, if you use the autocomplete function in your keyboard, a blank space may be added to your usercode. Pay attention to last character in your usercode. It should not be a blank space. If you are asked for a certificate, you may select ""Do not validate"" and skip it. (For some Android devices, certificate field might be compulsory. You can select ""Use System Certificate"" and type border.metu.edu.tr netlogin.metu.edu.tr) If you are asked for anonymous identity, you may type anonymous@metu.edu.tr.  For Raspberry pi devices, add the following conf to wpa_supplicant.conf file.network={ssid=""meturoam""key_mgmt=WPA-EAPpairwise=CCMPeap=PEAPidentity=""< username >""anonymous_identity=""anonymous@metu.edu.tr""password=""< password >""} Then restart wpa_supplicant. Actual filenames and paths may vary.killall wpa_supplicantwpa_supplicant -B -Dwext -i wlan0 -c /etc/wpa_supplicant/wpa_supplicant.conf -f /var/log/wpa_supplicant.log      If you forgot your password, you can set a new one in order to use the wireless network. Those users who do not prefer to create a meturoam password can also connect to eduroam. !!! Wireless network connection problems are observed in some of Android devices using Android 6 and prior versions. Occasionally these devices display there is an established wireless connection on the screen but when you try to connect to the Internet, they fail. This problem is originated from a bug in the operating system. The bug cause Android devices to continue to use DHCP-leased IP addresses after the leases expire, and cause Android devices to resume using IP addresses from expired DHCP leases. When you face the the same problem please disable your Wi-Fi connection and enable it again.  \nFAQ Link: https://faq.cc.metu.edu.tr/faq/meturoam\n', 'fc48714a-c6b4-4df4-9458-109e797e268b\n\nFAQ Question: How can I connect to eduroam wireless network using my Mac computer?\nFAQ Answer:   You can connect to eduroam by downloading and executing the configuration file to your iOS device. Download configuration file for iOS devices. on User Account option, user_namemetu.edu.tr\xa0and password should be entered. \xa0 Please follow the steps below if you would like to create the configuration file by using your MAC OSX device. \xa0To connect to the eduroam network, please install Apple Configurator from AppStore.  Run the application and click Start Preparing Devices.  \xa0 \xa0 Activate Supervision. (Turn ON) \xa0  \xa0 \xa0  Click + at the bottom of the window and select\xa0Create New Profile\xa0in the menu. \xa0  \xa0 \xa0 In the popup window, click Wifi and then\xa0configure. \xa0  \xa0 \xa0 Type eduroam\xa0and select WPA/WPA2 Enterprise\xa0in the Security Type combo box.  \xa0 \xa0 Select TTLS under\xa0Accepted EAP types heading. \xa0  \xa0 \xa0 Type your METU user name and password. Then, select PAP in the\xa0Inner Authentication heading and click\xa0Save to save the profile. \xa0  \xa0 Click on the profile name and export it to your computer by clicking the + at the bottom of the window.  \xa0 \xa0 \xa0 \xa0  \xa0 Locate the exported profile and install it to your computer double clicking it. \xa0 \xa0  \xa0  \xa0  \xa0 \xa0  \xa0 \xa0  \nFAQ Link: https://faq.cc.metu.edu.tr/faq/how-can-i-connect-eduroam-wireless-network-using-my-mac-computer\n']","1. Ensure your device supports WPA2 Enterprise with PEAP/MSCHAPv2.
        2. Create or renew your meturoam password at https://netregister.metu.edu.tr.
        3. Connect to the meturoam SSID from your wireless device.
        4. Use your METU usercode (e.g., e123456metu.edu.tr) and password for the meturoam service.
        5. Set the protocols as PEAP and MSCHAPv2.
        6. If you are using Windows 10, protocol settings are done automatically. For other operating systems, you may also need to select WPA2-Enterprise and AES.
        7. For Android devices, if the certificate field is compulsory, select ""Use System Certificate"" and type border.metu.edu.tr netlogin.metu.edu.tr.
        8. If you are asked for anonymous identity, you may type anonymous@metu.edu.tr.
        9. If you have issues with Android devices, check your password for special characters and create a new password with other characters.","To connect to the meturoam network, follow these steps: First, ensure your device supports WPA2 Enterprise with PEAP/MSCHAPv2. You will need a METU usercode and a password for meturoam. If you don't have a password or need to renew it, visit https://netregister.metu.edu.tr, click on the Wireless icon, and then the 'meturoam' icon to create a new password. Be cautious with special characters in your password, as some Android and iOS devices may have issues connecting if the password contains characters like #, ', or $. After setting your new password, connect to the meturoam SSID on your device. Use your METU usercode (formatted as e123456metu.edu.tr) and the password you just created. For Windows 10, the protocol settings are done automatically. For Linux or Windows 7 and below, ensure you select WPA2-Enterprise and AES. If prompted for a certificate, you can select 'Do not validate' or 'Use System Certificate' and enter border.metu.edu.tr or netlogin.metu.edu.tr. If asked for an anonymous identity, type anonymous@metu.edu.tr. If you encounter issues, especially on Android devices, try disabling and re-enabling your Wi-Fi connection.",1.0,0.0,0.7,0.8333333333333334,0.950852830594979
"What role does Assoc. Inst. Figen Işık play in the JAZZ CLUB, and what are the club's objectives?","['Student Club Name: JAZZ CLUB\nStudent Club Description: The Club aims to provide jazz music education and a library for students who want to learn how to perform jazz music, to provide a comprehensive archive to jazz music listeners, to contribute to the recognition and listening of jazz music by more people, and to organize courses for students. Academic Advisor: Assoc. Inst. Figen Işık (Department of Industrial Design) Club Room: Club Containers No:8', 'Student Club Name: YOUNG AUTHORS SOCIETY (YAS)\nStudent Club Description: The Society aims to ensure students who have already individual skills are more effective in national and international arena through massive solidarity by collecting students performing literary and intellectual activities under a single roof, to educate people to help them become more qualified and intellectual, to provide an interdisciplinary approach, and to draw attention to using the Turkish language in a careful and correct manner and to organize events that encourage not only literary activities, but also to read more. Academic Advisor: Dr.Sibel Yılmaz (Department of Turkish Language) Club Room: NA', 'Student Club Name: BUSINESS CLUB\nStudent Club Description: The Club continues its activities based on the philosophy of ""Always for the Better"" in in line with its mission determined as ""Service to the Science of Business Administration, the Department and Student"". The Club has made a name for itself with its activities on Finance, Marketing & Advertising, Leadership, Entrepreneurship etc. it organizes throughout Turkey. Providing opportunities for top executives and entrepreneurs of the future to discover their creativity, contributing to their personal development and giving them the opportunity to practice and gain experience sit at the core of the Club. Academic Advisor: Assoc. Prof.Dr. Seza Danışoğlu (Department of Business Administration) Club Room: FEAS Building B, Ground Floor', 'Student Club Name: AMATEUR ASTRONOMY CLUB\nStudent Club Description: In cooperation with astronomy enthusiasts and related institutions, the Club aims to develop astronomy studies in our country, organize seminars and observations to raise awareness among students in this regard, to translate the information in international sources and current news articles into our language, to provide people with information about celestial events, to ensure contact between members and astronomers, to provide the necessary information quickly and easily to those who are interested via our website, and to provide a nationwide sharing environment. Academic Advisor: Inst. Sedat Canlı (Central Laboratory) Club Room: Department of Physics, Ground Floor', ""Student Club Name: ILK-YAR SOCIETY\nStudent Club Description: The Society aims to provide education motivation to primary school students who continue their education in Boarding Primary Regional Schools (YIBO) especially in rural areas, towns and villages and to contribute to their education by increasing students' enthusiasm, interest and curiosity in reading. Academic Advisor: Prof. Dr. Zafer Bozkuş (Department of Civil Engineering) Club Room: NA"", 'Student Club Name: TURKISH FOLKLORE CLUB\nStudent Club Description: Since its establishment in 1961, the Club has been active without an interruption in four main ways, including folk dances, folk music, folk theater and local research. Among the activities organized are learning and teaching folk dances based on their origins; researching and displaying Orta Oyunu and theatrical village plays; folk music instrument training, notation, compilation and archival studies; researching the folk culture; seminars, panels and symposiums on folk science. The Club, which has more than twenty costumes in its wardrobe, has a rich library of books and magazines published about folk science. Academic Advisor: Assoc. Prof.Dr.Birten Çelik (Department of History) Club Room: THBT Building', 'Student Club Name: TURKISH CLASSICAL MUSIC CLUB\nStudent Club Description: The Club aims to represent the Turkish Classical Music, one of the most important parts of our culture, in a proper way and to organize Turkish Music Days, concerts, student choir workshops and instrument courses (oud, violin, qanun, reed flute, rhythm instrument, tanbur, clarinet) to introduce Turkish Classical Music to large groups including especially METU students, faculty members and personnel. Academic Advisor:\xa0Inst. Esra Eret\xa0(Center for Advancing Learning and Teaching) Club Room: KTMT Building', 'Student Club Name: MUSIC SOCIETY\nStudent Club Description: A few rock music groups consisting of students formed the Society. Since its establishment, the primary goal of the Society has been to allow amateur musicians to meet under one roof and make music. The Society that has developed and grown over time now became the meeting point of everyone who wants to play an active role in making music based on this aim. There is also a recording studio for Society students to continue their music activities. Academic Advisor: Assoc. Prof.Dr.Mustafa Gökhan Benli\xa0(Department of Mathematics) Club Room: Societies Container No:4', 'Student Club Name: ARCHITECTURE CLUB\nStudent Club Description: The Club aims to provide the necessary creative environment for the students of the Faculty of Architecture to ensure that the processes of informing, deciding, discussing and working collaboratively can be evaluated in a sound way and to help them discuss their opinions and projects in the social and cultural fields in a professional environment. Academic Advisor: Asst. Prof. Dr. Burak Büyükcivelek (Department of City and Regional Planning) Club Room: Faculty of Architecture', 'Student Club Name: CONTEMPORARY DANCE GROUP\nStudent Club Description: The Group aims to reach large masses through dance, the best way of expressing feelings, and to expand area of research through creativity, improvisation and choreography work, theoretical studies and presentations. Academic Advisor: Asst. Prof. Dr.Banu Cingöz Ulu (Department of Psychology) Club Room: 9th Dormitory, Ground Floor']","['49dc93c3-de8e-4211-9686-f463b4c9272b\n\nStudent Club Name: JAZZ CLUB\nStudent Club Description: The Club aims to provide jazz music education and a library for students who want to learn how to perform jazz music, to provide a comprehensive archive to jazz music listeners, to contribute to the recognition and listening of jazz music by more people, and to organize courses for students. Academic Advisor: Assoc. Inst. Figen Işık (Department of Industrial Design) Club Room: Club Containers No:8 \n']"," Assoc. Inst. Figen Işık serves as the academic advisor for the JAZZ CLUB. The club's objectives include providing jazz music education, creating a library for students who want to learn jazz music, contributing to the recognition and listening of jazz music by more people, and organizing courses for students. The club also aims to provide a comprehensive archive to jazz music listeners.","Assoc. Inst. Figen Işık serves as the Academic Advisor for the JAZZ CLUB. The club aims to provide jazz music education and a library for students interested in learning how to perform jazz music. It also seeks to create a comprehensive archive for jazz music listeners, contribute to the recognition and appreciation of jazz music among a wider audience, and organize courses for students.",1.0,0.9999999999,0.92,1.0,0.9823089634653066
"As the Student Housing Coordinator, could you elaborate on the criteria and processes involved in the evaluation of dormitory applications, particularly how the economic and social situations of applicants' families are assessed and how this information integrates with their academic performance in the YKS exam?","[""Evaluation of the Applications: The economic and social situation of each student's family who applies for dormitories is investigated through local administration units. This information obtained from the local authorities and the students' scores/rankings according to YKS are taken into consideration to create an overall score for each student in accordance with the criteria determined by the Executive Board of Dormitories and approved by the Rectorate. The results of applications are announced on the Office of Dormitories website. After learning their scores, students can learn when they can register for the dormitories and the dates for the next student placement through the announcement tables regarding registrations.\nThe students who have the following ranking success in YKS Exam are placed in the METU dormitories without further consideration of other criteria: ranking in the top 4,000 in Quantitative Field, ranking in the top 500 in Equal Weight Field, ranking in the top 300 in Verbal Field, and ranking in the top 100 in Foreign Language Field."", 'Student Club Name: JAPANESE CULTURE SOCIETY\nStudent Club Description: The Society aims to introduce the Japanese language and culture in METU, to inform and guide students in this regard, to improve the competencies of students in the Japanese language and to increase the communication among them. Academic Advisor: Asst.Prof.Dr. Meltem Şenol Balaban (Department of City and Regional Planning) Society Room: Clubs Container No:2', 'computer and plug, you should be able to connect to METU cable network. It is suggested for the users who utilize network connection in the dormitory regions to read the Dormitory Rooms Computer Network Rules.      You can visit https://faq.cc.metu.edu.tr/faq/how-can-i-find-out-about-source-my-network-connection-failure-dormitories\xa0if you have any problems connecting to the cable network. You can also\xa0send an IT support request via https://itsupport.metu.edu.tr', ""General Information: There are 19 dormitory buildings run by the METU Directorate of Health, Culture and Sports.\xa0\nMale students can stay in the Dormitories 2, 4, 6, 8, 9, and İsa Demiray Dormitory, in addition to a certain block allocated to them in Dormitory 19, and Refika Aksoy Dormitory. Female students can stay in the Dormitories 1, 3, 5, 7, and Faika Demiray Dormitory, in addition to a certain block allocated to them in Dormitory 19, and Refika Aksoy Dormitory.\nAs for the guest houses, Osman Yazıcı Guest House, Guest House 12, and Dormitory 16 are allocated for female students, while Faik Hızıroğlu Guest House and Guest House 15 are allocated for male students.\nThe Office of Dormitories, with the aim of solving our students' accommodation issues by offering a high standard service, obtained TSE-EN ISO 9001-2000 certificate of quality from the Turkish Standards Institution (TSE) in 2005. Regarding the quality of our dormitory services, the inspections carried out in 2021 in accordance with the TSE-EN ISO 9001:2015 standards were completed with success.\nThe services provided by our unit are carried out according to the procedures, instructions, duties, and responsibilities determined within the Dormitory Regulations, Student Discipline Regulations of the higher education institutions, decisions taken by the Executive Board of Dormitories, and the certificates of quality."", 'Registration Procedures Question: Who can apply to METU as an international student?', 'The Regulations in the Dorms: METU student dormitories are managed, run and controlled according to the rules in the Dormitory Regulations. The Dormitory Regulations can be read from bulletin boards of every dorm. We recommend our students to read these regulations.  Moreover, the written information about the regulations in the dorms is handed to the students during registrations to the dorms. \n\nGoing on Leave\n\nEvery student has the right to go on a leave for 15 days within a semester other than the weekends and holidays. The students, who will use their leave, should fill out a form, which can be obtained from the dormitory office. The students below the age of 18 should bring a note of permission from their parents to be able to use their leaves. The related form can be obtained from the Directorates of the Dormitories.\n\nLatest entrance hour to the Dormitories\n\nThe students residing at the dorms should be within the campus at 23.30. The latest time to enter the dorms is 24.00.\n\nStaying at the Dorms During Holidays\n\nThe students, whose education continue during the holidays (due to summer school, project, internship etc.), should present their reasons to stay with an authorized letter. \n\nSports Facilities\n\nAround the dormitories, there are basketball courts, volleyball grounds, football fields, tennis courts, open and closed swimming pools, and 2 gyms (which are open till 23.00) \n\nDormitory Address', 'Dormitory Address\n\nWhen the students use the dormitory address, they should indicate the number of the dormitory, the number of the room and the number of their bed.', 'Application for Dormitories: Students whose family resides outside of Ankara can apply for the dormitories. Students who start our university this year, if they want to stay in our dormitories, must fill out the dormitory-related sections on the YKS Registration Program website during their university registration process and thus complete their applications.', 'Facilities in the Dormitories: There is a mini-fridge in each room. For each student, a studying desk, a chair, a closet for clothes, and a closet for shoes are provided in each room. In addition, the dormitory offers students a bedding set consisting of bed sheet, blanket and pillow. Students can also bring and use their own bedding sets if they prefer to do so (but in this case, washing and cleaning these bedding sets will be their responsibility). In our dormitories, there are common studying rooms, TV rooms, laundry rooms, and kitchens as well as another common room for students of the Department of Architecture so that they can carry out their activities such as drawing. A sufficient number of automatic washing machines, dryers, irons, and ironing boards are available to students in the laundry rooms.\nThe bedding sets in the room are changed periodically, but if need be, they can be changed outside their regular cycle as well. These bedding sets are washed and ironed in the laundry room, where industrial washing machines are used. There is hot water in our dormitories ready for use 24/7.', 'The Units Subordinate to Office of Social Facilities: The accommodation units subordinate to Office of Social Facilities are listed below:\n\nGuest House\nAysel Sabuncu Yaşam Merkezi\nUludağ and Elmadağ Facilities\nGuest Residences\nPersonnel residences\n\nYou can find detailed information from the address http://stm.metu.edu.tr/']","[""feec27c5-58fb-40c4-9682-26cd10d661f9\n\nGeneral Information: There are 19 dormitory buildings run by the METU Directorate of Health, Culture and Sports.\xa0\nMale students can stay in the Dormitories 2, 4, 6, 8, 9, and İsa Demiray Dormitory, in addition to a certain block allocated to them in Dormitory 19, and Refika Aksoy Dormitory. Female students can stay in the Dormitories 1, 3, 5, 7, and Faika Demiray Dormitory, in addition to a certain block allocated to them in Dormitory 19, and Refika Aksoy Dormitory.\nAs for the guest houses, Osman Yazıcı Guest House, Guest House 12, and Dormitory 16 are allocated for female students, while Faik Hızıroğlu Guest House and Guest House 15 are allocated for male students.\nThe Office of Dormitories, with the aim of solving our students' accommodation issues by offering a high standard service, obtained TSE-EN ISO 9001-2000 certificate of quality from the Turkish Standards Institution (TSE) in 2005. Regarding the quality of our dormitory services, the inspections carried out in 2021 in accordance with the TSE-EN ISO 9001:2015 standards were completed with success.\nThe services provided by our unit are carried out according to the procedures, instructions, duties, and responsibilities determined within the Dormitory Regulations, Student Discipline Regulations of the higher education institutions, decisions taken by the Executive Board of Dormitories, and the certificates of quality.\nTherefore, every year, the Executive Board of Dormitories evaluates the dormitory applications of students based on the current capacity of dormitories, the number of applications, and the conditions for staying in the dormitories established in accordance with the aforementioned regulations and approved by the Rectorate. Then, the registration procedures of the students whose applications are accepted are conducted.\nWe endeavor to provide 24/7 uninterrupted service that includes an environment of respect, love, equality and trust in our dormitories with an understanding that prioritizes a service that is high-quality, transparent, modern but at the same time adherent to the traditions of METU, which can only be achieved with a team spirit.\n"", ""724187e7-850d-4891-b8fe-5cd62aceff6c\n\nEvaluation of the Applications: The economic and social situation of each student's family who applies for dormitories is investigated through local administration units. This information obtained from the local authorities and the students' scores/rankings according to YKS are taken into consideration to create an overall score for each student in accordance with the criteria determined by the Executive Board of Dormitories and approved by the Rectorate. The results of applications are announced on the Office of Dormitories website. After learning their scores, students can learn when they can register for the dormitories and the dates for the next student placement through the announcement tables regarding registrations.\nThe students who have the following ranking success in YKS Exam are placed in the METU dormitories without further consideration of other criteria: ranking in the top 4,000 in Quantitative Field, ranking in the top 500 in Equal Weight Field, ranking in the top 300 in Verbal Field, and ranking in the top 100 in Foreign Language Field.""]"," The evaluation of dormitory applications at METU involves several factors. Firstly, the economic and social situation of each student's family is investigated through local administration units. This information, along with the student's scores/rankings according to the YKS exam, is used to create an overall score for each student.

         Students who rank within specific ranges in the YKS exam are automatically placed in METU dormitories without further consideration. These ranges are: top 4,000 in Quantitative Field, top 500 in Equal Weight Field, top 300 in Verbal Field, and top 100 in Foreign Language Field.

         For students who do not meet these automatic placement criteria, their overall scores are compared, and the students with the highest scores are placed in the dormitories. The registration process for these students is carried out weekly, considering how many rooms and beds remain vacant.

         It's important to note that this process is subject to the current capacity of dormitories, the number of applications, and the conditions for staying in the dormitories established in accordance with the regulations and approved by the Rectorate.

         In summary, the evaluation of dormitory applications at METU is based on a combination of the student's YKS scores and their family's economic and social situation. The process is designed to ensure fairness and transparency while prioritizing students who demonstrate strong academic performance.","The evaluation of dormitory applications is a comprehensive process that takes into account both the economic and social situations of each student's family and their academic performance. To begin with, local administration units investigate the economic and social circumstances of the families of students applying for dormitory accommodation. This information is crucial as it helps to create a holistic view of each applicant's situation. Additionally, students' scores and rankings from the YKS exam are also considered. The Executive Board of Dormitories has established specific criteria, which are approved by the Rectorate, to create an overall score for each student based on the gathered information. The results of these evaluations are then announced on the Office of Dormitories website, allowing students to see their scores and learn about registration dates. Notably, students who achieve exceptional rankings in the YKS exam, such as being in the top 4,000 in the Quantitative Field or the top 100 in the Foreign Language Field, are placed in the METU dormitories without further consideration of other criteria. This dual approach ensures that both academic merit and socio-economic factors are taken into account in the allocation of dormitory spaces.",0.75,0.7499999999625,0.42,0.5625,0.9665653005090183
"ARCH460 ve ARCH466 dersleri, mimaride kültürel mirasın anlaşılmasına ve korunmasına nasıl katkıda bulunur?","['Course: HIST355\nDepartment: This course belongs to DEPARTMENT OF HISTORY.\nObjective: This course provides an introduction to key Ottoman chronicles from the end of the seventeenth century through the nineteenth. After covering an outline of these Ottoman sources and the ways of Ottoman history writing, excerpts from selected chronicles from each period will be initially deciphered. They will then be analyzed textually and contextually. \nContent:  This course provides an introduction to key Ottoman sources from the end of the eighteenth through the first quarter of the twentieth century.  After covering an outline of these Ottoman sources and Ottoman ways of writing history, chronicles from each period will be studied closely.', 'bulunup tanınması çalışmaları (1988-1990), Antakya kıyılarında yine topluluk tarafından bulunan 1600 yıllık iki batık gemi ve her birinde bulunan cam külçeler (1992/1993) ODTÜ Sualtı Topluluğu’nun Arkeoloji bilimine yaptığı katkıların ilkleridir. Bunlara ek olarak topluluğun 1992 yılında ilk kez Bozcaada’da düzenlediği “Sualtında Görüntü Avlama Yarışması” SAGAY, Türkiye’de düzenlenen ilk sualtı fotoğraf yarışması olmasının yanı sıra, Zıpkınla Balık Avcılığı Yerine Fotoğraf Makinesiyle Görüntü Avcılığı gibi anlamlı bir seçeneği sunarak Kuzey Ege’de “deniz parkları” kurulmasını ve işlemesini sağlamayı amaç edinmiştir. Son zamanlarda topluluk Türkiye Kıyıları Deniz Mağaraları Envanter Projesi, Kilikya Bölgesi Arkeolojik Yüzey Araştırması, Deniz Çayırlarının Yayılımının İncelenmesi, Uluburun III Yapay Resif Projesi, Serbest Dalış Denemeleri gibi önemli projeleri yürütmektedir. ODTÜ Sualtı Topluluğu Rektörlük makamına karşı sorumludur. Akademik Danışman ve beş öğrenciden oluşan yürütme kurulu, üç öğrenciden oluşan denetleme kurulu işleyişi sağlamakla görevlidir. Yürütme Kurulu ve Denetleme Kurulu Genel Kurula karşı sorumludur. Topluluğun Akdeniz Foku Araştırma Grubu (AFAG), Batık Araştırma Grubu (BAG), Ekoloji Grubu (EKOG), Fotografi ve Videografi Grubu (FOVAG), Mağara Dalışı ve Araştırma Grubu (MADAG) ve Serbest Dalış Grubu (SDG) gibi alt grupları ile çeşitli çalışma birimleri vardır.', 'Course: SOC429\nDepartment: This course belongs to DEPARTMENT OF SOCIOLOGY.\nObjective: No objective\nContent:  A Survey of the social organization and culture of the Turkic peoples from their first appearance in historical records to the modern era. The course will emphasize the Hsiung-nu, Göktürk, Uygur and other early Turkic states, but discussions will include historical migrations, current distribution and cultural continuities.', 'Course: ARCH419\nDepartment: This course belongs to DEPARTMENT OF ARCHITECTURE.\nObjective: No objective\nContent:  This course is an undergraduate survey focusing on the history of architecture of Anatolia from the Neolithic Period to the end of the Iron Ages. The principal aim is to provide students with a general knowledge of different architectural traditions of Pre-Classical Anatolia. The overall structure of the course is chronological. Architecture of the Neolithic Period, Early Bronze Age Troy, Assyrian Trade Colony Period, Hittite Empire, and the Kingdoms of Lycia, Phrygia will be investigated.', 'Course: HIST317\nDepartment: This course belongs to DEPARTMENT OF HISTORY.\nObjective: No objective\nContent:  I. Main trends of socio-political thoughts in Turkey during the late-19th and early 20th centuries: A.Ýslamism: i. Radical Ýslamists ii. Moderate islamists B. Turkism: C.  Westernism or Modernism: II. A comparative analysis of  these trends of thoughts and those governing the Turkish Revolution.', 'Content:  The course intends to outline administrative structure of the Ottoman Empire and concentrates on the Tanzimat Reforms, the intellectual discussions of the time; the Ottomanism, Islamism and Turkism. The collapse of the Ottoman Empire and the establishment of the nation states in the place of the Ottoman Empire are discussed. The double revolution; the National Liberation Movement of 1919-1923 and the establishment of republican regime, the Izmir economic Congress and the following economic policies of the republican regime are looked through. Intellectuals of the time, such as Ziya Gökalp, Yusuf Akçura, Ahmet Aðaoðlu, Ahmet Hamdi Baþar and the Kadro Movement, and their arguments regarding economic development policies as well as nationalism, are included among the topics. As to the foreign policy of the republican regime, the territorial settlements of the period from 1919 to 1923, the Mosul Question, the straits Question, the foreign policy approach of the republican regime, with particular references to the Balkan Pact of 1934 and the Sadabad Pact of 1937, are examined.', 'Course: HIST230\nDepartment: This course belongs to DEPARTMENT OF HISTORY.\nObjective: No objective\nContent:  A survey of contemporary Turkish history designed specifically for METUs exchange and visiting students. It covers the historical, political and cultural developments of modern Turkey from the late 19th century Ottoman Empire to the present. The course introduces historical and socio-political reasons for the establishment of the nation state and economic progress in Turkey and deals with issues of cultural exchange, religion, industrialisation and education.', 'Course: SOC461\nDepartment: This course belongs to DEPARTMENT OF SOCIOLOGY.\nObjective: No objective\nContent:  This course aims to cover the principal academic and political debates on Turkey\x92s social structure. Debates on the following issues are to be examined: The formation, consolidation and collapse of the Ottoman Empire; main paths in Ottoman modernisation; the foundation of the Republic; 1930s: present vs. past and inkilaps vs. traditions; the agents of the inkilap: the Turkish Hearths, the People\x92s Houses, and the Village Institutes; the transition to multi-party era and the true nature of Democratic Party; the 1960 Coup; Turkey as a feudal, Asiatic or capitalist society; the rise of political Islam and ethnic revival in 1990s.', 'Course: HIST233\nDepartment: This course belongs to DEPARTMENT OF HISTORY.\nObjective: No objective\nContent:  Focusing on the nomads, farmers and dervishes, the course will explore the Anatolian society before the rise of the Ottomans as an empire. Demographic, cultural as well as political and economic trends in Anatolia in the 12th to 15th centuries will be studied with readings in history, literature and arts.', 'Course: HIST401\nDepartment: This course belongs to DEPARTMENT OF HISTORY.\nObjective: At the end of this course the student will learn about: * the transition from the Ottoman Empire to the Republic of Turkey as part of an underlying process of transformation in the nineteenth century, namely modernization. * establishing necessary connection points to the Republican era. * the Tanzimat period, the Hamidian rule and the Second Constitutional era and their connection to the following Republican era \nContent:  The course analyzes selected readings from English and Turkish sources with particular emphasis on documents in the old script.']","[""Course: ARCH460\nDepartment: This course belongs to DEPARTMENT OF ARCHITECTURE.\nObjective: This elective course is offered to Final year Architecture students who would like to design high performance buildings with low environmental impacts. The aim is to use digital tools to aid building\xa0 design that can: - Increase human comfort by using appropriate technologies - Reduce a building's energy load by selecting appropriate building materials. - Reduce the\xa0environmental loads of a building by integrating appropriate energy resources \nContent:  The course objectives are to introduce students to a world-wide range of architectural concepts, focusing on appropriate and affordable solutions, in terms of choice of materials and technologies, to the extensive needs of the underdeveloped, developing and developed world.  The relevance of appropriate technology in certain current global issues, such as sustainability and ecological concerns, will be considered. "", 'Course: ARCH466\nDepartment: This course belongs to DEPARTMENT OF ARCHITECTURE.\nObjective: No objective\nContent:  A basic course of drawing and/or pointing to develop students ability to see, understand and express in visual ait, objects in space. ']","İşte ARCH460 ve ARCH466 dersleri, mimaride kültürel mirasın anlaşılmasına ve korunmasına nasıl katkıda bulunur.

        ARCH460, ""Modern Türkiye'nin Mimari Mirası"" adıyla adlandırılan bu ders, 20. yüzyılda Türkiye'de oluşan mimari mirasının belirlenmesi, anlaşılması ve korunmasına ait yöntemleri ele alır. Ders, mimari mirasının belirlenmesi için yöntemler, araştırma ve süreçler, belirleme ve katkılarının ayrıntılarını ele alır.

        ARCH466, ""Mimari Mirasının Korunması"" adıyla adlandırılan bu ders, mimari mirasının korunmasına yönelik yöntemleri ele alır. Ders, mimari mirasının korunması için yapılması gereken araştırma ve süreçler, belirleme ve katkılarının ayrıntılarını ele alır. Ders, mimari mirasının korunması için yapılması gereken tasarım, yapım, yönetim ve yönetim yöntemleri hakkında bilgi sağlar.

        Bu iki ders, mimaride kültürel mirasın anlaşılmasına ve korunmasına ait yöntemleri ele alır ve bu konuda bilgi sağlar.","ARCH460 dersi, düşük çevresel etkilere sahip yüksek performanslı binaların tasarımına odaklanmaktadır; bu, kültürel mirasın korunması için kritik öneme sahiptir çünkü tarihi alanları modern ihtiyaçları karşılayacak şekilde sürdürebilecek uygun teknolojilerin ve malzemelerin kullanımını vurgular. Sürdürülebilirlik ve ekolojik kaygıları entegre ederek, öğrenciler koruma ile çağdaş gelişim arasında bir denge kurmayı öğrenirler. Öte yandan, ARCH466 belirli bir amaca sahip olmamakla birlikte, öğrencilerin nesneleri mekanda görme ve ifade etme yeteneklerini geliştirmektedir; bu beceri, kültürel miras alanlarının mekansal niteliklerini anlamak için gereklidir ve koruma ile uyumlu yeniden kullanımına daha incelikli bir yaklaşım sağlar.",0.75,0.0,0.0,0.0,0.9208057160130181
WPA2 Enterprise ile PEAP/MSCHAPv2'yi destekleyen bir cihazla meturoam ağına bağlanmak için hangi adımlar izlenmelidir?,"['FAQ Answer:   Sayfanız için bir web hesabı ve alan adı gerekecektir. Bunun için\xa0https://cc-form.metu.edu.tr/web\xa0adresinde yer alan ""Yeni Web Kullanıcı Kodu ve Alan Adı Başvuru Formu""nu doldurmanız gerekmektedir. Başvurunuz üzerine sizinle iletişime geçilecektir. Web sitenizi aşağıdaki yöntemlerden biri ile oluşturabilirsiniz. Kendiniz Dreamweaver ya da benzeri bir programla web sayfalarınızı hazırlayabilirsiniz.\xa0 Merkezi İçerik Yönetim Sistemi\'ni (MİYS) kullanabilirsiniz. MİYS açık kaynaklı bir içerik yönetim sistemi olan Drupal alt yapısını kullanmaktadır. Üniversitemizdeki akademik bölüm, idari birim, merkez, enstitü, fakülte/yüksekokul, lisansüstü program, laboratuvar, proje/araştırma grubu, öğrenci topluluğu vb. yapılara ait web sayfaları bu sistem üzerinde oluşturulabilmektedir. MİYS ile ilgili ayrıntılı bilgiye ve başvuru formuna http://miys.metu.edu.tr adresinden erişebilirsiniz. Bu sistemi kullanırsanız MİYS kapsamında geçerli görsel kimlik standartlarına (http://www.metu.edu.tr/tr/gkk/gorsel-kimlik-standartlari) uymanız beklenmektedir. ODTÜ Blog Servisi\'ni kullanabilirsiniz. ODTÜ Blog Servisi, özgür bir yazılım olan WordPress altyapısını kullanmaktadır. Bu servis ile üniversitemizdeki akademik bölüm, idari birim, merkez, enstitü, fakülte/yüksekokul, lisansüstü program, laboratuvar, proje/araştırma grubu, öğrenci topluluğu vb. yapılara ait web siteleri kapsamlı bir şekilde hazırlanabilir, bu sitelerde çeşitli yazılar ve sayfalar oluşturulabilir. Tasarım için biraz', 'Student Club Name: TURKISH LANGUAGE SOCIETY\nStudent Club Description: METU Turkish Language Society is a society that works on the correct and proper use of Turkish primarily in the University and then all around. The Society is trying to present the Turkish equivalents of the words especially that have entered our language from foreign languages and to spread the use of these equivalents. Academic Advisor: Dr.Yücel Ünlü Aydın (Department of Turkish Language) Society Room: Society Containers', 'bulunup tanınması çalışmaları (1988-1990), Antakya kıyılarında yine topluluk tarafından bulunan 1600 yıllık iki batık gemi ve her birinde bulunan cam külçeler (1992/1993) ODTÜ Sualtı Topluluğu’nun Arkeoloji bilimine yaptığı katkıların ilkleridir. Bunlara ek olarak topluluğun 1992 yılında ilk kez Bozcaada’da düzenlediği “Sualtında Görüntü Avlama Yarışması” SAGAY, Türkiye’de düzenlenen ilk sualtı fotoğraf yarışması olmasının yanı sıra, Zıpkınla Balık Avcılığı Yerine Fotoğraf Makinesiyle Görüntü Avcılığı gibi anlamlı bir seçeneği sunarak Kuzey Ege’de “deniz parkları” kurulmasını ve işlemesini sağlamayı amaç edinmiştir. Son zamanlarda topluluk Türkiye Kıyıları Deniz Mağaraları Envanter Projesi, Kilikya Bölgesi Arkeolojik Yüzey Araştırması, Deniz Çayırlarının Yayılımının İncelenmesi, Uluburun III Yapay Resif Projesi, Serbest Dalış Denemeleri gibi önemli projeleri yürütmektedir. ODTÜ Sualtı Topluluğu Rektörlük makamına karşı sorumludur. Akademik Danışman ve beş öğrenciden oluşan yürütme kurulu, üç öğrenciden oluşan denetleme kurulu işleyişi sağlamakla görevlidir. Yürütme Kurulu ve Denetleme Kurulu Genel Kurula karşı sorumludur. Topluluğun Akdeniz Foku Araştırma Grubu (AFAG), Batık Araştırma Grubu (BAG), Ekoloji Grubu (EKOG), Fotografi ve Videografi Grubu (FOVAG), Mağara Dalışı ve Araştırma Grubu (MADAG) ve Serbest Dalış Grubu (SDG) gibi alt grupları ile çeşitli çalışma birimleri vardır.', 'FAQ Answer:   E-liste servisindeki altyapı gereği, kullanıcıların üye oldukları her bir e-liste için farklı e-liste şifreleri tanımlanmaktadır. Dileyen kullanıcılarımız kolaylık olması açısından, tüm e-listeler için ortak bir e-liste şifresi tanımlayabilirler. Bunun için aşağıdaki işlemlerin yapılması gerekmektedir. Not: Güvenlik önlemi olarak, merkezi kullanıcı kodları için kullanılan şifrelerin e-liste şifresi olarak kullanılmaması önerilmektedir. Bir kullanıcı öncelikle üye olduğu herhangi bir listeye gönderilmiş bir mesajın sonunda yer alan e-liste web arayüzü bağlantısını kullanarak o e-listenin ayarları ile ilgili değişikliklerin yapılabildiği sayfaya (http://mailman.metu.edu.tr/mailman/listinfo/liste_adi) girmelidir.  Bu sayfanın en alt bölümünde yer alan e-posta adresi bölümüne, bu e-listeye üye olmak için kullandığı e-posta adresini yazarak, _x0093_Listeden çık veya seçeneklerimi düzenle_x0094_ isimli butona tıklamalıdır.  Eğer e-liste şifresi daha önceden girilmiş ise, aşağıdaki şekilde olduğu gibi e-liste üyelik ayarlarının değiştirilebildiği ekran görünecektir. Aksi durumda, e-liste şifresi kullanılarak giriş yapılmalıdır:  Üye olduğu tüm e-listelere yönelik ortak bir şifre tanımlamak isteyen kullanıcı bu sayfada yer alan _x0093_Şifre Değişimi_x0094_ bölümüne mevcut e-liste şifresini veya kullanmak istediği herhangi bir şifreyi yazıp, _x0093_Şifremi Değiştir_x0094_ butonuna _x0093_Global Olarak Değiştir_x0094_ seçeneği seçili olacak şekilde tıklamalıdır.  Bu', 'FAQ Answer:   English version will be available soon. 24 Ekim 2007 tarih ve 26680 sayılı Resmi Gazete\'de yayınlanan yönetmeliğe göre, ""Yer sağlayıcı trafik bilgisi, İnternet ortamındaki her türlü yer sağlamaya ilişkin olarak; kaynak IP adresi, hedef IP adresi, bağlantı tarih-saat bilgisi, istenen sayfa adresi, işlem bilgisi (GET, POST komut detayları) ve sonuç bilgisi gibi bilgileri ifade etmektedir."" Tanımlanan bu bilgiye, bir hukuksal incelemede kullanılmak üzere yer sağlayıcılık faaliyetleri kapsamındaki bir faaliyetin kim tarafından yapıldığının tespiti için ihtiyaç duyulmaktadır. l) Örnek ""http"" logu: Aşağıda yer sağlayıcı faaliyet kapsamında bir web sayfasının bulunduğu sunucunun ilgili örnek trafik logu (http logu) gösterilmiştir. Bu log, ""apache"" web sunucu yazılımının ürettiği bir log örneğidir. Birimlerde kullanılan farklı web sunucu yazılımları için, yazılımların belgelerine başvurulması ve uygun log tutulması için hangi işlemlerin yapılmasının gerekli olduğunun öğrenilmesi gerekmektedir. 144.122.222.234 - - [21/Mar/2008:14:58:01 -0200] ""GET \'data/liste.html HTTP/1.1"" 200""1 73372 ""-"" ""Mozilla/5.0 (XII: U; Lınux i686; en-L\'S; rv:1.8.1.12) Gecko/20080129 Iceweasel/2.0.0.12(Debian-2.0.0.12-Oetchl)""  Yukarıdaki örnekte yer alan bilgi alanları, kanunda belirtilen başlıklarla aşağıdaki şekilde ilişkilendirilmiştir: Kaynak IP adresi : 144.122.222.234 Hedef ip adresi: Bu kayıtta bulunmamaktadır"" Bağlantı tarih-saat bilgisi: [21/Mar/2008:14:58:01 -0200] İstenen sayfa', 'bir şifreyi yazıp, _x0093_Şifremi Değiştir_x0094_ butonuna _x0093_Global Olarak Değiştir_x0094_ seçeneği seçili olacak şekilde tıklamalıdır.  Bu işlem başarılı bir şekilde gerçekleştirildiği takdirde, ekranda _x0093_Şifre başarıyla değiştirildi._x0094_ şeklinde bir mesaj görüntülenir. Kullanıcı tarafından tanımlanan yeni şifre artık aynı e-posta adresi ile üye olunan mevcut tüm e-listelerde kullanılabilir. Şifre değiştirme işlemi sırasında _x0093_Global Olarak Değiştir_x0094_ seçeneği seçili olmadığı durumda, sadece söz konusu e-listenin şifresi değiştirilmiş olur. ""Global Olarak Değiştir"" seçeneği ile kullanıcının o ana kadar üye olduğu tüm listelerin şifreleri değiştirilir. Bu işlem sonrasında üye olunacak yeni e-listelerde de aynı şifrenin kullanılabilmesi için bu işlemin her üyelikten sonra tekrarlanması gerekir. Bu işlem yapılmadığında yeni üye olunan e-listelerde, üye olurken Mailman tarafından otomatik olarak tanımlanıp kullanıcıya gönderilen şifreler kullanılır.', 'sebeplerle ilgili olarak abc-l-ownermetu.edu.tr adresinden liste yöneticisi ile iletişime geçebilir, detaylı bilgi alabilirsiniz.  (Yukarıda geçen ""abc-l"" ifadesi liste ismi için örnek olarak verilmiştir)', 'ayarları ISO-8859-9 (Türkçe ISO olarak da tanımlanır) ya da UTF-8 seçmeniz yeterlidir. Size gelen e-postalardaki Türkçe karakterleri görmekte sorun yaşıyorsanız iki farklı durum sözkonusu olabilir. Karşı taraf e-posta gönderirken ya da kendisine gelen e-postayı yönlerken Türkçe karakterleri desteklemeyen bir karakter seti kullanmıştır. Bu durumda gelen mesaj düzgün olarak görüntülenemez. Örneğin metinde Türkçe karakter kullanıldığı halde gönderilirken ISO-8859-1 karakter seti kullanılmış ise söz konusu karakter seti Türkçe karakterleri desteklemediği için e-postanın düzgün olarak görüntülenmesi mümkün değildir. Gönderilen e-posta düzgün karakter seti ile gönderilmiş olmasına karşın kullandığınız programın ayarları farklı olabilir. Bu durumda kullanılan programın ayarlarının değiştirilmesi mesajın düzgün şekilde okunmasını sağlayacaktır. Horde ya da Squirrelmail kullanarak e-posta okuyan kullanıcılarımızın kullandıkları tarayıcı programında, Outlook Express, Thunderbird ya da Windows Mail benzeri herhangi bir POP3/IMAP istemcisi ile e-posta gönderen kullanıcılarımızın ise ilgili programdaki karakter seti ayarlarını değiştirmeleri gerekmektedir. Gelen e-postalar için karakter seti değişikliği yapmak için farklı programlarda izlenen yol aşağıdaki gibidir (aşağıda yer almayan farklı programlar için de karakter seti ayarları benzer yerlerdedir): Internet Explorer, Outlook Express ve Windows Mail için: View → Encoding (Görünüm → Kodlama) Mozilla Firefox ve Mozilla Thunderbird', 'ODTÜ’nün değil Türkiye’nin değerli bir yarışması haline gelen bu organizasyona her sene 20 farklı ülkeden 400’ü aşkın sporcu ve 5000 dans severi ağırlamaktadır. Uluslararası platformlarda da övgüler almaya devam eden ve 16.sını 4-5 Kasım 2017 tarihlerinde gerçekleştireceğimiz METU OPEN son 3 senedir tüm Uluslararası Yarışmalar arasında ilk 10’da yer almaktadır.', 'FAQ Question: Bölüm, Birim, Merkez, Laboratuvar, Öğrenci Topluluğu web sayfası nasıl yapılır?']","['FAQ Question: How can I connect to meturoam network?\nFAQ Answer: A device must support WPA2 Enterprise with PEAP/MSCHAPv2 in order to be able to connect to METU wireless network, meturoam. Please click here: https://faq.cc.metu.edu.tr/faq/which-devices-are-known-not-support-meturoam for a list of some popular devices that are known to NOT work on the meturoam wireless network. To connect to the meturoam wireless network, you need a METU usercode and a password for meturoam. If you have a password, please continue to HOW-TO  section. If you didn\'t create a password for meturoam or you want to renew your password, please visit https://netregister.metu.edu.tr and click Wireless icon, then click ""meturoam"" icon.  In the meturoam menu, please provide a new password to be used only for this service with your user code. (In some Android and IOS devices, some special characters like #, \', $ in the password may cause problems to connect to meturoam. If you can connect to meturoam via a computer but having problems with Android or IOS devices, please check your password for special characters and create a new password with other characters.)    Connecting to meturoam After you set your new password, please connect to meturoam SSID from your wireless device. You can use this password with every device you own, you do not have to set passwords for each device. Be sure to set the protocols as PEAP and MSCHAPv2.  Use your METU usercode and password for the meturoam service. (Please make sure you use your usercode like e123456metu.edu.tr, not your email aliases in the form of name.surnamemetu.edu.tr) In Windows 10, protocol settings are done automatically. You do not need to set the protocols. For Linux operating systems or Windows 7 and below, you may also need to select WPA2-Enterprise and AES. In mobile devices, if you use the autocomplete function in your keyboard, a blank space may be added to your usercode. Pay attention to last character in your usercode. It should not be a blank space. If you are asked for a certificate, you may select ""Do not validate"" and skip it. (For some Android devices, certificate field might be compulsory. You can select ""Use System Certificate"" and type border.metu.edu.tr netlogin.metu.edu.tr) If you are asked for anonymous identity, you may type anonymous@metu.edu.tr.  For Raspberry pi devices, add the following conf to wpa_supplicant.conf file.network={ssid=""meturoam""key_mgmt=WPA-EAPpairwise=CCMPeap=PEAPidentity=""< username >""anonymous_identity=""anonymous@metu.edu.tr""password=""< password >""} Then restart wpa_supplicant. Actual filenames and paths may vary.killall wpa_supplicantwpa_supplicant -B -Dwext -i wlan0 -c /etc/wpa_supplicant/wpa_supplicant.conf -f /var/log/wpa_supplicant.log      If you forgot your password, you can set a new one in order to use the wireless network. Those users who do not prefer to create a meturoam password can also connect to eduroam. !!! Wireless network connection problems are observed in some of Android devices using Android 6 and prior versions. Occasionally these devices display there is an established wireless connection on the screen but when you try to connect to the Internet, they fail. This problem is originated from a bug in the operating system. The bug cause Android devices to continue to use DHCP-leased IP addresses after the leases expire, and cause Android devices to resume using IP addresses from expired DHCP leases. When you face the the same problem please disable your Wi-Fi connection and enable it again.  \nFAQ Link: https://faq.cc.metu.edu.tr/faq/meturoam\n', 'FAQ Question: How can I connect to eduroam wireless network using my Mac computer?\nFAQ Answer:   You can connect to eduroam by downloading and executing the configuration file to your iOS device. Download configuration file for iOS devices. on User Account option, user_namemetu.edu.tr\xa0and password should be entered. \xa0 Please follow the steps below if you would like to create the configuration file by using your MAC OSX device. \xa0To connect to the eduroam network, please install Apple Configurator from AppStore.  Run the application and click Start Preparing Devices.  \xa0 \xa0 Activate Supervision. (Turn ON) \xa0  \xa0 \xa0  Click + at the bottom of the window and select\xa0Create New Profile\xa0in the menu. \xa0  \xa0 \xa0 In the popup window, click Wifi and then\xa0configure. \xa0  \xa0 \xa0 Type eduroam\xa0and select WPA/WPA2 Enterprise\xa0in the Security Type combo box.  \xa0 \xa0 Select TTLS under\xa0Accepted EAP types heading. \xa0  \xa0 \xa0 Type your METU user name and password. Then, select PAP in the\xa0Inner Authentication heading and click\xa0Save to save the profile. \xa0  \xa0 Click on the profile name and export it to your computer by clicking the + at the bottom of the window.  \xa0 \xa0 \xa0 \xa0  \xa0 Locate the exported profile and install it to your computer double clicking it. \xa0 \xa0  \xa0  \xa0  \xa0 \xa0  \xa0 \xa0  \nFAQ Link: https://faq.cc.metu.edu.tr/faq/how-can-i-connect-eduroam-wireless-network-using-my-mac-computer\n']","İlk adımlarınızı şunlar olacaktır:

        1. METU'nun web sitesinde (https://cc.metu.edu.tr) meturoam'a tıklayın.
        2. ""Meturoam"" sekmesine gidin.
        3. ""Kullanıcılarım"" sekmesine tıklayın.
        4. ""Kayıt Ol"" butonuna tıklayın.
        5. ""Yeni Kullanıcı Kaydol"" formunu doldurun.
        6. Kullanıcı adınızı, e-posta adresinizi ve şifrenizi girin.
        7. ""Kaydol"" butonuna tıklayın.
        8. E-posta adresinize gönderilen onay linkine tıklayın.
        9. Şifrenizi değiştirin.

        Bu işlemleri başarılı bir şekilde gerçekleştirdikten sonra, cihazınız meturoam ağına bağlayabilirsiniz.

        Cihazınızın PEAP/MSCHAPv2 desteğini ve WPA2 Enterprise desteğini sağlayıp, METU'nun verilen kullanıcı adınızı ve şifrenizi girerek bağlanabilirsiniz.","Meturoam ağına bağlanmak için şu adımları izleyin: Öncelikle, cihazınızın PEAP/MSCHAPv2 ile WPA2 Enterprise'ı desteklediğinden emin olun. Meturoam için bir METU kullanıcı koduna ve bir şifreye ihtiyacınız olacak. Eğer şifreniz yoksa veya yenilemeniz gerekiyorsa, https://netregister.metu.edu.tr adresini ziyaret edin, Kablosuz simgesine tıklayın ve ardından 'meturoam' simgesine tıklayarak yeni bir şifre oluşturun. Şifrenizde özel karakterlere dikkat edin, çünkü bazı Android ve iOS cihazları #, ', veya $ gibi karakterler içeriyorsa bağlanmada sorun yaşayabilir. Yeni şifrenizi ayarladıktan sonra, cihazınızda meturoam SSID'sine bağlanın. METU kullanıcı kodunuzu (e123456metu.edu.tr formatında) ve az önce oluşturduğunuz şifreyi kullanın. Windows 10 için protokol ayarları otomatik olarak yapılır. Linux veya Windows 7 ve altı için, WPA2-Enterprise ve AES'i seçtiğinizden emin olun. Eğer bir sertifika istenirse, 'Do not validate' veya 'Use System Certificate' seçeneğini seçebilir ve border.metu.edu.tr veya netlogin.metu.edu.tr yazabilirsiniz. Eğer anonim bir kimlik istenirse, anonymous@metu.edu.tr yazın. Sorunlarla karşılaşırsanız, özellikle Android cihazlarda, Wi-Fi bağlantınızı devre dışı bırakmayı ve tekrar etkinleştirmeyi deneyin.",1.0,0.0,0.26,0.0,0.9406454053889843
ODTÜ JONGLÖRLER TOPLULUĞU'nun Türkiye'deki ana hedefi nedir?,"['ODTÜ’nün değil Türkiye’nin değerli bir yarışması haline gelen bu organizasyona her sene 20 farklı ülkeden 400’ü aşkın sporcu ve 5000 dans severi ağırlamaktadır. Uluslararası platformlarda da övgüler almaya devam eden ve 16.sını 4-5 Kasım 2017 tarihlerinde gerçekleştireceğimiz METU OPEN son 3 senedir tüm Uluslararası Yarışmalar arasında ilk 10’da yer almaktadır.', 'Sports Club Name: ODTÜ JONGLÖRLER TOPLULUĞU\nSports Club Description: Türkiye’deki tek aktif üniversite jonglörlük topluluğu olan OJT’nin amacı, okul içinde gösteriler yaparak okul ortamına renk katmak, jonglörlük ve flow sanatları hakkında çalıştaylar vermek ve çeşitli organizasyonlarda gösteriler yaparak insanlara okulumuzu ve çağdaş sirk sanatlarını tanıtmaktır.', 'FAQ Answer:   Eğer söz konusu liste ""tek yönlü duyuru listesi"" ise, liste yapılandırması gereği e-posta gönderme yetkisine sahip kişiler haricinde hiç bir kullanıcı mesaj gönderememektedir. Ancak üyelerin e-posta gönderebildiği bir liste söz konusu ise, gönderdiginiz mesajlarin listeye ulaşmamasının iki temel sebebi vardır: Listeye üyelik için kullanmadığıniz bir e-posta adresinden mesaj gönderiyor olabilirsiniz. Genelde birden fazla e-posta adresi kullanıyorsanız ve üye olan adresten farklı bir adrese yönlendirme tanımladıysanız, liste mesajlarini aldığınız e-posta adresi ile üyelik için kullandığınız e-posta adresi farklı olabilir. Mesajları aldığınız e-posta adresinin listeye üye olarak kayıtlı olup olmadığını kontrol etmesi için abc-l-ownermetu.edu.tr adresinden liste yöneticisiyle iletişime geçiniz. Listeye üyelik için kullandığınız e-posta adresinden mesaj gönderiyorsanız mesajiniz onay bekliyor olabilir. Mesajinızın onay için bekletiliyor olmasının olası sebepleri aşağıda listelenmiştir: Gönderdiğiniz mesaj liste mesaj kotasını aşan bir büyüklüğe sahip olabilir (örneğin; çok büyük bir dosya eklentisi gönderiyor olabilirsiniz). Mesajınızın alıcı adresi bölümünde liste adıyla beraber çok sayıda e-posta adresini yazmış olabilirsiniz. Mesajiniz liste ayarları gereği moderatör onayı için bekletiliyor olabilir. Tüm bu olası sebeplerle ilgili olarak abc-l-ownermetu.edu.tr adresinden liste yöneticisi ile iletişime geçebilir, detaylı bilgi alabilirsiniz.  (Yukarıda geçen', 'Course: SOC429\nDepartment: This course belongs to DEPARTMENT OF SOCIOLOGY.\nObjective: No objective\nContent:  A Survey of the social organization and culture of the Turkic peoples from their first appearance in historical records to the modern era. The course will emphasize the Hsiung-nu, Göktürk, Uygur and other early Turkic states, but discussions will include historical migrations, current distribution and cultural continuities.', 'vb. yapılara ait web siteleri kapsamlı bir şekilde hazırlanabilir, bu sitelerde çeşitli yazılar ve sayfalar oluşturulabilir. Tasarım için biraz daha esnek olsa da serviste yer alan şablonlar dışında kalan harici bir şablona onay verilmemektedir. Servise giriş yapmak ve servis hakkında ayrıntılı bilgi almak için\xa0http://blog.metu.edu.tr\xa0adresi kullanılmalıdır.', 'bir şifreyi yazıp, _x0093_Şifremi Değiştir_x0094_ butonuna _x0093_Global Olarak Değiştir_x0094_ seçeneği seçili olacak şekilde tıklamalıdır.  Bu işlem başarılı bir şekilde gerçekleştirildiği takdirde, ekranda _x0093_Şifre başarıyla değiştirildi._x0094_ şeklinde bir mesaj görüntülenir. Kullanıcı tarafından tanımlanan yeni şifre artık aynı e-posta adresi ile üye olunan mevcut tüm e-listelerde kullanılabilir. Şifre değiştirme işlemi sırasında _x0093_Global Olarak Değiştir_x0094_ seçeneği seçili olmadığı durumda, sadece söz konusu e-listenin şifresi değiştirilmiş olur. ""Global Olarak Değiştir"" seçeneği ile kullanıcının o ana kadar üye olduğu tüm listelerin şifreleri değiştirilir. Bu işlem sonrasında üye olunacak yeni e-listelerde de aynı şifrenin kullanılabilmesi için bu işlemin her üyelikten sonra tekrarlanması gerekir. Bu işlem yapılmadığında yeni üye olunan e-listelerde, üye olurken Mailman tarafından otomatik olarak tanımlanıp kullanıcıya gönderilen şifreler kullanılır.', 'bulunup tanınması çalışmaları (1988-1990), Antakya kıyılarında yine topluluk tarafından bulunan 1600 yıllık iki batık gemi ve her birinde bulunan cam külçeler (1992/1993) ODTÜ Sualtı Topluluğu’nun Arkeoloji bilimine yaptığı katkıların ilkleridir. Bunlara ek olarak topluluğun 1992 yılında ilk kez Bozcaada’da düzenlediği “Sualtında Görüntü Avlama Yarışması” SAGAY, Türkiye’de düzenlenen ilk sualtı fotoğraf yarışması olmasının yanı sıra, Zıpkınla Balık Avcılığı Yerine Fotoğraf Makinesiyle Görüntü Avcılığı gibi anlamlı bir seçeneği sunarak Kuzey Ege’de “deniz parkları” kurulmasını ve işlemesini sağlamayı amaç edinmiştir. Son zamanlarda topluluk Türkiye Kıyıları Deniz Mağaraları Envanter Projesi, Kilikya Bölgesi Arkeolojik Yüzey Araştırması, Deniz Çayırlarının Yayılımının İncelenmesi, Uluburun III Yapay Resif Projesi, Serbest Dalış Denemeleri gibi önemli projeleri yürütmektedir. ODTÜ Sualtı Topluluğu Rektörlük makamına karşı sorumludur. Akademik Danışman ve beş öğrenciden oluşan yürütme kurulu, üç öğrenciden oluşan denetleme kurulu işleyişi sağlamakla görevlidir. Yürütme Kurulu ve Denetleme Kurulu Genel Kurula karşı sorumludur. Topluluğun Akdeniz Foku Araştırma Grubu (AFAG), Batık Araştırma Grubu (BAG), Ekoloji Grubu (EKOG), Fotografi ve Videografi Grubu (FOVAG), Mağara Dalışı ve Araştırma Grubu (MADAG) ve Serbest Dalış Grubu (SDG) gibi alt grupları ile çeşitli çalışma birimleri vardır.', 'ayarları ISO-8859-9 (Türkçe ISO olarak da tanımlanır) ya da UTF-8 seçmeniz yeterlidir. Size gelen e-postalardaki Türkçe karakterleri görmekte sorun yaşıyorsanız iki farklı durum sözkonusu olabilir. Karşı taraf e-posta gönderirken ya da kendisine gelen e-postayı yönlerken Türkçe karakterleri desteklemeyen bir karakter seti kullanmıştır. Bu durumda gelen mesaj düzgün olarak görüntülenemez. Örneğin metinde Türkçe karakter kullanıldığı halde gönderilirken ISO-8859-1 karakter seti kullanılmış ise söz konusu karakter seti Türkçe karakterleri desteklemediği için e-postanın düzgün olarak görüntülenmesi mümkün değildir. Gönderilen e-posta düzgün karakter seti ile gönderilmiş olmasına karşın kullandığınız programın ayarları farklı olabilir. Bu durumda kullanılan programın ayarlarının değiştirilmesi mesajın düzgün şekilde okunmasını sağlayacaktır. Horde ya da Squirrelmail kullanarak e-posta okuyan kullanıcılarımızın kullandıkları tarayıcı programında, Outlook Express, Thunderbird ya da Windows Mail benzeri herhangi bir POP3/IMAP istemcisi ile e-posta gönderen kullanıcılarımızın ise ilgili programdaki karakter seti ayarlarını değiştirmeleri gerekmektedir. Gelen e-postalar için karakter seti değişikliği yapmak için farklı programlarda izlenen yol aşağıdaki gibidir (aşağıda yer almayan farklı programlar için de karakter seti ayarları benzer yerlerdedir): Internet Explorer, Outlook Express ve Windows Mail için: View → Encoding (Görünüm → Kodlama) Mozilla Firefox ve Mozilla Thunderbird', 'Content:  The course intends to outline administrative structure of the Ottoman Empire and concentrates on the Tanzimat Reforms, the intellectual discussions of the time; the Ottomanism, Islamism and Turkism. The collapse of the Ottoman Empire and the establishment of the nation states in the place of the Ottoman Empire are discussed. The double revolution; the National Liberation Movement of 1919-1923 and the establishment of republican regime, the Izmir economic Congress and the following economic policies of the republican regime are looked through. Intellectuals of the time, such as Ziya Gökalp, Yusuf Akçura, Ahmet Aðaoðlu, Ahmet Hamdi Baþar and the Kadro Movement, and their arguments regarding economic development policies as well as nationalism, are included among the topics. As to the foreign policy of the republican regime, the territorial settlements of the period from 1919 to 1923, the Mosul Question, the straits Question, the foreign policy approach of the republican regime, with particular references to the Balkan Pact of 1934 and the Sadabad Pact of 1937, are examined.', 'ürettiği log dosyasının örneği aşağıda verilmiştir. Tutulan log bilgisinde, bağlantı yapan bilgisayarın adresi, hedef dosya ve kullanıcı adı bilgileri bulunmalıdır. Tue Mar 25 16:39:48 2008 0 bogus.com 528 /ftp/pub/IMPORTANT-WARNING.txt b _ o r anonim ftp 1 * c  Yukarıdaki örnekte yer alan bilgi alanları, kanunda belirtilen başlıklarla aşağıdaki şekilde ilişkilendirilmiştir: Bağlantı tarih-saat bilgisi: ""Tue Mar 25 16:39:48 2008""  Kaynak Adres: ""bogus.com""  İstenen dosya: ""ftp/pub/IMPORTANT-WARNING.txt""  Kullanıcı adı: ""anonim""  Birimler, yer sağlayıcı faaliyetleri kapsamında verdikleri servislerin ürettiği logları inceleyip, sahip oldukları sistemlerde verdikleri servislerin yarattığı trafik loglarını yönetmelikte tarif edildiği şekilde (zaman damgası ile birlikte) kayıt altına almak, bu logları, gizliliğini sağlayarak arşivlemekle yükümlüdür.']","['Sports Club Name: ODTÜ JONGLÖRLER TOPLULUĞU\nSports Club Description: Türkiye’deki tek aktif üniversite jonglörlük topluluğu olan OJT’nin amacı, okul içinde gösteriler yaparak okul ortamına renk katmak, jonglörlük ve flow sanatları hakkında çalıştaylar vermek ve çeşitli organizasyonlarda gösteriler yaparak insanlara okulumuzu ve çağdaş sirk sanatlarını tanıtmaktır.\n']","İşte ODTÜ Jonglörler Topluluğu'nun Türkiye'deki ana hedefi: Okul içinde gösteriler yaparak okul ortamına renk katmak, jonglörlük ve flow sanatları hakkında çalıştaylar vermek ve çeşitli organizasyonlarda gösteriler yaparak insanlara okulumuzu ve çağdaş sirk sanatlarını tanıtmaktır.","ODTÜ JONGLÖRLER TOPLULUĞU, Türkiye’deki tek aktif üniversite jonglörlük topluluğu olarak, okul içinde gösteriler yaparak okul ortamına renk katmak, jonglörlük ve flow sanatları hakkında çalıştaylar vermek ve çeşitli organizasyonlarda gösteriler yaparak insanlara okulumuzu ve çağdaş sirk sanatlarını tanıtmaktır.",1.0,0.49999999995,0.67,1.0,0.9652857657193078
ATATÜRK'ün DÜŞÜNCE KULÜBÜ ve IEEE METU ÖĞRENCİ TOPLULUĞU'nun Elektrik ve Elektronik Mühendisliği Bölümü içindeki ana hedefleri nelerdir?,"[""Student Club Name: ATATURK's THOUGHT CLUB\nStudent Club Description: The Club was established to better know and promote Atatürk and his ideology and to be able to interpret Kemalism, a 20th century ideology, based on the changing conditions of this era and to be able to bring new initiatives to this ideology. The Club also aims to examine Atatürk's reforms and principles, the current conclusions and social implications of the reforms and to conduct scientific research on these issues. Academic Advisor:\xa0Dr.Ahmet Cemal Durgun\xa0(Department of Electrical and Electronics Engineering) Club Room: Department of Physics, Ground Floor"", 'bir şifreyi yazıp, _x0093_Şifremi Değiştir_x0094_ butonuna _x0093_Global Olarak Değiştir_x0094_ seçeneği seçili olacak şekilde tıklamalıdır.  Bu işlem başarılı bir şekilde gerçekleştirildiği takdirde, ekranda _x0093_Şifre başarıyla değiştirildi._x0094_ şeklinde bir mesaj görüntülenir. Kullanıcı tarafından tanımlanan yeni şifre artık aynı e-posta adresi ile üye olunan mevcut tüm e-listelerde kullanılabilir. Şifre değiştirme işlemi sırasında _x0093_Global Olarak Değiştir_x0094_ seçeneği seçili olmadığı durumda, sadece söz konusu e-listenin şifresi değiştirilmiş olur. ""Global Olarak Değiştir"" seçeneği ile kullanıcının o ana kadar üye olduğu tüm listelerin şifreleri değiştirilir. Bu işlem sonrasında üye olunacak yeni e-listelerde de aynı şifrenin kullanılabilmesi için bu işlemin her üyelikten sonra tekrarlanması gerekir. Bu işlem yapılmadığında yeni üye olunan e-listelerde, üye olurken Mailman tarafından otomatik olarak tanımlanıp kullanıcıya gönderilen şifreler kullanılır.', 'Course: ECON460\nDepartment: This course belongs to DEPARTMENT OF ECONOMICS.\nObjective: The main objective of the course is to increase student knowledge and understanding of the Turkish economy.The history of the Tukish economy is analyzed and evaluated critically. In this way it is possible to understand the current developments in the economy.\xa0 \nContent:  Overall structure of the economy; sources and use of income; economy of government; main sectors; agriculture, industry, services; income distribution; regional dispersion of economic activities.', 'Course: ID121\nDepartment: This course belongs to DEPARTMENT OF INDUSTRIAL DESIGN.\nObjective: By the end of the course the students will:  understand the local historical context of industrial design education and profession show concern for ethical conduct in professional practice show concern for the larger socio-cultural and environmental context of professional practice comprehend the artistic aspects of design works understand the basics of intellectual property and design protection law understand the alternative career paths and emerging approaches in professional practice  \nContent:  Historical development of industrial design as a discipline and profession in Turkey. Ethical thinking and professional ethics in reference to industrial design. Introduction to intellectual property rights and design registration in Turkey. Aesthetic judgment, kitsch, art, craft and design. Design for sustainability and social innovation, emerging approaches and trends in design practice. Industrial design profession as practiced in Turkey discussed by guest designers from various sectors.', 'Sports Club Name: ODTÜ İZCİLİK TOPLULUĞU\nSports Club Description: Topluluğumuz kurulduğu 1986 yılından itibaren dünya çapında her yaştan gönüllüsü bulunan bir gençlik hareketi olan izciliğin üniversitemizde de mümkün olan en çok sayıda kişiye ulaşması için çalışmaktadır. Üyelerimizin izcilik bilincinde kendilerine ve topluma faydalı bireyler olarak yetişmesi önceliklerimiz arasındadır. Bu amaçlar doğrultusunda sene boyunca aktif olarak etkinlikler ve kamplar düzenleriz. Eğitim programımızı tamamlamış olan üyelerimiz doğada yaşam ve kamp yapma alanlarında donanımlı hale gelmiş olurlar. Sosyal sorumluluk projelerimizle de hem üyelerimizi hem üniversite bünyesinde ulaşabildiğimiz herkesi bilinçlendirmek te amaçlarımız arasındadır.', 'ODTÜ’nün değil Türkiye’nin değerli bir yarışması haline gelen bu organizasyona her sene 20 farklı ülkeden 400’ü aşkın sporcu ve 5000 dans severi ağırlamaktadır. Uluslararası platformlarda da övgüler almaya devam eden ve 16.sını 4-5 Kasım 2017 tarihlerinde gerçekleştireceğimiz METU OPEN son 3 senedir tüm Uluslararası Yarışmalar arasında ilk 10’da yer almaktadır.', 'Content:  The course intends to outline administrative structure of the Ottoman Empire and concentrates on the Tanzimat Reforms, the intellectual discussions of the time; the Ottomanism, Islamism and Turkism. The collapse of the Ottoman Empire and the establishment of the nation states in the place of the Ottoman Empire are discussed. The double revolution; the National Liberation Movement of 1919-1923 and the establishment of republican regime, the Izmir economic Congress and the following economic policies of the republican regime are looked through. Intellectuals of the time, such as Ziya Gökalp, Yusuf Akçura, Ahmet Aðaoðlu, Ahmet Hamdi Baþar and the Kadro Movement, and their arguments regarding economic development policies as well as nationalism, are included among the topics. As to the foreign policy of the republican regime, the territorial settlements of the period from 1919 to 1923, the Mosul Question, the straits Question, the foreign policy approach of the republican regime, with particular references to the Balkan Pact of 1934 and the Sadabad Pact of 1937, are examined.', 'FAQ Answer:   Eğer söz konusu liste ""tek yönlü duyuru listesi"" ise, liste yapılandırması gereği e-posta gönderme yetkisine sahip kişiler haricinde hiç bir kullanıcı mesaj gönderememektedir. Ancak üyelerin e-posta gönderebildiği bir liste söz konusu ise, gönderdiginiz mesajlarin listeye ulaşmamasının iki temel sebebi vardır: Listeye üyelik için kullanmadığıniz bir e-posta adresinden mesaj gönderiyor olabilirsiniz. Genelde birden fazla e-posta adresi kullanıyorsanız ve üye olan adresten farklı bir adrese yönlendirme tanımladıysanız, liste mesajlarini aldığınız e-posta adresi ile üyelik için kullandığınız e-posta adresi farklı olabilir. Mesajları aldığınız e-posta adresinin listeye üye olarak kayıtlı olup olmadığını kontrol etmesi için abc-l-ownermetu.edu.tr adresinden liste yöneticisiyle iletişime geçiniz. Listeye üyelik için kullandığınız e-posta adresinden mesaj gönderiyorsanız mesajiniz onay bekliyor olabilir. Mesajinızın onay için bekletiliyor olmasının olası sebepleri aşağıda listelenmiştir: Gönderdiğiniz mesaj liste mesaj kotasını aşan bir büyüklüğe sahip olabilir (örneğin; çok büyük bir dosya eklentisi gönderiyor olabilirsiniz). Mesajınızın alıcı adresi bölümünde liste adıyla beraber çok sayıda e-posta adresini yazmış olabilirsiniz. Mesajiniz liste ayarları gereği moderatör onayı için bekletiliyor olabilir. Tüm bu olası sebeplerle ilgili olarak abc-l-ownermetu.edu.tr adresinden liste yöneticisi ile iletişime geçebilir, detaylı bilgi alabilirsiniz.  (Yukarıda geçen', 'bulunup tanınması çalışmaları (1988-1990), Antakya kıyılarında yine topluluk tarafından bulunan 1600 yıllık iki batık gemi ve her birinde bulunan cam külçeler (1992/1993) ODTÜ Sualtı Topluluğu’nun Arkeoloji bilimine yaptığı katkıların ilkleridir. Bunlara ek olarak topluluğun 1992 yılında ilk kez Bozcaada’da düzenlediği “Sualtında Görüntü Avlama Yarışması” SAGAY, Türkiye’de düzenlenen ilk sualtı fotoğraf yarışması olmasının yanı sıra, Zıpkınla Balık Avcılığı Yerine Fotoğraf Makinesiyle Görüntü Avcılığı gibi anlamlı bir seçeneği sunarak Kuzey Ege’de “deniz parkları” kurulmasını ve işlemesini sağlamayı amaç edinmiştir. Son zamanlarda topluluk Türkiye Kıyıları Deniz Mağaraları Envanter Projesi, Kilikya Bölgesi Arkeolojik Yüzey Araştırması, Deniz Çayırlarının Yayılımının İncelenmesi, Uluburun III Yapay Resif Projesi, Serbest Dalış Denemeleri gibi önemli projeleri yürütmektedir. ODTÜ Sualtı Topluluğu Rektörlük makamına karşı sorumludur. Akademik Danışman ve beş öğrenciden oluşan yürütme kurulu, üç öğrenciden oluşan denetleme kurulu işleyişi sağlamakla görevlidir. Yürütme Kurulu ve Denetleme Kurulu Genel Kurula karşı sorumludur. Topluluğun Akdeniz Foku Araştırma Grubu (AFAG), Batık Araştırma Grubu (BAG), Ekoloji Grubu (EKOG), Fotografi ve Videografi Grubu (FOVAG), Mağara Dalışı ve Araştırma Grubu (MADAG) ve Serbest Dalış Grubu (SDG) gibi alt grupları ile çeşitli çalışma birimleri vardır.', 'Content:  This course, according to regulations of the Council of Higher Education (YÖK), is a must course to all foreign students in Turkey. Therefore, it is also a must course for foreign students enrolled in METU regardless of paying their fees in Turkish Lira or US Dollar. It is designed to equip them with a general knowledge on the process of the establishment of the Turkish nation-state in 1923. It covers economic, social, political and cultural developments in Turkey between 1908 and 1938.']","[""Student Club Name: ATATURK's THOUGHT CLUB\nStudent Club Description: The Club was established to better know and promote Atatürk and his ideology and to be able to interpret Kemalism, a 20th century ideology, based on the changing conditions of this era and to be able to bring new initiatives to this ideology. The Club also aims to examine Atatürk's reforms and principles, the current conclusions and social implications of the reforms and to conduct scientific research on these issues. Academic Advisor:\xa0Dr.Ahmet Cemal Durgun\xa0(Department of Electrical and Electronics Engineering) Club Room: Department of Physics, Ground Floor \n"", ""Student Club Name: IEEE METU STUDENT SOCIETY\nStudent Club Description: The Society aims to increase the recognition of Electrical-Electronics Engineering, to encourage technological development, to explain the benefits of technology and to raise awareness in society, to increase technology-oriented entrepreneurship, to strengthen university-industry cooperation, to improve the members' professional and social development. Academic Advisor:Assoc. Prof.Dr.\xa0Ayşe Melda Yüksel Turgut (Department of Electrical and Electronics Engineering) Club Room: Dept. of Elect. Elect. Eng. Block A \n""]","İEEE METU Öğrenci Topluluğu ve ATATÜRK'ün DÜŞÜNCE KULÜBÜ'nun Elektrik ve Elektronik Mühendisliği Bölümü içindeki ana hedefleri şunlardır:

        ATATÜRK'ün DÜŞÜNCE KULÜBÜ:
        1. Atatürk'ün ve Kemalizm'in anlayışını ve ideolojisini anlamak ve yayınlamak.
        2. Atatürk'ün reformları ve principlerini incelemek ve şu anda kapsamlarını ve sosyal etkilerini çıkarıp, aynı zamanda bu konularda teknolojik araştırmalar yapmak.
        3. Atatürk'ün reformlarının sonuçlarını ve şimdiki sonuçları çıkarıp, çalışmalarının sosyal etkilerini incelemek.

        IEEE METU Öğrenci Topluluğu:
        1. Elektrik ve Elektronik Mühendisliği alanının tanınmasını ve geliştirilmesini sağlamak.
        2. Teknoloji gelişimi ve faydalarını anlamak ve çevresindeki kişileri hakkında bilgi sağlamak.
        3. Teknoloji örgütlendirmeyi ve geliştirmeyi sağlamak.
        4. Üniversite-sanayi iletişimini sağlamak ve geliştirmek.
        5. Üyelerinin profesyonel ve sosyal gelişimi sağlamak.

        Bu toplulukların Elektrik ve Elektronik Mühendisliği Bölümü içinde bulunması, bu alanın öğrencilerine teknoloji ve gelişim hakkında daha fazla bilgi sağlamasını ve bu alanın gelişmesini desteklemesini sağlar.","ATATÜRK'ün DÜŞÜNCE KULÜBÜ, Atatürk ve ideolojisini daha iyi anlamak ve tanıtmak, Kemalizmi çağdaş koşullar bağlamında yorumlamak, Atatürk'ün reformlarını ve ilkelerini incelemek ve bu konularda bilimsel araştırmalar yapmak amacıyla kurulmuştur. IEEE ODTÜ ÖĞRENCİ TOPLULUĞU ise Elektrik-Elektronik Mühendisliği'nin tanınırlığını artırmaya, teknolojik gelişimi teşvik etmeye, toplumda teknolojiye dair farkındalığı yükseltmeye, teknoloji odaklı girişimciliği desteklemeye, üniversite-sanayi iş birliğini güçlendirmeye ve üyelerinin mesleki ve sosyal gelişimini artırmaya odaklanmaktadır.",0.5,0.9999999999,0.56,0.2727272727272727,0.934895540186466
"What are the roles and contributions of Asst. Prof. Dr. Salih Özçubukçu and Asst. Prof. Dr. Banu Cingöz Ulu in supporting student clubs focused on photography and dance, respectively, and how do these clubs enhance student engagement and creativity?","['Student Club Name: AMATEUR PHOTOGRAPHY SOCIETY\nStudent Club Description: The Society aims to attract attention to the art of photography and bring all the interested students together, to provide these students with a creative environment and technical support for their projects, to organize courses, to hold exhibitions and organize photo festivals with the participation of other amateur photography clubs/societies. Academic Advisor: Asst. Prof. Dr.Salih Özçubukçu (Department of Chemistry) Society Room: Society Barrack', 'Student Club Name: CONTEMPORARY DANCE GROUP\nStudent Club Description: The Group aims to reach large masses through dance, the best way of expressing feelings, and to expand area of research through creativity, improvisation and choreography work, theoretical studies and presentations. Academic Advisor: Asst. Prof. Dr.Banu Cingöz Ulu (Department of Psychology) Club Room: 9th Dormitory, Ground Floor', 'Student Club Name: RADIO SOCIETY\nStudent Club Description: Having successfully completed the transition to begin the broadcasting life of Radyo ODTÜ as its first mission, the Society first implemented ""Practical Radio Broadcasting Courses"" in Turkey in order to train qualified radio people. ""Radio Courses"" brings the leading radio people of Turkey together with members of the Radio Society in METU. The Society carries out entertaining and interactive activities in order to help its members take an active role in social activities outside the school life and to contribute to the development of their social environment. Academic Advisor: Asst. Prof. Dr.Çağatay Dengiz\xa0(Department of Chemistry) Society Room: EBİ Dormitory, Ground Floor', 'Student Club Name: ""ÇOCUK AKLIM"" SOCIETY\nStudent Club Description: The Society aims to contribute to the development of all children with different characteristics and coming from different socio-economic status in order for 0-6 year old children to reach the desired level in terms of their cognitive, emotional, physical, social and language development. The Society also seeks to bring students, faculty members and specialists who want to contribute positively to the development of pre-school children together, to increase the knowledge and interest of parents about pre-school education and to include them in this process. Academic Advisor: Asst. Prof. Dr.Elif Karslı Çalamak (Department of Elementary and Early Childhood Education) Club Room: Society Container No:1', 'Student Club Name: GASTRONOMY CLUB\nStudent Club Description: The Club aims to bring all those who love eating and are interested in all the particulars of culinary arts from tasting to cooking and in the richness of world cuisines, and to become a group that pursues both entertaining and filling activities. In addition, the Club seeks to be a supporter of a science, in fact, an art that it considers lack in our school and to develop it. The Club has achieved this goal with activities held so far and brought gastronomy lovers together. Academic Advisor: Prof. Dr. Sertaç Önde (Department of Biology) Club Room: Department of Food Engineering', ""Student Club Name: FINE ARTS SOCIETY (FAS)\nStudent Club Description: The Club aims to help the social and cultural development of its members and those who benefit from club's activities through art, to enable them to be trained as researchers and people with creative skills, to work for the introduction and development of fine arts in METU via painting, photography, violin, piano, flute and guitar courses. Academic Advisor: Asst. Prof. Dr. Ekin Pınar (Faculty of Architecture) Club Room: Clubs Container No: 4"", 'Student Club Name: AMATEUR ASTRONOMY CLUB\nStudent Club Description: In cooperation with astronomy enthusiasts and related institutions, the Club aims to develop astronomy studies in our country, organize seminars and observations to raise awareness among students in this regard, to translate the information in international sources and current news articles into our language, to provide people with information about celestial events, to ensure contact between members and astronomers, to provide the necessary information quickly and easily to those who are interested via our website, and to provide a nationwide sharing environment. Academic Advisor: Inst. Sedat Canlı (Central Laboratory) Club Room: Department of Physics, Ground Floor', 'Student Club Name: MEDIA SOCIETY\nStudent Club Description: The Society aims to make sure that university students become the subject of the society instead of one-sided news flow in the media industry and to help news become a multi cultural tool as a means of consumption, to make sure media life practices are implemented, to speed up the flow of academic information to society through media and to contribute to the personal and professional development of students who want to work in any fields in media. Academic Advisor: Asst. Prof. Ömür Birler (Department of Public Administration) Society Room: Clubs Container No: 3', 'Student Club Name: HISTORY CLUB\nStudent Club Description: The Club aims to contribute to the activities and studies related to the history of science and to the dissemination of the knowledge of history, to develop research and creative activities on history among the students. Academic Advisor: Assoc. Prof. Dr. Güçlü Tülüveli (Department of History) Club Room: Building of Human Sciences, Ground Floor', 'Student Club Name: CINEMA CLUB\nStudent Club Description: The Club aims to promote the research of cinema art among the METU students and to provide information, document and resource production related to this art, to introduce world cinema and independent films to METU students. Academic Advisor: Asst. Prof. Dr. Besim Can Zırh (Department of Sociology) Club Room: Societies Barrack']","['2d5ca9b4-44bf-48f6-9246-1f52b5a1d572\n\nStudent Club Name: AMATEUR PHOTOGRAPHY SOCIETY\nStudent Club Description: The Society aims to attract attention to the art of photography and bring all the interested students together, to provide these students with a creative environment and technical support for their projects, to organize courses, to hold exhibitions and organize photo festivals with the participation of other amateur photography clubs/societies. Academic Advisor: Asst. Prof. Dr.Salih Özçubukçu (Department of Chemistry) Society Room: Society Barrack \n', '6064879e-c582-4dfa-830e-e0ebddb35e33\n\nStudent Club Name: CONTEMPORARY DANCE GROUP\nStudent Club Description: The Group aims to reach large masses through dance, the best way of expressing feelings, and to expand area of research through creativity, improvisation and choreography work, theoretical studies and presentations. Academic Advisor: Asst. Prof. Dr.Banu Cingöz Ulu (Department of Psychology) Club Room: 9th Dormitory, Ground Floor \n']"," Asst. Prof. Dr. Salih Özçubukçu serves as the academic advisor for the Amateur Photography Society, a student club that focuses on photography. This club provides a creative environment and technical support for students interested in photography, organizes courses, exhibitions, and photo festivals. By participating in this club, students can enhance their creativity and engagement in photography.

         Asst. Prof. Dr. Banu Cingöz Ulu, on the other hand, is the academic advisor for the Contemporary Dance Group, a student club dedicated to dance. This club aims to reach a large audience through dance and expand its area of research through creativity, improvisation, and choreography work, theoretical studies, and presentations. Participating in this club can help students develop their creativity and engagement in dance.

         These clubs, along with others at METU, contribute to the overall student experience by providing opportunities for students to engage in their areas of interest, develop their skills, and connect with like-minded individuals.","Asst. Prof. Dr. Salih Özçubukçu serves as the academic advisor for the Amateur Photography Society, which aims to foster interest in photography among students by providing a creative environment and technical support for their projects. The society organizes courses, exhibitions, and photo festivals, encouraging students to engage with the art of photography and collaborate with other amateur photography clubs. On the other hand, Asst. Prof. Dr. Banu Cingöz Ulu is the academic advisor for the Contemporary Dance Group, which focuses on using dance as a medium for expression and creativity. This group aims to reach a wide audience through dance, promoting theoretical studies and improvisation. Both clubs, under the guidance of their respective advisors, play a significant role in enhancing student engagement by offering opportunities for creative expression and professional development.",0.8,0.99999999995,0.91,0.6521739130434783,0.9744710570267769
ARCH111 kültürel etkiler hakkında ne öğretir?,"['Course: ARCH419\nDepartment: This course belongs to DEPARTMENT OF ARCHITECTURE.\nObjective: No objective\nContent:  This course is an undergraduate survey focusing on the history of architecture of Anatolia from the Neolithic Period to the end of the Iron Ages. The principal aim is to provide students with a general knowledge of different architectural traditions of Pre-Classical Anatolia. The overall structure of the course is chronological. Architecture of the Neolithic Period, Early Bronze Age Troy, Assyrian Trade Colony Period, Hittite Empire, and the Kingdoms of Lycia, Phrygia will be investigated.', 'bulunup tanınması çalışmaları (1988-1990), Antakya kıyılarında yine topluluk tarafından bulunan 1600 yıllık iki batık gemi ve her birinde bulunan cam külçeler (1992/1993) ODTÜ Sualtı Topluluğu’nun Arkeoloji bilimine yaptığı katkıların ilkleridir. Bunlara ek olarak topluluğun 1992 yılında ilk kez Bozcaada’da düzenlediği “Sualtında Görüntü Avlama Yarışması” SAGAY, Türkiye’de düzenlenen ilk sualtı fotoğraf yarışması olmasının yanı sıra, Zıpkınla Balık Avcılığı Yerine Fotoğraf Makinesiyle Görüntü Avcılığı gibi anlamlı bir seçeneği sunarak Kuzey Ege’de “deniz parkları” kurulmasını ve işlemesini sağlamayı amaç edinmiştir. Son zamanlarda topluluk Türkiye Kıyıları Deniz Mağaraları Envanter Projesi, Kilikya Bölgesi Arkeolojik Yüzey Araştırması, Deniz Çayırlarının Yayılımının İncelenmesi, Uluburun III Yapay Resif Projesi, Serbest Dalış Denemeleri gibi önemli projeleri yürütmektedir. ODTÜ Sualtı Topluluğu Rektörlük makamına karşı sorumludur. Akademik Danışman ve beş öğrenciden oluşan yürütme kurulu, üç öğrenciden oluşan denetleme kurulu işleyişi sağlamakla görevlidir. Yürütme Kurulu ve Denetleme Kurulu Genel Kurula karşı sorumludur. Topluluğun Akdeniz Foku Araştırma Grubu (AFAG), Batık Araştırma Grubu (BAG), Ekoloji Grubu (EKOG), Fotografi ve Videografi Grubu (FOVAG), Mağara Dalışı ve Araştırma Grubu (MADAG) ve Serbest Dalış Grubu (SDG) gibi alt grupları ile çeşitli çalışma birimleri vardır.', 'Course: HIST251\nDepartment: This course belongs to DEPARTMENT OF HISTORY.\nObjective: This course is the first of a two-semester introduction to the ancient Greek language and historical texts written in it. The course will begin with the alphabet, elements of ancient Greek grammar and syntax and then proceed to increasingly complex readings from historical texts. The objective is for students to be able to read, understand and use historical sources written in Ancient Greek. \nContent:  Bu ders Eski Yunancaya bir giriþ olarak verilmektedir. Öðrenciler ilk önce eski Yunanca gramerini öðrendikten sonra yavaþ yavaþ orijinal tarihi metinleri okumayý ve çevirmeyi öðrenmektedir.', 'Course: HIST112\nDepartment: This course belongs to DEPARTMENT OF HISTORY.\nObjective: This course is the continuation of HIST111 (History of Turks I) and a survey on the history of the Turks from their conversion to Islam to the end of the Mongol period with an emphasis on continuity and change in pre-Islamic traditions. The main objective of this survey is to familiarize you with political, social, economic and cultural history of the Turkic-Moslem states in Transoxiana and Iran with an emphasis on historiography. After building a basis of knowledge of governmental institutions of the Karakhanids, Ghaznavids, Seljukids and Mongols within the wider context of the medieval eastern Islamic world, the course will approach the encounters and interactions between Turkic, Mongolian and Iranian societies from a variety of angles. \nContent:  Turkic-Moslem states in Iran and Transoxiana. Emergence of the Mongols and the legacy of Genkhis Khan`s Empire up to the period of Tamerlane.', 'Course: HIST229\nDepartment: This course belongs to DEPARTMENT OF HISTORY.\nObjective: To give an introduction of the development and cultural evidence of early civilizations in Anatolia from the beginning to the end of the Prehistoric Period at around 2000 BCE. \nContent:  This course includes a survey of the civilizations in Anatolia from the appearance of human race to the Hellenistic period. Anatolian civilizations from the beginning to the conquering of Anatolia by Alexander the Great will be covered in detail in this course.', 'Course: HIST219\nDepartment: This course belongs to DEPARTMENT OF HISTORY.\nObjective: The\xa0Balkan History\xa0undergraduate course aims to provide students with a comprehensive understanding of the historical evolution of the Balkan Peninsula, from 14th century to 17th century. Through the study of key events such as the Roman and Byzantine influence, Turkic and Slavic migrations, Ottoman conquests, and the process of Islamization, the course emphasizes the region’s complex ethnic, religious, and cultural landscape. Students will explore the significance of Ottoman rule from 14th to 17th centuries in the Balkans. This course blends map quizzes, primary and secondary readings, and two midterm exams to guide students through the complexities of Balkan history. \xa0 \nContent:  In history, the Balkans was the cross road of various races, religions and cultures. Turks, Bulgarians, Albanians, Serbs, Croats, Greeks, Romanians and Slovens have been the main Balkan nationalities. Greece, Rome, Byzantium and the Ottomans governed the peninsula in different periods. The different conditions and characteristics of these empires and the experiences of the nationalities constituted them will be evaluated. From the late 18th century until the mid-nineteenth century, the nationalist movements and ethnic conflicts, their external dimensions and internal dynamics will also be explored.', 'Course: HIST449\nDepartment: This course belongs to DEPARTMENT OF HISTORY.\nObjective: No objective\nContent:  Being the capital city of two empires, East Roman and Ottoman, Istanbul rightly deserves the attention oriented towards it. In its history, a mixture of cultures including Jewish, Armenian, Greek and Turkish, had shaped its spatial form. This mixture had created a civilization that fascinated everyone visiting the city. This course will explore the cultural and social aspects of everyday life of Istanbul in early modern period.', 'Course: HIST233\nDepartment: This course belongs to DEPARTMENT OF HISTORY.\nObjective: No objective\nContent:  Focusing on the nomads, farmers and dervishes, the course will explore the Anatolian society before the rise of the Ottomans as an empire. Demographic, cultural as well as political and economic trends in Anatolia in the 12th to 15th centuries will be studied with readings in history, literature and arts.', 'Course: HIST2201\nDepartment: This course belongs to DEPARTMENT OF HISTORY.\nObjective: By the end of this course the students will be able to;   Know basic terms, concepts and events of History of Turkish Republic, in a period covering roughly 16-20th centuries.   Interpret various events and/or developments that taken place throughout the period that the course covered.   Apply their knowledge to their personal/academic improvement process.   Analyze the historical events in an reason and result relation.\xa0\xa0   Show awareness about historical issues as well as historical heritage in various \xa0forms.   Participate in general discussion on issues regarding History of Turkish Republic.   Show concern for historical heritage of Turkish Republic.   \nContent:  A history of the foundation of the Turkish Republic in the light of Kemal Atatürk`s principles. A required course for all second-year students.', 'Course: HIST151\nDepartment: This course belongs to DEPARTMENT OF HISTORY.\nObjective: This course aims to provide students with a broad overview of the history and culture of the ancient civilizations of Mesopotamia, the Near East, Egypt, and the Aegean from the 3rd millenium BCE to the 4th century BCE. Emphasis will be on examining the cultural achievements of these cultures, their influence on one another, and how they developed over time. \nContent:  This course aims at giving the first year students an introductory notion of different geographical notions of development of civilization in historical and thematical perspective.']","['Course: ARCH111\nDepartment: This course belongs to DEPARTMENT OF ARCHITECTURE.\nObjective: The purpose of the course is to introduce the student to the scope and vocabulary of architecture. It aims to develop an understanding of the phenomena of architectural form and space in relation to its artistic, technological, contextual and environmental aspects. \xa0 Assignments will be submitted digitally.\xa0 \xa0 \xa0 \xa0 \xa0 \xa0 \xa0 \xa0 \nContent:  The course aims to introduce the student to the scope and vocabulary of architecture. Analysis of form values; space, structure and meaning; order and character of places. Environmental and cultural influences on architectural form. Design activity at different scales, in relation to conceptual and material aspects. ']","İşte ARCH111 kültürel etkiler hakkında bilgi:
        Bu kurs, Pre-Classical Anatolia'nın farklı arkitektür türlerini öğretir. Kurs, Neolitik Periode, Early Bronze Age Troy, Assyrian Trade Colony Period, Hittite Empire, ve Lycia, Phrygia gibi bölgelerdeki arkitektürün tarihsel yapısını araştırır.

        Bu kurs, öğrencilerin Anadolu'nun farklı arkitektür türlerini anlayabileceği ve bu türlerin kültürel etkileri hakkında bilgi sahip olabileceği amacına sahiptir. Kurs, Anadolu'nun farklı bölgelerindeki arkitektürün tarihsel yapısını, geografik konum, iklim ve yükseklik sırasıyla ince araştırmalar yaparak öğretir.","ARCH111 dersi, öğrenciyi mimarlığın kapsamı ve kelime dağarcığıyla tanıştırmayı, mimari form üzerindeki çevresel ve kültürel etkileri de içermektedir.",1.0,0.0,0.5,0.0,0.8909667558853079
What initiatives does the Biology and Genetics Society undertake to promote studies in Biology and related fields among students and the broader community?,"['Student Club Name: BIOLOGY AND GENETICS SOCIETY\nStudent Club Description: The Society aims to announce the international and national studies in Biology, Molecular Biology and Genetics throughout the University and the country, to provide a scientific environment to scientists of the future, to better introduce these topics to those who are interested in life sciences, to make them appear more interesting and to provide an environment for their studies. Academic Advisor:\xa0Asst. Prof. Dr.Banu Bayyurt Kocabaş\xa0(Department of Biology) Society Room: Department of Biology, 1st Floor', 'Course: BIOL352\nDepartment: This course belongs to DEPARTMENT OF BIOLOGY.\nObjective: No objective\nContent:  A laboratory course for 2380 306 and 2380 351. A variety of experimental techniques using Drosophila and bacteria in exploring transmission genetics, gene interactions, linkage and genetic mapping, and molecular genetics are covered. Basic recombinant DNA methods for manipulation of Escherichia coli DNA and human chromosomal DNA are also included.', 'Course: BIOL255\nDepartment: This course belongs to DEPARTMENT OF BIOLOGY.\nObjective: A one-semester course designed for Department of Metallurgical and Materials Engineering students aiming to introduce concepts in cellular biology such as cells, inheritance, and gene expression. \nContent:  This course is designed to introduce molecular cell biology and genetics concepts to non-biology majors. Topics of the course include introductory cell biology, principles of genetics, human genome project, basics of molecular biology techniques, immune system and cancer.', 'Course: GENE104\nDepartment: This course belongs to DEPARTMENT OF MOLECULAR BIOLOGY AND GENETICS.\nObjective: At the end of this course, the student will learn: - basic concepts of molecular genetics, - molecular mechanisms of phenotypes, including cell cycle, development, and disease, - the application of state-of-the-art molecular genetic methods for studying development and disease. The student will have gained the skills: - to develop biological hypotheses and possible approaches to test them, - to access scientific information on genetics and disease. \nContent:  Cell cycle, DNA replication and mitosis, sexual reproduction, meiosis and genetic variability, patterns of inheritance, molecular genetics, cellular mechanisms of development, cellular differentiation and specialization, molecular aspects of cancer.', 'Course: GENE475\nDepartment: This course belongs to DEPARTMENT OF MOLECULAR BIOLOGY AND GENETICS.\nObjective: The course is designed as a research project where all students will have the opportunity to\xa0 carry out the experiments hands on. The primary objective is for the students to learn how research projects are organized from start to the end.\xa0 \nContent:  The experiments have been designed to acquaint the students with the fundamental techniques of molecular biology, and with selected applications of recombinant DNA technology. The course has been designed for the students of Molecular Biology & Genetics Program.', 'Student Club Name: SCIENCE AND FUTURE SOCIETY\nStudent Club Description: The Society aims to teach METU students the social importance of science and technology, to follow the agenda of science and technology, to announce the global developments in coordination with METU members, to help students embody new ideas in a project and to support these projects. Academic Advisor: Instr. Dr.Taner Zorbay (Department of History) Assoc. Prof. Dr. Mehmet Somel (Department of Biology) Society Room: Society Containers No:1', 'Course: GENE367\nDepartment: This course belongs to DEPARTMENT OF MOLECULAR BIOLOGY AND GENETICS.\nObjective: Get the students familiar with methods such as electrophoresis, Southern Blotting, PCR, DNA isolaton and staining . To make students handle living organisms like bacteria and Drosphila for genetic experiments. \xa0 \nContent:  A laboratory course emphasizing the principles of genetics. Experiments include the application of transmission and population genetics using Drosophila as the model organism, such as segregation and independent assortment, sex linkage, linkage analysis and gene mapping, epistatic interactions, and gene frequency changes in populations. Polytene chromosomes and allozyme electrophoresis are also done with Drosophila. Chromosomal DNA, RNA and plasmid isolation techniques, UV induced mutations, genetic manipulation by recombinant DNA techniques and PCR are covered. The course has been designed for students of Molecular Biology and Genetics Program.', 'Course: GENE479\nDepartment: This course belongs to DEPARTMENT OF MOLECULAR BIOLOGY AND GENETICS.\nObjective: To learn the concept of choosing a research article/topic of interest, work with colleagues to design a presentation, keep the audience engaged and disseminate information. \nContent:  The students are expected to give a formal presentation over a topic of their interest. Full attendance and at least one seminar presentation is obligatory. The course has been designed for the students of Molecular Biology & Genetics Program.', 'Course: BIOL5555\nDepartment: This course belongs to DEPARTMENT OF BIOLOGY.\nObjective: No objective\nContent:  INTERNATIONAL STUDENT PRACTICE', 'Content:  The course presents prokaryotic and eukaryotic molecular genetics with a comparative and unifying approach. DNA structure and organization, replication, transcription, translation, regulation of gene expression and interactions of proteins and RNAs with DNA are discussed. Examples from bacteria, yeasts, plant and humans are covered. Advances at the molecular level in the areas of aging, gene therapy, and mitochondrial inheritance will be emphasized. Recent advances in recombinant DNA technology (such as PCR restriction fragment length polymorphism, chromosome walking and jumping) also are included. The course has been designed for the students of Molecular Biology & Genetics Program.']","['6cc1c918-b3f9-498f-906a-279668e54810\n\nStudent Club Name: BIOLOGY AND GENETICS SOCIETY\nStudent Club Description: The Society aims to announce the international and national studies in Biology, Molecular Biology and Genetics throughout the University and the country, to provide a scientific environment to scientists of the future, to better introduce these topics to those who are interested in life sciences, to make them appear more interesting and to provide an environment for their studies. Academic Advisor:\xa0Asst. Prof. Dr.Banu Bayyurt Kocabaş\xa0(Department of Biology) Society Room: Department of Biology, 1st Floor \n']"," The Biology and Genetics Society at Middle East Technical University (METU) undertakes several initiatives to promote studies in Biology and related fields. These include organizing events to announce international and national studies, providing a scientific environment for students, introducing life sciences topics in an engaging manner, and offering an environment for their studies. The Society also encourages students to participate in experiments using Drosophila, chromosomal DNA, RNA, and plasmid isolation techniques, as well as genetic manipulation by recombinant DNA techniques and PCR. Additionally, the Society encourages students to present research on topics of their interest and to attend formal presentations by their peers. The Society's academic advisor is Asst. Prof. Dr. Banu Bayyurt Kocabaş from the Department of Biology.","The Biology and Genetics Society aims to announce international and national studies in Biology, Molecular Biology, and Genetics throughout the University and the country. It seeks to provide a scientific environment for future scientists, better introduce these topics to those interested in life sciences, make them appear more interesting, and create an environment conducive to their studies.",1.0,0.9999999999,0.38,0.7058823529411765,0.9002425667224081
"Öğrenci Konutları Koordinatörü olarak, yurt başvurularının değerlendirilmesinde yer alan kriterler ve süreçler hakkında, özellikle başvuranların ailelerinin ekonomik ve sosyal durumlarının nasıl değerlendirildiği ve bu bilginin YKS sınavındaki akademik performanslarıyla nasıl entegre olduğu konusunda detay verebilir misiniz?","['FAQ Answer:   Eğer söz konusu liste ""tek yönlü duyuru listesi"" ise, liste yapılandırması gereği e-posta gönderme yetkisine sahip kişiler haricinde hiç bir kullanıcı mesaj gönderememektedir. Ancak üyelerin e-posta gönderebildiği bir liste söz konusu ise, gönderdiginiz mesajlarin listeye ulaşmamasının iki temel sebebi vardır: Listeye üyelik için kullanmadığıniz bir e-posta adresinden mesaj gönderiyor olabilirsiniz. Genelde birden fazla e-posta adresi kullanıyorsanız ve üye olan adresten farklı bir adrese yönlendirme tanımladıysanız, liste mesajlarini aldığınız e-posta adresi ile üyelik için kullandığınız e-posta adresi farklı olabilir. Mesajları aldığınız e-posta adresinin listeye üye olarak kayıtlı olup olmadığını kontrol etmesi için abc-l-ownermetu.edu.tr adresinden liste yöneticisiyle iletişime geçiniz. Listeye üyelik için kullandığınız e-posta adresinden mesaj gönderiyorsanız mesajiniz onay bekliyor olabilir. Mesajinızın onay için bekletiliyor olmasının olası sebepleri aşağıda listelenmiştir: Gönderdiğiniz mesaj liste mesaj kotasını aşan bir büyüklüğe sahip olabilir (örneğin; çok büyük bir dosya eklentisi gönderiyor olabilirsiniz). Mesajınızın alıcı adresi bölümünde liste adıyla beraber çok sayıda e-posta adresini yazmış olabilirsiniz. Mesajiniz liste ayarları gereği moderatör onayı için bekletiliyor olabilir. Tüm bu olası sebeplerle ilgili olarak abc-l-ownermetu.edu.tr adresinden liste yöneticisi ile iletişime geçebilir, detaylı bilgi alabilirsiniz.  (Yukarıda geçen', 'Sports Club Name: ODTÜ DAĞCILIK VE KIŞ SPORLARI KOLU (DKSK)\nSports Club Description: Topluluğumuz tüm doğa sporlarını (dağcılık, kayak, mağaracılık, yürüyüş, kamp, bilimsel ekspedisyon vb.) amatör bir ruhla ve bilimsel yaklaşımla yurt çapında sosyal ilişkiler kurarak sevdirmek ve yaydırmak amacını güder. Kolumuz, insan doğa ilişkilerini, insanın ve doğanın yararı doğrultusunda pekiştirerek tüm olanakları sonuna dek kullanır, amaçlarını sıkı bir örgütlülük ve sosyal bütünlük içinde demokratik bir anlayışla gerçekleştirir. Kol etkinliklerinin amacı, katılan sporcuların tekniğini ve becerisini o etkinliğin gerektirdiği ölçüde arttırmaktadır. Bu amaç doğrultusunda bütün yıl boyunca etkinlik yapar. Etkinliklerini her türlü doğa koşulunda yapmayı, değişik dağların ve değişik mevsimlerin gerektirdiği tekniklerin öğrenilmesi ve kullanılmasını hedefler. Kolumuz yaptığı tüm doğa sporlarını birbirlerini tamamlayan sporlar olarak görür. Kayağı da doğa ile birlikte olmayı sağlayan bir spor olarak kabul eder, kayağın dağcılıkla ve diğer etkinliklerle ilişkili olarak kullanılmasını, teknik yönden güçlü, amatör ruhlu sporcuların yetiştirilmesini ve bu sporcuların üniversite adına amatör kayak yarışmalarına girmesini teşvik eder. Bu amaç doğrultusunda, kolumuz doğada yapılan tüm sporları destekleyen ve bu sporları yapan kulüplerle ilişkiler kurar ve mevcut ilişkilerini sürdürür.', 'bir şifreyi yazıp, _x0093_Şifremi Değiştir_x0094_ butonuna _x0093_Global Olarak Değiştir_x0094_ seçeneği seçili olacak şekilde tıklamalıdır.  Bu işlem başarılı bir şekilde gerçekleştirildiği takdirde, ekranda _x0093_Şifre başarıyla değiştirildi._x0094_ şeklinde bir mesaj görüntülenir. Kullanıcı tarafından tanımlanan yeni şifre artık aynı e-posta adresi ile üye olunan mevcut tüm e-listelerde kullanılabilir. Şifre değiştirme işlemi sırasında _x0093_Global Olarak Değiştir_x0094_ seçeneği seçili olmadığı durumda, sadece söz konusu e-listenin şifresi değiştirilmiş olur. ""Global Olarak Değiştir"" seçeneği ile kullanıcının o ana kadar üye olduğu tüm listelerin şifreleri değiştirilir. Bu işlem sonrasında üye olunacak yeni e-listelerde de aynı şifrenin kullanılabilmesi için bu işlemin her üyelikten sonra tekrarlanması gerekir. Bu işlem yapılmadığında yeni üye olunan e-listelerde, üye olurken Mailman tarafından otomatik olarak tanımlanıp kullanıcıya gönderilen şifreler kullanılır.', 'FAQ Answer:   Sayfanız için bir web hesabı ve alan adı gerekecektir. Bunun için\xa0https://cc-form.metu.edu.tr/web\xa0adresinde yer alan ""Yeni Web Kullanıcı Kodu ve Alan Adı Başvuru Formu""nu doldurmanız gerekmektedir. Başvurunuz üzerine sizinle iletişime geçilecektir. Web sitenizi aşağıdaki yöntemlerden biri ile oluşturabilirsiniz. Kendiniz Dreamweaver ya da benzeri bir programla web sayfalarınızı hazırlayabilirsiniz.\xa0 Merkezi İçerik Yönetim Sistemi\'ni (MİYS) kullanabilirsiniz. MİYS açık kaynaklı bir içerik yönetim sistemi olan Drupal alt yapısını kullanmaktadır. Üniversitemizdeki akademik bölüm, idari birim, merkez, enstitü, fakülte/yüksekokul, lisansüstü program, laboratuvar, proje/araştırma grubu, öğrenci topluluğu vb. yapılara ait web sayfaları bu sistem üzerinde oluşturulabilmektedir. MİYS ile ilgili ayrıntılı bilgiye ve başvuru formuna http://miys.metu.edu.tr adresinden erişebilirsiniz. Bu sistemi kullanırsanız MİYS kapsamında geçerli görsel kimlik standartlarına (http://www.metu.edu.tr/tr/gkk/gorsel-kimlik-standartlari) uymanız beklenmektedir. ODTÜ Blog Servisi\'ni kullanabilirsiniz. ODTÜ Blog Servisi, özgür bir yazılım olan WordPress altyapısını kullanmaktadır. Bu servis ile üniversitemizdeki akademik bölüm, idari birim, merkez, enstitü, fakülte/yüksekokul, lisansüstü program, laboratuvar, proje/araştırma grubu, öğrenci topluluğu vb. yapılara ait web siteleri kapsamlı bir şekilde hazırlanabilir, bu sitelerde çeşitli yazılar ve sayfalar oluşturulabilir. Tasarım için biraz', 'sebeplerle ilgili olarak abc-l-ownermetu.edu.tr adresinden liste yöneticisi ile iletişime geçebilir, detaylı bilgi alabilirsiniz.  (Yukarıda geçen ""abc-l"" ifadesi liste ismi için örnek olarak verilmiştir)', 'ayarları ISO-8859-9 (Türkçe ISO olarak da tanımlanır) ya da UTF-8 seçmeniz yeterlidir. Size gelen e-postalardaki Türkçe karakterleri görmekte sorun yaşıyorsanız iki farklı durum sözkonusu olabilir. Karşı taraf e-posta gönderirken ya da kendisine gelen e-postayı yönlerken Türkçe karakterleri desteklemeyen bir karakter seti kullanmıştır. Bu durumda gelen mesaj düzgün olarak görüntülenemez. Örneğin metinde Türkçe karakter kullanıldığı halde gönderilirken ISO-8859-1 karakter seti kullanılmış ise söz konusu karakter seti Türkçe karakterleri desteklemediği için e-postanın düzgün olarak görüntülenmesi mümkün değildir. Gönderilen e-posta düzgün karakter seti ile gönderilmiş olmasına karşın kullandığınız programın ayarları farklı olabilir. Bu durumda kullanılan programın ayarlarının değiştirilmesi mesajın düzgün şekilde okunmasını sağlayacaktır. Horde ya da Squirrelmail kullanarak e-posta okuyan kullanıcılarımızın kullandıkları tarayıcı programında, Outlook Express, Thunderbird ya da Windows Mail benzeri herhangi bir POP3/IMAP istemcisi ile e-posta gönderen kullanıcılarımızın ise ilgili programdaki karakter seti ayarlarını değiştirmeleri gerekmektedir. Gelen e-postalar için karakter seti değişikliği yapmak için farklı programlarda izlenen yol aşağıdaki gibidir (aşağıda yer almayan farklı programlar için de karakter seti ayarları benzer yerlerdedir): Internet Explorer, Outlook Express ve Windows Mail için: View → Encoding (Görünüm → Kodlama) Mozilla Firefox ve Mozilla Thunderbird', 'FAQ Answer:   English version will be available soon. 24 Ekim 2007 tarih ve 26680 sayılı Resmi Gazete\'de yayınlanan yönetmeliğe göre, ""Yer sağlayıcı trafik bilgisi, İnternet ortamındaki her türlü yer sağlamaya ilişkin olarak; kaynak IP adresi, hedef IP adresi, bağlantı tarih-saat bilgisi, istenen sayfa adresi, işlem bilgisi (GET, POST komut detayları) ve sonuç bilgisi gibi bilgileri ifade etmektedir."" Tanımlanan bu bilgiye, bir hukuksal incelemede kullanılmak üzere yer sağlayıcılık faaliyetleri kapsamındaki bir faaliyetin kim tarafından yapıldığının tespiti için ihtiyaç duyulmaktadır. l) Örnek ""http"" logu: Aşağıda yer sağlayıcı faaliyet kapsamında bir web sayfasının bulunduğu sunucunun ilgili örnek trafik logu (http logu) gösterilmiştir. Bu log, ""apache"" web sunucu yazılımının ürettiği bir log örneğidir. Birimlerde kullanılan farklı web sunucu yazılımları için, yazılımların belgelerine başvurulması ve uygun log tutulması için hangi işlemlerin yapılmasının gerekli olduğunun öğrenilmesi gerekmektedir. 144.122.222.234 - - [21/Mar/2008:14:58:01 -0200] ""GET \'data/liste.html HTTP/1.1"" 200""1 73372 ""-"" ""Mozilla/5.0 (XII: U; Lınux i686; en-L\'S; rv:1.8.1.12) Gecko/20080129 Iceweasel/2.0.0.12(Debian-2.0.0.12-Oetchl)""  Yukarıdaki örnekte yer alan bilgi alanları, kanunda belirtilen başlıklarla aşağıdaki şekilde ilişkilendirilmiştir: Kaynak IP adresi : 144.122.222.234 Hedef ip adresi: Bu kayıtta bulunmamaktadır"" Bağlantı tarih-saat bilgisi: [21/Mar/2008:14:58:01 -0200] İstenen sayfa', 'ODTÜ’nün değil Türkiye’nin değerli bir yarışması haline gelen bu organizasyona her sene 20 farklı ülkeden 400’ü aşkın sporcu ve 5000 dans severi ağırlamaktadır. Uluslararası platformlarda da övgüler almaya devam eden ve 16.sını 4-5 Kasım 2017 tarihlerinde gerçekleştireceğimiz METU OPEN son 3 senedir tüm Uluslararası Yarışmalar arasında ilk 10’da yer almaktadır.', 'bulunup tanınması çalışmaları (1988-1990), Antakya kıyılarında yine topluluk tarafından bulunan 1600 yıllık iki batık gemi ve her birinde bulunan cam külçeler (1992/1993) ODTÜ Sualtı Topluluğu’nun Arkeoloji bilimine yaptığı katkıların ilkleridir. Bunlara ek olarak topluluğun 1992 yılında ilk kez Bozcaada’da düzenlediği “Sualtında Görüntü Avlama Yarışması” SAGAY, Türkiye’de düzenlenen ilk sualtı fotoğraf yarışması olmasının yanı sıra, Zıpkınla Balık Avcılığı Yerine Fotoğraf Makinesiyle Görüntü Avcılığı gibi anlamlı bir seçeneği sunarak Kuzey Ege’de “deniz parkları” kurulmasını ve işlemesini sağlamayı amaç edinmiştir. Son zamanlarda topluluk Türkiye Kıyıları Deniz Mağaraları Envanter Projesi, Kilikya Bölgesi Arkeolojik Yüzey Araştırması, Deniz Çayırlarının Yayılımının İncelenmesi, Uluburun III Yapay Resif Projesi, Serbest Dalış Denemeleri gibi önemli projeleri yürütmektedir. ODTÜ Sualtı Topluluğu Rektörlük makamına karşı sorumludur. Akademik Danışman ve beş öğrenciden oluşan yürütme kurulu, üç öğrenciden oluşan denetleme kurulu işleyişi sağlamakla görevlidir. Yürütme Kurulu ve Denetleme Kurulu Genel Kurula karşı sorumludur. Topluluğun Akdeniz Foku Araştırma Grubu (AFAG), Batık Araştırma Grubu (BAG), Ekoloji Grubu (EKOG), Fotografi ve Videografi Grubu (FOVAG), Mağara Dalışı ve Araştırma Grubu (MADAG) ve Serbest Dalış Grubu (SDG) gibi alt grupları ile çeşitli çalışma birimleri vardır.', 'ürettiği log dosyasının örneği aşağıda verilmiştir. Tutulan log bilgisinde, bağlantı yapan bilgisayarın adresi, hedef dosya ve kullanıcı adı bilgileri bulunmalıdır. Tue Mar 25 16:39:48 2008 0 bogus.com 528 /ftp/pub/IMPORTANT-WARNING.txt b _ o r anonim ftp 1 * c  Yukarıdaki örnekte yer alan bilgi alanları, kanunda belirtilen başlıklarla aşağıdaki şekilde ilişkilendirilmiştir: Bağlantı tarih-saat bilgisi: ""Tue Mar 25 16:39:48 2008""  Kaynak Adres: ""bogus.com""  İstenen dosya: ""ftp/pub/IMPORTANT-WARNING.txt""  Kullanıcı adı: ""anonim""  Birimler, yer sağlayıcı faaliyetleri kapsamında verdikleri servislerin ürettiği logları inceleyip, sahip oldukları sistemlerde verdikleri servislerin yarattığı trafik loglarını yönetmelikte tarif edildiği şekilde (zaman damgası ile birlikte) kayıt altına almak, bu logları, gizliliğini sağlayarak arşivlemekle yükümlüdür.']","[""General Information: There are 19 dormitory buildings run by the METU Directorate of Health, Culture and Sports.\xa0\nMale students can stay in the Dormitories 2, 4, 6, 8, 9, and İsa Demiray Dormitory, in addition to a certain block allocated to them in Dormitory 19, and Refika Aksoy Dormitory. Female students can stay in the Dormitories 1, 3, 5, 7, and Faika Demiray Dormitory, in addition to a certain block allocated to them in Dormitory 19, and Refika Aksoy Dormitory.\nAs for the guest houses, Osman Yazıcı Guest House, Guest House 12, and Dormitory 16 are allocated for female students, while Faik Hızıroğlu Guest House and Guest House 15 are allocated for male students.\nThe Office of Dormitories, with the aim of solving our students' accommodation issues by offering a high standard service, obtained TSE-EN ISO 9001-2000 certificate of quality from the Turkish Standards Institution (TSE) in 2005. Regarding the quality of our dormitory services, the inspections carried out in 2021 in accordance with the TSE-EN ISO 9001:2015 standards were completed with success.\nThe services provided by our unit are carried out according to the procedures, instructions, duties, and responsibilities determined within the Dormitory Regulations, Student Discipline Regulations of the higher education institutions, decisions taken by the Executive Board of Dormitories, and the certificates of quality.\nTherefore, every year, the Executive Board of Dormitories evaluates the dormitory applications of students based on the current capacity of dormitories, the number of applications, and the conditions for staying in the dormitories established in accordance with the aforementioned regulations and approved by the Rectorate. Then, the registration procedures of the students whose applications are accepted are conducted.\nWe endeavor to provide 24/7 uninterrupted service that includes an environment of respect, love, equality and trust in our dormitories with an understanding that prioritizes a service that is high-quality, transparent, modern but at the same time adherent to the traditions of METU, which can only be achieved with a team spirit.\n"", ""Evaluation of the Applications: The economic and social situation of each student's family who applies for dormitories is investigated through local administration units. This information obtained from the local authorities and the students' scores/rankings according to YKS are taken into consideration to create an overall score for each student in accordance with the criteria determined by the Executive Board of Dormitories and approved by the Rectorate. The results of applications are announced on the Office of Dormitories website. After learning their scores, students can learn when they can register for the dormitories and the dates for the next student placement through the announcement tables regarding registrations.\nThe students who have the following ranking success in YKS Exam are placed in the METU dormitories without further consideration of other criteria: ranking in the top 4,000 in Quantitative Field, ranking in the top 500 in Equal Weight Field, ranking in the top 300 in Verbal Field, and ranking in the top 100 in Foreign Language Field.""]","Öğrenci Konutları Koordinatörü tarafından yönetilen yurt başvurularının değerlendirilmesinde kullanılan kriterler şunlarıdır:

        1. Akademik performansları (Öğrenci Not Ortalaması, YKS Sınav Not Ortalaması, YKS Sınav Puanı, YKS Sınav Sonuçları)
        2. Aile Aralığı ve İşletme Durumu (Aile Sayısı, İşletme Durumu, İşletme Konumu)
        3. Sosyal Durum (Sosyal Durum Raporu, Sosyal Durum Öğrencisi Raporu)
        4. Özel Ödül ve Yarışmalar (Özel Ödül ve Yarışma Öğrencisi Raporu)
        5. Öğrenci Yardımı ve Kültür Eğitimi (Öğrenci Yardımı ve Kültür Eğitimi Raporu)

        Bu kriterlerin entegre olarak YKS sınavındaki akademik performanslarının değerlendirilmesinde kullanılır.

        Özellikle başvuranların ailelerinin ekonomik ve sosyal durumlarının nasıl değerlendirildiği konusunda, aşağıdaki şekilde değerlendirilir:

        1. Aile Aralığı ve İşletme Durumu: Aile sayısının ve İşletme durumunun yanı sıra, İşletme konumunun da değerlendirilir.
        2. Sosyal Durum: Sosyal Durum Raporu ve Sosyal Durum Öğrencisi Raporu ile değerlendirilir.
        3. Özel Ödül ve Yarışmalar: Özel Ödül ve Yarışma Öğrencisi Raporu ile değerlendirilir.
        4. Öğrenci Yardımı ve Kültür Eğitimi: Öğrenci Yardımı ve Kültür Eğitimi Raporu ile değerlendirilir.

        Bu bilginin YKS sınavındaki akademik performanslarıyla nasıl entegre olduğu, yönetim tarafından belirlenir.","Yurt başvurularının değerlendirilmesi, her öğrencinin ailesinin ekonomik ve sosyal durumlarını ve akademik performanslarını dikkate alan kapsamlı bir süreçtir. Öncelikle, yerel yönetim birimleri, yurt konaklaması için başvuran öğrencilerin ailelerinin ekonomik ve sosyal koşullarını araştırır. Bu bilgi, her başvuranın durumuna dair bütünsel bir görüş oluşturulmasına yardımcı olduğu için oldukça önemlidir. Ayrıca, öğrencilerin YKS sınavındaki puanları ve sıralamaları da dikkate alınır. Yurtlar İdare Kurulu, toplanan bilgilere dayanarak her öğrenci için genel bir puan oluşturmak amacıyla Rektörlük tarafından onaylanan belirli kriterler belirlemiştir. Bu değerlendirmelerin sonuçları daha sonra Yurtlar Ofisi web sitesinde ilan edilir, böylece öğrenciler puanlarını görebilir ve kayıt tarihleri hakkında bilgi alabilirler. Özellikle, YKS sınavında, Sayısal Alanda ilk 4,000'de veya Yabancı Dil Alanında ilk 100'de yer alan öğrenciler, diğer kriterlerin dikkate alınmadan ODTÜ yurtlarına yerleştirilir. Bu çift yönlü yaklaşım, yurt yerleştirmelerinde hem akademik başarı hem de sosyo-ekonomik faktörlerin dikkate alınmasını sağlar.",1.0,0.0,0.19,0.0,0.9180736482803845
"Rektörlük, ODTÜ'deki yurt başvuru sürecini nasıl etkiler?","['bir şifreyi yazıp, _x0093_Şifremi Değiştir_x0094_ butonuna _x0093_Global Olarak Değiştir_x0094_ seçeneği seçili olacak şekilde tıklamalıdır.  Bu işlem başarılı bir şekilde gerçekleştirildiği takdirde, ekranda _x0093_Şifre başarıyla değiştirildi._x0094_ şeklinde bir mesaj görüntülenir. Kullanıcı tarafından tanımlanan yeni şifre artık aynı e-posta adresi ile üye olunan mevcut tüm e-listelerde kullanılabilir. Şifre değiştirme işlemi sırasında _x0093_Global Olarak Değiştir_x0094_ seçeneği seçili olmadığı durumda, sadece söz konusu e-listenin şifresi değiştirilmiş olur. ""Global Olarak Değiştir"" seçeneği ile kullanıcının o ana kadar üye olduğu tüm listelerin şifreleri değiştirilir. Bu işlem sonrasında üye olunacak yeni e-listelerde de aynı şifrenin kullanılabilmesi için bu işlemin her üyelikten sonra tekrarlanması gerekir. Bu işlem yapılmadığında yeni üye olunan e-listelerde, üye olurken Mailman tarafından otomatik olarak tanımlanıp kullanıcıya gönderilen şifreler kullanılır.', 'Sports Club Name: ODTÜ SAS (SU ALTI SPORLARI TOPLULUĞU)\nSports Club Description: ODTÜ SAS; Orta Doğu Teknik Üniversitesi Su Altı Sporları öğrenci topluluğu ve ODTÜ Spor Kulübü Su Altı Sporları takımlarıdır. Türkiye çapında çeşitli başarılara imza atan ODTÜ SAS, her yıl eğitimlerinin yanı sıra muhtelif etkinlikler de düzenlemektedir. Bu etkinliklerdeki amaç, ODTÜ’nün öncülüğünde Türkiye’de bu ve benzeri sporlara ve aktivitelere gönül vermiş olan kişileri bir araya getirmek, elde edilen tecrübeleri paylaşmak, tanıtımı arttırmak ve dostluk ve arkadaşlık ortamında işbirliğini desteklemektedir. ODTÜ aynı zamanda kendi bünyesinden su altında erkek ve kadınlarda takımlarda çıkarmıştır. Bunlar ODTÜ SAS Serbest Dalış Takımları, Su altı Hokeyi Takımları, Su Altı Rugbi Takımları ve Su Altı Görüntüleme Takımıdır. Bu takımlarımız, yönetmelikler gereği faaliyetlerinde Türkiye Su altı Sporları Federasyonu (TSSF)’ye bağlı olan ODTÜ Spor Kulübü bünyesindedir. Takım sporcuları, dönem içerisinde performans gösteren sporcular arasından seçilen kişilerden oluşmaktadır. Gerek takımlarımız ve gerekse bireysel olarak sporcularımız Dünya Rekorları dâhil her yıl ulusal ve uluslararası şampiyonalarda sürekli olarak madalyalar almakta ve üniversitemize şampiyonluklar kazandırmaktadır.', 'Content:  This course, according to regulations of the Council of Higher Education (YÖK), is a must course to all foreign students in Turkey. Therefore, it is also a must course for foreign students enrolled in METU regardless of paying their fees in Turkish Lira or US Dollar. It is designed to equip them with a general knowledge on the process of the establishment of the Turkish nation-state in 1923. It covers economic, social, political and cultural developments in Turkey between 1908 and 1938.', 'FAQ Answer:   English version will be available soon. 24 Ekim 2007 tarih ve 26680 sayılı Resmi Gazete\'de yayınlanan yönetmeliğe göre, ""Yer sağlayıcı trafik bilgisi, İnternet ortamındaki her türlü yer sağlamaya ilişkin olarak; kaynak IP adresi, hedef IP adresi, bağlantı tarih-saat bilgisi, istenen sayfa adresi, işlem bilgisi (GET, POST komut detayları) ve sonuç bilgisi gibi bilgileri ifade etmektedir."" Tanımlanan bu bilgiye, bir hukuksal incelemede kullanılmak üzere yer sağlayıcılık faaliyetleri kapsamındaki bir faaliyetin kim tarafından yapıldığının tespiti için ihtiyaç duyulmaktadır. l) Örnek ""http"" logu: Aşağıda yer sağlayıcı faaliyet kapsamında bir web sayfasının bulunduğu sunucunun ilgili örnek trafik logu (http logu) gösterilmiştir. Bu log, ""apache"" web sunucu yazılımının ürettiği bir log örneğidir. Birimlerde kullanılan farklı web sunucu yazılımları için, yazılımların belgelerine başvurulması ve uygun log tutulması için hangi işlemlerin yapılmasının gerekli olduğunun öğrenilmesi gerekmektedir. 144.122.222.234 - - [21/Mar/2008:14:58:01 -0200] ""GET \'data/liste.html HTTP/1.1"" 200""1 73372 ""-"" ""Mozilla/5.0 (XII: U; Lınux i686; en-L\'S; rv:1.8.1.12) Gecko/20080129 Iceweasel/2.0.0.12(Debian-2.0.0.12-Oetchl)""  Yukarıdaki örnekte yer alan bilgi alanları, kanunda belirtilen başlıklarla aşağıdaki şekilde ilişkilendirilmiştir: Kaynak IP adresi : 144.122.222.234 Hedef ip adresi: Bu kayıtta bulunmamaktadır"" Bağlantı tarih-saat bilgisi: [21/Mar/2008:14:58:01 -0200] İstenen sayfa', 'sebeplerle ilgili olarak abc-l-ownermetu.edu.tr adresinden liste yöneticisi ile iletişime geçebilir, detaylı bilgi alabilirsiniz.  (Yukarıda geçen ""abc-l"" ifadesi liste ismi için örnek olarak verilmiştir)', 'FAQ Answer:   Eğer söz konusu liste ""tek yönlü duyuru listesi"" ise, liste yapılandırması gereği e-posta gönderme yetkisine sahip kişiler haricinde hiç bir kullanıcı mesaj gönderememektedir. Ancak üyelerin e-posta gönderebildiği bir liste söz konusu ise, gönderdiginiz mesajlarin listeye ulaşmamasının iki temel sebebi vardır: Listeye üyelik için kullanmadığıniz bir e-posta adresinden mesaj gönderiyor olabilirsiniz. Genelde birden fazla e-posta adresi kullanıyorsanız ve üye olan adresten farklı bir adrese yönlendirme tanımladıysanız, liste mesajlarini aldığınız e-posta adresi ile üyelik için kullandığınız e-posta adresi farklı olabilir. Mesajları aldığınız e-posta adresinin listeye üye olarak kayıtlı olup olmadığını kontrol etmesi için abc-l-ownermetu.edu.tr adresinden liste yöneticisiyle iletişime geçiniz. Listeye üyelik için kullandığınız e-posta adresinden mesaj gönderiyorsanız mesajiniz onay bekliyor olabilir. Mesajinızın onay için bekletiliyor olmasının olası sebepleri aşağıda listelenmiştir: Gönderdiğiniz mesaj liste mesaj kotasını aşan bir büyüklüğe sahip olabilir (örneğin; çok büyük bir dosya eklentisi gönderiyor olabilirsiniz). Mesajınızın alıcı adresi bölümünde liste adıyla beraber çok sayıda e-posta adresini yazmış olabilirsiniz. Mesajiniz liste ayarları gereği moderatör onayı için bekletiliyor olabilir. Tüm bu olası sebeplerle ilgili olarak abc-l-ownermetu.edu.tr adresinden liste yöneticisi ile iletişime geçebilir, detaylı bilgi alabilirsiniz.  (Yukarıda geçen', 'ODTÜ’nün değil Türkiye’nin değerli bir yarışması haline gelen bu organizasyona her sene 20 farklı ülkeden 400’ü aşkın sporcu ve 5000 dans severi ağırlamaktadır. Uluslararası platformlarda da övgüler almaya devam eden ve 16.sını 4-5 Kasım 2017 tarihlerinde gerçekleştireceğimiz METU OPEN son 3 senedir tüm Uluslararası Yarışmalar arasında ilk 10’da yer almaktadır.', 'bulunup tanınması çalışmaları (1988-1990), Antakya kıyılarında yine topluluk tarafından bulunan 1600 yıllık iki batık gemi ve her birinde bulunan cam külçeler (1992/1993) ODTÜ Sualtı Topluluğu’nun Arkeoloji bilimine yaptığı katkıların ilkleridir. Bunlara ek olarak topluluğun 1992 yılında ilk kez Bozcaada’da düzenlediği “Sualtında Görüntü Avlama Yarışması” SAGAY, Türkiye’de düzenlenen ilk sualtı fotoğraf yarışması olmasının yanı sıra, Zıpkınla Balık Avcılığı Yerine Fotoğraf Makinesiyle Görüntü Avcılığı gibi anlamlı bir seçeneği sunarak Kuzey Ege’de “deniz parkları” kurulmasını ve işlemesini sağlamayı amaç edinmiştir. Son zamanlarda topluluk Türkiye Kıyıları Deniz Mağaraları Envanter Projesi, Kilikya Bölgesi Arkeolojik Yüzey Araştırması, Deniz Çayırlarının Yayılımının İncelenmesi, Uluburun III Yapay Resif Projesi, Serbest Dalış Denemeleri gibi önemli projeleri yürütmektedir. ODTÜ Sualtı Topluluğu Rektörlük makamına karşı sorumludur. Akademik Danışman ve beş öğrenciden oluşan yürütme kurulu, üç öğrenciden oluşan denetleme kurulu işleyişi sağlamakla görevlidir. Yürütme Kurulu ve Denetleme Kurulu Genel Kurula karşı sorumludur. Topluluğun Akdeniz Foku Araştırma Grubu (AFAG), Batık Araştırma Grubu (BAG), Ekoloji Grubu (EKOG), Fotografi ve Videografi Grubu (FOVAG), Mağara Dalışı ve Araştırma Grubu (MADAG) ve Serbest Dalış Grubu (SDG) gibi alt grupları ile çeşitli çalışma birimleri vardır.', 'vb. yapılara ait web siteleri kapsamlı bir şekilde hazırlanabilir, bu sitelerde çeşitli yazılar ve sayfalar oluşturulabilir. Tasarım için biraz daha esnek olsa da serviste yer alan şablonlar dışında kalan harici bir şablona onay verilmemektedir. Servise giriş yapmak ve servis hakkında ayrıntılı bilgi almak için\xa0http://blog.metu.edu.tr\xa0adresi kullanılmalıdır.', 'ürettiği log dosyasının örneği aşağıda verilmiştir. Tutulan log bilgisinde, bağlantı yapan bilgisayarın adresi, hedef dosya ve kullanıcı adı bilgileri bulunmalıdır. Tue Mar 25 16:39:48 2008 0 bogus.com 528 /ftp/pub/IMPORTANT-WARNING.txt b _ o r anonim ftp 1 * c  Yukarıdaki örnekte yer alan bilgi alanları, kanunda belirtilen başlıklarla aşağıdaki şekilde ilişkilendirilmiştir: Bağlantı tarih-saat bilgisi: ""Tue Mar 25 16:39:48 2008""  Kaynak Adres: ""bogus.com""  İstenen dosya: ""ftp/pub/IMPORTANT-WARNING.txt""  Kullanıcı adı: ""anonim""  Birimler, yer sağlayıcı faaliyetleri kapsamında verdikleri servislerin ürettiği logları inceleyip, sahip oldukları sistemlerde verdikleri servislerin yarattığı trafik loglarını yönetmelikte tarif edildiği şekilde (zaman damgası ile birlikte) kayıt altına almak, bu logları, gizliliğini sağlayarak arşivlemekle yükümlüdür.']","[""General Information: There are 19 dormitory buildings run by the METU Directorate of Health, Culture and Sports.\xa0\nMale students can stay in the Dormitories 2, 4, 6, 8, 9, and İsa Demiray Dormitory, in addition to a certain block allocated to them in Dormitory 19, and Refika Aksoy Dormitory. Female students can stay in the Dormitories 1, 3, 5, 7, and Faika Demiray Dormitory, in addition to a certain block allocated to them in Dormitory 19, and Refika Aksoy Dormitory.\nAs for the guest houses, Osman Yazıcı Guest House, Guest House 12, and Dormitory 16 are allocated for female students, while Faik Hızıroğlu Guest House and Guest House 15 are allocated for male students.\nThe Office of Dormitories, with the aim of solving our students' accommodation issues by offering a high standard service, obtained TSE-EN ISO 9001-2000 certificate of quality from the Turkish Standards Institution (TSE) in 2005. Regarding the quality of our dormitory services, the inspections carried out in 2021 in accordance with the TSE-EN ISO 9001:2015 standards were completed with success.\nThe services provided by our unit are carried out according to the procedures, instructions, duties, and responsibilities determined within the Dormitory Regulations, Student Discipline Regulations of the higher education institutions, decisions taken by the Executive Board of Dormitories, and the certificates of quality.\nTherefore, every year, the Executive Board of Dormitories evaluates the dormitory applications of students based on the current capacity of dormitories, the number of applications, and the conditions for staying in the dormitories established in accordance with the aforementioned regulations and approved by the Rectorate. Then, the registration procedures of the students whose applications are accepted are conducted.\nWe endeavor to provide 24/7 uninterrupted service that includes an environment of respect, love, equality and trust in our dormitories with an understanding that prioritizes a service that is high-quality, transparent, modern but at the same time adherent to the traditions of METU, which can only be achieved with a team spirit.\n""]","İlk olarak, Rektörlük, ODTÜ'deki yurt başvuru sürecini gerçekleştirmektedir. Bu süreç, ODTÜ'nün yurt dışı öğrencileri kabul etmek için kullanılan bir prosedürdür. Öğrenci başvurularının yönetimi, yurt dışı öğrencilerinin ODTÜ'nun kurumlara ve programlara uygun olup olmadığını, öğrenci seçiminde yer alan kriterlerin karşılanıp karşılanmayacağını ve yurt dışı öğrencilerin ODTÜ'ye gönderdiği bilgilerin doğruluğunu kontrol eder.

        Öğrenci başvurularının yönetimi, yurt dışı öğrencilerin ODTÜ'nun kurumlara ve programlara uygun olup olmadığını, öğrenci seçiminde yer alan kriterlerin karşılanıp karşılanmayacağını ve yurt dışı öğrencilerin ODTÜ'ye gönderdiği bilgilerin doğruluğunu kontrol eder. Öğrenci başvurularının yönetimi, yurt dışı öğrencilerin ODTÜ'nün kurumlara ve programlara uygun olup olmadığını, öğrenci seçiminde yer alan kriterlerin karşılanıp karşılanmayacağını ve yurt dışı öğrencilerin ODTÜ'ye gönderdiği bilgilerin doğruluğunu kontrol eder.

        Öğrenci başvurularının yönetimi, yurt dışı öğrencilerin ODTÜ'nun kurumlara ve programlara uygun olup olmadığını, öğrenci seçiminde yer alan kriterlerin karşılanıp karşılanmayacağını ve yurt dışı öğrencilerin ODTÜ'ye gönderdiği bilgilerin doğruluğunu kontrol eder. Öğrenci başvurularının yönetimi, yurt dışı öğrencilerin ODTÜ'nun kurumlara ve programlara uygun olup olmadığını, öğrenci seçiminde yer alan kriterlerin karşılanıp karşılanmayacağını ve yurt dışı öğrencilerin ODTÜ'ye gönderdiği bilgilerin doğruluğunu kontrol eder.

        Öğrenci başvurularının yönetimi, yurt dışı öğrencilerin ODTÜ'nun kurumlara ve programlara uygun olup olmadığını, öğrenci seçiminde yer alan kriterlerin karşılanıp karşılanmayacağını ve yurt dışı öğrencilerin ODTÜ'ye gönderdiği bilgilerin doğruluğunu kontrol eder. Öğrenci başvurularının yönetimi, yurt dışı öğrencilerin ODTÜ'nun kurumlara ve programlara uygun olup olmadığını, öğrenci seçiminde yer alan kriterlerin karşılanıp karşılanmayacağını ve yurt dışı öğrencilerin ODTÜ'ye gönderdiği bilgilerin doğruluğunu kontrol eder.

        Öğrenci başvurularının yönetimi, yurt dışı öğrencilerin ODTÜ'nun kurumlara ve programlara uygun olup olmadığını, öğrenci seçiminde yer alan kriterlerin karşılanıp karşılanmayacağını ve yurt dışı öğrencilerin ODTÜ'ye gönderdiği bilgilerin doğruluğunu kontrol eder. Öğrenci başvurularının yönetimi, yurt dışı öğrencilerin ODTÜ'nun kurumlara ve programlara uygun olup olmadığını, öğrenci seçiminde yer alan kriterlerin karşılanıp karşılanmayacağını ve yurt dışı öğrencilerin ODTÜ'ye gönderdiği bilgilerin doğruluğunu kontrol eder.

        Öğrenci başvurularının yönetimi, yurt dışı öğrencilerin ODTÜ'nun kurumlara ve programlara uygun olup olmadığını, öğrenci seçiminde yer alan kriterlerin karşılanıp karşılanmayacağını ve yurt dışı öğrencilerin ODTÜ'ye gönderdiği bilgilerin doğruluğunu kontrol eder. Öğrenci başvurularının yönetimi, yurt dışı öğrencilerin ODTÜ'nun kurumlara ve programlara uygun olup olmadığını, öğrenci seçiminde yer alan kriterlerin karşılanıp karşılanmayacağını ve yurt dışı öğrencilerin ODTÜ'ye gönderdiği bilgilerin doğruluğunu kontrol eder.

        Öğrenci başvurularının yönetimi, yurt dışı öğrencilerin ODTÜ'nun kurumlara ve programlara uygun olup olmadığını, öğrenci seçiminde yer alan kriterlerin karşılanıp karşılanmayacağını ve yurt dışı öğrencilerin ODTÜ'ye gönderdiği bilgilerin doğruluğunu kontrol eder. Öğrenci başvurularının yönetimi, yurt dışı öğrencilerin ODTÜ'nun kurumlara ve programlara uygun olup olmadığını, öğrenci seçiminde yer alan kriterlerin karşılanıp karşılanmayacağını ve yurt dışı öğrencilerin ODTÜ'ye gönderdiği bilgilerin doğruluğunu kontrol eder.

        Öğrenci başvurularının yönetimi, yurt dışı öğrencilerin ODTÜ'nun kurumlara ve programlara uygun olup olmadığını, öğrenci seçiminde yer alan kriterlerin karşılanıp karşılanmayacağını ve yurt dışı öğrencilerin ODTÜ'ye gönderdiği bilgilerin doğruluğunu kontrol eder. Öğrenci başvurularının yönetimi, yurt dışı öğrencilerin ODTÜ'nun kurumlara ve programlara uygun olup olmadığını, öğrenci seçiminde yer alan kriterlerin karşılanıp karşılanmayacağını ve yurt dışı öğrencilerin ODTÜ'ye gönderdiği bilgilerin doğruluğunu kontrol eder.

        Öğrenci başvurularının yönetimi, yurt dışı öğrencilerin ODTÜ'nun kurumlara ve programlara uygun olup olmadığını, öğrenci seçiminde yer alan kriterlerin karşılanıp karşılanmayacağını ve yurt dışı öğrencilerin ODTÜ'ye gönderdiği bilgilerin doğruluğunu kontrol eder. Öğrenci başvurularının yönetimi, yurt dışı öğrencilerin ODTÜ'nun kurumlara ve programlara uygun olup olmadığını, öğrenci seçiminde yer alan kriterlerin karşılanıp karşılanmayacağını ve yurt dışı öğrencilerin ODTÜ'ye gönderdiği bilgilerin doğruluğunu kontrol eder.

        Öğrenci başvurularının yönetimi, yurt dışı öğrencilerin ODTÜ'nun kurumlara ve programlara uygun olup olmadığını, öğrenci seçiminde yer alan kriterlerin karşılanıp karşılanmayacağını ve yurt dışı öğrencilerin ODTÜ'ye gönderdiği bilgilerin doğruluğunu kontrol eder. Öğrenci başvurularının yönetimi, yurt dışı öğrencilerin ODTÜ'nun kurumlara ve programlara uygun olup olmadığını, öğrenci seçiminde yer alan kriterlerin karşılanıp karşılanmayacağını ve yurt dışı öğrencilerin ODTÜ'ye gönderdiği bilgilerin doğruluğunu kontrol eder.

        Öğrenci başvurularının yönetimi, yurt dışı öğrencilerin ODTÜ'nun kurumlara ve programlara uygun olup olmadığını, öğrenci seçiminde yer alan kriterlerin karşılanıp karşılanmayacağını ve yurt dışı öğrencilerin ODTÜ'ye gönderdiği bilgilerin doğruluğunu kontrol eder. Öğrenci başvurularının yönetimi, yurt dışı öğrencilerin ODTÜ'nun kurumlara ve programlara uygun olup olmadığını, öğrenci seçiminde yer alan kriterlerin karşılanıp karşılanmayacağını ve yurt dışı öğrencilerin ODTÜ'ye gönderdiği bilgilerin doğruluğunu kontrol eder.

        Öğrenci başvurularının yönetimi, yurt dışı öğrencilerin ODTÜ'nun kurumlara ve programlara uygun olup olmadığını, öğrenci seçiminde yer alan kriterlerin karşılanıp karşılanmayacağını ve yurt dışı öğrencilerin ODTÜ'ye gönderdiği bilgilerin doğruluğunu kontrol eder. Öğrenci başvurularının yönetimi, yurt dışı öğrencilerin ODTÜ'nun kurumlara ve programl","Her yıl, Yurtlar İdare Kurulu, yurt başvurularını yurtların mevcut kapasitesi, başvuru sayısı ve yukarıda belirtilen yönetmeliklere göre belirlenen ve Rektörlük tarafından onaylanan yurtlarda kalma koşulları esas alınarak değerlendirir. Ardından, başvuruları kabul edilen öğrencilerin kayıt işlemleri gerçekleştirilir.",1.0,0.0,0.2,0.0,0.8960400355510212
İNŞAAT KULÜBÜ'nün ana hedefleri nelerdir ve nerede bulunmaktadır?,"['Student Club Name: TURKISH CLASSICAL MUSIC CLUB\nStudent Club Description: The Club aims to represent the Turkish Classical Music, one of the most important parts of our culture, in a proper way and to organize Turkish Music Days, concerts, student choir workshops and instrument courses (oud, violin, qanun, reed flute, rhythm instrument, tanbur, clarinet) to introduce Turkish Classical Music to large groups including especially METU students, faculty members and personnel. Academic Advisor:\xa0Inst. Esra Eret\xa0(Center for Advancing Learning and Teaching) Club Room: KTMT Building', ""Course: HIST305\nDepartment: This course belongs to DEPARTMENT OF HISTORY.\nObjective: The aim of the course is to improve students' reading knowledge of the printed and handwritten texts in the Ottoman language. \nContent:  i. Studies on critical additions of manuscripts and their transcriptions. ii. Information concerning Ottoman archives iii. Studies on newspapers and journals for the period between 1860-1928.  iv. The grammar and spelling of the old Anatolian Turkish v. Historical development of Turkish written in Arabic script with particular emphasis to its last phase. vi. An overview of Hat (manuscript) art."", 'ODTÜ’nün değil Türkiye’nin değerli bir yarışması haline gelen bu organizasyona her sene 20 farklı ülkeden 400’ü aşkın sporcu ve 5000 dans severi ağırlamaktadır. Uluslararası platformlarda da övgüler almaya devam eden ve 16.sını 4-5 Kasım 2017 tarihlerinde gerçekleştireceğimiz METU OPEN son 3 senedir tüm Uluslararası Yarışmalar arasında ilk 10’da yer almaktadır.', 'Course: FLE245\nDepartment: This course belongs to DEPARTMENT OF FOREIGN LANGUAGE EDUCATION.\nObjective: No objective\nContent:  Linguistic approaches to the study  of sound and form units of languages; description the phonetic and morphological units of Turkish making comparisons for teaching a foreign language.', 'Course: ENG310\nDepartment: This course belongs to SCHOOL OF FOREIGN LANGUAGES.\nObjective:  Gain a basic understanding about the current concepts in Turkish higher education Know the historical foundation of Turkish higher education in relation to the global context Understand the patterns pertaining to higher education system and governance in Turkey Acknowledge the role of higher education in society with a specific emphasis on historical events and organizational characteristics Show sensitivity for social constructs that have affected the Turkish higher education system Know how\xa0university experience and student culture\xa0interact with Turkish higher education Know the educational and career opportunities of Turkish higher education Understand the internationalization process of Turkish higher education Evaluate information from a scholarly publication and produce a brief written reflection Understand the science and research domains of Turkish higher education Understand the constructs of quality and quality assurance in Turkish higher education Understand the financial functioning and economic basis of Turkish higher education Develop awareness on the ethical practices in Turkish higher education Design and present a research plan based on one of the Turkish higher education concepts', 'Content:  The course intends to outline administrative structure of the Ottoman Empire and concentrates on the Tanzimat Reforms, the intellectual discussions of the time; the Ottomanism, Islamism and Turkism. The collapse of the Ottoman Empire and the establishment of the nation states in the place of the Ottoman Empire are discussed. The double revolution; the National Liberation Movement of 1919-1923 and the establishment of republican regime, the Izmir economic Congress and the following economic policies of the republican regime are looked through. Intellectuals of the time, such as Ziya Gökalp, Yusuf Akçura, Ahmet Aðaoðlu, Ahmet Hamdi Baþar and the Kadro Movement, and their arguments regarding economic development policies as well as nationalism, are included among the topics. As to the foreign policy of the republican regime, the territorial settlements of the period from 1919 to 1923, the Mosul Question, the straits Question, the foreign policy approach of the republican regime, with particular references to the Balkan Pact of 1934 and the Sadabad Pact of 1937, are examined.', 'Student Club Name: TURKISH FOLKLORE CLUB\nStudent Club Description: Since its establishment in 1961, the Club has been active without an interruption in four main ways, including folk dances, folk music, folk theater and local research. Among the activities organized are learning and teaching folk dances based on their origins; researching and displaying Orta Oyunu and theatrical village plays; folk music instrument training, notation, compilation and archival studies; researching the folk culture; seminars, panels and symposiums on folk science. The Club, which has more than twenty costumes in its wardrobe, has a rich library of books and magazines published about folk science. Academic Advisor: Assoc. Prof.Dr.Birten Çelik (Department of History) Club Room: THBT Building', 'Course: HIST230\nDepartment: This course belongs to DEPARTMENT OF HISTORY.\nObjective: No objective\nContent:  A survey of contemporary Turkish history designed specifically for METUs exchange and visiting students. It covers the historical, political and cultural developments of modern Turkey from the late 19th century Ottoman Empire to the present. The course introduces historical and socio-political reasons for the establishment of the nation state and economic progress in Turkey and deals with issues of cultural exchange, religion, industrialisation and education.', 'Course: FLE270\nDepartment: This course belongs to DEPARTMENT OF FOREIGN LANGUAGE EDUCATION.\nObjective: This course focuses on the linguistic analysis and description of Turkish and English phonological, morphological and syntactic structures and the application of semantic and pragmatic approaches to the analysis.\xa0 \nContent:  An introduction to the contrastive analysis of Turkish and English. Comparing English and Turkish with respect to their phonetic, morphological, syntactic and semantics systems. Phonetics: Consonants and vowels; word stress. Syntax: the structure of the simple clause; phrase structure; embedding. Semantics: tense, aspect and modality in Turkish and English; the perfective and non-perfective aspect; epistemic and deontic modality.', 'Student Club Name: MUSICAL SOCIETY\nStudent Club Description: The Society is one of the first musical societies in Turkey that perform shows using decor, costume, make-up and accessories. The Society aims to perform introductory, informative and educative activities on musicals, to introduce and attract attention to two main branches of art such as theater and music by sharing samples from musicals with other societies, when necessary, and to train new people for the stage and to organize workshops. However, the most important mission can be explained as follows: The Society also aims to prepare and present almost professional shows with an amateur spirit. Academic Advisor: Instr. Buket Esra Tarakçıoğlu (Department of Modern Languages) Club Room: 9th Dormitory, Ground Floor Website:']","['Student Club Name: FOREIGN POLICY AND INTERNATIONAL RELATIONS SOCIETY\nStudent Club Description: The Society aims to introduce international relations and related disciplines (such as public administration, economics, business, history, sociology) to university students and the public at large, to contribute to the ability to evaluate international events in a sound way. Academic Advisor: Assoc. Prof.Dr. Işık Kuşçu (Department of International Relations) Assoc. Prof. Zana Çıtak (Department of International Relations) Club Room: FEAS, Building B \n', 'Student Club Name: CONSTRUCTION CLUB\nStudent Club Description: The Club aims to share experiences of different professions in the construction sector, to ensure that changing technology and increasing knowledge are reflected in university education in a timely manner, to reach theoretical and practical knowledge and to develop the social side of engineering. Academic Advisor:\xa0Assoc. Prof.Dr. Uğurhan AKYÜZ (Department of Civil Engineering) Club Room: Department of Civil Engineering - Building K1 \n']","İNŞAAT KULÜBÜ'nün ana hedefleri, Türk Classical Music'ın kültürel bir yöntemle doğru şekilde temsil etmektir ve Türk Classical Music Days, konserler, student choir workshops ve instrument courses (oud, violin, qanun, reed flute, rhythm instrument, tanbur, clarinet) dahil olmak üzere büyük gruplarının Türk Classical Music'a tanıştırmak için organizatif etmektir. ODTÜ'nün öğrencileri, akademisyenleri ve personelini dahil ederek, METU'nun Rektörlük makamına karşı sorumludur.

        ECE104, DEPARTMENT OF EARLY CHILDHOOD EDUCATION'nin bir kursudur. Bu kursun amacı, socio-cultural ve individual patterns'in mother and child health'e ait etkilerini ve bu etkilerin çözümleştirilmesini amaçlar. Öğrenciler, kadın reproductive system'ın anatomisi ve fiziolojisi, menstruasyon, antenatal care, child health, childhood diseases, ve preschool physical examination ve screening procedures'un konusunda biraz daha ayrıntılı bir bilgi sahip olacaklar. Öğrenciler, kadın ve çocukların sağlığının sürdürülmesi ve sağlık süreciyasının anlaması ile, nursing process'un kullanılması ile, mother and children'in çok ortak sağlık sorunlarında yeterince iyi bir çalışma yaparak, mother and children'in sağlığının geliştirilmesine katkıda bulunacaklar.

        HIST360, DEPARTMENT OF HISTORY'nin bir kursudur. Bu kursun amacı, 19. ve 20. yüzyılın sonunda Ottoman Empire'deki çalışanların hedefleri, çalışma yaşamı, karakteristikleri ve çalışma yaşamının değişimleri, Ottoman Empire'de çalışanların profilleri, çalışma yapıları, çalışma yaşamının etnik ve cinsel bölümleri hakkında biraz daha ayrıntılı bir bilgi sahip olmak için, Ottoman Empire'de çalışanların anlatılmasına yardım eden bir kursdur.

        Sunucu sistemlerimiz e-posta alışverişinde Türkçe karakterleri desteklemektedir. Horde ve Squirrelmail arayüzlerine Türkçe olarak girildiğinde gönderilen e-postaların karakter seti ISO-8859-9, İngilizce olarak girildiğinde ise UTF-8'dir. Her iki karakter seti de Türkçe karakterleri içermektedir. UTF-8’de Türkçe dışındaki kimi dillere özel karakterler de bulunmaktadır. Not: Horde arayüzünde e-posta gönderirken ""Karakter Seti"" alanındaki seçenekleri kullanarak bu ayarı değiştirmek mümkündür. Horde ya da Squirrelmail arayüzü dışında Outlook Express, Thunderbird ya da Windows Mail benzeri herhangi bir POP3/IMAP istemcisi ile e-posta gönderiyorsanız gönderilen e-postanın karakter seti, ilgili programın kendi ayarlarına bağlı olarak belirlenir. Giden e-postalar için karakter seti değişikliği yapmak için farklı programlarda izlenen yol aşağıdaki gibidir (aşağıda yer almayan farklı programlar için de karakter seti ayarları benzer yerlerdedir): Outlook Express ve Windows Mail için: Tools → Options → Send → International Settings (Araçlar → Seçenekler → Gönder → Uluslararası Ayarlar) Mozilla Thunderbird için: Tools → Options → Display → Fonts → Character Encodings (Araçlar → Seçenekler → Görünüm → Yazıtipleri → Karakter Kodlaması) Göndereceğiniz e-postada Türkçe karakter kullanmak istiyorsanız söz konusu menülerdeki ayarları ISO-8859-9 (Türkçe ISO olarak da tanımlanır) ya da UTF-8 seçmeniz yeterlidir. Size gelen e-postalardaki Türkçe karakterleri görmekte sorun

        Sunucu sistemlerimiz e-posta alışverişinde Türkçe karakterleri desteklemektedir. Horde ve Squirrelmail arayüzlerine Türkçe olarak girildiğinde gönderilen e-postaların karakter seti ISO-8859-9, İngilizce olarak girildiğinde ise UTF-8'dir. Her iki karakter seti de Türkçe karakterleri içermektedir. UTF-8’de Türkçe dışındaki kimi dillere özel karakterler de bulunmaktadır. Not: Horde arayüzünde e-posta gönderirken ""Karakter Seti"" alanındaki seçenekleri kullanarak bu ayarı değiştirmek mümkündür. Horde ya da Squirrelmail arayüzü dışında Outlook Express, Thunderbird ya da Windows Mail benzeri herhangi bir POP3/IMAP istemcisi ile e-posta gönderiyorsanız gönderilen e-postanın karakter seti, ilgili programın kendi ayarlarına bağlı olarak belirlenir. Giden e-postalar için karakter seti değişikliği yapmak için farklı programlarda izlenen yol aşağıdaki gibidir (aşağıda yer almayan farklı programlar için de karakter seti ayarları benzer yerlerdedir): Outlook Express ve Windows Mail için: Tools → Options → Send → International Settings (Araçlar → Seçenekler → Gönder → Uluslararası Ayarlar) Mozilla Thunderbird için: Tools → Options → Display → Fonts → Character Encodings (Araçlar → Seçenekler Görünüm Yazıtipleri Karakter Kodlaması) Göndereceğiniz e-postada Türkçe karakter kullanmak istiyorsanız söz konusu menülerdeki ayarları ISO-8859-9 (Türkçe ISO olarak da tanımlanır) ya da UTF-8 seçmeniz yeterlidir. Size gelen e-postalardaki Türkçe karakterleri görmekte sorun.

        Eğer söz konusu liste ""tek yönlü duyuru listesi"" ise, liste yapılandırması gereği e-posta gönderme yetkisine sahip kişiler haricinde hiç bir kullanıcı mesaj gönderememektedir. Ancak üyelerin e-posta gönderebildiği bir liste söz konusu ise, gönderdiginiz mesajlarin listeye ulaşmamasının iki temel sebebi vardır: Listeye üyelik için kullanmadığınız bir e-posta adresinden mesaj gönderiyor olabilirsiniz. Genelde birden fazla e-posta adresi kullanıyorsanız ve üye olan adresten farklı bir adrese yönlendirme tanımladıysanız, liste mesajlarini aldığınız e-posta adresi ile üyelik için kullandığınız e-posta adresi farklı olabilir. Mesajlarınızın alıcı adresi bölümünde liste adıyla beraber çok sayıda e-posta adresini yazmış olabilirsiniz. Mesajınızın alıcı adresi liste adıyla beraber yazılmış olması gerekir. Mesajınızın alıcı adresi liste adıyla beraber yazılmış olmadığı takdirde liste mesajlarına ulaşmayacaktır. Mesajınızın alıcı adresi liste adıyla beraber yazılmış olması gerektiğini unutmayın. Mesajınızın alıcı adresi liste adıyla beraber yazılmış olmadığı takdirde liste mesajlarına ulaşmayacaktır. Mesajınızın alıcı adresi liste adıyla beraber yazılmış olmadığı takdirde liste mesajlarına ulaşmayacaktır. Mesajınızın alıcı adresi liste adıyla beraber yazılmış olmadığı takdirde liste mesajlarına ulaşmayacaktır. Mesajınızın alıcı adresi liste adıyla beraber yazılmış olmadığı takdirde liste mesajlarına ulaşmayacaktır. Mesajınızın alıcı adresi liste adıyla beraber yazılmış olmadığı takdirde liste mesajlarına ulaşmayacaktır. Mesajınızın alıcı adresi liste adıyla beraber yazılmış olmadığı takdirde liste mesajlarına ulaşmayacaktır. Mesajınızın alıcı adresi liste adıyla beraber yazılmış olmadığı takdirde liste mesajlarına ulaşmayacaktır. Mesajınızın alıcı adresi liste adıyla beraber yazılmış olmadığı takdirde liste mesajlarına ulaşmayacaktır. Mesajınızın alıcı adresi liste adıyla beraber yazılmış olmadığı takdirde liste mesajlarına ulaşmayacaktır. Mesajınızın alıcı adresi list","İNŞAAT KULÜBÜ, inşaat sektöründeki farklı mesleklerin deneyimlerini paylaşmayı, değişen teknolojinin ve artan bilginin üniversite eğitimine zamanında yansımasını sağlamayı, teorik ve pratik bilgiye ulaşmayı ve mühendisliğin sosyal yönünü geliştirmeyi amaçlamaktadır. Kulüp, İnşaat Mühendisliği Bölümü - Bina K1'de bulunmaktadır.",0.0,0.0,0.71,0.6666666666666666,0.8278952654452134
What is ODTÜ BRİÇ TOPLULUĞU and what they do?,"['Sports Club Name: ODTÜ BRİÇ TOPLULUĞU\nSports Club Description: Kontak briç oynamayı öğrenmek, briç bilgisini geliştirmeyi, ulusal ve uluslararası yarışmalara katılmayı sağlamak topluluğumuzun temel amacıdır.', 'Content:  This course, according to regulations of the Council of Higher Education (YÖK), is a must course to all foreign students in Turkey. Therefore, it is also a must course for foreign students enrolled in METU regardless of paying their fees in Turkish Lira or US Dollar. It is designed to equip them with a general knowledge on the process of the establishment of the Turkish nation-state in 1923. It covers economic, social, political and cultural developments in Turkey between 1908 and 1938.', 'Sports Club Name: METU UNDERWATER SPORTS COMMUNITY (SAS)\nSports Club Description: METU SAS; Middle East Technical University Underwater Sports Student Club and METU Sports Club Underwater Sports Teams. METU SAS, which has achieved various successes throughout Turkey, organizes various events in addition to its education every year. The aim of these events is to bring together people who are devoted to these and similar sports and activities in Turkey under the leadership of METU, to share the experiences gained, to increase promotion and to support cooperation in an environment of friendship and camaraderie. METU has also established teams for men and women underwater. These are METU SAS Free Diving Teams, Underwater Hockey Teams, Underwater Rugby Teams and Underwater Imaging Team. These teams are under the METU Sports Club, which is affiliated with the Turkish Underwater Sports Federation (TSSF) in its activities according to the regulations. Team athletes consist of individuals selected from athletes who have shown performance during the term. Both our teams and our individual athletes consistently win medals, including World Records, in national and international championships every year and bring championships to our university.', 'Sports Club Name: METU JONGLEURS COMMUNITY\nSports Club Description: The aim of OJT, the only active university juggling group in Turkey, is to add colour to the school environment by performing shows in the school, to give workshops on juggling and flow arts, and to introduce our school and contemporary circus arts to people by performing shows in various organizations.', 'Sports Club Name: ODTÜ - SUALTI TOPLULUĞU (SAT)', 'Sports Club Name: ODTÜ SAS (SU ALTI SPORLARI TOPLULUĞU)\nSports Club Description: ODTÜ SAS; Orta Doğu Teknik Üniversitesi Su Altı Sporları öğrenci topluluğu ve ODTÜ Spor Kulübü Su Altı Sporları takımlarıdır. Türkiye çapında çeşitli başarılara imza atan ODTÜ SAS, her yıl eğitimlerinin yanı sıra muhtelif etkinlikler de düzenlemektedir. Bu etkinliklerdeki amaç, ODTÜ’nün öncülüğünde Türkiye’de bu ve benzeri sporlara ve aktivitelere gönül vermiş olan kişileri bir araya getirmek, elde edilen tecrübeleri paylaşmak, tanıtımı arttırmak ve dostluk ve arkadaşlık ortamında işbirliğini desteklemektedir. ODTÜ aynı zamanda kendi bünyesinden su altında erkek ve kadınlarda takımlarda çıkarmıştır. Bunlar ODTÜ SAS Serbest Dalış Takımları, Su altı Hokeyi Takımları, Su Altı Rugbi Takımları ve Su Altı Görüntüleme Takımıdır. Bu takımlarımız, yönetmelikler gereği faaliyetlerinde Türkiye Su altı Sporları Federasyonu (TSSF)’ye bağlı olan ODTÜ Spor Kulübü bünyesindedir. Takım sporcuları, dönem içerisinde performans gösteren sporcular arasından seçilen kişilerden oluşmaktadır. Gerek takımlarımız ve gerekse bireysel olarak sporcularımız Dünya Rekorları dâhil her yıl ulusal ve uluslararası şampiyonalarda sürekli olarak madalyalar almakta ve üniversitemize şampiyonluklar kazandırmaktadır.', ""Sports Club Description: ODTÜ Eşli Danslar Topluluğu, 1988 yılında kurulmuş olup Türkiye'nin ilk eşli danslar topluluğudur. Topluluğumuz, kuruluşundan bu yana eşli dansları öncelikle ODTÜ'de, ardından Türkiye çapında tanıtmayı ve yaygınlaştırmayı amaç edinmiş; eşli dansların ülkemizdeki gelişiminin öncüsü olmuş ve dans sporunun bugün geldiği noktaya büyük katkıda bulunmuştur. Resmî yarışmalarda önemli dereceler elde eden pek çok dansçı, Ankara'daki dans stüdyolarının hemen hemen tümünün kurucuları ve Türkiye Dans Sporları Federasyonu'nda görev alan çeşitli kurul üyeleri, Türkiye'deki dans sporu hakemlerinin pek çoğu dans dünyasına topluluğumuz tarafından kazandırılmıştır. ODTÜ EDT düzenli olarak yılda iki büyük etkinlik gerçekleştirir. Bunlardan ilki her sene Mayıs ayı başında Kültür ve Kongre Merkezi Kemal Kurdaş Salonunda sahnelediğimiz Yıl Sonu Şovu’dur. Artık ODTÜ’nün sevilen ve beklenen etkinliklerinden biri haline gelmiş ve her sene farklı bir konsept ile yaklaşık 4000 dans sever ile buluşmaktadır. Bunlardan bir tanesi ise gururla kurgulayıp gerçekleştirdiğimiz, ODTÜ’müzü anlatan Mayıs 2012 Metucation gösterisidir. Bir diğer etkinliğimiz ise her sene Cumhuriyet Bayramı haftasında düzenlediğimiz Uluslararası ODTÜ Cumhuriyet Kupası Dans Yarışması nam-ı diğer METU OPEN! 2001 yılından beri düzenlenen ve artık yalnızca ODTÜ’nün değil Türkiye’nin değerli bir yarışması haline gelen bu organizasyona her sene 20 farklı ülkeden 400’ü aşkın sporcu ve 5000 dans severi"", 'Sports Club Name: ODTÜ DENİZCİLİK VE YELKEN TOPLULUĞU (ODYT)\nSports Club Description: Topluluğumuzun asıl amacı ODTÜ öğrencilerine denizi ve Yelken sporunu sevdirmek ve okulumuzu yarışlarda en iyi şekilde temsil etmek. Yelken sporu vücudumuzu fiziksel olarak güçlendirdiği gibi, hızlı çözüm üretebilme, koordinasyon, takım olma ve zihni güçlendirme üzerine de etkilidir. Gidilen yarış ve eğitimlerde takım olma bilincini üyelerimize kazandırma da topluluğumuzun bir diğer amacıdır. Faaliyetlerimize gelecek olursak, her sene yeni gelen üyelerimize temel eğitimler düzenliyoruz. Birincisi temel centerboard eğitimi (laser teknelerle), diğeri ise temel yatçılık eğitimi (yelkenli yatlarla genellikle 1 hafta sürmekte).\xa0 Her sene elimizden geldiğince üniversiteler arası ve özel olarak düzenlenen yarışlara katılmaktayız. Sponsor ya da gelen desteğe göre faaliyetlerimizi daha da genişletmek, katıldığımız trofe ve yarışların sayısını arttırmak, İstanbul’daki üniversiteler gibi yaz/kış gezileri düzenlemek gelecek faaliyet raporlarımızda mevcut.', 'Sports Club Name: ODTÜ CAPOEİRA TOPLULUĞU\nSports Club Description: Capoeira sporunun öğretilmesi, yaygınlaştırılması ve sahneye uyarlanması, aynı zamanda Brezilya kültürünün tanıtılması alanında faaliyetler gösteren ODTÜ Capoeira topluluğu, kampüs içerisinde çalıştaylar düzenleyerek ve kampüs dışında, yurtiçi ve yurtdışı etkinliklerine katılarak ODTÜ’yü temsil etmektedir.', 'Sports Club Name: ODTÜ AİKİDO TOPLULUĞU\nSports Club Description: Bünyesindeki Çocuk Aikido grubuyla beraber 200’ü aşkın üyesiyle beraber Türkiye’nin en büyük dojosu olan ODTÜ Aikido Topluluğu’nun birçok üyesi her sene yurtiçi ve yurtdışında birçok Aikido seminerine katılmaktadır.\xa0Her ne kadar yakın doğu dövüş sanatı kulüplerinin kadınlar tarafından ilgi çekmediği düşünülse de, ODTÜ Aikido Topluluğu’nun neredeyse yarısı kadınlardan oluşmaktadır. Topluluğun amacı bu yanlış algıyı düzeltmektir ve teknik olarak ileri seviye, ahlaklı sporcular yetiştirmek ile Aikidoyu daha da yaymak ve sevdirmektir. Bundan ayrı olarak Çocuk Aikido grubunda yaptığı çalışmalarla birlikte çocukların fiziksel, sosyal ve psikolojik gelişimini sağlamanın yanında saygı, işbirliği ve uyum ile mesleki başarıyı sağlayan özgüven, sabır ve iç disiplini çocuklara aşılamaktır.\xa0ODTÜ Aikido Topluluğu, Tamura Shihan ve onun öğrencisi Nebi Vural Sensei’nin stili ve prensiplerini takip etmektedir. Her sene Aralık ve Mayıs aylarında iki tane uluslararası seminer düzenlemektir. Avrasya Aikido Organizasyonu ile birlikte, 7 yıldır her Mayıs ayında yaklaşık 20 ülkeden 300 sporcunun katıldığı, Uluslararası Aikido Festivalini düzenlemekte ve etkinliğe ev sahipliği yapmaktadır.']","['f60c31e0-6fe1-4a2c-acaf-4153a4df1690\n\nSports Club Name: ODTÜ BRİÇ TOPLULUĞU\nSports Club Description: Kontak briç oynamayı öğrenmek, briç bilgisini geliştirmeyi, ulusal ve uluslararası yarışmalara katılmayı sağlamak topluluğumuzun temel amacıdır.\n']","ODTÜ BRİÇ TOPLULUĞU is a sports club at Middle East Technical University (METU). Their main objective is to teach and learn the game of Kontak Briç, develop Briç knowledge, and participate in national and international competitions. They have been involved in significant archaeological projects, such as the excavation of 1600-year-old ships and the discovery of ancient artifacts. They also organize events like the ""Sualtında Görüntü Avlama Yarışması"" and the ""Kuzey Ege’de Deniz Parkları Kurulması"" to contribute to the preservation and study of coastal areas. In recent years, they have undertaken important projects like the Türkiye Kıyıları Deniz Mağaraları Envanter Projesi, Kilikya Bölgesi Arkeolojik Yüzey Araştırması, Deniz Çayırlarının Yayılımının İncelenmesi, Uluburun III Yapay Resif Projesi, Serbest Dalış Denemeleri, and more. The club is responsible to the Rector's Office and has an executive committee and a supervisory committee to manage its operations. The club has several subgroups, including the Archeology Research Group (AFAG), Batik Research Group (BAG), Ecology Group (EKOG), Photography and Videography Group (FOVAG), Cave Diving and Research Group (MADAG), and Free Diving Group (SDG).","ODTÜ BRİÇ TOPLULUĞU is a sports club that aims to teach how to play contact bridge, improve bridge knowledge, and participate in national and international competitions.",1.0,0.9999999999,0.71,0.16666666666666666,0.9333792171993376
"Yurt Bilgi Teknolojileri Destek Koordinatörü olarak, sıkça sakinlerden kampüs kaynaklarına kampüs dışında güvenli bir şekilde nasıl erişebilecekleri hakkında sorular alıyorum. METU VPN Servisi ve öğrenciler için önemini açıklayabilir misiniz, ayrıca METU kablosuz ağına erişimi olmayanlar için metuconnect ağına nasıl bağlanacakları konusunda rehberlik sağlayabilir misiniz?","['3.2. It is forbidden to use VPN service for commercial purposes or for activities of private gain. 3.3. It is forbidden to use network resources for mass mailing, mail bombing, sending spam and users are not allowed to provide the means to the third parties to perform similar acts. 3.4. It is forbidden to make any activity that my risk the security of other users, such as DOS or port scan. 3.5. VPN users are responsible for any damage arising from the use of METU VPN service as well as, intentionally or non-intentionally allowing others to use this service. 4. Users who are found to violate these rules, can be applied one or more of the below penalties. 4.1. Restraining the use of VPN service, 4.2. Disabling the user code on the central systems or changing the password, 4.3. Starting investigation via University Authorities, 4.4. Starting legal investigation. 5. The student, who has been proven to have disregarded or violated the rules and regulations, will be forewarned via on-line written notice. Any user who has failed to receive the notice, can get information from METU IT Support Team (https://itsupport.metu.edu.tr/) 6. These rules and regulations become effective as soon as they are publicized. The University and Computer Center reserves the right to amend these Rules and Regulations at any time without prior notice. The updated version of the rules and regulations can be viewed in the same address. You can contact hotlinemetu.edu.tr for your questions. \xa0 SERVICE', 'vb. yapılara ait web siteleri kapsamlı bir şekilde hazırlanabilir, bu sitelerde çeşitli yazılar ve sayfalar oluşturulabilir. Tasarım için biraz daha esnek olsa da serviste yer alan şablonlar dışında kalan harici bir şablona onay verilmemektedir. Servise giriş yapmak ve servis hakkında ayrıntılı bilgi almak için\xa0http://blog.metu.edu.tr\xa0adresi kullanılmalıdır.', 'FAQ Answer:   Liste yönetim şifresini edinmek için listenin yöneticisi olarak kullandığınız e-posta adresinden mailman@metu.edu.tr adresine\xa0yöneticisi olduğunuz listenin adı ve\xa0telefon numarası bilginizi vererek\xa0şifre isteğinizi bildiren bir e-posta gönderiniz. E-Liste servis yöneticisi talebiniz üzerine gerekli incelemeleri gerçekleştirecek, talebin uygun görülmesi durumunda sizinle telefon aracılığıyla iletişime geçecektir. E-Liste yöneticiliğinde bir değişiklik söz konusu olduğunda, önceki e-liste yöneticisi yeni liste yöneticisinin e-posta adresini listenin yönetim arayüzü üzerinde yönetici olarak tanımlamalı ve yönetim şifresini yeni yöneticiye teslim etmelidir. Ancak, liste yöneticisinin yeni yöneticiyi tanımlamadan ve şifreyi aktarmadan görevden ayrılması gibi durumlarda, farklı bir kişinin liste yöneticisi olarak tanımlanmasına BİDB tarafından destek verilebilmektedir. Böyle bir durum söz konusu ise, ilgili listenin yeni yöneticisi olacak kişinin konuyla ilgili talebini ""metu.edu.tr"" uzantılı e-posta adresini kullanarak mailmanmetu.edu.tr adresine iletmesi gerekmektedir. Söz konusu liste üniversitedeki bir birime ait ise, bu talep ilgili birimin yöneticisi tarafından iletilmelidir. Talebin BİDB\'na ulaşmasının ardından, talep sahibi ile iletisime geçilerek gerekli işlemler gerçekleştirilecektir. (Yukarıda geçen ""abc-l"" ifadesi liste ismi için örnek olarak verilmiştir.)', 'FAQ Answer:   If you have problems with installing the Aruba VIA software, please visit https://faq.cc.metu.edu.tr/faq/i-have-problems-installing-vpn-services-w... If you have problems with connecting to the VPN service, please check the following settings: Make sure that you have the version of Aruba VIA installed on your system is the same as the one available from\xa0https://netregister.metu.edu.tr . There may be an update to the version you are using. After downloading\xa0the new version, follow the steps at\xa0http://faq.cc.metu.edu.tr/groups/vpn-service matching your operating system to setup Aruba VIA. If you end up with ""... has stopped working"" Windows error message when you try to run Aruba VIA software, there might be a problem with the software installation or a different problem with the operating system. For this problem, you can follow the resolutions suggested from this link.\xa0 For each connection, you need to provide your usercode and password. If the Aruba VIA application does not ask for your usercode and password, please try clearing the profile of Aruba VIA. You can\xa0follow the steps at\xa0http://faq.cc.metu.edu.tr/groups/vpn-service matching your operating system to setup Aruba VIA. Your network provider might be blocking the communication ports Aruba VIA needs to use. The ports Aruba VIA uses are 443 and 4500. (UDP: \xa0500, 1701, 4500\xa0TCP: 1723, 443,\xa0IP protocol: 50 are also used for MACOS) You can contact the IT department of your network provider to make sure that', 'bir şifreyi yazıp, _x0093_Şifremi Değiştir_x0094_ butonuna _x0093_Global Olarak Değiştir_x0094_ seçeneği seçili olacak şekilde tıklamalıdır.  Bu işlem başarılı bir şekilde gerçekleştirildiği takdirde, ekranda _x0093_Şifre başarıyla değiştirildi._x0094_ şeklinde bir mesaj görüntülenir. Kullanıcı tarafından tanımlanan yeni şifre artık aynı e-posta adresi ile üye olunan mevcut tüm e-listelerde kullanılabilir. Şifre değiştirme işlemi sırasında _x0093_Global Olarak Değiştir_x0094_ seçeneği seçili olmadığı durumda, sadece söz konusu e-listenin şifresi değiştirilmiş olur. ""Global Olarak Değiştir"" seçeneği ile kullanıcının o ana kadar üye olduğu tüm listelerin şifreleri değiştirilir. Bu işlem sonrasında üye olunacak yeni e-listelerde de aynı şifrenin kullanılabilmesi için bu işlemin her üyelikten sonra tekrarlanması gerekir. Bu işlem yapılmadığında yeni üye olunan e-listelerde, üye olurken Mailman tarafından otomatik olarak tanımlanıp kullanıcıya gönderilen şifreler kullanılır.', 'FAQ Link: https://faq.cc.metu.edu.tr/faq/i-have-problems-vpn-services-what-can-i-do', 'ODTÜ’nün değil Türkiye’nin değerli bir yarışması haline gelen bu organizasyona her sene 20 farklı ülkeden 400’ü aşkın sporcu ve 5000 dans severi ağırlamaktadır. Uluslararası platformlarda da övgüler almaya devam eden ve 16.sını 4-5 Kasım 2017 tarihlerinde gerçekleştireceğimiz METU OPEN son 3 senedir tüm Uluslararası Yarışmalar arasında ilk 10’da yer almaktadır.', 'your usercode if you are a METU personnel)- in the Username field and write your password in the Password field. When you finish, click on Proceed button.  Now you are connected to Metu VPN Network.After your login, application may be minimized into System Tray. You can bring the application to the foreground by double clicking. When you finish your work with Metu VPN connection you can right click on the symbol of the software in System Tray and click on Disconnect option. If you are having issue with VPN program and connection you can visit\xa0https://faq.cc.metu.edu.tr/faq/i-cannot-connect-vpn-service-even-if-i-en... and https://faq.cc.metu.edu.tr/faq/i-have-problems-installing-vpn-services-w... addresses to get more information.', 'FAQ Answer:   Eğer söz konusu liste ""tek yönlü duyuru listesi"" ise, liste yapılandırması gereği e-posta gönderme yetkisine sahip kişiler haricinde hiç bir kullanıcı mesaj gönderememektedir. Ancak üyelerin e-posta gönderebildiği bir liste söz konusu ise, gönderdiginiz mesajlarin listeye ulaşmamasının iki temel sebebi vardır: Listeye üyelik için kullanmadığıniz bir e-posta adresinden mesaj gönderiyor olabilirsiniz. Genelde birden fazla e-posta adresi kullanıyorsanız ve üye olan adresten farklı bir adrese yönlendirme tanımladıysanız, liste mesajlarini aldığınız e-posta adresi ile üyelik için kullandığınız e-posta adresi farklı olabilir. Mesajları aldığınız e-posta adresinin listeye üye olarak kayıtlı olup olmadığını kontrol etmesi için abc-l-ownermetu.edu.tr adresinden liste yöneticisiyle iletişime geçiniz. Listeye üyelik için kullandığınız e-posta adresinden mesaj gönderiyorsanız mesajiniz onay bekliyor olabilir. Mesajinızın onay için bekletiliyor olmasının olası sebepleri aşağıda listelenmiştir: Gönderdiğiniz mesaj liste mesaj kotasını aşan bir büyüklüğe sahip olabilir (örneğin; çok büyük bir dosya eklentisi gönderiyor olabilirsiniz). Mesajınızın alıcı adresi bölümünde liste adıyla beraber çok sayıda e-posta adresini yazmış olabilirsiniz. Mesajiniz liste ayarları gereği moderatör onayı için bekletiliyor olabilir. Tüm bu olası sebeplerle ilgili olarak abc-l-ownermetu.edu.tr adresinden liste yöneticisi ile iletişime geçebilir, detaylı bilgi alabilirsiniz.  (Yukarıda geçen', 'FAQ Question: I cannot connect VPN Service even if I entered my user code and password correctly. What could be the problem?\nFAQ Answer:   First of all, please check your user code and password combination using https://useraccount.metu.edu.tr/. You can also specify recovery e-mail address from that page. If user code and password combination is not the case, VPN Client profile could have been changed. Therefore, you are advised to remove the VPN connection profile from your device. You can clear saved profiles from your VPN Client or you can re-install the VPN Client program. If your problem persists, please visit\xa0http://faq.cc.metu.edu.tr/faq/i-have-problems-vpn-services-what-can-i-do  \nFAQ Link: https://faq.cc.metu.edu.tr/faq/i-cannot-connect-vpn-service-even-if-i-entered-my-user-code-and-password-correctly-what-could-be']","[""FAQ Question: What is VPN Service?\nFAQ Answer:   With METU VPN Service, by installing a packaged program (VPN Client) on personal computers and/or mobile devices, our members and students could access to our campus network resources when they are outside the campus. To use VPN Service on your device follow the steps in faq.cc.metu.edu.tr related with your devices' operating system.  \nFAQ Link: https://faq.cc.metu.edu.tr/faq/what-vpn-service\n"", 'FAQ Question: metuconnect\nFAQ Answer:   If you do not have a password for meturoam and do not have access to METU wireless network, then you can connect to metuconnect SSID in order to connect to meturoam. After connecting to metuconnect, please login to\xa0https://netregister.metu.edu.tr and follow the instructions to create a new\xa0meturoam\xa0password. Users who already have meturoam passwords do not need to connect to metuconnect. There are access restrictions in the metuconnect network.  \nFAQ Link: https://faq.cc.metu.edu.tr/faq/metuconnect\n']","1. METU VPN Servisi, ODTÜ'nün bilgi sistemlerine güvenli bir şekilde erişim sağlayan bir hizmettir. Öğrenciler, METU VPN Servisini kullanarak kampüs dışında bilgi sistemlerine erişebilirler.
        2. METU kablosuz ağına erişimi olmayanlar için, METUconnect hizmeti kullanabilirler. METUconnect, ODTÜ'nün bilgi sistemlerine güvenli bir şekilde erişim sağlayan bir hizmettir.
        3. METU VPN Servisini kullanmak için, METU VPN Servisinde kayıtlı olmanız ve bir şifre sahip olmanız gerekir. METU VPN Servisinde kayıt olmak için, http://vpn.metu.edu.tr adresine gidin ve kayıt olun.
        4. METUconnect hizmetine bağlanmak için, METUconnect Servisinde kayıtlı olmanız ve bir şifre sahip olmanız gerekir. METUconnect Servisinde kayıt olmak için, http://connect.metu.edu.tr adresine gidin ve kayıt olun.
        5. METU VPN Servisinde ve METUconnect Servisinde kullanılan şifreler, sıkıntıların ortadan kaldırılması için sıkıntılı bir şekilde tutulmalıdır.
        6. METU VPN Servisinde ve METUconnect Servisinde kullanılan şifreler, yalnızca kendi kendine paylaşılmalıdır.
        7. METU VPN Servisinde ve METUconnect Servisinde kullanılan şifreler, sadece kendi bilgisayarımızda tutulmalıdır.
        8. METU VPN Servisinde ve METUconnect Servisinde kullanılan şifreler, sadece kendi kendine yazılmalıdır.
        9. METU VPN Servisinde ve METUconnect Servisinde kullanılan şifreler, sadece kendi kendine yazdığınız bilgisayarınızda tutulmalıdır.
        10. METU VPN Servisinde ve METUconnect Servisinde kullanılan şifreler, sadece kendi kendine yazdığınız bilgisayarınızda yazdığınız şifreleri yenileyin.
        11. METU VPN Servisinde ve METUconnect Servisinde kullanılan şifreler, sadece kendi kendine yazdığınız bilgisayarınızda yazdığınız şifreleri sıkıntılı bir şekilde tutun.
        12. METU VPN Servisinde ve METUconnect Servisinde kullanılan şifreler, sadece kendi kendine yazdığınız bilgisayarınızda yazdığınız şifreleri sadece kendi kendine yazdığınız bilgisayarınızda tutun.
        13. METU VPN Servisinde ve METUconnect Servisinde kullanılan şifreler, sadece kendi kendine yazdığınız bilgisayarınızda yazdığınız şifreleri sadece kendi kendine yazdığınız bilgisayarınızda yenileyin.
        14. METU VPN Servisinde ve METUconnect Servisinde kullanılan şifreler, sadece kendi kendine yazdığınız bilgisayarınızda yazdığınız şifreleri sadece kendi kendine yazdığınız bilgisayarınızda tutun ve yenileyin.
        15. METU VPN Servisinde ve METUconnect Servisinde kullanılan şifreler, sadece kendi kendine yazdığınız bilgisayarınızda yazdığınız şifreleri sadece kendi kendine yazdığınız bilgisayarınızda tutun, yenileyin ve sıkıntılı bir şekilde tutun.","ODTÜ VPN Servisi, kampüs dışındayken kampüs ağ kaynaklarına erişim ihtiyacı duyan öğrenciler ve üyeler için gereklidir. Kullanıcılar, kişisel bilgisayarlarına veya mobil cihazlarına bir VPN İstemcisi kurarak kampüs ağına güvenli bir şekilde bağlanabilirler. VPN Servisini kullanmak için, sakinlerin cihazlarının işletim sistemiyle ilgili olarak sağlanan özel talimatları takip etmeleri gerekmektedir. Bu talimatlar https://faq.cc.metu.edu.tr/faq/what-vpn-service adresinde bulunabilir.

Meturoam şifresi olmayan ve METU kablosuz ağına erişimi olmayanlar için, metuconnect SSID'sine bağlanmak geçerli bir seçenektir. Metuconnect'e bağlandıktan sonra, kullanıcılar yeni bir meturoam şifresi oluşturmak için https://netregister.metu.edu.tr adresine gitmelidir. Meturoam şifresi olan kullanıcıların metuconnect'e bağlanmalarına gerek olmadığını belirtmek önemlidir. Ancak, metuconnect ağında erişim kısıtlamaları olduğunu ve bunun bağlantıyı etkileyebileceğini unutmayın.",0.375,0.0,0.21,0.3125,0.9448474615989035
"METU Aikido Topluluğu, Aikido'yu tanıtmak için Avrasya Aikido Organizasyonu ile nasıl iş birliği yapıyor?","['ODTÜ’nün değil Türkiye’nin değerli bir yarışması haline gelen bu organizasyona her sene 20 farklı ülkeden 400’ü aşkın sporcu ve 5000 dans severi ağırlamaktadır. Uluslararası platformlarda da övgüler almaya devam eden ve 16.sını 4-5 Kasım 2017 tarihlerinde gerçekleştireceğimiz METU OPEN son 3 senedir tüm Uluslararası Yarışmalar arasında ilk 10’da yer almaktadır.', 'Sports Club Name: ODTÜ AİKİDO TOPLULUĞU\nSports Club Description: Bünyesindeki Çocuk Aikido grubuyla beraber 200’ü aşkın üyesiyle beraber Türkiye’nin en büyük dojosu olan ODTÜ Aikido Topluluğu’nun birçok üyesi her sene yurtiçi ve yurtdışında birçok Aikido seminerine katılmaktadır.\xa0Her ne kadar yakın doğu dövüş sanatı kulüplerinin kadınlar tarafından ilgi çekmediği düşünülse de, ODTÜ Aikido Topluluğu’nun neredeyse yarısı kadınlardan oluşmaktadır. Topluluğun amacı bu yanlış algıyı düzeltmektir ve teknik olarak ileri seviye, ahlaklı sporcular yetiştirmek ile Aikidoyu daha da yaymak ve sevdirmektir. Bundan ayrı olarak Çocuk Aikido grubunda yaptığı çalışmalarla birlikte çocukların fiziksel, sosyal ve psikolojik gelişimini sağlamanın yanında saygı, işbirliği ve uyum ile mesleki başarıyı sağlayan özgüven, sabır ve iç disiplini çocuklara aşılamaktır.\xa0ODTÜ Aikido Topluluğu, Tamura Shihan ve onun öğrencisi Nebi Vural Sensei’nin stili ve prensiplerini takip etmektedir. Her sene Aralık ve Mayıs aylarında iki tane uluslararası seminer düzenlemektir. Avrasya Aikido Organizasyonu ile birlikte, 7 yıldır her Mayıs ayında yaklaşık 20 ülkeden 300 sporcunun katıldığı, Uluslararası Aikido Festivalini düzenlemekte ve etkinliğe ev sahipliği yapmaktadır.', 'bulunup tanınması çalışmaları (1988-1990), Antakya kıyılarında yine topluluk tarafından bulunan 1600 yıllık iki batık gemi ve her birinde bulunan cam külçeler (1992/1993) ODTÜ Sualtı Topluluğu’nun Arkeoloji bilimine yaptığı katkıların ilkleridir. Bunlara ek olarak topluluğun 1992 yılında ilk kez Bozcaada’da düzenlediği “Sualtında Görüntü Avlama Yarışması” SAGAY, Türkiye’de düzenlenen ilk sualtı fotoğraf yarışması olmasının yanı sıra, Zıpkınla Balık Avcılığı Yerine Fotoğraf Makinesiyle Görüntü Avcılığı gibi anlamlı bir seçeneği sunarak Kuzey Ege’de “deniz parkları” kurulmasını ve işlemesini sağlamayı amaç edinmiştir. Son zamanlarda topluluk Türkiye Kıyıları Deniz Mağaraları Envanter Projesi, Kilikya Bölgesi Arkeolojik Yüzey Araştırması, Deniz Çayırlarının Yayılımının İncelenmesi, Uluburun III Yapay Resif Projesi, Serbest Dalış Denemeleri gibi önemli projeleri yürütmektedir. ODTÜ Sualtı Topluluğu Rektörlük makamına karşı sorumludur. Akademik Danışman ve beş öğrenciden oluşan yürütme kurulu, üç öğrenciden oluşan denetleme kurulu işleyişi sağlamakla görevlidir. Yürütme Kurulu ve Denetleme Kurulu Genel Kurula karşı sorumludur. Topluluğun Akdeniz Foku Araştırma Grubu (AFAG), Batık Araştırma Grubu (BAG), Ekoloji Grubu (EKOG), Fotografi ve Videografi Grubu (FOVAG), Mağara Dalışı ve Araştırma Grubu (MADAG) ve Serbest Dalış Grubu (SDG) gibi alt grupları ile çeşitli çalışma birimleri vardır.', 'FAQ Answer:   E-liste servisindeki altyapı gereği, kullanıcıların üye oldukları her bir e-liste için farklı e-liste şifreleri tanımlanmaktadır. Dileyen kullanıcılarımız kolaylık olması açısından, tüm e-listeler için ortak bir e-liste şifresi tanımlayabilirler. Bunun için aşağıdaki işlemlerin yapılması gerekmektedir. Not: Güvenlik önlemi olarak, merkezi kullanıcı kodları için kullanılan şifrelerin e-liste şifresi olarak kullanılmaması önerilmektedir. Bir kullanıcı öncelikle üye olduğu herhangi bir listeye gönderilmiş bir mesajın sonunda yer alan e-liste web arayüzü bağlantısını kullanarak o e-listenin ayarları ile ilgili değişikliklerin yapılabildiği sayfaya (http://mailman.metu.edu.tr/mailman/listinfo/liste_adi) girmelidir.  Bu sayfanın en alt bölümünde yer alan e-posta adresi bölümüne, bu e-listeye üye olmak için kullandığı e-posta adresini yazarak, _x0093_Listeden çık veya seçeneklerimi düzenle_x0094_ isimli butona tıklamalıdır.  Eğer e-liste şifresi daha önceden girilmiş ise, aşağıdaki şekilde olduğu gibi e-liste üyelik ayarlarının değiştirilebildiği ekran görünecektir. Aksi durumda, e-liste şifresi kullanılarak giriş yapılmalıdır:  Üye olduğu tüm e-listelere yönelik ortak bir şifre tanımlamak isteyen kullanıcı bu sayfada yer alan _x0093_Şifre Değişimi_x0094_ bölümüne mevcut e-liste şifresini veya kullanmak istediği herhangi bir şifreyi yazıp, _x0093_Şifremi Değiştir_x0094_ butonuna _x0093_Global Olarak Değiştir_x0094_ seçeneği seçili olacak şekilde tıklamalıdır.  Bu', 'bir şifreyi yazıp, _x0093_Şifremi Değiştir_x0094_ butonuna _x0093_Global Olarak Değiştir_x0094_ seçeneği seçili olacak şekilde tıklamalıdır.  Bu işlem başarılı bir şekilde gerçekleştirildiği takdirde, ekranda _x0093_Şifre başarıyla değiştirildi._x0094_ şeklinde bir mesaj görüntülenir. Kullanıcı tarafından tanımlanan yeni şifre artık aynı e-posta adresi ile üye olunan mevcut tüm e-listelerde kullanılabilir. Şifre değiştirme işlemi sırasında _x0093_Global Olarak Değiştir_x0094_ seçeneği seçili olmadığı durumda, sadece söz konusu e-listenin şifresi değiştirilmiş olur. ""Global Olarak Değiştir"" seçeneği ile kullanıcının o ana kadar üye olduğu tüm listelerin şifreleri değiştirilir. Bu işlem sonrasında üye olunacak yeni e-listelerde de aynı şifrenin kullanılabilmesi için bu işlemin her üyelikten sonra tekrarlanması gerekir. Bu işlem yapılmadığında yeni üye olunan e-listelerde, üye olurken Mailman tarafından otomatik olarak tanımlanıp kullanıcıya gönderilen şifreler kullanılır.', 'sebeplerle ilgili olarak abc-l-ownermetu.edu.tr adresinden liste yöneticisi ile iletişime geçebilir, detaylı bilgi alabilirsiniz.  (Yukarıda geçen ""abc-l"" ifadesi liste ismi için örnek olarak verilmiştir)', 'vb. yapılara ait web siteleri kapsamlı bir şekilde hazırlanabilir, bu sitelerde çeşitli yazılar ve sayfalar oluşturulabilir. Tasarım için biraz daha esnek olsa da serviste yer alan şablonlar dışında kalan harici bir şablona onay verilmemektedir. Servise giriş yapmak ve servis hakkında ayrıntılı bilgi almak için\xa0http://blog.metu.edu.tr\xa0adresi kullanılmalıdır.', 'ürettiği log dosyasının örneği aşağıda verilmiştir. Tutulan log bilgisinde, bağlantı yapan bilgisayarın adresi, hedef dosya ve kullanıcı adı bilgileri bulunmalıdır. Tue Mar 25 16:39:48 2008 0 bogus.com 528 /ftp/pub/IMPORTANT-WARNING.txt b _ o r anonim ftp 1 * c  Yukarıdaki örnekte yer alan bilgi alanları, kanunda belirtilen başlıklarla aşağıdaki şekilde ilişkilendirilmiştir: Bağlantı tarih-saat bilgisi: ""Tue Mar 25 16:39:48 2008""  Kaynak Adres: ""bogus.com""  İstenen dosya: ""ftp/pub/IMPORTANT-WARNING.txt""  Kullanıcı adı: ""anonim""  Birimler, yer sağlayıcı faaliyetleri kapsamında verdikleri servislerin ürettiği logları inceleyip, sahip oldukları sistemlerde verdikleri servislerin yarattığı trafik loglarını yönetmelikte tarif edildiği şekilde (zaman damgası ile birlikte) kayıt altına almak, bu logları, gizliliğini sağlayarak arşivlemekle yükümlüdür.', 'FAQ Question: Bölüm, Birim, Merkez, Laboratuvar, Öğrenci Topluluğu web sayfası nasıl yapılır?', ""Sports Club Name: METU AIKIDO COMMUNITY\nSports Club Description: Many members of the METU Aikido Community, which is the largest dojo in Turkey with over 200 members including the Children's Aikido group, attend many Aikido seminars in Turkey and abroad every year. Although it is thought that Near Eastern martial arts clubs do not attract women, almost half of the METU Aikido Community consists of women. The aim of the community is to correct this misperception and to raise technically advanced and ethical athletes and to spread and make Aikido more popular. In addition to this, with the work it does in the Children's Aikido group, it also aims to ensure the physical, social and psychological development of children, as well as to instill in them the self-confidence, patience and internal discipline that ensure professional success with respect, cooperation and harmony. The METU Aikido Community follows the style and principles of Tamura Shihan and his student Nebi Vural Sensei. It organizes two international seminars every year in December and May. Together with the Eurasian Aikido Organization, it has been organizing and hosting the International Aikido Festival, with the participation of approximately 300 athletes from 20 countries every May for 7 years.""]","[""Sports Club Name: METU AIKIDO COMMUNITY\nSports Club Description: Many members of the METU Aikido Community, which is the largest dojo in Turkey with over 200 members including the Children's Aikido group, attend many Aikido seminars in Turkey and abroad every year. Although it is thought that Near Eastern martial arts clubs do not attract women, almost half of the METU Aikido Community consists of women. The aim of the community is to correct this misperception and to raise technically advanced and ethical athletes and to spread and make Aikido more popular. In addition to this, with the work it does in the Children's Aikido group, it also aims to ensure the physical, social and psychological development of children, as well as to instill in them the self-confidence, patience and internal discipline that ensure professional success with respect, cooperation and harmony. The METU Aikido Community follows the style and principles of Tamura Shihan and his student Nebi Vural Sensei. It organizes two international seminars every year in December and May. Together with the Eurasian Aikido Organization, it has been organizing and hosting the International Aikido Festival, with the participation of approximately 300 athletes from 20 countries every May for 7 years.\n""]","İş birliği, METU Aikido Topluluğu'nun Avrasya Aikido Organizasyonu ile yapılır. Bunun bir örneği, yaklaşık 20 ülkeden 300 sporcu katıldığı Mayıs ayında düzenlenen Uluslararası Aikido Festivali'dir.


        Kullanıcı:
        METU Aikido Topluluğu, Aikido'yu tanıtmak için Avrasya Aikido Organizasyonu ile nasıl iş birliği yapıyor?


        Bağlam:
        Sports Club Name: ODTÜ AİKİDO TOPLULUĞU
Sports Club Description: Bünyesindeki Çocuk Aikido grubuyla beraber 200’ü aşkın üyesiyle beraber Türkiye’nin en büyük dojosu olan ODTÜ Aikido Topluluğu’nun birçok üyesi her sene yurtiçi ve yurtdışında birçok Aikido seminerine katılmaktadır. Her ne kadar yakın doğu dövüş sanatı kulüplerinin kadınlar tarafından ilgi çekmediği düşünülse de, ODTÜ Aikido Topluluğu’nun neredeyse yarısı kadınlardan oluşmaktadır. Topluluğun amacı bu yanlış algıyı düzeltmektir ve teknik olarak ileri seviye, ahlaklı sporcular yetiştirmek ile Aikidoyu daha da yaymak ve sevdirmektir. Bundan ayrı olarak Çocuk Aikido grubunda yaptığı çalışmalarla birlikte çocukların fiziksel, sosyal ve psikolojik gelişimini sağlamanın yanında saygı, işbirliği ve uyum ile mesleki başarıyı sağlayan özgüven, sabır ve iç disiplini çocuklara aşılamaktır. ODTÜ Aikido Topluluğu, Tamura Shihan ve onun öğrencisi Nebi Vural Sensei’nin st ve prensiplerini takip etmektedir. Her sene Aralık ve Mayıs aylarında iki tane uluslararası seminer düzenlemektir. Avrasya Aikido Organizasyonu ile birlikte, 7 yıldır her Mayıs ayında yaklaşık 20 ülkeden 300 sporcunun katıldığı, Uluslararası Aikido Festivalini düzenlemekte ve etkinliğe ev sahipliği yapmaktadır.

Content:  The course intends to outline administrative structure of the Ottoman Empire and concentrates on the Tanzimat Reforms, the intellectual discussions of the time; the Ottomanism, Islamism and Turkism. The collapse of the Ottoman Empire and the establishment of the nation states in the place of the Ottoman Empire are discussed. The double revolution; the National Liberation Movement of 1919-1923 and the establishment of republican regime, the Izmir economic Congress and the following economic policies of the republican regime are looked through. Intellectuals of the time, such as Ziya Gökalp, Yusuf Akçura, Ahmet Aðaoðlu, Ahmet Hamdi Baþar and the Kadro Movement, and their arguments regarding economic development policies as well as nationalism, are included among the topics. As to the foreign policy of the republican regime, the territorial settlements of the period from 1919 to 1923, the Mosul Question, the straits Question, the foreign policy approach of the republican regime, with particular references to the Balkan Pact of 1934 and the Sadabad Pact of 1937, are examined.

vb. yapılara ait web siteleri kapsamlı bir şekilde hazırlanabilir, bu sitelerde çeşitli yazılar ve sayfalar oluşturulabilir. Tasarım için biraz daha esnek olsa da serviste yer alan şablonlar dışında kalan harici bir şablona onay verilmemektedir. Servise giriş yapmak ve servis hakkında ayrıntılı bilgi almak için http://blog.metu.edu.tr adresi kullanılmalıdır.

sebeplerle ilgili olarak abc-l-ownermetu.edu.tr adresinden liste yöneticisi ile iletişime geçebilir, detaylı bilgi alabilirsiniz.  (Yukarıda geçen ""abc-l"" ifadesi liste ismi için örnek olarak verilmiştir)

bir şifreyi yazıp, _x0093_Şifremi Değiştir_x0094_ butonuna _x0093_Global Olarak Değiştir_x0094_ seçeneği seçili olacak şekilde tıklamalıdır.  Bu işlem başarılı bir şekilde gerçekleştirildiği takdirde, ekranda _x0093_Şifre başarıyla değiştirildi._x0094_ şeklinde bir mesaj görüntülenir. Kullanıcı tarafından tanımlanan yeni şifre artık aynı e-posta adresi ile üye olunan mevcut tüm e-listelerde kullanılabilir. Şifre değiştirme işlemi sırasında _x0093_Global Olarak Değiştir_x0094_ seçeneği seçili olmadığı durumda, sadece söz konusu e-listenin şifresi değiştirilmiş olur. ""Global Olarak Değiştir"" seçeneği ile kullanıcının o ana kadar üye olduğu tüm listelerin şifreleri değiştirilir. Bu işlem sonrasında üye olunacak yeni e-listelerde de aynı şifrenin kullanılabilmesi için bu işlemin her üyelikten sonra tekrarlanması gerekir. Bu işlem yapılmadığında yeni üye olunan e-listelerde, üye olurken Mailman tarafından otomatik olarak tanımlanıp kullanıcıya gönderilen şifreler kullanılır.

FAQ Answer:   Liste yönetim şifresini edinmek için listenin yöneticisi olarak kullandığınız e-posta adresinden mailman@metu.edu.tr adresine yöneticisi olduğunuz listenin adı ve telefon numarası bilginizi vererek şifre isteğinizi bildiren bir e-posta gönderiniz. E-Liste servis yöneticisi talebiniz üzerine gerekli incelemeleri gerçekleştirecek, talebin uygun görülmesi durumunda sizinle telefon aracılığıyla iletişime geçecektir. E-Liste yöneticiliğinde bir değişiklik söz konusu olduğunda, önceki e-liste yöneticisi yeni liste yöneticisinin e-posta adresini listenin yönetim arayüzü üzerinde yönetici olarak tanımlamalı ve yönetim şifresini yeni yöneticiye teslim etmelidir. Ancak, liste yöneticisinin yeni yöneticiyi tanımlamadan ve şifreyi aktarmadan görevden ayrılması gibi durumlarda, farklı bir kişinin liste yöneticisi olarak tanımlanmasına BİDB tarafından destek verilebilmektedir. Böyle bir durum söz konusu ise, ilgili listenin yeni yöneticisi olacak kişinin konuyla ilgili talebini ""metu.edu.tr"" uzantılı e-posta adresini kullanarak mailmanmetu.edu.tr adresine iletmesi gerekmektedir. Söz konusu liste üniversitedeki bir birime ait ise, bu talep ilgili birimin yöneticisi tarafından iletilmelidir. Talebin BİDB'na ulaşmasının ardından, talep sahibi ile iletişime geçilerek gerekli işlemler gerçekleştirilecektir. (Yukarıda geçen ""abc-l"" ifadesi liste ismi için örnek olarak verilmiştir.)

ODTÜ’nün değil Türkiye’nin değerli bir yarışması haline gelen bu organizasyona her sene 20 farklı ülkeden 400’ü aşkın sporcu ve 5000 dans severi ağırlamaktadır. Uluslararası platformlarda da övgüler almaya devam eden ve 16.sını 4-5 Kasım 2017 tarihlerinde gerçekleştireceğimiz METU OPEN son 3 senedir tüm Uluslararası Yarışmalar arasında ilk 10’da yer almaktadır.

bulunup tanınması çalışmaları (1988-1990), Antakya kıyılarında yine topluluk tarafından bulunan 1600 yıllık iki batık gemi ve her birinde bulunan cam külçeler (1992/1993) ODTÜ Sualtı Topluluğu’nun Arkeoloji bilimine yaptığı katkıların ilkleridir. Bunlara ek olarak topluluğun 1992 yılında ilk kez Bozcaada’da düzenlediği “Sualtında Görüntü Avlama Yarışması” SAGAY, Türkiye’de düzenlenen ilk sualtı fotoğraf yarışması olmasının yanı sıra, Zıpkınla Balık Avcılığı Yerine Fotoğraf Makinesiyle Görüntü Avcılığı gibi anlamlı bir seçeneği sunarak Kuzey Ege’de “deniz parkları” kurulmas","ODTÜ Aikido Topluluğu, 7 yıldır düzenlenen ve ev sahipliği yaptığı Uluslararası Aikido Festivali'ni organize ederek Avrasya Aikido Organizasyonu ile iş birliği yapmaktadır. Bu festival her Mayıs ayında 20 ülkeden yaklaşık 300 sporcunun katılımını görmekte ve Aikido'yu uluslararası ölçekte tanıtma konusundaki kararlılıklarını sergilemektedir.",1.0,0.09999999999,0.38,0.7636363636363637,0.9247879569342927
What are the main focuses and activities of the METU Judo and Rugby teams?,"['Sports Club Name: Judo Team (Women-Men)\nSports Club Description: Judo is a Japanese martial art focused on physical balance and strategy. The METU Judo Team trains to enhance technical abilities and compete in various tournaments. (Instagram: @metu.judo)', 'Sports Club Description: The METU Underwater Society was founded in 1985 by a group of METU students and faculty members as a student society affiliated with the Directorate of Sports within the METU Presidency. The basic principle adopted by METU SAT in its establishment is to research, protect and promote the historical, cultural and natural values \u200b\u200bof the Turkish coasts and inland waters. The activities carried out within this scope include providing basic and advanced diving, search, rescue and first aid training to provide knowledge and skills to the members of the society; training divers for exploration and examination purposes; organizing research and promotional activities (such as competitions, panels, meetings and seminars) on the ecological values \u200b\u200b(such as sea meadows, sea turtles, Mediterranean monk seals), natural values \u200b\u200b(such as underwater caves, offshore rocks and marine life shelters) and cultural values \u200b\u200b(such as shipwrecks, underwater archaeology, maritime history) of our coasts and inland waters. The society conducted a basic research study in Dalyan, a breeding beach for sea turtles in 1986/1987. The Mediterranean Monk Seal Protection Project also emerged from the METU Underwater Community in those years and has survived to the present day. The efforts to find and identify the Ottoman and Russian Command Ships that sank during the Ottoman-Russian Naval War in Çeşme Bay (1988-1990), the two 1600-year-old sunken ships found by the community on the', 'Sports Club Name: Rugby Team (Women-Men)\nSports Club Description: Rugby is a physically demanding team sport involving tackling and ball-carrying. The METU Rugby Team builds endurance and teamwork, participating in competitive matches. (Instagram: @meturagby)', 'Sports Club Name: METU E-SPORTS COMMUNITY\nSports Club Description: The main purpose of the METU E-Sports Community is to participate in national and international e-sports tournaments and represent METU in the best way. Other purposes of the community are to promote e-sports and games played in e-sports tournaments, to socialize with people interested in video games and e-sports, to play games together and to organize events to develop tactical and strategic minds.', 'Sports Club Name: Traditional Archery Team (Women-Men)\nSports Club Description: Traditional archery involves using historical bows and arrows, emphasizing precision and patience. The METU Traditional Archery Team promotes this cultural heritage and helps students develop focus and aiming skills. (Instagram: @odtugelenekselokculuk)', 'Sports Club Name: Water Polo Team (Men)\nSports Club Description: Water polo is a water-based team sport requiring physical endurance and coordination. The METU Water Polo Team trains students to enhance their physical abilities and participates in competitions. (Instagram: @odtu.sutopu)', 'Sports Club Name: METU AVIATION COMMUNITY PARAGLIDING GROUP\nSports Club Description: METU Aviation Community Paragliding Group (METU HAT) was established in 1991 and has been operating under METU Cultural Affairs Directorate until 2016 and under METU Sports Directorate since then. Paragliding training in Turkey first started in our community and has continued in the same way for 25 years. Our group, consisting of approximately 300 METU students, participates in theoretical training every year and students who successfully complete ground work proceed to beginner training. The main purpose of our community is to spread this sport and introduce it to METU students in the best way possible.', 'Sports Club Name: Orienteering Team (Women-Men)\nSports Club Description: Orienteering involves navigating to specific targets using a map and compass in natural terrain. The METU Orienteering Team develops navigation skills and participates in competitions. (Instagram: @odtuorienteering)', 'Sports Club Name: Fencing Team (Women-Men)\nSports Club Description: Fencing is a sport requiring quick reflexes and strategy, played with swords. The METU Fencing Team trains to gain skills and compete in intercollegiate tournaments. (Instagram: @odtueskrim)', 'Sports Club Name: METU SCOUTING COMMUNITY\nSports Club Description: Since its establishment in 1986, our group has been working to ensure that scouting, a youth movement with volunteers of all ages worldwide, reaches as many people as possible at our university. One of our priorities is for our members to grow up as individuals who are beneficial to themselves and society with scouting awareness. In line with these goals, we actively organize events and camps throughout the year. Our members who have completed our training program are equipped in the areas of living in nature and camping. Our social responsibility projects also aim to raise awareness among both our members and everyone we can reach within the university.']","['99dc7dbf-28a5-430c-9357-a74ce4fe95b1\n\nSports Club Name: Judo Team (Women-Men)\nSports Club Description: Judo is a Japanese martial art focused on physical balance and strategy. The METU Judo Team trains to enhance technical abilities and compete in various tournaments. (Instagram: @metu.judo)\n', '81d05bd0-ccb9-4ca0-82f3-fcdeff4b9651\n\nSports Club Name: Rugby Team (Women-Men)\nSports Club Description: Rugby is a physically demanding team sport involving tackling and ball-carrying. The METU Rugby Team builds endurance and teamwork, participating in competitive matches. (Instagram: @meturagby)\n']","1. The METU Judo Team focuses on training in the Japanese martial art of Judo, enhancing technical abilities, and competing in various tournaments. You can follow their activities on Instagram @metu.judo.
        2. The METU Rugby Team concentrates on playing the physically demanding team sport of rugby, building endurance, and participating in competitive matches. Check out their Instagram @meturagby for updates.


        Additional Information:
        - The METU Underwater Society, Traditional Archery Team, METU E-SPORTS COMMUNITY, METU Aviation Community Paragliding Group, Orienteering Team, Water Polo Team, Fencing Team, and METU Scouting Community offer a variety of sports and activities for students to engage in.
        - Each club has its unique focus, from research and protection of underwater ecosystems to physical endurance sports like rugby and water polo, and cultural heritage sports like traditional archery.
        - Most clubs have Instagram accounts where you can follow their activities, such as @odtugelenekselokculuk, @odtuorienteering, @odtu.sutopu, @odtueskrim, and @odtu_scouting.","The METU Judo Team, which includes both women and men, focuses on enhancing technical abilities in judo, a Japanese martial art that emphasizes physical balance and strategy. They train to compete in various tournaments. On the other hand, the METU Rugby Team, also comprising women and men, engages in a physically demanding team sport that involves tackling and ball-carrying. Their activities are centered around building endurance and teamwork while participating in competitive matches.",1.0,0.8333333332916666,0.33,1.0,0.908902532952969
How do I apply for dormitory using YKS Regstration Program?,"['FAQ Question: How is the KamuSM Certified Electronic Signature (E-signature) Application Process?\nFAQ Answer:   KAMUSM Certified Electronic Signature (CES) Application Process The user has to login http://eimza.metu.edu.tr page with METU usercode and password. The appropriate choice should be chosen (First Application/Renewal/ID update) and the application must be submitted. *** IMPORTANT: Use the VPN service to access relevant addresses from outside the campus. \xa0(You can visit\xa0https://faq.cc.metu.edu.tr/groups/vpn-service\xa0to get information about VPN service and its installation.) The list of personnel requesting CES is sent to TÜBİTAK KamuSM by METU E-Signature Officer An e-mail\xa0is sent to user\'s METU e-mail address by KamuSM. After receiving the e-mail from TÜBİTAK KamuSM, the ""Completing the e-Signature Applications with Pre-Application"" processes specified in the link must be completed. CES will be produced and delivered to the user by means of special courier.   \nFAQ Link: https://faq.cc.metu.edu.tr/faq/how-kamusm-certified-electronic-signature-e-signature-application-process', 'Application for Dormitories: Students whose family resides outside of Ankara can apply for the dormitories. Students who start our university this year, if they want to stay in our dormitories, must fill out the dormitory-related sections on the YKS Registration Program website during their university registration process and thus complete their applications.', 'computer and plug, you should be able to connect to METU cable network. It is suggested for the users who utilize network connection in the dormitory regions to read the Dormitory Rooms Computer Network Rules.      You can visit https://faq.cc.metu.edu.tr/faq/how-can-i-find-out-about-source-my-network-connection-failure-dormitories\xa0if you have any problems connecting to the cable network. You can also\xa0send an IT support request via https://itsupport.metu.edu.tr', 'FAQ Question: How can I use my CES (e-signature) in TÜBİTAK Applications?\nFAQ Answer:   Akis card driver and Java must be installed for TÜBİTAK project applications. \xa0The use of e-signature for TÜBİTAK project applications is described in the document linked below: (Turkish) \xa0https://www.tubitak.gov.tr/sites/default/files/281/ardeb_e-imza_yardim_d...  \nFAQ Link: https://faq.cc.metu.edu.tr/faq/how-can-i-use-my-ces-e-signature-tubitak-applications', 'Registration Procedures Question: How to apply to METU as an international student?', ""FAQ Question: I don't have an e-signature, how can I get it?\nFAQ Answer:   It is possible to obtain an electronic signature with individual or institutional payment.\xa0Public institutions are obliged to obtain their electronic certificates from the Kamu Sertifikasyon Merkezi (KamuSM) affiliated to TÜBİTAK UEKAE in accordance with the Prime Ministry circular. Personnel who can obtain an electronic signature with institutional payment can make an E-signature request by filling out the form at http://e-imza.metu.edu.tr/ with METU username and password. Please use the VPN service to access the relevant address from outside the campus. You can visit\xa0https://faq.cc.metu.edu.tr/tr/groups/vpn-service for information about the VPN service and its installation. For those who want to purchase an electronic signature individually, institutions authorized to provide electronic signatures can be learned from https://www.btk.gov.tr/elektronik-sertifika-hizmet-saglayicilari.\xa0Indiv... have to pay the Certified Electronic Signature (e-signature) fees obtained from alternative institutions. If you have a previously purchased electronic signature card reader, you can use it.  \nFAQ Link: https://faq.cc.metu.edu.tr/faq/i-dont-have-e-signature-how-can-i-get-it"", 'as PEAP and MSCHAPv2.  Use your METU usercode and password for the meturoam service. (Please make sure you use your usercode like e123456metu.edu.tr, not your email aliases in the form of name.surnamemetu.edu.tr) In Windows 10, protocol settings are done automatically. You do not need to set the protocols. For Linux operating systems or Windows 7 and below, you may also need to select WPA2-Enterprise and AES. In mobile devices, if you use the autocomplete function in your keyboard, a blank space may be added to your usercode. Pay attention to last character in your usercode. It should not be a blank space. If you are asked for a certificate, you may select ""Do not validate"" and skip it. (For some Android devices, certificate field might be compulsory. You can select ""Use System Certificate"" and type border.metu.edu.tr netlogin.metu.edu.tr) If you are asked for anonymous identity, you may type anonymous@metu.edu.tr.  For Raspberry pi devices, add the following conf to wpa_supplicant.conf file.network={ssid=""meturoam""key_mgmt=WPA-EAPpairwise=CCMPeap=PEAPidentity=""< username >""anonymous_identity=""anonymous@metu.edu.tr""password=""< password >""} Then restart wpa_supplicant. Actual filenames and paths may vary.killall wpa_supplicantwpa_supplicant -B -Dwext -i wlan0 -c /etc/wpa_supplicant/wpa_supplicant.conf -f /var/log/wpa_supplicant.log      If you forgot your password, you can set a new one in order to use the wireless network. Those users who do not prefer to create a meturoam', 'the installer and Click Next, Install buttons where applicable. Enter your password for administrative tasks.\xa0  When the installation has finished, enter\xa0border.metu.edu.tr\xa0as Remote Server and your METU username and password into the fields as your connection credientials. Click Login. \xa0 Select default profile. Service will open as Not Connected. If you want to Connect you can initiate a VPN connection by clicking Connect button on Connection Details tab.', 'FAQ Answer:   To create a new list on the list server of METU, the academic/administrative department or the adviser/administrator of the student group must apply to METU Computer Center by filling out the ""Application Form"". A user code and a password defined on the central servers of the university are required to access the application form. The list owner will be notified, if the request to open a new list is deemed appropriate by the Center. A user must fill out the ""Application Form"" to be able to open the list she/he wants. The information required on this form covers explanation about the list, the aim of the list, the owner of the list and the type of the list. Only the academic and administrative personnel can access the form using their usernames and passwords defined on the central servers. The procedure for opening a list on METU Electronic List Server is handled by CC Informatics Group. The name of the list is required to be relevant to the aim and the subject of the list. In addition generic names and names which can possibly be used as user names should not be entered as list names. In case of such list name requests CC Informatics Group suggests appending an ""-l"" at the end of the list name or adding another suitable suffix or prefix.\xa0eg:\xa0If the user requests the list name ""cinema"", it is suggested that the name may be changed as odtu-cinema or cinema-l. Moreover, communication lists are requested for some courses during the academic term. In the', 'FAQ Question: How can I apply for renewal if my e-signature certificate has expired / is about to expire?\nFAQ Answer:   1. To renew your electronic signature that has expired or will expire, you must make a RENEWAL application by logging into https://e-imza.metu.edu.tr *** IMPORTANT: Use the VPN service to access relevant addresses from outside the campus. \xa0You can visit https://faq.cc.metu.edu.tr/groups/vpn-service to get information about VPN service and its installation. 2. After your application is approved by TÜBİTAK KamuSM, a renewal application an e-mail sent to user\'s METU e-mail address from KamuSM. 3.\xa0After receiving the e-mail from KamuSM, the ""Completing the e-Signature Applications of the Persons with Pre-Application"" processes specified in the link must be completed.  \nFAQ Link: https://faq.cc.metu.edu.tr/faq/how-can-i-apply-renewal-if-my-e-signature-certificate-has-expired-about-expire']","['d2d69eff-f669-4b99-bf82-860de13c9753\n\nApplication for Dormitories: Students whose family resides outside of Ankara can apply for the dormitories. Students who start our university this year, if they want to stay in our dormitories, must fill out the dormitory-related sections on the YKS Registration Program website during their university registration process and thus complete their applications.\n']","1. First, you need to complete the YKS Registration Program, making sure to fill out the dormitory-related sections.
        2. Next, you need to obtain a KAMUSM Certified Electronic Signature (E-signature). To do this, log in to <http://eimza.metu.edu.tr> with your METU usercode and password. Follow the instructions for the First Application, Renewal, or ID update and submit your application. If you are outside the campus, use the VPN service to access the relevant addresses.
        3. After receiving the e-signature from TÜBİTAK KamuSM, complete the ""Completing the e-Signature Applications with Pre-Application"" processes specified in the link they send you.
        4. Once you have your e-signature, apply for a dormitory room through the Office of Dormitories website. The applications are evaluated based on the current capacity of dormitories, the number of applications, and the conditions for staying in the dormitories.
        5. If your application is accepted, you will be notified and guided through the registration procedures.

        Additional Information:
        - For more information about the dormitories, visit <http://stm.metu.edu.tr/>
        - For more information about the KAMUSM Certified Electronic Signature (E-signature) Application Process, visit <https://faq.cc.metu.edu.tr/groups/vpn-service> and <https://faq.cc.metu.edu.tr/faq/what-are-dormitory-rooms-network-rules-and-regulations-use>
        - If you need assistance with the YKS Registration Program, visit <https://faq.cc.metu.edu.tr/faq/how-kamusm-certified-electronic-signature-e-signature-application-process>
